clause_text,clause_type
Consents. All governmental and other consents that are required to have been obtained by it with respect to this Agreement or any Credit Support Document to which it is a party have been obtained and are in full force and effect and all conditions of any such consents have been complied with; and,consents
"Consents. Except as otherwise provided herein, wherever in this Lease the consent of a Party is required to an act by or for the other Party, such consent shall not be unreasonably withheld or delayed. Lessor’s actual reasonable costs and expenses (including but not limited to architects’, attorneys’, engineers’ and other consultants’ fees) incurred in the consideration of, or response to, a request by Lessee for any Lessor consent, including but not limited to consents to an assignment, a subletting or the presence or use of a Hazardous Substance, shall be paid by Lessee upon receipt of an invoice and supporting documentation therefor. Lessor’s consent to any act, assignment or subletting shall not constitute an acknowledgment that no Default or Breach by Lessee of this Lease exists, nor shall such consent be deemed a waiver of any then existing Default or Breach, except as may be otherwise specifically stated in writing by Lessor at the time of such consent. The failure to specify herein any particular condition to Lessor’s consent shall not preclude the imposition by Lessor at the time of consent of such further or other conditions as are then reasonable with reference to the particular matter for which consent is being given. In the event that either Party disagrees with any determination made by the other hereunder and reasonably requests the reasons for such determination, the determining party shall furnish its reasons in writing and in reasonable detail within 10 business days following such request.",consents
"Consents. Neither the Company nor any of its Subsidiaries is required to obtain any consent, authorization or order of, or make any filing or registration with, any court, governmental agency or any regulatory or self-regulatory agency or any other Person in order for it to execute, deliver or perform any of its obligations under or contemplated by the Transaction Documents, in each case in accordance with the terms hereof or thereof. All consents, authorizations, orders, filings and registrations which the Company is required to obtain pursuant to the preceding sentence have been obtained or effected on or prior to the Closing Date, and the Company and its Subsidiaries are unaware of any facts or circumstances which might prevent the Company from obtaining or effecting any of the registration, application or filings pursuant to the preceding sentence. The Company is not in violation of the listing requirements of the Principal Market and has no knowledge of any facts which would reasonably lead to delisting or suspension of the Common Stock in the foreseeable future.",consents
"Consents. The person signing this Agreement on behalf of each party hereby represents and warrants that he has the necessary power, consent and authority to execute and deliver this Agreement on behalf of such party.",consents
"Consents. The execution, delivery and performance by the Company of the Transaction Documents, and the offer, issuance and sale of the Securities require no consent of, action by or in respect of, or filing with, any Person, governmental body, agency, or official other than filings that have been made pursuant to applicable state securities laws, and post-sale filings pursuant to applicable state and federal securities laws which the Company undertakes to file within the applicable time periods. Subject to the accuracy of the representations and warranties of the Investor set forth in Section 5 hereof, the Company has taken all action necessary to exempt (i) the issuance and sale of the Securities, (ii) the issuance of the Shares upon due conversion of the Debenture, and (iii) the other transactions contemplated by the Transaction Documents from the provisions of any shareholder rights plan or other “poison pill” arrangement, any anti-takeover, business combination or control share law or statute binding on the Company or to which the Company or any of its assets and properties may be subject and any provision of the Company’s Articles of Incorporation or By-laws that is or could reasonably be expected to become applicable to the Investor as a result of the transactions contemplated hereby, including without limitation, the issuance of the Securities and the ownership, disposition or voting of the Securities by the Investor or the exercise of any right granted to the Investor pursuant to this Agreement or the other Transaction Documents.",consents
"Consents. (a) Except for Paragraph 33 hereof (Auctions) or as otherwise provided herein, wherever in this Lease the consent of a Party is required to an act by or for the other Party, such consent shall not be unreasonably withheld or delayed. Lessor's actual reasonable costs and expenses (including but not limited to architects', attorneys', engineers' and other consultants' fees) incurred in the consideration of, or response to, a request by Lessee for any Lessor consent pertaining to this Lease or the Premises, including but not limited to consents to an assignment a subletting or the presence or use of a Hazardous Substance, shall be paid by Lessee to Lessor upon receipt of an invoice and supporting documentation therefor. In addition to the deposit described in Paragraph 12.2(e), Lessor may, as a condition to considering any such request by Lessee, require that Lessee deposit with Lessor an amount of money (in addition to the Security Deposit held under Paragraph 5) reasonably calculated by Lessor to represent the cost Lessor will incur in considering and responding to Lessee's request. Any unused portion of said deposit shall be refunded to Lessee without interest. Lessor's consent to any act, assignment of this Lease or subletting of the Premises by Lessee shall not constitute an acknowledgment that no Default or Breach by Lessee of this Lease exists, nor shall such consent be deemed a waiver of any then existing Default or Breach, except as may be otherwise specifically stated in writing by Lessor at the time of such consent.",consents
"Consents. All consents, approvals, waivers or amendments pursuant to all contracts, licenses, permits, trademarks and other intangibles in connection with the transactions contemplated herein, or for the continued operation of the Company after the Closing Date on the basis as presently operated shall have been obtained.",consents
"Consents. Agent shall have received any and all Consents necessary to permit the effectuation of the transactions contemplated by this Agreement and the Other Documents; and, Agent shall have received such Consents and waivers of such third parties as might assert claims with respect to the Collateral, as Agent and its counsel shall deem necessary;",consents
"Consents. The Company shall have obtained in a timely fashion any and all consents, permits, approvals, registrations and waivers necessary for consummation of the purchase and sale of the Securities, all of which shall be and remain so long as necessary in full force and effect.",consents
"Consents. No consent, approval, authorization or order of any court, governmental agency or body or arbitrator having jurisdiction over the Company, or any of its affiliates, the NASD, NASDAQ or the Company's Shareholders is required for execution of this Agreement, and all other agreements entered into by the Company relating thereto, including, without limitation issuance and sale of the Securities, and the performance of the Company's obligations hereunder.",consents
"Consents. Whenever consent or approval of either party is required under this Work Letter, that party shall not unreasonably withhold, condition or delay such consent or approval, unless expressly set forth herein to the contrary.",consents
"Consents. All material consents, waivers, approvals, authorizations or orders required to be obtained, and all filings required to be made, by the Company and/or the Shareholders for the authorization, execution and delivery of this Agreement and the consummation by them of the transactions contemplated by this Agreement, shall have been obtained and made by the Company or the Shareholders, as the case may be, except where the failure to receive such consents, waivers, approvals, authorizations or orders or to make such filings would not have a Material Adverse Effect on the Company or the Acquiror Company.",consents
"Consents. Neither the Company nor any Subsidiary is required to obtain any consent from, authorization or order of, or make any filing or registration with (other than the filing with the SEC of one or more Registration Statements in accordance with the requirements of the Registration Rights Agreement, a Form D with the SEC and any other filings as may be required by any state securities agencies), any Governmental Entity (as defined below) or any regulatory or self-regulatory agency or any other Person in order for it to execute, deliver or perform any of its respective obligations under or contemplated by the Transaction Documents, in each case, in accordance with the terms hereof or thereof. All consents, authorizations, orders, filings and registrations which the Company or any Subsidiary is required to obtain pursuant to the preceding sentence have been or will be obtained or effected on or prior to the Closing Date, and neither the Company nor any of its Subsidiaries are aware of any facts or circumstances which might prevent the Company or any of its Subsidiaries from obtaining or effecting any of the registration, application or filings contemplated by the Transaction Documents. The Company is not in violation of the requirements of the Principal Market and has no knowledge of any facts or circumstances which could reasonably lead to delisting or suspension of the Common Stock in the foreseeable future. “Governmental Entity” means any nation, state, county, city, town, village, district, or other political jurisdiction of any nature, federal, state, local, municipal, foreign, or other government, governmental or quasi-governmental authority of any nature (including any governmental agency, branch, department, official, or entity and any court or other tribunal), multi-national organization or body; or body exercising, or entitled to exercise, any administrative, executive, judicial, legislative, police, regulatory, or taxing authority or power of any nature or instrumentality of any of the foregoing, including any entity or enterprise owned or controlled by a government or a public international organization or any of the foregoing.",consents
"Consents. Except for paragraphs 33 (auctions) and 34 (signs) hereof, wherever in this Lease the consent of one party is required to an act of the other party such consent shall not be unreasonably withheld or delayed.",consents
"Consents. Any and all consents, agreements or approvals provided for or permitted by this Agreement shall be in writing and a signed copy thereof shall be filed and kept with the books of the Fund.",consents
"Consents. The consent of the Agent, the Swing Line Lender and the LC Issuers shall be required prior to an assignment becoming effective; provided that the consent of the Agent shall not be required for any assignment to a Person that is a Lender, an Affiliate of such Lender or an Approved Fund with respect to such Lender. The consent of the Borrower shall be required prior to an assignment becoming effective unless (i) such assignment is to a Lender, an Affiliate of a Lender or an Approved Fund or (ii) a Default has occurred and is continuing; provided that the Borrower shall be deemed to have consented to any such assignment unless it shall object thereto by written notice to the Agent within fifteen (15) days after having received notice thereof. Any consent required under this Section 12.3.2 shall not be unreasonably withheld or delayed.",consents
"Consents. Except for consents, approvals, filings and registrations from or with the Superintendent, FDIC, FRB, and SEC, and compliance with any conditions contained therein, and the approval of this Agreement by the shareholders of CNYF, and the certificate of merger with the Secretary of State of the State of Delaware, no consents or approvals of, or filings or registrations with, any public body or authority are necessary, and no consents or approvals of any third parties are necessary, or will be, in connection with (a) the execution and delivery of this Agreement by Niagara Bancorp and Niagara Merger Corp, and (b) the completion by Niagara Bancorp and Niagara Merger Corp of the transactions contemplated hereby. Niagara Bancorp has no reason to believe that (i) any required consents or approvals will not be received or will be received with conditions, limitations or restrictions unacceptable to it or which would adversely impact Niagara Bancorp's ability to complete the transactions contemplated by this Agreement or that (ii) any public body or authority, the consent or approval of which is not required or any filing with which is not required, will object to the completion of the transactions contemplated by this Agreement.",consents
"Consents. The Company shall have received evidence, in form and substance reasonably satisfactory to it, that such licenses, permits, consents, approvals, authorizations, qualifications and orders of governmental authorities and other third parties as necessary in connection with the transactions contemplated hereby have been obtained.",consents
"Consents. No consent from or approval of any court, governmental entity or any other person is necessary in connection with its execution and delivery of this Agreement and performance of the obligations of CENTREX hereunder or under any other agreement to which CENTREX is a party; and the consummation of the transactions contemplated by this Agreement will not require the approval of any entity or person in order to prevent the termination of any material right, privilege, license or agreement relating to CENTREX or its assets or business.",consents
"Consents. The Borrower will maintain in force and promptly obtain or renew, and will promptly send certified copies to the Agent of, all consents required:",consents
"Consents. All consents, approvals, orders and authorizations required on the part of such Purchaser in connection with the execution, delivery or performance of this Agreement and the consummation of the transactions contemplated herein have been obtained and are effective as of the Closing Date.",consents
"Consents. No consent, waiver, approval, order or authorization of, or registration, declaration or filing with, any court, administrative agency or commission or other federal, state, county, local or other foreign governmental authority, instrumentality, agency or commission (""Governmental Entity"") is required by or with respect to Q5 in connection with the execution and delivery of this Agreement and any Related Agreements to which Q5 is a party or the consummation of the transactions contemplated hereby and thereby, except for (i) such consents, waivers, approvals, orders, authorizations, registrations, declarations and filings as may be required under applicable securities laws and (ii) the filing of the Merger Agreement with the Secretary of State of the State of Delaware.",consents
"Consents. No consent, approval, authorization or order of any court, governmental agency or body or arbitrator having jurisdiction over the Company, or any of its Affiliates, or the Company's shareholders is required for the execution by the Company of the Transaction Documents and compliance and performance by the Company of its obligations under the Transaction Documents, including, without limitation, the issuance and sale of the Securities. The Transaction Documents and the Company’s performance of its obligations thereunder has been unanimously approved by the Company’s Board of Directors.",consents
"Consents. Borrower’s execution, delivery and performance of the Notes, this Agreement and all other Loan Documents, and Borrower’s execution of the Warrant, (i) have been duly authorized by all necessary corporate action of Borrower, (ii) will not result in the creation or imposition of any Lien upon the Collateral, other than Permitted Liens and the Liens created by this Agreement and the other Loan Documents, (iii) do not violate any provisions of Borrower’s Certificate or Articles of Incorporation (as applicable), bylaws, or any, law, regulation, order, injunction, judgment, decree or writ to which Borrower is subject and (iv) except as described on Schedule 5.3, do not violate any contract or agreement or require the consent or approval of any other Person. The individual or individuals executing the Loan Documents and the Warrant are duly authorized to do so.",consents
Consents. Each of the Consents identified in Part 3.2 of the Disclosure Letter must have been obtained and must be in full force and effect.,consents
"Consents. Other than any consents which have already been obtained, no consent, waiver, approval, authorization, exemption, registration, license or declaration is required to be made or obtained by such party in connection with (a) the execution, delivery or performance of this Agreement or (b) the consummation of any of the transactions contemplated herein.",consents
Consents. Your rights in respect of the Restricted Shares are conditioned on the receipt to the full satisfaction of the Committee of any required consents that the Committee may determine to be necessary or advisable (including your consenting to the Company’s supplying to any third-party recordkeeper of the Plan such personal information as the Committee deems advisable to administer the Plan).,consents
"Consents. Except as set forth on EXHIBIT 2.4, no consent, authorization, permit, license or filing with any governmental authority, any lender, lessor, any manufacturer or supplier or any other person or entity is required to authorize, or is required in connection with, the execution, delivery and performance of this Agreement and the agreements and documents contemplated hereby on the part of Company or Shareholders.",consents
"Consents. No consent, approval, authorization or order of any court, governmental agency or body or arbitrator having jurisdiction over the Company, Subsidiaries or any of their Affiliates, any Principal Market (as defined in Section 9(b)), or the Company’s stockholders is required for the execution by the Company of the Transaction Documents and compliance and performance by the Company and Subsidiaries of their obligations under the Transaction Documents, including, without limitation, the issuance and sale of the Securities. The Transaction Documents and the Company’s performance of its obligations thereunder has been unanimously approved by the Company’s board of directors in accordance with the Company’s Certificate of Incorporation and applicable law. Any such qualifications and filings will, in the case of qualifications, be effective upon Closing and will, in the case of filings, be made within the time prescribed by law.",consents
"Consents. No consent, waiver, approval, order or authorization of, or registration, declaration or filing with, any governmental authority or any third party, including a party to any agreement with Raybor, is required by or with respect to Raybor in connection with the execution and delivery of this Agreement or the consummation of the transactions contemplated by this Agreement, except for (a) such consents, waivers, approvals, orders, authorizations, registrations, declarations and filings as may be required under applicable federal and state securities laws and (b) such consents, waivers, approvals, orders, authorizations, registrations, declarations and filings in which the failure of which to obtain would not in the aggregate have a Material Adverse Effect on Raybor or adversely affect the ability of Raybor to consummate the transactions contemplated by this Agreement.",consents
"Consents. Each Borrower hereby consents and agrees that, without notice to or by Borrower and without affecting or impairing in any way the obligations or liability of Borrower hereunder, the Agent may, from time to time before or after revocation of this Agreement, do any one or more of the following in its sole and absolute discretion: (i) accept partial payments of, compromise or settle, renew, extend the time for the payment, discharge, or performance of, refuse to enforce, and release all or any parties to, any or all of the Secured Obligations; (ii) grant any other indulgence to any Borrower or any other Person in respect of any or all of the Secured Obligations or any other matter; (iii) accept, release, waive, surrender, enforce, exchange, modify, impair, or extend the time for the performance, discharge, or payment of, any and all property of any kind securing any or all of the Secured Obligations or any guaranty of any or all of the Secured Obligations, or on which the Agent at any time may have a Lien, or refuse to enforce its rights or make any compromise or settlement or agreement therefor in respect of any or all of such property; (iv) substitute or add, or take any action or omit to take any action which results in the release of, any one or more other Borrowers or any endorsers or guarantors of all or any part of the Secured Obligations, including, without limitation one or more parties to this Agreement, regardless of any destruction or impairment of any right of contribution or other right of Borrower; (v) apply any sums received from any other Borrower, any guarantor, endorser, or co-signer, or from the disposition of any Collateral or security, to any Indebtedness whatsoever owing from such person or secured by such Collateral or security, in such manner and order as the Agent determines in its sole discretion, and regardless of whether such Indebtedness is part of the Secured Obligations, is secured, or is due and payable. Each Borrower consents and agrees that the Agent shall be under no obligation to marshal any assets in favor of Borrower, or against or in payment of any or all of the Secured Obligations. Each Borrower further consents and agrees that the Agent shall have no duties or responsibilities whatsoever with respect to any property securing any or all of the Secured Obligations. Without limiting the generality of the foregoing, the Agent shall have no obligation to monitor, verify, audit, examine, or obtain or maintain any insurance ...",consents
"Consents. No consent, waiver, approval or authorization is required from any person or entity (that has not already been obtained) in connection with the execution and delivery of this Agreement by Purchaser or the performance by Purchaser of the transactions contemplated hereby.",consents
"Consents. The Company is not required to obtain any consent, authorization or order of, or make any filing or registration with, any court or governmental agency or any regulatory or self-regulatory agency in order for it to execute, deliver or perform any of its obligations under or contemplated by the Offering Documents. Except as otherwise provided in the Offering Documents, all consents, authorizations, orders, filings and registrations which the Company is required to obtain pursuant to the preceding sentence have been obtained or effected on or prior to the date hereof. The Company and its Subsidiaries are unaware of any facts or circumstances which might prevent the Company from obtaining or effecting any of the foregoing.",consents
"Consents. The Company is not required to obtain any consent from, authorization or order of, or make any filing or registration with, any court, governmental agency or any regulatory or self-regulatory agency or any other Person (including, without limitation, the Financial Industry Regulatory Authority) in order for it to execute, deliver or perform any of its obligations under or contemplated by the Transaction Documents, in each case, in accordance with the terms hereof or thereof, other than (i) the filing with the SEC of the Prospectus Supplement and (ii) the filing with the SEC of the 8-K Filing (as defined below) (collectively, the “Required Filings”). All consents, authorizations, orders, filings and registrations which the Company is required to obtain at or prior to the Closing have been obtained or effected on or prior to the Closing Date, and neither the Company nor any of its Subsidiaries are aware of any facts or circumstances which might prevent the Company from obtaining or effecting any of the registration, application or filings contemplated by the Transaction Documents. Required Filings to be made after the Closing Date shall be made in compliance with the terms of this Agreement and applicable federal and state securities laws. The Company is not in violation of the requirements of the Principal Market and has no knowledge of any facts or circumstances which could reasonably lead to delisting or suspension of the Common Stock in the foreseeable future.",consents
"Consents. Except for consents, approvals and authorizations which have been obtained, no consent, approval, authorization or order of, or filing, registration or qualification with, any court or Governmental Authority or third party in respect of any Credit Party is required in connection with the execution, delivery or performance of this Credit Agreement or any of the other Credit Documents by such Credit Party.",consents
