clause_text,clause_type
"Consents. In connection with the entering into and performance of this Agreement and the other Transaction Documents, the Company or any of its Subsidiary is not required to obtain any consent, authorization or order of, or make any filing or registration with, (a) any Governmental Authority in order for it to execute, deliver or perform any of its obligations under or contemplated hereby or thereby or (b) any third party pursuant to any agreement, indenture or instrument to which the Company or any of its Subsidiaries is a party, in each case in accordance with the terms hereof or thereof other than such as have been made or obtained, and except for any required filing or notification with the SEC or the NYSE regarding the issuance of the Purchased Shares , or the listing of ADSs representing the Purchased Shares with the NYSE. The Company has no knowledge of any facts or circumstances that might prevent the Company from obtaining or effecting any of the filings or notifications described in the preceding sentence. The Company is not in violation of the listing requirements of the NYSE and has no knowledge of any facts that would reasonably lead to delisting or suspension of its ADSs from the NYSE in the foreseeable future.",consents
"Consents. No registration, filing with the consent or approval of, or other action by, any federal, state or other governmental authority, agency, regulatory body, third party or other Person is or will be required in connection with the execution, delivery and performance by the Seller of this Agreement and the consummation of the transactions contemplated hereby.",consents
"Consents. Each of the Consents identified in Schedule 7.3 (the ""Material Consents"") shall have been obtained and shall be in full force and effect.",consents
Consents. Each of the Consents identified in Part 2.20 of the Disclosure Schedule shall have been obtained and shall be in full force and effect.,consents
"Consents. Each of the Consents identified or required to have been identified in the FDH Disclosure Schedule shall have been obtained and shall be in full force and effect, other than those Consents, which have been expressly waived by SKYC.",consents
"Consents. Each of Parent, the Company and each Member shall promptly -------- apply for or otherwise seek, and use its reasonable efforts to obtain, all consents and approvals required to be obtained by it for the consummation of the Merger, and the Company and the Members shall use all reasonable efforts to obtain all consents, waivers and approvals under any of the Company's agreements, contracts, licenses or leases in order to preserve the benefits thereunder for the Surviving Corporation and otherwise in connection with the Merger. All of such Company consents and approvals are set forth in Section 5.9 of the Company Schedules.",consents
"Consents. Except for (i) as set forth in Section 2.25 of the Disclosure Schedule, (ii) compliance with and filings under the HSR Act, (iii) the filing with the Commission of the Proxy Statement, and such reports under the Exchange Act as may be required in connection with this Agreement and the transactions contemplated hereby, (iv) the filing of the Certificate of Merger with the Secretary of State of the State of Delaware and appropriate documents with the relevant authorities of other states in which the Company is qualified to do business, (v) if required under the Exchange Act, the filing of the Schedule 13E-3 with the Commission, and (vi) such filings in connection with any state or local tax which is attributable to the change in beneficial ownership of Company's or its Subsidiaries' real property, if any (collectively, ""Gains Taxes""), (the items in clauses (i) through (vi) being collectively referred to herein as (""Company Consents""), no Governmental Authorizations or Private Authorizations are required to be obtained or made by or with respect to Company or any of its Subsidiaries on or prior to the Closing Date in connection with (A) the execution, delivery and performance of this Agreement or any of the Transaction Documents to which Company is a party, the consummation of the transactions contemplated hereby and thereby or the taking by Company of any other action contemplated hereby or thereby, (B) the continuing validity and effectiveness of (and prevention of any material default under or violation of the terms of) any Lease or Material Agreement to which any of Company or its Subsidiaries is a party or any Governmental Authorization of any of Company or its Subsidiaries or (C) the conduct by Company or any of its Subsidiaries of their respective businesses following the Closing as conducted on the date hereof.",consents
"Consents. Except as to filings which may be required under applicable state securities regulations, no consent, authorization, approval, order, license, certificate, or permit of or from, or declaration or filing with, any federal, state, local, or other governmental authority or of any court or other tribunal is required by the Company or any of its subsidiaries in connection with the transactions contemplated hereby. No consent of any party to any contract, agreement, instrument, lease, license, arrangement, or understanding to which the Company or any of its subsidiaries is a party, or by which any of its properties or assets is bound, is required for the execution, delivery, or performance by the Company of the transactions contemplated by the Transaction Documents.",consents
"Consents. Seller shall use its best efforts to obtain the Consents described in Section 8.2(c), without any material change in the terms or conditions of any Contract or License as in effect on the date of this Agreement. Seller shall advise Buyer of any communications it receives concerning the Consents and of any conditions proposed, considered, or requested for any of the Consents. Upon Buyer's request, Seller shall cooperate with Buyer and use its best efforts to obtain from the lessors under each Real Property lease such estoppel certificates and consents to the collateral assignment of the lessee's interest under each such lease as Buyer's lenders may request.",consents
Consents. Each of Sky and SBI shall use its reasonable best efforts to obtain any required consents to the transactions contemplated by this Agreement.,consents
"Consents. All other governmental and third party notifications, filings, consents, waivers and approvals required for the consummation of the transactions contemplated by this Agreement shall have been made or received.",consents
"Consents. Receipt by the Agent of evidence that all governmental, shareholder and third party consents and approvals required in connection with the transactions and the related financings contemplated hereby and expiration of all applicable waiting periods without any action being taken by any authority that could restrain, prevent or impose any material adverse conditions on such transactions or that could seek or threaten any of the foregoing, and no law or regulation shall be applicable which in the judgment of the Agent could have such effect.",consents
"Consents. Neither the execution, delivery or performance of this Agreement by the Company, nor the consummation by it of the obligations and transactions contemplated hereby (including, without limitation, the issuance, the reservation for issuance and the delivery of the Shares and the provision to the Purchaser of the rights contemplated by the Transaction Documents) requires any consent of, authorization by, exemption from, filing with or notice to any Governmental Entity or any other Person, other than filings required under applicable U.S. federal and state securities laws.",consents
"Consents. The Corporation is not subject to any law, ordinance, regulation, rule, order, judgment, injunction, decree, charter, bylaw, contract, commitment, lease, agreement, instrument or other restriction of any kind which would prevent the Corporation from performing the terms of this Agreement or any of the transactions contemplated hereby without the consent of any third party, or which would require the consent of any third party for the consummation of this Agreement or any of the transactions contemplated hereby, or which would result in any penalty, forfeiture or other termination as a result of such consummation.",consents
"Consents. No consent, approval, qualification, order or authorization of, or registration, declaration or filing with, any court, administrative agency or commission or other governmental authority or instrumentality, domestic or foreign, or other third party is required by or with respect to the CATV Shareholders in connection with the execution and delivery of this Agreement, or the consummation by the CATV Shareholders of the transactions contemplated hereby, which has not already been obtained.",consents
"Consents. Receipt by the Administrative Agent of a written representation from the Borrower that (i) all governmental, shareholder, member, partner and third party consents and approvals necessary or, in the reasonable opinion of the Administrative Agent, desirable, in connection with the transactions contemplated hereby have been received and are in full force and effect and (ii) no condition or requirement of law exists which could reasonably be likely to restrain, prevent or impose any material adverse condition on the transactions contemplated hereby;",consents
"Consents. All consents of the other party and all other consents, orders and permits of Federal, state and local regulatory authorities deemed necessary by the Trust to permit consummation, in all material respects, of the transactions contemplated herein shall have been obtained, except where failure to obtain any such consent, order or permit would not involve a risk of a material adverse effect on the assets or properties of either party or the Trust.",consents
"Consents. In connection with the entering into and performance of this Agreement and the other Transaction Documents, the Purchaser is not required to obtain any consent, authorization or order of, or make any filing or registration with, (a) any Governmental Authority in order for it to execute, deliver or perform any of its obligations under or contemplated hereby or thereby or (b) any third party pursuant to any agreement, indenture or instrument to which the Purchaser is a party, in each case in accordance with the terms hereof or thereof other than such as have been made or obtained.",consents
"Consents. Other than in connection or compliance with the provisions of the Securities Laws (including the filing and declaration of effectiveness of the Registration Statement), applicable state corporate and securities Laws, the rules of NASDAQ, the ABCA, the OGCA, the Laws of the State of Arkansas with respect to Simmons Bank, and the Requisite Regulatory Approvals, no notice to, filing with, or Consent of, any public body or authority is necessary for the consummation by Simmons of the Merger and the other transactions contemplated in this Agreement.",consents
"Consents. (a) Each of the parties hereto shall use all commercially reasonable efforts to take, or cause to be taken, all appropriate action to do, or cause to be done, all things necessary, proper or advisable under applicable Law or otherwise to consummate and make effective the transactions contemplated by this Agreement and the Ancillary Agreements as promptly as practicable, including using all commercially reasonable efforts to (i) obtain from Governmental Authorities and other Persons all consents, approvals, authorizations, qualifications and orders as are necessary for the consummation of the transactions contemplated by this Agreement and the Ancillary Agreements, (ii) promptly make all necessary filings, and thereafter make any other required submissions, with respect to this Agreement required under any applicable Law (other than the HSR Act), and (iii) in no event later than ten (10) business days following the date hereof, file or cause to be filed with the United States Federal Trade Commission (the “FTC”) and the United States Department of Justice (the “DOJ”) the notification and report form pursuant to the HSR Act, required for the transactions contemplated hereby; and (iv) as promptly as practicable, comply with any request for additional information and documents pursuant to the HSR Act. Each of the parties hereto shall inform the others promptly of any communication made by or on behalf of such party to (including permitting the other party to review such communication in advance), or received from, the FTC or the DOJ and shall furnish to the other such information and assistance as the other may reasonably request in connection with its preparation of any filing, submission or other act that is necessary or advisable under the HSR Act to the extent permitted by applicable Law. The parties hereto shall keep each other timely apprised of the status of any communications with, and any inquiries or requests for additional information from, the FTC or the DOJ to the extent permitted by applicable Law, and shall comply promptly with any such inquiry or request. No party shall agree to participate in any meeting with any Governmental Authority in respect of any filings, investigation or other inquiry unless it consults with the other party in advance and, to the extent permitted by such Governmental Authority, gives the other party the opportunity to attend and participate thereat. Subject to the Mutual Non-Disclosure Agreement, dated as of October 13...",consents
"Consents. No consent, approval, authorization or order of any court, governmental agency or body or arbitrator having jurisdiction over the Company, or any of its Affiliates, the Over The Counter Bulletin Board (the “Bulletin Board”) or the Company’s shareholders is required for the execution by the Company of the Transaction Documents and compliance and performance by the Company of its obligations under the Transaction Documents, including, without limitation, the issuance and sale of the Purchased Shares. The Transaction Documents and the Company’s performance of its obligations thereunder have been unanimously approved by the Company’s Board of Directors. No consent, approval, order or authorization of, or registration, qualification, designation, declaration or filing with, any governmental authority in the world, including without limitation, the United States, or elsewhere is required by the Company or any Affiliate of the Company in connection with the consummation of the transactions contemplated by this Agreement, except as would not otherwise have a Material Adverse Effect or the consummation of any of the other agreements, covenants or commitments of the Company or any Subsidiary contemplated by the other Transaction Documents. Any such qualifications and filings will, in the case of qualifications, be effective on the Closing and will, in the case of filings, be made within the time prescribed by law.",consents
"Consents. Whenever consent or approval of either party is required, that party shall not unreasonably withhold or delay such consent or approval, except as may be expressly set forth to the contrary.",consents
"Consents. Except as herein otherwise provided, whenever in this Agreement the consent or approval of Owner or Manager is required, such consent or approval shall not be unreasonably withheld or delayed. Such consent or approval shall be in writing only and shall be duly executed by an authorized officer or agent of the party granting such consent or approval.",consents
"Consents. (A) In the event Agent requests the consent of a Lender and does not receive a written denial thereof within five (5) Business Days after such Lender's receipt of such request, then such Lender will be deemed to have given such consent.",consents
"Consents. The Company shall have provided to the Agent evidence satisfactory to the Agent that all governmental, shareholder and third party consents and approvals necessary in connection with the transactions contemplated hereby have been obtained and remain in effect.",consents
"Consents. No consent, approval or authorization of or designation, declaration or filing with any other person, including without limitation any governmental authority, on the part of the Company is required in connection with the valid execution, delivery or performance of this Agreement or the consummation of any transaction contemplated hereby.",consents
"Consents. Buyer shall make all filings with and notifications of -------- governmental authorities, regulatory agencies and other entities required to be made by Buyer in connection with the execution and delivery of this Agreement and the consummation of the transactions contemplated hereby; and Buyer shall obtain all authorizations, waivers, consents and permits, from all third parties, including, without limitation, applicable governmental authorities, regulatory agencies, lessors, lenders and contract parties, required to permit the consummation of the transactions contemplated by this Agreement, and to avoid any breach, default, termination, acceleration or modification of any material agreement, contract, lease or permit as a result of, or in connection with, the execution and performance of this Agreement.",consents
"Consents. Except as set forth in Schedule 4.7, no consent, approval, order or authorization of, or registration, qualification, designation, declaration or filing with, any federal, state or local governmental authority or any Person or entity is required on the part of the Company in connection with the execution, delivery and performance by the Company of this Agreement and issuance, sale and delivery of the Shares, except such filings as have been or will be made prior to the Closing Date, except any notices of sale required to be filed with the Securities and Exchange Commission under Regulation D of the Securities Act, or such other filings as may be required under applicable state securities laws, all of which will be timely filed within the applicable periods therefor.",consents
"Consents. The Company shall promptly apply for or otherwise seek and use its best efforts to obtain all consents and approvals required to be obtained by it for the consummation of the Merger including all consents, waivers and approvals under any of the Contracts as may be required in connection with the Merger (all of such consents, waivers and approvals are set forth in the Company Schedules) so as to preserve all rights of and benefits to the Company thereunder from and after the Effective Time.",consents
"Consents. The Company shall have obtained all authorizations, consents, waivers and approvals as may be required to consummate the transactions contemplated by this Agreement.",consents
"Consents. The Company shall have obtained all governmental, regulatory or third party consents and approvals, if any, necessary for the sale of the Securities.",consents
"Consents. No consent, license, permit, or authorization of, exemption by, notice or report to, or registration, filing or declaration with, any governmental authority or agency is required in connection with the execution, delivery and performance by Borrower of this Agreement or the transactions contemplated hereby.",consents
Consents. Borrower has obtained or caused to be obtained or issued any required consent of a governmental agency or other Person in connection with the financing contemplated hereby;,consents
"Consents. The consent of the Borrower shall be required prior to an assignment becoming effective unless the Purchaser is a Lender, an Affiliate of a Lender or an Approved Fund (other than a Lender or Affiliate of a Lender or an Approved Fund that becomes a Lender solely by means of the settlement of a credit derivative), provided that the consent of the Borrower shall not be required if (i) a Default has occurred and is continuing or (ii) if such assignment is in connection with the physical settlement of any Lender’s obligations to direct or indirect contractual counterparties in credit derivative transactions relating to the Revolving Loans; provided that the assignment without the Borrower’s consent pursuant to clause (ii) shall not increase the Borrower’s liability under Section 3.5. The consent of the Agent shall be required prior to an assignment becoming effective unless the Purchaser is a Lender, an Affiliate of a Lender or an Approved Fund (other than a Lender or Affiliate of a Lender or an Approved Fund that becomes a Lender solely by means of the settlement of a credit derivative). Any consent required under this Section 12.3.2 shall not be unreasonably withheld or delayed.",consents
"Consents. Certified copies of all documents evidencing any necessary consents and governmental approvals, if any, with respect to this Agreement, the Financing Agreements, and any other documents provided for herein or therein to be executed by Borrower.",consents
"Consents. The Sub-Adviser hereby ratifies and approves the assumption by the Adviser of the interests, rights and responsibilities of ILIAC under the Agreement and agrees, subject to the terms and conditions of said Agreement, (a) to look solely to the Adviser for the performance of advisory duties and obligations under such Agreement after the effective date written above, and (b) to continue to perform its obligations thereunder as if no such merger had occurred and as if ILIAC and the Adviser were one and the same entity.",consents
"Consents. No approval, consent, compliance, exemption, authorization or other action by, or notice to, or filing with, any local, state or federal governmental authority or any other person or entity (individually and collectively, a “Consent”), not already obtained or made, and no lapse of a waiting period under any applicable law, statute, regulation, order or decree, is necessary or required in connection with the execution, delivery or performance by the Company of this Agreement or the transactions contemplated hereby; provided, however, that the foregoing representation and warranty shall not apply to any Consent which may be required in the future as a result of the application of the rights and obligations provided for hereunder or the conducting of the Company’s business.",consents
"Consents. All necessary governmental (domestic or foreign), regulatory and third party approvals, if any, in connection with the transactions contemplated by this Agreement and the other Loan Documents shall have been obtained and remain in full force and effect, in each case without any action being taken by any competent authority which could restrain or prevent such transaction or impose, in the reasonable judgment of the Administrative Agent, materially adverse conditions upon the consummation of such transactions.",consents
"Consents. All consents, approvals, orders, authorizations and waivers of, and all declarations, filings and registrations with, third parties (including Governmental Entities) required to be obtained or made by or on the part of the parties hereto, or otherwise reasonably necessary for the consummation of the transactions contemplated hereby, shall have been obtained or made, and all thereof shall be in full force and effect at the time of Closing.",consents
Consents. Each of the parties hereto will use its best efforts to obtain the consents of all third parties and governmental authorities necessary to the consummation of the transactions contemplated by this Agreement.,consents
"Consents. Except as expressly stated otherwise in this document, a party may conditionally or unconditionally give or withhold any consent to be given under this document and is not obliged to give its reasons for doing so.",consents
"Consents. Except for filings under foreign, federal and applicable state securities laws and except for Permits (as defined below), the absence of which either individually or in the aggregate would not have a Material Adverse Effect, all permits, consents, approvals, orders, authorizations of, or declarations to (collectively, “Permits”) or filings with any federal, state, local or foreign court, governmental or regulatory authority, or other person (including third party consents) required on the part of the Company in connection with the execution, delivery or performance of this Agreement and the other Transaction Documents and the consummation of the transactions contemplated herein and therein have been obtained or will be obtained prior to the Closing Date, and will be effective as of the Closing Date.",consents
"Consents. Except (a) as set forth in Schedule 4.4, (b) for Customary Post-Closing Consents, (c) under Contracts that are terminable upon not greater than sixty (60) days notice without payment of any fee, and (d) preferential purchase rights set forth in Schedule 4.10, there are no consents or other restrictions on assignment, including, but not limited to, requirements for consents from Third Parties to any assignment (in each case) that would be applicable in connection with the transfer of the Assets or the consummation of the transactions contemplated by this Agreement by Seller.",consents
