clause_text,clause_type
Consents. Any required consent to the transactions contemplated by this Agreement shall have been obtained or waived.,consents
"Consents. All consents and approvals required in connection with the execution, delivery and performance of this Agreement shall have been obtained.",consents
"Consents. With respect to any provision of this Sublease which provides, in effect, that Sublessor shall not unreasonably withhold or unreasonably delay any consent or any approval, Sublessee, shall not in any event be entitled to make, nor shall Sublessee make, any claim for money damages and Sublessee hereby waives any claim for money damages; nor shall Sublessee claim any money damages by way of setoff, counterclaim or defense, based upon any claim or assertion by Sublessee that Sublessor has unreasonably withheld or unreasonably delayed any consent or approval; but Sublessee's sole remedy shall be an action or proceeding to enforce any such provisions, or for specific performance, injunction or declaratory judgment.",consents
"Consents. Except as otherwise stated in Section 5, no consent, approval, waiver or authorization, or designation, declaration, notification, or filing with any person or entity (governmental or private), on the part of the Borrower is required in connection with the valid execution, delivery and performance of this Note or the consummation of any other transaction contemplated hereby (other than such notifications or filings required under applicable federal or state securities laws, if any), except for such consents, approvals, waivers, authorizations, designations, declarations, notifications, or filings that have been received prior to the date hereof.",consents
"Consents. The Parties shall use their commercially reasonable efforts to obtain the Consents required to Transfer any Assets, Contracts, licenses, permits and authorizations issued by any Governmental Entity or parts thereof as contemplated by this Agreement. Notwithstanding anything herein to the contrary, no Contract or other Asset shall be transferred if it would violate applicable Law or, in the case of any Contract, the rights of any third party to such Contract.",consents
"Consents. Receipt by the Administrative Agent of a written representation from the Borrower that (i) all governmental, shareholder and third party consents (including Securities and Exchange Commission clearance) and approvals necessary or, in the reasonable opinion of the Administrative Agent, advisable in connection with the transactions contemplated hereby have been received and are in full force and effect and (ii) no condition or requirement of law exists which could reasonably be likely to restrain, prevent or impose any material adverse condition on the transactions contemplated hereby, and receipt by the Administrative Agent of copies of any required orders of any regulatory authority approving the Borrower's execution, delivery and performance of this Credit Agreement and the borrowings hereunder.",consents
"Consents. No consent, approval, or authorization of, or declaration, filing or registration with, any governmental or regulatory authority or any court or other tribunal, and no consent or waiver of any party to any material contract to which Seller is a party or is bound is required to be obtained by Seller in connection with the execution, delivery, and performance of this Agreement by Seller, such that the failure to obtain or make any such consent, approval, authorization, declaration, filing, or registration would materially adversely affect the consummation of the transactions contemplated by this Agreement.",consents
"Consents. No consent from, or other approval of, any governmental entity or any other person, which has not been obtained, is necessary in connection with the execution, delivery, or performance of this Agreement by Purchaser.",consents
"Consents. No authorization, consent, approval, license, exemption of, or filing or registration with, any Governmental Authority, or approval or consent of any other Person, is required for the due execution, delivery or performance by the Borrower of any of the Loan Documents.",consents
"Consents. Seller shall have made all filings with and notifications of governmental authorities and regulatory agencies required to be made by it in connection with the execution and delivery of this Agreement, the performance of the transactions contemplated hereby and the continued operation of Seller’s business by Buyer subsequent to the Closing, and Buyer shall have received such governmental consents or permits required to use and own the Purchased Assets, if any.",consents
"Consents. All consents, authorizations and approvals of any Person to or as a result of the consummation of the transactions contemplated hereby, that are necessary or advisable in connection with the operations and business of the Company as currently conducted and as proposed to be conducted, or for which the failure to obtain the same might have, individually or in the aggregate, a Material Adverse Effect, have been lawfully and validly obtained by the Company, except as described in Schedules 4.5(c), 4.10 and 4.16 hereto. All consents, authorizations and approvals described in schedules 4.5(c), 4.10 and 4.16 will have been lawfully and validly obtained prior to the Closing.",consents
"Consents. No approval, consent, order or action of or filing with any -------- court, administrative agency, governmental authority or other third party is required for the execution, delivery or performance by the Shareholders of this Agreement or any Shareholder Related Document. The execution, delivery and performance by the Shareholders of this Agreement and any Shareholder Related Documents do not violate any mortgage, indenture, contract, agreement, lease or commitment or other instrument of any kind to which any Shareholder is a party or by which any Shareholder or such Shareholder's assets or properties may be bound or affected or any law, rule or regulation applicable to any Shareholder or any court injunction, order or decree or any valid and enforceable order of any governmental agency in effect as of the date hereof having jurisdiction over any Shareholder.",consents
"Consents. Lender shall have received true copies (in each case Certified as to authenticity on such date by such Person as may be appropriate or may be reasonably required by Lender) of all documents and instruments, including all consents, authorizations and filings, required or advisable under any Requirements of Law or by any Contractual Obligation in connection with the execution, delivery, performance, validity and enforceability of the Second Advance Note, and such consents, authorizations and filings shall be reasonably satisfactory in form and substance to Lender and its counsel and be in full force and effect.",consents
"Consents. Except for (i) consents or approvals of, or filings with, any applicable Governmental Authorities in connection with assignments of the Assets which are not customarily obtained prior to the assignment of the Assets, (ii) Preference Rights and Transfer Requirements, and (iii) the consents, filings or notices expressly described and set forth on Schedule 4.2(e), no consent, approval, authorization or permit of, or filing with or notification to, any Person is required for or in connection with the execution and delivery of this Agreement by Buyer or for or in connection with the consummation of the transactions and performance of the terms and conditions contemplated hereby by Buyer.",consents
"Consents. Except (a) as set forth on Schedule 5.2l hereto, (b) for filings pursuant to the H-S-R Act, or (c) the FCC Applications, no filing, consent, approval or authorization of any governmental authority or of any third party on the part of any Seller or the Company is required in connection with the execution and delivery of this Agreement by Sellers or the consummation of the transactions contemplated hereby (including any consents required under any Company Material Contract as a result of the change in control contemplated hereby).",consents
"Consents. Except for any Consents where the failure to obtain such Consents, either in any individual case or in the aggregate, would not reasonably be expected to have a Material Adverse Effect, no Consent of or with any court, Governmental Entity or third person is required to be obtained by Metro in connection with the execution and delivery by Metro of this Agreement or the Services Agreement or the consummation by Metro of the transactions contemplated hereby and thereby.",consents
"Consents. All approvals, authorizations, consents, orders or other actions of any Person or Governmental Authority applicable to the Backup Servicer, required in connection with the execution and delivery of this Agreement, the performance by the Backup Servicer of the transactions contemplated hereby and the fulfillment by the Backup Servicer of the terms hereof have been obtained.",consents
"Consents. All requisite consents of third parties, including, but not limited to, governmental or other regulatory agencies, federal, state or municipal, required to be received by or on the part of the Company and the Seller for the execution and delivery of this Agreement and the performance of their respective obligations hereunder have been obtained and are in full force and effect. The Company and the Seller have fully complied with all conditions of such consents.",consents
"Consents. All licenses, consents and approvals required from and all registrations and filings required to be made by the Seller with any governmental or other public body or authority for the making and performance by the Seller of this Agreement and the other Transaction Documents to which it is a party have been obtained and are in effect.",consents
"Consents. The Company is not required to obtain any consent, approval or authorization from, or to file any declaration or statement with, any governmental instrumentality or other agency in connection with or as a condition to the performance of this Agreement, except those that will have been obtained as of the Transaction Closing Date.",consents
"Consents. All necessary consents, approvals and authorizations of all governmental authorities and other Third Parties required to be obtained by it in connection with the execution, delivery and performance of this Agreement have been obtained by it.",consents
"Consents. No approval, consent, exemption, authorization or other action by, or notice to, or filing with, any Governmental Authority or any other Person is necessary or required in connection with the execution, delivery or performance by, or enforcement against any Grantor or any Subsidiary Issuer of this Agreement, except (i) as may be required by laws affecting the offering and sale of securities generally, (ii) filings with the United States Copyright Office and/or the United States Patent and Trademark Office, and (iii) filings under the UCC and/or the Assignment of Claims Act.",consents
"Consents. All consents, approvals, authorisations and other orders of all United States, Jersey, Channel Islands and United Kingdom regulatory authorities required in connection with the execution of and performance by, Funding and/or the Mortgages Trustee, of the transactions contemplated by the Legal Agreements to which Funding and/or the Mortgages Trustee, as the case may be, is a party or the compliance by each of them with the terms of the Legal Agreements are, or will on the Closing Date be, in full force and effect;",consents
"Consents. No Consent, authorization or order of, or filing or registration with, any Person is required to be obtained or made by the Purchaser for the execution, delivery and performance by the Purchaser of this Agreement or the other Transaction Documents to which it is a party or the consummation of any of the transactions contemplated hereby or thereby other than those that will have been made or obtained on or prior to the Closing Date.",consents
"Consents. Each of iPrint and Wood shall use all reasonable -------- efforts to obtain all necessary consents, waivers, permits and approvals under any of iPrint's or Wood's agreements, contracts, licenses or leases as may be necessary or advisable to consummate the Combination and the other transactions contemplated by this Agreement.",consents
"Consents. Schedule 3.4 hereto sets forth a true and complete list of all consents of governmental and other regulatory agencies, foreign or domestic, and of other third parties (other than OAC's shareholders) required to be received by or on the part of Ocean or OAC to enable them to enter into and carry out this Agreement in all material respects. All such requisite consents have been, or prior to the Closing will have been, obtained.",consents
Consents. (a) All of the Consents set forth on Part 7.3(a) of the Company Disclosure Schedule shall have been obtained and shall be in full force and effect.,consents
"Consents. Except as set forth in the Perfection Certificate, no consent of any party (other than a Grantor) to any Copyright License, Patent License, Trade Secret License or Trademark License constituting Collateral or any obligor in respect of any material Account constituting Collateral or which owes in the aggregate a material portion of all the Accounts constituting Collateral is required, or purports to be required, to be obtained by or on behalf of any Grantor in connection with the execution, delivery and performance of this Agreement that has not been obtained. Each Copyright License, Patent License, Trade Secret License, Trademark License and Account constituting Collateral is in full force and effect and constitutes a valid and legally enforceable obligation of the Grantor party thereto and (to the knowledge of such Grantor) each other party thereto except as enforceability may be limited by bankruptcy, insolvency, reorganization, moratorium or similar laws affecting the enforcement of creditor's rights generally and by general equitable principles (whether enforcement is sought by proceedings in equity or at law) and except to the extent the failure of any such Copyright License, Patent License, Trade Secret License, Trademark License or Account constituting Collateral to be in full force and effect or valid or legally enforceable could not be reasonably expected, in the aggregate, to have a material adverse effect on the value of the Collateral. Except as set forth on the Perfection Certificate, no consent or authorization of, filing with or other act by or in respect of any Governmental Authority is required in connection with the execution, delivery, performance, validity or enforceability of any of the Copyright Licenses, Patent Licenses, Trade Secret Licenses, Trademark Licenses and Accounts constituting Collateral by any party thereto other than those which have been duly obtained, made or performed and are in full force and effect and those the failure of which to make or obtain could not be reasonably expected, in the aggregate, to have a material adverse effect on the value of the Collateral. Except as set forth on the Perfection Certificate, no Grantor nor (to the knowledge of any Grantor) any other party to any Copyright License, Patent License, Trade Secret License or Trademark License or Account constituting Collateral is in default in the performance or observance of any of the terms thereof, except for such defaults as could not reasonably ...",consents
"Consents. Without limiting the generality of Section 5.1 hereof, each of the parties hereto shall (i) use reasonable best efforts to obtain all Consents, if any, of Governmental Authorities and third parties which are to be obtained by such party and are necessary in connection with the consummation of the transactions contemplated by this Agreement prior to the Closing, and (ii) provide reasonable cooperation and assistance reasonably requested by the Company with regard to the Company obtaining all Consents, if any, of Governmental Authorities and third parties which are to be obtained by the Company and are necessary in connection with the consummation of the transactions contemplated by this Agreement prior to the Closing, including but not limited to those Consents set forth in Schedule 5.2. Notwithstanding the foregoing, neither the Purchasers nor the Seller shall have any obligation to pay any fee to any third party (other than filing or other fees payable to Governmental Authorities) for the purpose of obtaining any Consent or any costs and expenses of any third party resulting from the process of obtaining such Consents. Each of the parties hereto shall make or cause to be made all filings and submissions under laws and regulations applicable to it as may be required for the consummation of the transactions contemplated by this Agreement.",consents
"Consents. All consents, approvals, orders and authorizations required on the part of such Purchaser in connection with the execution, delivery or performance of this Agreement and the Notes, the issuance of the Common Stock upon conversion of the Notes in accordance with their terms and the consummation of the other transactions contemplated herein have been obtained or made, other than (i) the expiration or termination of the applicable waiting period under the HSR Act or any foreign antitrust requirements in connection with the issuance of Common Stock upon conversion of the Notes and (ii) such consents, approvals, orders and authorizations the failure of which to make or obtain, individually or in the aggregate, would not reasonably be expected to have a Purchaser Adverse Effect.",consents
"Consents. Except as otherwise provided herein, wherever in this Lease the consent of a Party is required to an act by or for the other Party, such consent shall not be unreasonably withheld, conditioned or delayed. Lessor’s actual reasonable costs and expenses (including but not limited to architects’, attorneys’, engineers’ and other consultants’ fees) incurred in the consideration of, or response to, a request by Lessee for any Lessor consent, including but not limited to consents to an assignment, a subletting or the presence or use of a Hazardous Substance, shall be paid by Lessee upon receipt of an invoice and supporting documentation therefor. Lessor’s consent to any act, assignment or subletting shall not constitute an acknowledgment that no Default or Breach by Lessee of this Lease exists, nor shall such consent be deemed a waiver of any then existing Default or Breach, except as may be otherwise specifically stated in writing by Lessor at the time of such consent. The failure to specify herein",consents
"Consents. No consents, licenses or approvals are required in connection with the execution, delivery and performance by any Credit Party of the Credit Documents to which it is a party, other than as are in full force and effect and, to the extent requested by the Administrative Agent, are attached thereto;",consents
Consents. All consents and other determinations to be made by the Investors pursuant to this Agreement will be made by the Initial Investors or the Investors holding a majority in interest of the Registrable Securities.,consents
"Consents. Each Participant covenants and agrees (subject, in the case of the Loan Participant, to all of the terms and provisions of the Indenture) that it shall not unreasonably withhold its consent to any consent requested by the Lessee, TILC, TRLTII, the Owner Trustee, the Pass Through Trustee or the Indenture Trustee, as the case may be, under the terms of the Operative Agreements that by its terms is not to be unreasonably withheld by the Owner Trustee or the Indenture Trustee.",consents
"Consents. (a) Subject to any relevant reservations or qualifications contained in any legal opinion referred to in Clause 15.4(a) (Legal validity) above, all material and necessary authorisations, registrations, consents, approvals, licences (other than the Licences), and filings required by it in connection with the execution, validity or enforceability of the Finance Documents to which it is a party and performance of the transactions contemplated by the Finance Documents have been obtained (or, if applicable, will be obtained within the required time period) and are validly existing.",consents
"Consents. The Contracts listed on Schedule 3.6 are the only Contracts binding upon Company, including without limitation Real Property, requiring a consent, approval, authorization, order or other action of or filing with any Person as a result of the execution, delivery and performance of this Agreement or any of the Additional Agreements or the consummation of the transactions contemplated hereby or thereby (each of the foregoing, a “Contracts Subject to Consent”).",consents
"Consents. No Governmental Approval or consent or authorization of, filing with, notice to or other act by or in respect of, any other Person is required in connection with the extensions of credit hereunder or with the execution, delivery, performance, validity or enforceability of this Agreement or any of the Loan Documents, except (i) Governmental Approvals, consents, authorizations, filings and notices that have been obtained or made and are in full force and effect and (ii) the filings referred to in Section 6.19. No Governmental Approval or consent or authorization of, filing with, notice to or other act by or in respect of, any other Person is required in connection with the consummation of the Transactions (excluding the Loan Documents), except (i) Governmental Approvals, consents, authorizations, filings and notices that have been obtained or made and are in full force and effect, (ii) the filings referred to in Section 6.19 and (iii) those, the failure of which to obtain or make would not reasonably be expected to have a Material Adverse Effect.",consents
Consents. The Company and the Stockholder agree to take all -------- necessary corporate or other action and to use their best efforts to obtain all consents and approvals required for consummation of the transactions contemplated by this Agreement.,consents
"Consents. The execution, delivery and performance by Buyer and/or its Affiliates of this Agreement and the other Documents, and consummation by Buyer and/or its Affiliates of the transactions contemplated hereby and thereby, do not and will not require the authorization, consent, approval, exemption, clearance or other action by or notice or declaration to, or filing with, any court or administrative or other governmental body, or the consent, waiver or approval of any other person or entity, excluding consents that Seller is obligated to obtain under Section 7.12 below.",consents
"Consents. 6.5.1. Prior to the Closing, Seller will use commercially reasonable efforts to obtain in writing, as promptly as possible and at its expense, all the Required Consents, in form and substance reasonably satisfactory to Buyer and will deliver to Buyer copies of such Required Consents after they are obtained by Seller; provided, that Seller will use a form of letter or application prepared by Buyer (subject to reasonable review and comment by Seller); provided that in no event will Seller request the consent of any Third Party or Affiliate later than 45 days following the date hereof. All documents delivered or filed with any Governmental Authority or any Person by or on behalf of Seller pursuant to this Section 6.5, when so delivered or filed, will be correct, current and complete in all material respects. Buyer will cooperate with Seller to obtain all Required Consents, but Buyer will not be required to accept or agree or accede to any modifications or amendments to, or changes in, or the imposition of any condition to the transfer to Buyer of any Contract, Franchise or written instrument evidencing Real Property that are not reasonably acceptable to Buyer. Prior to the Closing, Seller will (i) use commercially reasonable efforts to give any notices required by the terms of the Contracts, Franchises, Real Property agreements and Licenses to be given prior to Closing and (ii) cooperate in good faith with Buyer in connection with requests for consents (other than Required Consents) required by the terms of the Contracts, Franchises, Real Property agreements and Licenses to be obtained. Notwithstanding the foregoing, Buyer will comply with the reasonable requests of Seller and, to the extent required, negotiate in good faith with any Third Party, as commercially reasonable for Seller to assign to Buyer in part the rights and obligations under any master Contract disclosed on SCHEDULE 4.6.",consents
"Consents. No consent, approval, authorization or order of, or filing, registration or qualification with, any court or governmental authority or other Person is required in connection with the execution, delivery or performance of this Agreement or the Warrants.",consents
