clause_text,clause_type
"Costs and Expenses. Following the occurrence of any event of default under any of the Loan Documents, Mortgagor shall pay upon demand all costs and expenses (including reasonable attorneys’ fees and all amounts paid to accountants, real estate brokers and other advisors employed by Mortgagee and to any contractors for labor and materials), incurred by Mortgagee in the exercise of any of its rights, remedies or powers under any of the Loan Documents or with respect to any Collateral with respect to such event of default, and any amount thereof not paid promptly following demand therefor, together with interest thereon at the rate provided in the Note from the date of such demand, shall become part of the Aggregate Debt and shall be secured by the lien of this Open End Mortgage and Security Agreement. In connection with and as part of the foregoing, in the event that any of the Loan Documents is placed in the hands of any attorney for the collection of any sum payable thereunder, Mortgagor agrees to pay reasonable attorneys’ fees for the collection of the amount being claimed under such Loan Documents, as well as all costs, disbursements and allowances provided by law, and the payment of such fees and costs, disbursements and allowances shall also be secured by the lien of this Open End Mortgage and Security Agreement. Nothing in this paragraph 22 shall limit the obligation of Mortgagor to pay costs and expenses of Mortgagee for which Mortgagor is otherwise liable under the Loan Documents.",costs-and-expenses
"Costs and Expenses. If any lawsuit, reference, or arbitration is commenced which arises out of, or which relates to this Guaranty, the prevailing party shall be entitled to recover from each other party such sums as the court, referee, or arbitrator may adjudge to be reasonable attorneys’ fees (including allocated costs for services of in-house counsel) in the action or proceeding, in addition to costs and expenses otherwise allowed by law. In all other situations, including any Insolvency Proceeding, Guarantor agrees to pay all of CPHP’s costs and expenses, including attorneys’ fees (including allocated costs for services of CPHP’s in-house counsel), that may be incurred in any effort to collect or enforce the Obligations or any part of the Obligations or any term of this Guaranty. From the time(s) incurred until paid in full to CPHP, all sums shall bear interest at an interest rate of ten percent (10%) per annum.",costs-and-expenses
"Costs and Expenses. 13.11.1 Except as provided in this Section 13.11, all costs and expenses for testing and verifying measurement, gauging or testing devices shall be borne by the Party whose devices are being tested and verified; provided, however, that representatives of the Parties attending such tests and verifications shall do so at the cost and risk of the Party they represent.",costs-and-expenses
"Costs and Expenses. Subject to Section 21.1.12, each Party shall bear its own costs (including attorneys’ or Experts’ fees or costs) in respect of enforcement of such Party’s rights in any Dispute proceeding as a result of the other Party failing to perform or failing timely to perform its obligations under this Agreement including failing timely to make any payment in accordance with this Agreement.",costs-and-expenses
"Costs and Expenses. Except as otherwise expressly provided in the Agreement or this Sale Supplement, each party hereto shall be responsible for its own costs and expenses incurred in connection with the negotiation and execution of the Agreement, this Sale Supplement and all documents relating thereto. Seller shall be required to pay all expenses incurred by it in connection with its obligations hereunder to the extent such expenses do not constitute Servicer Advances and shall not be entitled to reimbursement therefor except as specifically provided for herein or in the applicable Deferred Servicing Agreement. Seller shall reimburse Purchasers for any reasonable out-of-pocket costs, including legal fees, incurred by Purchasers in connection with obtaining any required Third Party Consents; provided, however, that neither Purchaser shall incur such costs without the prior written approval of Seller.",costs-and-expenses
"Costs and Expenses. Trustor shall reimburse Trustee, as part of the Obligations secured hereunder, for all reasonable disbursements and expenses (including reasonable legal fees and expenses and any expenses incurred by Trustee in complying with the Nevada Gaming Laws and Gaming Licenses) incurred by reason of and as provided for in this Deed of Trust, including any of the foregoing incurred in Trustee’s administering and executing the trust created by this Deed of Trust and performing Trustee’s duties and exercising Trustee’s powers under this Deed of Trust.",costs-and-expenses
"Costs and Expenses. The Borrower shall pay (i) all reasonable and documented out-of-pocket expenses incurred by the Agents, the Arranger and any Person providing Cash Management Services or furnishing Bank Products to any of the Loan Parties, in connection with this Agreement and the other Loan Documents, including without limitation (A) the reasonable and documented fees, charges and disbursements of (1) counsel for the Agents and the Arranger, (2) appraisers, (3) commercial finance examiners, and (4) all such out-of-pocket expenses incurred during any workout, restructuring or negotiations in respect of the Obligations and Other Liabilities, as wells as expenses of any outside consultants engaged by the Agents, (B) in connection with (1) the syndication of the credit facilities provided for herein, (2) the preparation, negotiation, administration, management, execution and delivery of this Agreement and the other Loan Documents or any amendments, modifications or waivers of the provisions thereof (whether or not the transactions contemplated hereby or thereby shall be consummated), (3) the enforcement or protection of their rights in connection with this Agreement or the Loan Documents or efforts to preserve, protect, collect, or enforce the Collateral or in connection with any proceeding under any Debtor Relief Laws, or (4) any workout, restructuring or negotiations in respect of any Obligations and Other Liabilities, and (ii) with respect to the L/C Issuer, all reasonable out-of-pocket expenses incurred in connection with the issuance, amendment, renewal or extension of any Letter of Credit or any demand for payment thereunder; and (iii) all reasonable out-of-pocket expenses incurred by the Credit Parties who are not the Agents, the Arranger, the L/C Issuer or any Person providing Cash Management Services or furnishing Bank Products to any of the Loan Parties, after the occurrence and during the continuance of an Event of Default, provided that such Credit Parties shall be entitled to reimbursement for no more than one counsel representing all such Credit Parties (absent a conflict of interest in which case the Credit Parties may engage and be reimbursed for additional counsel).",costs-and-expenses
"Costs and Expenses. Except as set forth in Section 10.2, expenses incurred by Sterling on the one hand and Roma on the other hand, in connection with or related to the authorization, preparation and execution of this Agreement, the solicitation of shareholder approval and all other matters related to the closing of the transactions contemplated hereby, including all fees and expenses of agents, representatives, counsel and accountants employed by either such party or its Affiliates, shall be borne solely and entirely by the party that has incurred same.",costs-and-expenses
"Costs and Expenses. Except as otherwise agreed to by the parties hereto, the costs and expenses (including the fees and disbursements of counsel and accountants) of the Collateral Manager and of the Issuer incurred in connection with the negotiation and preparation of and the execution of this Agreement and any amendment hereto, and all matters incidental thereto, shall be borne by the Issuer. The Issuer will pay or reimburse the Collateral Manager for expenses including fees and out-of-pocket expenses reasonably incurred by the Collateral Manager in connection with the services provided by the Collateral Manager under this Agreement, the Indenture or the Master Loan Sale Agreement, including with respect to (a) legal advisers, consultants, rating agencies, accountants (including tax accountants), brokers and other professionals retained by the Issuer or the Collateral Manager (on behalf of the Issuer), (b) asset pricing and asset rating services, compliance services and software, and accounting, programming and data entry services directly related to the management of the Assets, (c) all taxes, regulatory and governmental charges (not based on the income of the Collateral Manager), insurance premiums or expenses, (d) any and all costs and expenses incurred in connection with the acquisition or disposition of investments on behalf of the Issuer (whether or not actually consummated) and management thereof, including attorneys’ fees and disbursements, (e) any fees, expenses or other amounts payable to any Rating Agency, (f) expenses and fees relating to any issuance of additional Notes, redemption, Refinancing or Re-Pricing, as applicable, by the Issuer, (g) any extraordinary costs and expenses incurred by the Collateral Manager in the performance of its obligations under this Agreement and the Indenture and (h) as otherwise agreed upon by the Issuer and the Collateral Manager. In",costs-and-expenses
"Costs and Expenses. Guarantor agrees to pay to Lender on demand ------------------ the reasonable out-of-pocket costs and expenses of Lender, and the reasonable fees and disbursements of counsel to Lender, in connection with the negotiation, preparation, execution and delivery of this Amendment and any other documents to be delivered in connection herewith.",costs-and-expenses
"Costs and Expenses. Seller shall pay Buyer’s reasonable actual out of pocket costs and expenses, including reasonable fees and expenses of accountants, attorneys and advisors, incurred in connection with the preparation, negotiation, execution and consummation of this Amendment.",costs-and-expenses
"Costs and Expenses. All reasonable costs and expenses (including reasonable attorneys fees) incurred by the Company in the exercise or enforcement of any right, power or remedy granted it under this Agreement shall become part of the indebtedness secured hereunder and shall constitute a personal liability of the Borrower payable immediately upon demand and bearing interest until paid at the Company's bank interest rate then being earned by the Company on its deposits.",costs-and-expenses
"Costs and Expenses. Prologis shall pay (a) all reasonable and documented out-of-pocket expenses incurred by any Agent and its Affiliates (including the reasonable and documented fees, charges and disbursements of counsel for such Agent), in connection with (x) the syndication of the credit facilities provided for herein and the preparation, negotiation, execution, delivery and administration of this Agreement and the other Loan Documents and (y) any amendment, modification or waiver of the provisions hereof or thereof (whether or not the transactions contemplated hereby or thereby shall be consummated); provided that Prologis shall have no liability under clause (x) for any fees, charges or disbursements of any counsel other than Haynes and Boone, LLP, Clifford Chance and any other counsel selected by the applicable Agent and approved by Prologis (such approval not to be unreasonably withheld or delayed) and (b) all reasonable and documented out-of-pocket expenses incurred by any Agent, any Lender or any L/C Issuer (including the reasonable fees, charges and disbursements of any counsel for any Agent, any Lender or any L/C Issuer), and shall pay all fees and time charges for attorneys who may be employees of any Agent, any Lender or any L/C Issuer, in connection with the enforcement or protection of its rights (i) in connection with this Agreement and the other Loan Documents, including its rights under this Section, or (ii) in connection with the Loans or Letters of Credit issued hereunder, including all such out-of-pocket expenses incurred during any workout, restructuring or negotiations arising hereunder.",costs-and-expenses
"Costs and Expenses. Each Lender agrees to reimburse the Agent and the Issuers for all costs and expenses suffered or incurred by them or any security trustee in performing their duties hereunder and under the other Loan Documents, or in the exercise of any right or power imposed or conferred upon them hereby or thereby, to the extent that they are not promptly reimbursed for same by the Borrowers or out of the Collateral, all such costs and expenses to be borne by the Lenders ratably in accordance with the amounts of their respective Commitments.",costs-and-expenses
"Costs and Expenses. Each Guarantor, jointly and severally, agrees to pay on demand, all costs and expenses of every kind incurred by Buyer or Collateral Agent: (a) in enforcing this Guaranty, (b) in collecting any of the Obligations from the Company or any Guarantor, (c) in realizing upon or protecting or preserving any collateral for this Guaranty or for payment of any of the Obligations, and (d) in connection with any amendment of, modification to, waiver or forbearance granted under, or enforcement or administration of any Transaction Document or for any other purpose in connection with any Transaction Document, in each case, to the extent Buyer or Collateral Agent may take such action pursuant to the terms and conditions of this Agreement. “Costs and expenses” as used in the preceding sentence shall include, without limitation, reasonable attorneys’ fees incurred by Buyer or Collateral Agent in retaining legal counsel for advice, suit, appeal, any insolvency or other proceedings under the Bankruptcy Code or otherwise, or for any purpose specified in the preceding sentence.",costs-and-expenses
"Costs and Expenses. The Borrower shall pay (i) all reasonable documented out-of-pocket expenses incurred by the Administrative Agent and its Affiliates (including the reasonable and documented fees, charges and disbursements of one firm of outside counsel for such Persons, one local or special counsel to such Persons in any relevant jurisdiction and one regulatory counsel), in connection with the syndication of the credit facilities provided for herein, the preparation, negotiation, execution, delivery and administration of this Agreement and the other Loan Documents or any amendments, modifications or waivers of the provisions hereof or thereof (whether or not the transactions contemplated hereby or thereby shall be consummated), (ii) [reserved] and (iii) all reasonable and documented out-of-pocket expenses incurred by the Administrative Agent or any Lender, which, in the case of any Lender, other than the Administrative Agent and its Affiliates, shall be limited to one firm of outside counsel for all such Lenders, one local or special counsel to such Persons in any relevant jurisdiction and one regulatory counsel (and, in the case, of an actual or perceived conflict of interest, one additional counsel for all such similarly affected persons, one additional local or special counsel for all such similarly affected persons and one regulatory counsel for all such similarly affected persons) (including the reasonable and documented fees, charges and disbursements of counsel) in connection with the enforcement or protection of its rights (A) in connection with this Agreement and the other Loan Documents, including its rights under this Section, or (B) in connection with the Loans made hereunder, including all such reasonable and documented out-of-pocket expenses incurred during any workout, restructuring or negotiations in respect of such Loans.",costs-and-expenses
"Costs and Expenses. (a) In addition to the payment of certain enforcement expenses as provided for in the Priority of Payments, Purchaser shall be responsible for:",costs-and-expenses
"Costs and Expenses. Insurance premiums and any costs or expenses with respect to the insurance described in this Article VI shall be Deductions in determining Operating Profit. Premiums on policies for more than one year shall be charged pro rata against Gross Revenues over the period of the policies. Any reserves, losses, costs, damages or expenses which are uninsured, or fall within deductible limits, shall be treated as a cost of insurance and shall be Deductions in determining Operating Profit.",costs-and-expenses
"Costs and Expenses. Guarantor shall also pay on demand by Lender all costs and expenses, including, without limitation, all reasonable attorneys fees, incurred by Lender in connection with the enforcement or collection of this Guaranty and with the collection or sale of any collateral securing this Guaranty. This covenant shall survive the payment of the Obligations.",costs-and-expenses
"Costs and Expenses. The Payor hereby agrees to pay on demand all reasonable out-of-pocket costs, fees, expenses, disbursements and other charges (including but not limited to the fees, expenses, disbursements and other charges of counsel to the Payee) of the Payee arising in connection with any consent or waiver granted or requested hereunder or in connection herewith, and any renegotiation, amendment, work-out or settlement of this Note or the indebtedness arising hereunder.",costs-and-expenses
"Costs and Expenses. As a condition of this Amendment, Borrowers will promptly on demand pay or reimburse Bank for the costs and expenses incurred by Bank in connection with this Amendment, including, without limitation, Attorneys’ Fees.",costs-and-expenses
"Costs and Expenses. The Contributor will pay all reasonable expenses incident to the performance of its obligations under this Agreement and any other Transaction Document and the Contributor agrees to pay all reasonable out-of-pocket costs and expenses of the Transferor, including fees and expenses of counsel, in connection with the enforcement of any obligation of the Contributor hereunder.",costs-and-expenses
"Costs and Expenses. Company shall be solely responsible for all costs and expenses related to its development and commercialization of the Licensed Product, including without limitation costs and expenses associated with all preclinical activities and clinical trials, and all regulatory filings and proceedings relating to the Licensed Product.",costs-and-expenses
"Costs and Expenses. Borrower shall be liable for all reasonable costs, charges and expenses, including attorney's fees and disbursements, incurred by Lender by reason of the occurrence of any Event of Default or the exercise of Lender's remedies with respect thereto, each of which shall be repayable by Borrower on demand with interest, and added to the Obligations.",costs-and-expenses
"Costs and Expenses. The Authorized Participant shall be responsible for any and all expenses and costs incurred by the Trust in connection with any Orders, including, without limitation, any transaction fees or interest or funding cost incurred by the Trust in connection with the Authorized Participant’s failure to timely settle any Order.",costs-and-expenses
"Costs and Expenses. The Issuer must and the SF Manager must cause the Issuer to pay all costs and expenses of the Note Holder and the OF Manager and any employee, Officer, agent or contractor of the Note Holder and the OF Manager in relation to:",costs-and-expenses
"Costs and Expenses. Contemporaneously with the execution and delivery hereof, Borrower shall pay, or cause to be paid, all costs and expenses incident to the preparation, execution and recordation hereof and the consummation of the transaction contemplated hereby, including, but not limited to, reasonable fees and expenses of legal counsel to Administrative Agent.",costs-and-expenses
"Costs and Expenses. Buyer and Seller shall each pay their respective expenses, brokers’ fees and commissions and expenses incurred in connection with this Agreement and the transactions contemplated hereby, including all accounting, legal and appraisal fees and settlement charges. All transfer taxes, if any, incurred as a result of the transfer of the Purchased Assets shall be paid by Seller.",costs-and-expenses
"Costs and Expenses. Each party shall bear its own costs and expenses in relation to the negotiations leading up to the sale and purchase of the Sale Share and to the preparation, execution and carrying into effect of this Agreement and all other documents referred to in it which relate to the sale and purchase of the Sale Share. The Vendor confirms that no expense of whatever nature relating to the sale and purchase of the Sale Share has been or is to be borne by the Company.",costs-and-expenses
"Costs and Expenses. The Seller agrees to pay on demand all reasonable and documented costs and expenses in connection with the preparation, execution and delivery of this Agreement and the other documents and agreements to be delivered hereunder and thereunder, including, without limitation, the reasonable and documented fees and out-of-pocket expenses of one firm of primary counsel for the Administrative Agent and the Purchaser Agents, the Purchasers and the Banks.",costs-and-expenses
"Costs and Expenses. Borrower shall reimburse Lender upon demand for all out-of-pocket costs and expenses (including, without limitation, Attorneys’ Fees and expenses) incurred by Lender in the preparation, negotiation and execution of this Amendment and any and all other agreements, documents, instruments and/or certificates relating to the amendment of Borrower’s existing credit facilities with Lender. Borrower further agree to pay or reimburse Lender for (a) any stamp or other taxes (excluding income or gross receipts taxes) which may be payable with respect to the execution, delivery, filing and/or recording of any of the Loan Documents, and (b) the cost of any filings and searches, including, without limitation, Uniform Commercial Code filings and searches.",costs-and-expenses
"Costs and Expenses. The Borrower agrees to pay (i) all expenses incurred by any Agent, including transportation expenses and reasonable fees, charges and disbursements of counsel for such Agent, in connection with the syndication of the Loans and the preparation and administration of this Agreement and the other Financing Documents or any amendments, modifications or waivers of the provisions hereof or thereof requested or agreed to by the Borrower (whether or not the transactions contemplated hereby or thereby shall be consummated), and (ii) all expenses incurred by any Agent or any Lender, including fees, charges and disbursements of any counsel for any Agent or any Lender, in connection with (x) the enforcement or protection of its rights in connection with this Agreement and the other Financing Documents, including its rights under this Section 9.3, (y) the exercise of its rights under Section 7.2 upon the occurrence of a Default or an Event of Default or (z) any amendment, waiver, workout, restructuring or negotiations in respect of the Loans.",costs-and-expenses
Costs and Expenses. Each Borrower agrees to pay all reasonable costs and expenses of the Agent (including the reasonable fees and out-of-pocket expenses of legal counsel of the Agent) that are incurred in connection with the execution and delivery of this Agreement and the other agreements and documents entered into in connection herewith.,costs-and-expenses
"Costs and Expenses. The Issuer agrees to pay on demand all costs and expenses of the Holders in connection with the preparation, execution and delivery of this Agreement, including the reasonable fees, costs and expenses of counsel for the Holders with respect thereto.",costs-and-expenses
"Costs and Expenses. The Company shall pay (i) all reasonable and documented out of pocket expenses incurred by the Administrative Agent and its Affiliates (including the reasonable and documented fees, disbursements and other charges of (x) one counsel for the Arrangers, the Administrative Agent and their Affiliates and (y) if reasonably necessary as determined by the Administrative Agent or the Arrangers, one firm of local counsel and one regulatory counsel in each applicable jurisdiction), in connection with the syndication of the credit facilities provided for herein, the preparation, negotiation, execution, delivery and administration of this Agreement and the other Loan Documents or any amendments, modifications or waivers of the provisions hereof or thereof (whether or not the transactions contemplated hereby or thereby shall be consummated), (ii) all reasonable and documented out of pocket expenses incurred by any L/C Issuer in connection with the issuance, amendment, renewal or extension of any Letter of Credit or any demand for payment thereunder and (iii) all out of pocket expenses incurred by the Administrative Agent, any Lender or any L/C Issuer (including",costs-and-expenses
