clause_text,clause_type
"Costs and Expenses. Except as provided above in this Section 9.6(d), the costs and expenses, including attorneys’ fees and expenses, incurred by the Indemnified Party in connection with any claim will be reimbursed on a calendar quarter basis by the indemnifying Party, without prejudice to the indemnifying Party’s right to contest the Indemnified Party’s right to indemnification and subject to refund in the event the indemnifying Party is ultimately held not to be obligated to indemnify the Indemnified Party.",costs-and-expenses
"Costs and Expenses. To the fullest extent allowed by applicable law, Borrower shall pay all expenses and costs, including Attorneys' Fees and Costs incurred by Lender as a result of any default under this Note or in connection with efforts to collect any amount due under this Note, or to enforce the provisions of any of the other Loan Documents, including those incurred in post-judgment collection efforts and in any bankruptcy proceeding (including any action for relief from the automatic stay of any bankruptcy proceeding) or judicial or non-judicial foreclosure proceeding.",costs-and-expenses
"Costs and Expenses. All third party and out-of-pocket expenses incurred by Consultant in the performance of the Services or for the settlement of debts shall be paid by the Company, or Consultant shall be reimbursed if paid by Consultant on behalf of the Company, within ten (10) days of receipt of written notice by Consultant, provided that the Company must approve in advance all such expenses in excess of $500 per month.",costs-and-expenses
"Costs and Expenses. The initial Servicer agrees to pay all reasonable costs and disbursements in connection with the perfection and the maintenance of perfection, as against all third parties, of the Trustees’ and Issuer’s right, title and interest in and to the Loan Assets (including, without limitation, the security interest in the Related Property related thereto and the security interests provided for in the Indenture); provided that to the extent permitted by the Required Loan Documents, the Servicer may seek reimbursement for such costs and disbursements from the related Obligors.",costs-and-expenses
"Costs and Expenses. The Company agrees to pay on demand the costs and expenses of each of the Purchasers in connection with the negotiation, preparation, execution and delivery of the Operative Documents and the other instruments and documents to be delivered hereunder or thereunder or in connection with the transactions contemplated hereby or thereby or in connection with any consents hereunder or waivers or amendments hereto or thereto, including the fees and expenses of Vedder, Price, Kaufman & Kammholz, P.C., counsel for the Agent, with respect to all of the foregoing (whether or not the transactions contemplated hereby are consummated), and all costs and expenses (including attorneys’ fees), if any, incurred by the Agent, the holders of the Notes or any other holders of a Note in connection with a default under or the enforcement of the Operative Documents or any other instrument or document to be delivered hereunder or thereunder. The Company agrees to indemnify and save the holders of the Notes and the Agent harmless from any and all liabilities, losses, costs and expenses (collectively, “indemnified liabilities”) incurred by the holders of the Notes or the Agent in connection with any action, suit or proceeding brought against the Agent or any holder of any Note by any Person (but excluding attorneys’ fees for litigation solely between the holders of the Notes to which the Company is not a party) which arises out of the transactions contemplated or financed hereby or out of any action or inaction by the Agent or any holder of any Note hereunder or thereunder, except for such thereof as is caused by the gross negligence or willful misconduct of the party seeking to be indemnified. The provisions of this Section and the protective provisions of Section 2 hereof shall survive payment of the Notes.",costs-and-expenses
"Costs and Expenses. In addition to the rights of indemnification granted under Section 16.1, the Borrower agrees to pay on demand all reasonable and documented out-of-pocket costs and expenses of the Administrative Agent, the Collateral Agent, the Collateral Custodian and the Lenders in connection with the preparation, execution, delivery, syndication and administration of this Agreement, any liquidity support facility and the other documents and agreements to be delivered hereunder or with respect hereto, and, subject to any cap on such costs and expenses agreed upon in a separate letter agreement among the Borrower, the Servicer and the Administrative Agent or the Collateral Agent and Collateral Custodian Fee Letter, as applicable, and the Borrower further agrees to pay all reasonable and documented out-of-pocket costs and expenses of the Administrative Agent and the Lenders in connection with any amendments, waivers or consents executed in connection with this Agreement, including the reasonable fees and reasonable and documented out-of-pocket expenses of counsel to the Administrative Agent and any related Lender, the Collateral Agent, the Collateral Custodian and the Lenders with respect thereto and with respect to advising the Administrative Agent and the Lenders as to its rights and remedies under this Agreement, and to pay all reasonable, documented and out-of-pocket costs and expenses, if any (including reasonable outside counsel fees and expenses), of the Administrative Agent, the Collateral Agent, the Collateral Custodian and the Lenders, in connection with the enforcement against the Servicer or the Borrower of this Agreement or any of the other Transaction Documents and the other documents and agreements to be delivered hereunder or with respect hereto; provided that in the case of reimbursement of counsel for the Lenders other than the Administrative Agent, such reimbursement shall be limited to one outside counsel to the Administrative Agent and any related Lender.",costs-and-expenses
"Costs and Expenses. The Company will pay all costs, expenses and fees incident to the performance of the obligations of the Company under this Agreement, including, without limiting the generality of the foregoing, the following: accounting fees of the Company; the fees and disbursements of counsel for the Company; the cost of printing and delivering to, or as requested by, the Underwriters copies of the Registration Statement, Preliminary Prospectuses, the Prospectus, this Agreement, the Underwriters' Selling Memorandum, the Underwriters' Invitation Letter, the Listing Application, the Blue Sky Survey and any supplements or amendments thereto; the filing fees of the Commission; the filing fees and expenses (including legal fees and disbursements) incident to securing any required review by the National Association of Securities Dealers, Inc. (the ""NASD"") of the terms of the sale of the Shares; the listing fees of the NASDAQ Stock Market; and the expenses, including the fees and disbursements of counsel for the Underwriters, incurred in connection with the qualification of the Shares under State securities or Blue Sky laws. The Company agrees to pay all costs and expenses of the Underwriters, including the fees and disbursements of counsel for the Underwriters, incident to the offer and sale of directed shares of the Common Stock by the Underwriters to employees and persons having business relationships with the Company and its Subsidiaries. The Company",costs-and-expenses
"Costs and Expenses. Seller will pay all expenses incident to the performance of its obligations under this Agreement and all expenses in connection with the perfection as against third parties of Purchaser’s right, title and interest in and to the Seller Assets and Purchaser agrees to pay expenses incident to the performance of its obligations under this Agreement.",costs-and-expenses
"Costs and Expenses. Guarantor shall pay on demand by Bank all costs and expenses, including without limitation, all reasonable attorneys' fees incurred by Bank in connection with the preparation, administration, enforcement and/or collection of this Guaranty. This covenant shall survive the payment of the Guaranteed Indebtedness.",costs-and-expenses
"Costs and Expenses. The Borrower agrees to pay all reasonable costs and expenses of the Administrative Agent in connection with the preparation, execution and delivery of this Amendment, including without limitation the reasonable fees and expenses of Moore & Van Allen.",costs-and-expenses
"Costs and Expenses. Borrower shall pay on demand all reasonable costs and expenses of Administrative Agent (including the reasonable fees, costs and expenses of counsel to Administrative Agent) incurred in connection with the preparation, execution and delivery of this Amendment.",costs-and-expenses
"Costs and Expenses. The Borrowers agree to pay on demand all reasonable out- of-pocket costs and expenses of the Agent (including Attorney Costs) in connection with the preparation, execution, syndication, delivery and administration (including perfection and protection of any Collateral and the costs of Intralinks or SyndTrak (or similar service), if applicable) of this Agreement, the other Loan Documents and all other documents provided for herein or delivered or to be delivered hereunder or in connection herewith (including any amendment, supplement or waiver to any Loan Document), whether or not the transactions contemplated hereby or thereby shall be consummated, and all reasonable out-of-pocket costs and expenses (including Attorney Costs) incurred by the Agent and each Lender after an Event of Default in connection with the collection of the Obligations or the enforcement of this Agreement the other Loan Documents or any such other documents or during any workout, restructuring or negotiations in respect thereof. In addition, the Borrowers agree to pay and to save the Agent and the Lenders harmless from all liability for, any fees of the Borrowers’ auditors in connection with any reasonable exercise by the Agent and the Lenders of their rights pursuant to Section 10.5. All Obligations provided for in this Section 15.5 shall survive repayment of the Loans, cancellation of the Notes and termination of this Agreement.",costs-and-expenses
"Costs and Expenses. Unless otherwise provided in this Agreement, each party shall bear all fees and expenses incurred in performing its obligations under this Agreement.",costs-and-expenses
"Costs and Expenses. The Borrower shall reimburse the Administrative Agent for all reasonable out-of-pocket costs and expenses (including attorneys’ fees) incurred by the Administrative Agent in connection with the preparation, negotiation and execution of this Amendment and the other agreements and documents executed and delivered in connection herewith.",costs-and-expenses
"Costs and Expenses. Borrower shall bear all taxes, fees, and ------------------ expenses (including reasonable fees and expenses of counsel for Lender) in connection with the Loan, the Note, the preparation and, if applicable, the recordation of this Loan Agreement and the other Loan Documents, and in connection with any amendments, waivers, or consents pursuant to the provisions hereof hereafter made and any workout or restructuring relating to the Loan. If, at any time, an Event of Default occurs or Lender becomes a party to any suit or proceeding in order to protect its interests or priority in any Property or its rights under this Loan Agreement or any of the other Loan Documents, or if Lender is made a party to any suit or proceeding by virtue of the Loan, this Loan Agreement, or any Property and as a result of any of the foregoing, Lender employs counsel to advise or provide other representation with respect to this Loan Agreement, any Property, or to collect the Obligations, or to take any action in or with respect to any suit or proceeding relating to this Loan Agreement, any of the other Loan Documents, any Property, Borrower, or any other Borrower Party, or to protect, collect, or liquidate any of the Collateral, or attempt to enforce any security interest or lien granted to Lender by any of the Loan Documents, then in any such event, all of the attorney's fees arising from such services, including fees on appeal and in any bankruptcy proceedings, and any expenses, costs, and charges relating thereto shall constitute additional obligations of Borrower to Lender payable on demand of Lender. Without limiting the foregoing, Borrower has undertaken the obligation for payment of, and shall pay, all recording and filing fees, revenue or documentary stamps or taxes, intangibles taxes, transfer taxes, recording taxes and other taxes, expenses and charges payable in connection with this Loan Agreement, any of the other Loan Documents, the Obligations, or the filing of any financing statements or other instruments required to effectuate the purposes of this Loan Agreement, and if Borrower fails to do so, Borrower agrees to reimburse Lender for the amounts paid by Lender, together with penalties or interest, if any, incurred by Lender as a result of underpayment or nonpayment. This Section shall survive for eighteen (18) months after repayment of the Obligations.",costs-and-expenses
"Costs and Expenses. (a) PPG agrees to pay all reasonable and customary out-of-pocket costs and expenses of the Administrative Agent (within 10 days of receipt of a written itemized statement, together with supporting documentation, identifying in reasonable detail the amounts of such costs and expenses) incurred in connection with the preparation, execution and delivery of this Agreement, the other Loan Documents and the other documents to be delivered hereunder or thereunder, including, without limitation, all due diligence, syndication (including printing, distribution and bank meetings), transportation, computer, duplication, appraisal, consultant, and audit expenses and the reasonable fees and expenses of counsel for the Administrative Agent with respect thereto. PPG further agrees to pay all reasonable and documented out-of-pocket costs and expenses, if any, of the Administrative Agent, the Issuing Lenders and the Lenders incurred in connection with the enforcement of this Agreement, any of the other Loan Documents and the other documents to be delivered hereunder or thereunder, including, without limitation, reasonable fees and expenses of counsel for the Administrative Agent, each Issuing Lender and each Lender in connection with the enforcement of rights under this Section 9.04(a).",costs-and-expenses
"Costs and Expenses. In accordance with the provisions of Section 11.3 (Costs and Expenses) of the Credit Agreement, each Guarantor agrees to pay or reimburse the Administrative Agent and each of the other Guarantied Parties upon demand for all out-of-pocket costs and expenses, including reasonable attorneys’ fees (including allocated costs of internal counsel and costs of settlement), incurred by the Administrative Agent and such other Guarantied Parties in enforcing this Guaranty against such Guarantor or any security therefor or exercising or enforcing any other right or remedy available in connection herewith or therewith.",costs-and-expenses
"Costs and Expenses. The Borrower shall pay (a) all reasonable and documented out-of-pocket fees and expenses incurred by the Administrative Agent, the Arranger and their respective Affiliates (including, but not limited to, the reasonable and documented out-of-pocket fees and expenses associated with the preparation, due diligence, administration, syndication, travel and all reasonable and documented out-of-pocket fees, charges and disbursements of one primary counsel to the Administrative Agent, and, if reasonably necessary, of a single local counsel to the Administrative Agent in each relevant jurisdiction and a single special counsel in each reasonably necessary specialty, and in the case of any conflict of interest, one additional local and/or special counsel (as applicable)), in connection with the syndication of the credit facilities provided for herein, the preparation, negotiation, execution, delivery of the Commitment Letter, this Agreement and the other Loan Documents, the administration of this Agreement and the other Loan Documents or any amendments, modifications or waivers of the provisions hereof or thereof (whether or not the transactions contemplated hereby or thereby shall be consummated), (b) all reasonable and documented out-of-pocket expenses incurred by the Issuing Lender in connection with the issuance, amendment or extension of any Letter of Credit or any demand for payment thereunder as provided in Section 2.9.2, (c) all out-of-pocket expenses incurred by the Administrative Agent, the Arranger, any Lender or the Issuing Lender (including the fees, charges and disbursements of any counsel for the Administrative Agent, the Arranger any Lender or the Issuing Lender), in connection with the enforcement or protection of its rights (i) in connection with the Commitment Letter, this Agreement and the other Loan Documents, including its rights under this Section, or (ii) in connection with the Loans made or Letters of Credit issued hereunder, including all such out-of-pocket expenses incurred during any workout, restructuring or negotiations in respect of such Loans or Letters of Credit, and (d) all reasonable and documented out-of-pocket expenses of the Administrative Agent’s regular employees and agents engaged periodically to perform audits of the Loan Parties’ books, records and business properties.",costs-and-expenses
Costs and Expenses. The Borrower shall pay (or cause to be paid) all of its reasonable costs and disbursements in connection with the performance of its obligations hereunder and under the Transaction Documents.,costs-and-expenses
"Costs and Expenses. As provided in Section 10.3 of the First Lien Credit Agreement, the Borrower agrees to reimburse Administrative Agent for all fees, costs, and expenses, including the reasonable fees, costs, and expenses of counsel or other advisors for advice, assistance, or other representation, in connection with this Amendment and any other agreements, documents, instruments, releases, terminations or other collateral instruments delivered by the Administrative Agent in connection with this Amendment.",costs-and-expenses
"Costs and Expenses. GEIM will bear the cost of rendering the services it is obligated to provide under this Agreement and will provide the Trust with all executive, administrative, clerical and other personnel necessary for the investment and administrative operations of the Fund and will pay salaries and other employment-related costs of employing these persons. GEIM will furnish the Trust and the Fund with office space, facilities, and equipment and will pay the day-to-day expenses related to the operation of such space, facilities and equipment. Except for those expenses assumed by the Fund as provided below, GEIM shall bear all of the Fund's expenses, including, but not limited to: charges and expenses of any registrar, the costs of custody, transfer agency and recordkeeping services in connection with the Fund; registration costs of the Fund and its shares under Federal and state securities laws; the cost and expense of printing, including typesetting, and distributing of prospectuses describing the Fund and supplements to those prospectuses to regulatory authorities and the Fund's shareholders; all expenses incurred in conducting meetings of the Fund's shareholders and meetings of the Board relating to the Fund, excluding fees paid to members of the Board who are not affiliated with GEIM or any of its affiliates; all expenses incurred in preparing, printing and mailing proxy statements and reports to shareholders of the Fund; all expenses incident to any dividend, withdrawal or redemption options provided to Fund shareholders (except for purchase premiums and redemption fees, if any, charged directly to shareholders); charges and expenses of any outside service used for pricing the Fund's portfolio securities and calculating the net asset value of the Fund's shares; fees and expenses of legal counsel, including counsel to the members of the Board who are not interested persons of the Fund, or GEIM, and independent auditors; membership dues of industry associations; postage; insurance premiums on property or personnel (including officers and Trustees) of the Trust that inure to their benefit; and all other costs of the Fund's operations. The Fund will bear the following expenses: advisory and administration fees as described in Section 5 of this Agreement; shareholder servicing and distribution fees under the terms of the shareholder servicing and distribution plan adopted by the Trust with respect to the Fund pursuant to Rule 12b-1 (the ""Plan"") under the 1940 Act; broke...",costs-and-expenses
"Costs and Expenses. The Borrower agrees to pay to the Collateral Agent on demand the reasonable out-of-pocket costs and expenses of the Collateral Agent and the Lenders party hereto, and the reasonable fees and disbursements of counsel to the Collateral Agent and the Lenders party hereto (including allocated costs of internal counsel), in connection with the negotiation, preparation, execution and delivery of this Amendment and any other documents to be delivered in connection herewith.",costs-and-expenses
"Costs and Expenses. The Borrower agrees to pay on demand all reasonable costs and expenses of the Agent in connection with the preparation, reproduction, execution, and delivery of this Amendment and the other instruments and documents to be delivered hereunder, including (A) the costs and expenses incurred by the Agent in conducting and completing its field audit, as contemplated in the First Amendment, and (B) the reasonable fees and out-of-pocket expenses of counsel for the Agent with respect hereto. All such fees and charges, if not paid promptly when due, may be charged directly as Revolving Loans.",costs-and-expenses
"Costs and Expenses. Except to the extent that the effect of such payment would be to render any loan or forbearance of money usurious or otherwise illegal under any applicable law, the Debtor shall pay the Secured Party on demand the amount of all moneys expended and all costs and expenses (including reasonable attorneys’ fees and disbursements) incurred by the Secured Party in connection with or as a result of the Secured Party’s taking action under subsection (i) or exercising its rights under Section 6, together with interest thereon from the date expended or incurred by the Secured Party at the Default Rate.",costs-and-expenses
"Costs and Expenses. 7.1 Funding and the Mortgages Trustee, proportionately in accordance with and subject to the applicable Funding Priority of Payments set out in the Funding Deed of Charge or the applicable Priority of Payments for the Mortgages Trustee under the Mortgages Trust Deed, as the case may be, will on each Payment Date reimburse the Cash Manager for all out-of-pocket costs, expenses and charges (together with any amounts in respect of Irrecoverable VAT due thereon) properly incurred by the Cash Manager in the performance of the Cash Management Services including any such costs, expenses or charges not reimbursed to the Cash Manager on any previous Payment Date and the Cash Manager shall supply Funding and/or the Mortgages Trustee with an appropriate VAT invoice issued by the Cash Manager or, if the Cash Manager has treated the relevant cost, expense or charge as a disbursement for VAT purposes, by the person making the supply.",costs-and-expenses
"Costs and Expenses. The Borrower agrees to pay, or reimburse the Administrative Agent for paying, (i) all reasonable out-of-pocket expenses incurred by the Arrangers and the Administrative Agent and its Affiliates, including the reasonable fees, charges and disbursements of Special Counsel, the preparation of this Agreement and the other Loan Documents or any amendments, modifications or waivers of the provisions hereof or thereof (whether or not the transactions contemplated hereby or thereby shall be consummated), (ii) all out-of-pocket expenses incurred by any Issuing Bank in connection with the issuance, amendment, renewal or extension of any Letter of Credit or any demand for payment thereunder, (iii) all out-of-pocket expenses incurred by the Administrative Agent, any Issuing Bank or any Lender, including the fees, charges and disbursements of one counsel acting on behalf of all indemnified persons (and, in the event of any conflict of interest, of additional counsel for all affected indemnified persons and, if necessary, of one local counsel in any relevant jurisdiction) the Administrative Agent, Issuing Bank or Lender, in connection with the enforcement or protection of its rights in connection with this Agreement and the other Loan Documents, including its rights under this Section 9.03, or in connection with the Loans made or Letters of Credit issued hereunder, including in connection with any workout, restructuring or negotiations in respect thereof and (iv) all transfer, stamp, documentary or other similar taxes, assessments or charges levied by any governmental or revenue authority in respect of this Agreement or any of the other Loan Documents or any other document referred to herein or therein.",costs-and-expenses
"Costs and Expenses. The Borrower shall, whether or not the transactions contemplated hereby shall be consummated:",costs-and-expenses
