clause_text,clause_type
"Definitions. Unless otherwise defined in this Amendment, all capitalized terms used, but not otherwise defined, herein shall have the meaning given to such terms in the Deposit Agreement.",definitions
Definitions. (a) Capitalized terms used herein without definition shall have the meanings assigned to them in the Indenture.,definitions
"Definitions. When used in this Agreement, the following terms shall have the meanings specified:",definitions
"Definitions. (a) The term """,definitions
"Definitions. Except as otherwise expressly provided in or pursuant to this Indenture or unless the context otherwise requires, for all purposes of this Indenture:",definitions
"Definitions. Section 2. Whenever used herein, unless otherwise required by the context or specifically provided:",definitions
"Definitions. In this Agreement, unless something in the subject matter or context is inconsistent therewith:",definitions
"Definitions. Section 1.01. Unless the context otherwise requires, the several terms defined in the Development Credit Agreement, the Preamble to this Agreement and in the General Conditions (as so defined) have the respective meanings therein set forth.",definitions
"Definitions. As used in this Declaration, the following terms shall have the following meanings:",definitions
Definitions. Capitalized terms used but not otherwise defined herein shall have the meaning given them in the Servicing Agreement.,definitions
"Definitions. The terms “registered investment company,” “vote of a majority of the outstanding voting securities,” “assignment,” and “interested persons,” when used herein, shall have the respective meanings specified in the Investment Company Act as now in effect or as hereafter amended, and subject to such orders or no-action letters as may be granted by the Securities and Exchange Commission (“Commission”).",definitions
Definitions. The following words shall have the following meanings when used in this Agreement. Terms not otherwise defined in this Agreement shall have the meanings attributed to such terms in the Uniform Commercial Code. All references to dollar amounts shall mean amounts in lawful money of the United States of America.,definitions
Definitions. 1. CLEC Certification,definitions
"Definitions. Capitalized terms used in this Agreement without definition shall have their respective meanings set forth in the Purchase Agreement. As used in this Agreement, the following capitalized terms shall have the following meanings:",definitions
"Definitions. For all purposes of this Agreement, except as otherwise expressly provided or unless the context otherwise requires, (i) the terms defined in this Article shall have the meanings assigned to them in this Article and include the plural as well as the singular, (ii) all accounting terms not otherwise defined herein shall have the meanings assigned to them in accordance with GAAP, (iii) all references in this Agreement to designated ""Articles,"" ""Sections"" and other subdivisions are to the designated Articles, Sections and other subdivisions of this Agreement, and (iv) the words ""herein,"" ""hereof,"" ""hereunder"" and other words of similar import refer to this Agreement as a whole and not to any particular Article, Section or other subdivision.",definitions
Definitions. For purposes of this amendment:,definitions
"Definitions. As used in this Agreement, the following terms shall have the meanings set forth in this Section 1.1:",definitions
Definitions. (a) As used in this Agreement:,definitions
"Definitions. Whenever the following terms are used in this Agreement, they shall have the meaning specified below unless the context clearly indicates to the contrary.",definitions
Definitions. All terms used herein and not otherwise defined shall have the meanings set forth in the Agreement.,definitions
Definitions. In this agreement:,definitions
"Definitions. For purposes of this Chapter: business person means a national of a Party who is engaged in trade in goods, trade in services or investment activities; temporary entry means entry into the territory of a Party by a business person of the other Party without the intent to establish permanent residence; business visitor means a natural person of a Party who is: (i) a service seller who is a sales representative of a service supplier of that Party and is seeking temporary entry to the other Party for the purpose of negotiating the sale of services for that service supplier, where such representative will not be engaged in making direct sales to the general public or in supplying services directly; (ii) an investor of a Party or a duly authorized representative of an investor of a Party, who is seeking temporary entry into the territory of the other Party to establish, develop, administer, expand, monitor, or dispose an investment of that investor; or (iii) a goods seller who is seeking temporary entry to the territory of the other Party to negotiate the sale of goods where such negotiations do not involve direct sales to the general public; intra-corporate transferee means a manager, an executive, or a specialist, who is a senior employee of a service supplier of a Party with a commercial presence, as defined in Chapter 8 (Trade in Services), in the territory of the other Party; executive means a natural person within an organization who primarily directs the management of the organization, exercises wide latitude in decision-making, and receives only general supervision or direction from higher level executives, the board of directors and/or stockholders of the business. An executive would not directly perform tasks related to the actual provision of the service nor the operation of an investment; immigration measure means any law, regulation or procedure affecting the entry and sojourn of foreign nationals; manager means a natural person within an organization who primarily directs the organization or a department or sub-division of the organization, supervises and controls the work of other supervisory, professional or managerial employees, has the authority to hire and fire or take other personnel actions (such as promotion or leave authorization), and exercises discretionary authority over day-to-day operations; and specialist means an employee within an organization who possesses knowledge at an advanced level of technical expertise, and who possesses p...",definitions
Definitions. For the purposes of this Chapter:,definitions
"Definitions. (i) For purposes of this clause, “Products.” Deliverables furnished under this Contract by or through Contractor, including existing and custom Products, including, but not limited to: a) components of the hardware environment, b) printed materials (including but not limited to training manuals, system and user documentation, reports, drawings), whether printed in hard copy or maintained on diskette, CD, DVD or other electronic media c) third party software, d) modifications, customizations, custom programs, program listings, programming tools, data, modules, components, and e) any properties embodied therein, whether in tangible or intangible form (including but not limited to utilities, interfaces, templates, subroutines, algorithms, formulas, source code, object code).",definitions
Definitions. The following terms are defined as follows:,definitions
"Definitions. Except as otherwise specified herein or as the context may otherwise require, capitalized terms used but not otherwise defined herein are defined in Appendix A hereto, which also contains rules as to usage that are applicable herein.",definitions
"Definitions. In this Agreement, unless the context otherwise requires the following words and expressions have the following meanings:",definitions
"Definitions. (a) Unless otherwise defined herein, terms defined in the Credit Agreement and used herein shall have the respective meanings given to such terms in the Credit Agreement, and the following terms are used herein as defined in the UCC: Account, Certificated Security, Chattel Paper, Commercial Tort Claim, Commodity Account, Document, Equipment, Farm Products, Fixtures, General Intangible, Goods, Instrument, Inventory, Letter-of-Credit Rights, Money, Securities Account and Supporting Obligation.",definitions
Definitions. When used herein the following terms shall have the following meanings:,definitions
"Definitions. In this Agreement, unless the context otherwise requires, the following terms shall have the following meanings respectively:",definitions
"Definitions. “Personally Identifiable Information” or “PII” means information in any format about an identifiable individual, including, name, address, phone number, e-mail address, account number(s), identification number(s), any other actual or assigned attribute associated with or identifiable to an individual and any information that when used separately or in combination with other information could identify an individual. “Issuer PII” means PII furnished by the Issuer, the Servicer or their Affiliates to the Asset Representations Reviewer and PII developed or otherwise collected or acquired by the Asset Representations Reviewer in performing its obligations under this Agreement.",definitions
"Definitions. For purposes of this Chapter: trade in services means the supply of a service: (a) from the territory of a Party into the territory of the other Party; (b) in the territory of a Party by a person of that Party to a person of the other Party; (c) by a service supplier of a Party, through commercial presence in the territory of the other Party; or (d) by a service supplier through presence of natural persons of a Party in the territory of the other Party; juridical person means an entity constituted or organized under applicable law, whether or not for profit, and whether privately or governmentally owned or controlled, including a corporation, trust, partnerhsip, sole proprietorship, joint venture or association; juridical person is: (i) ""owned"" by persons of a Party if more than 50% of the equity in it is beneficially owned by persons of that Party; (ii) ""controlled"" by persons of a Party if such persons have the power to name a majority of its directors or otherwise to legally direct its actions; service supplier of a Party means any person of that Party that supplies a service; (3) measure means any measure by a Party, whether in the form of a law, regulation, rule, procedure, decision, administrative action, or any other form; supply of a service includes the production, distribution, marketing, sale and delivery of a service; commercial presence means any type of business or professional establishment, including through: (i) the constitution, acquisition or maintenance of a juridical person; or (ii) the creation or maintenance of a branch or a representative office, within the territory of a Party for the purpose of supplying a service; and natural person of a Party means a natural person who resides in the territory of a Party, and who under the law of that Party is a national of that Party.",definitions
"Definitions. For purposes of this Chapter: investment means every kind of asset invested by investors of one Party in accordance with the laws and regulations of the other Party in the territory of the latter, and in particular, though not exclusively, includes: (a) movable, immovable property and other property rights such as mortgages and pledges, and similar rights; (b) shares, debentures, stock and any other kind of participation in companies; (c) claims to money or to any other performance having an economic value associated with an investment (11); (d) intellectual property rights, in particularly copyrights, patents, trade-marks, trade-names, know-how and technological process, as well as good-will; (e) concessions conferred by law or under contract, including concessions to search for, cultivate, extract or exploit natural resources. investors means: (a) for China: (i) natural persons who have nationality of the People's Republic of China in accordance with its law; (ii) economic entities established in acordance with the laws of the People's Republic of China and domiciled in the territory of the People ´s Republic of China; or (iii) legal entities not established under the law of the People's Republic of China but effectively controlled, by natural persons, as defined in subparagraph (a)(i) or by economic entities as defined in subparagraph (a)(ii), that have made an investment in the territory of the other Party; and (b) for Peru: (i) natural persons who, according to the law of the Republic of Peru, have its nationality; or (ii) all juridical persons established in accordance with the laws of the Republic of Peru, including civil and commercial companies and other associations with or without a legally ackowledged existence that perform an economic activity included within the sphere of this Chapter and which are directly or indirectly controlled by nationals of the Republic of Peru, that have made an investment in the territory of the other Party; and returns means the amounts yielded by investments, such as profits, dividends, interests, capital gains, royalties, fees or other legitimate income.",definitions
"Definitions. As used in this Agreement, the terms ""affiliated person,"" ""assignment,"" ""control,"" ""interested person,"" ""principal underwriter"" and ""vote of a majority of the outstanding voting securities"" shall have the meanings set forth in the 1940 Act and the rules and regulations thereunder, subject to any applicable orders of exemption issued by the Securities and Exchange Commission.",definitions
"Definitions. For purposes of the Agreement, the following terms are defined as follows:",definitions
"Definitions. Capitalized terms used and not defined in this Agreement, including Exhibit A hereto and any provisions of the SWSA incorporated by reference herein (regardless of whether such terms are defined in the SWSA), shall have the meanings ascribed to such terms in the Trust Agreement.",definitions
"Definitions. Unless the context otherwise requires, the following terms shall have the following meanings for purposes of this Agreement:",definitions
"Definitions. Whenever used in this Agreement, the following terms shall have the meanings set forth below and, when the meaning is intended, the initial letter of the word is capitalized:",definitions
"Definitions. For purposes of this Agreement, the following terms shall have the respective meanings given to them below:",definitions
Definitions. All capitalized terms not otherwise defined herein are used herein with the respective definitions given them in the Credit Agreement.,definitions
Definitions. The following terms used in this Agreement shall have the following meanings (unless otherwise expressly provided herein):,definitions
"Definitions. Whenever the following terms are used in this Agreement, they shall have the meanings set forth below. Capitalized terms not otherwise defined herein shall have the same meanings as in the Plan.",definitions
Definitions. The following terms shall have the meanings ascribed to them below:,definitions
Definitions. Capitalized terms used in this Agreement shall have the meanings specified therefor on Schedule 1.1.,definitions
Definitions. For purposes of this Agreement: -----------,definitions
"Definitions. As used in this Trust Agreement, the following terms shall have the following meanings unless the context otherwise requires:",definitions
"Definitions. As used in this Agreement, the following terms, whether used in the singular or plural, shall have the following meanings:",definitions
"Definitions. For purposes of this Agreement, the following terms shall have the meanings specified:",definitions
"Definitions. For purposes of this Agreement, except as otherwise expressly provided or unless the context otherwise requires, the following terms shall have the following respective meanings:",definitions
Definitions. The following definitions shall apply to the respective terms (in the singular and plural forms of such terms) used in this Deposit Agreement and the Receipts:,definitions
Definitions. Any capitalized terms used but not otherwise defined herein shall have the meanings ascribed to such terms in the Credit Agreement.,definitions
"Definitions. Capitalized terms used but not otherwise defined herein, including in the related Purchase Agreement and Bill of Sale, shall have the definitions set forth in Appendix A to the Indenture dated as of August 14, 2014, among the Eligible Lender Trustee on behalf of the Trust, the Trust and the Indenture Trustee, as such appendix may be amended or supplemented from time to time with the consent of the parties hereto. For purposes hereof:",definitions
Definitions. Capitalized terms used in this Agreement shall have the following meanings:,definitions
Definitions. Capitalized terms used herein without definition shall have the meanings given to them in the Purchase Agreement. The terms set forth below are used herein as so defined:,definitions
"Definitions. Affiliate is defined as a person that (directly or indirectly) owns or controls, is owned or controlled by, or is under common ownership or control with, another person. For purposes of this paragraph, the term “own” means to own an equity interest (or equivalent thereof) of more than 10 percent. Commission is defined as the appropriate regulatory agency in each state of BellSouth’s nine-state region (Alabama, Florida, Georgia, Kentucky, Louisiana, Mississippi, North Carolina, South Carolina, and Tennessee). Competitive Local Exchange Carrier (CLEC) means a telephone company certificated by the Commission to provide local exchange service within BellSouth's franchised area. Effective Date is defined as the date that the Agreement is effective for purposes of rates, terms and conditions and shall be thirty (30) days after the date of the last signature executing the Agreement. Future amendments for rate changes will also be effective thirty (30) days after the date of the last signature executing the amendment.",definitions
Definitions. The term “,definitions
Definitions. AS USED IN THIS AGREEMENT:,definitions
"Definitions. In addition to terms defined elsewhere in this Agreement, the following terms when used in this Agreement shall have the meanings indicated below:",definitions
Definitions. 48 SECTION 9.4. Interpretation . . . . . . . . . . . . . . . . . . . . . . . . . . . . . . . . . . . . . . . . . . . . 49 SECTION 9.5. Counterparts . . . . . . . . . . . . . . . . . . . . . . . . . . . . . . . . . . . . . . . . . . . . . 49 SECTION 9.6. Entire Agreement; No Third-Party Beneficiaries . . . . . . . . . . . . . . . . . . . . . . . . . . . . 49 SECTION 9.7. Governing Law . . . . . . . . . . . . . . . . . . . . . . . . . . . . . . . . . . . . . . . . . . . . . 49 SECTION 9.8. Assignment . . . . . . . . . . . . . . . . . . . . . . . . . . . . . . . . . . . . . . . . . . . . . . 49 SECTION 9.9. Enforcement of the Agreement . . . . . . . . . . . . . . . . . . . . . . . . . . . . . . . . . . . . . 49,definitions
Definitions. (a) For the purposes of this Guaranty:,definitions
"Definitions. As used in this Credit Agreement, the following terms shall have the meanings specified below unless the context otherwise requires:",definitions
Definitions. All of the capitalized terms contained in this Appendix shall have the same meanings as defined in the Agreement unless otherwise defined herein and shall be in addition to any other terms defined herein:,definitions
"Definitions. The following terms have the meanings set forth, or referred to, below:",definitions
"Definitions. For all purposes of this Indenture and of any indenture supplemental hereto, except as otherwise expressly provided or unless the context otherwise requires:",definitions
Definitions. Capitalized terms used herein and not otherwise defined herein shall have their respective defined meanings given them in the Credit Agreement.,definitions
"Definitions. Wherever they are used herein, the following terms have the following respective meanings:",definitions
Definitions. Capitalized words and phrases used in this Agreement have the following meanings:,definitions
Definitions. The following defined terms will have the respective meanings set forth below.,definitions
Definitions. The following terms are defined as follows (except as otherwise agreed in writing by the parties):,definitions
"Definitions. Unless specifically set forth to the contrary herein, the following terms, whether used in the singular or plural, shall have the respective meanings set forth below:",definitions
"Definitions. In this Agreement, unless there is something in the subject matter or context inconsistent therewith, the following terms shall have the following meanings respectively:",definitions
Definitions. (a) For purposes of this Agreement:,definitions
"Definitions. For all purposes of this Trust Agreement, except as otherwise expressly provided herein or unless the context otherwise requires, capitalized terms not otherwise defined herein shall have the meanings assigned to such terms in Appendix A to the Indenture, dated December 21, 2004, between American Home Mortgage Investment Trust 2004-4, as Issuer, and The Bank of New York, as Indenture Trustee, which is incorporated by reference herein. All other capitalized terms used herein shall have the meanings specified herein.",definitions
"Definitions. For purposes of this Agreement, the following capitalized terms have the following meanings:",definitions
"Definitions. The following terms, as used herein, shall have the following respective meanings:",definitions
"Definitions. Capitalized terms used herein and not otherwise defined herein shall have the meanings ascribed to them in the Credit Agreement. The following terms, as used in this Guaranty, shall have the following meanings:",definitions
"Definitions. With the exception of the definition of ""Affiliate"" set forth in Section 2.12(a)(i) below (which definition shall apply only to this Section 2.12), for purposes of this Agreement, the following terms shall have the meanings set forth below:",definitions
"Definitions. For purposes of this Agreement, the following terms shall have the meanings so indicated:",definitions
"Definitions. As used in this Agreement, the following terms shall have the following meanings, unless a different meaning is clearly required by the context:",definitions
Definitions. Capitalized terms used herein and not otherwise defined herein shall have the meanings ascribed thereto in the Credit Agreement.,definitions
"Definitions. Except as otherwise defined herein or as the context may otherwise require, capitalized terms used but not otherwise defined herein are defined in Appendix A to the Sale and Servicing Agreement dated as of the date hereof (as from time to time amended, supplemented or otherwise modified and in effect, the “Sale and Servicing Agreement”) between the Issuer, the Servicer, Santander Drive Auto Receivables LLC and Wilmington Trust, National Association, as indenture trustee, which also contains rules as to usage that are applicable herein. Whenever used in this Agreement, the following words and phrases shall have the following meanings:",definitions
"Definitions. The following terms, as used in this Agreement, have the following meanings:",definitions
Definitions. Section 1.02 Acts of Holders............................................... Section 1.03 Effect of Headings and Table of Contents...................... Section 1.04 Benefits of Agreement.........................................,definitions
"Definitions. Unless otherwise defined herein, capitalized terms shall have the meanings assigned to such terms in the Grant Notice or the Plan.",definitions
"Definitions. Unless otherwise defined herein, terms defined in the Purchase Agreement and used herein shall have the meanings given to them in the Purchase Agreement. The words “hereof,” “herein,” “hereto” and “hereunder” and words of similar import when used in this Guarantee shall refer to this Guarantee as a whole and not to any particular provision of this Guarantee, and Section and Schedule references are to this Guarantee unless otherwise specified. The meanings given to terms defined herein shall be equally applicable to both the singular and plural forms of such terms. The following terms shall have the following meanings:",definitions
"Definitions. Whenever used in this Agreement, the following terms and their variant forms shall have the meaning set forth below:",definitions
Definitions. In this Deed:,definitions
Definitions. The terms defined in Section 14 and elsewhere in this Master Agreement will have the meanings therein specified for the purpose of this Master Agreement.,definitions
"Definitions. Section 1.01. Wherever used in this Project Agreement, unless the context otherwise requires, the several terms defined in the Loan Agreement and in the Loan Regulations (as so defined) have the respective meanings therein set forth.",definitions
"Definitions. Unless otherwise provided in this Agreement, the following terms shall have the following meanings:",definitions
"Definitions. The terms that follow, when used in this Agreement and any Terms Agreement, shall have the meanings indicated.",definitions
Definitions. The following definitions shall apply to this Agreement:,definitions
"Definitions. Unless the context requires a different meaning, capitalized terms are used in this Agreement as defined below.",definitions
