clause_text,clause_type
"Definitions. As used in this Agreement, the following terms shall have the following meanings:",definitions
"Definitions. For all purposes of this Indenture, except as otherwise expressly provided or unless the context otherwise requires:",definitions
Definitions. For purposes of this Agreement:,definitions
"Definitions. For purposes of this Agreement, the following terms shall have the following meanings:",definitions
Definitions. As used in this Agreement:,definitions
"Definitions. As used in this Agreement, the following terms have the respective meanings set forth below:",definitions
Definitions. In this Agreement:,definitions
"Definitions. Whenever used in this Agreement, the following words and phrases, unless the context otherwise requires, shall have the following meanings:",definitions
"Definitions. For purposes of this Agreement, the following terms shall have the meanings set forth below:",definitions
"Definitions. As used herein, the following terms shall have the following meanings:",definitions
"Definitions. In addition to the terms defined elsewhere in this Agreement, for all purposes of this Agreement, the following terms have the meanings set forth in this Section 1.1:",definitions
"Definitions. Capitalized terms used and not otherwise defined herein that are defined in the Purchase Agreement shall have the meanings given such terms in the Purchase Agreement. As used in this Agreement, the following terms shall have the following meanings:",definitions
"Definitions. The following terms, as used herein, have the following meanings:",definitions
"Definitions. The terms that follow, when used in this Agreement, shall have the meanings indicated.",definitions
Definitions. For the purposes of this Agreement:,definitions
Definitions. As used in this,definitions
"Definitions. The terms defined in this Article I shall, for all purposes of this Agreement, have the respective meanings set forth below:",definitions
"Definitions. Any question of interpretation of any term or provision of this Agreement, including but not limited to the investment advisory fee, the computations of net asset values, and the allocation of expenses, having a counterpart in or otherwise derived from the terms and provisions of the Advisory Agreement or the 1940 Act, shall have the same meaning as and be resolved by reference to such Advisory Agreement or the 1940 Act.",definitions
"Definitions. Whenever used in this Agreement, the following words and phrases shall have the meanings specified:",definitions
"Definitions. The following definitions shall for all purposes, unless otherwise clearly indicated, apply to the respective terms used in this Deposit Agreement:",definitions
"Definitions. For purposes of this Agreement, the following definitions shall apply:",definitions
"Definitions. Whenever used herein, unless otherwise required by the context or specifically provided:",definitions
Definitions. For the purpose of this Agreement:,definitions
"Definitions. Capitalized terms used herein and not otherwise defined herein shall have the respective meanings set forth in the Securities Purchase Agreement. As used in this Agreement, the following terms shall have the following meanings:",definitions
"Definitions. As used in this Agreement, the following capitalized defined terms shall have the following meanings:",definitions
Definitions. Capitalized terms used but not defined in this Amendment shall have the meanings given to them in the Loan Agreement.,definitions
"Definitions. The following definitions shall be for all purposes, unless otherwise clearly indicated to the contrary, applied to the terms used in this Agreement.",definitions
"Definitions. References to a “Section” or the “recitals” are, unless otherwise specified, to a Section or the recitals of this Agreement. Capitalized terms not otherwise defined herein shall have the meaning ascribed thereto in the Lead Securitization Servicing Agreement. Whenever used in this Agreement, the following terms shall have the respective meanings set forth below unless the context clearly requires otherwise.",definitions
"Definitions. In addition to the terms defined elsewhere in this Agreement: (a) capitalized terms that are not otherwise defined herein have the meanings given to such terms in the Debentures (as defined herein), and (b) the following terms have the meanings set forth in this Section 1.1:",definitions
"Definitions. For purposes of this Agreement, the following terms shall have the meanings indicated below:",definitions
Definitions. The terms defined in Section 14 and in the Schedule will have the meanings therein specified for the purpose of this Master Agreement.,definitions
Definitions. SPECIFICATION 10 REGISTRY PERFORMANCE SPECIFICATIONS,definitions
Definitions. As used herein:,definitions
"Definitions. In this Agreement, the following terms shall have the following meanings:",definitions
"Definitions. In this Agreement, unless the context otherwise requires:",definitions
"Definitions. As used herein, the following terms shall have the meanings set forth below:",definitions
Definitions. The following capitalized terms used herein have the following meanings:,definitions
Definitions. The following terms shall have the following meanings:,definitions
"Definitions. Whenever used in this Agreement, the following words shall have the meanings set forth below:",definitions
"Definitions. As used in this Agreement, the following terms have the meanings indicated:",definitions
"Definitions. As used in this Agreement, the following terms shall have the following meanings (such meanings to be equally applicable to both the singular and plural forms of the terms defined):",definitions
Definitions. The following terms shall have the following meanings for purposes of this Agreement:,definitions
"Definitions. Whenever used in this Agreement, the following words and phrases, unless the context otherwise requires, shall have the meanings specified in this Article.",definitions
"Definitions. Any question of interpretation of any term or provision of this Agreement having a counterpart in or otherwise derived from a term or provision of the 1940 Act shall be resolved by reference to such term or provision of the 1940 Act and to interpretations thereof, if any, by the United States courts or, in the absence of any controlling decision of any such court, by rules, releases or orders of the SEC validly issued pursuant to the Act. As used in this Agreement, the terms “majority of the outstanding voting securities,” “affiliated person,” “interested person,” “assignment,” “broker,” “investment adviser,” “net assets,” “sale,” “sell,” and “security” shall have the same meaning as such terms have in the 1940 Act, subject to such exemptions as may be granted by the SEC by any rule, release or order. Where the effect of a requirement of the federal securities laws reflected in any provision of this Agreement is made less restrictive by a rule, release, or order of the SEC, whether of special or general application, such provision shall be deemed to incorporate the effect of such rule, release, or order.",definitions
"Definitions. As used in this Agreement, the following terms shall have the meanings indicated below:",definitions
"Definitions. For purposes of this Agreement, the following terms have the meanings specified or referred to in this Section 1:",definitions
Definitions. The following terms shall have the following meanings when used herein:,definitions
Definitions. For the purposes of this Appendix A the following terms shall have the meanings indicated below:,definitions
"Definitions. As used in this Agreement, and unless the context requires a different meaning, the following terms have the meanings indicated:",definitions
Definitions. ARTICLE II,definitions
"Definitions. Covered employees: Employees of a contractor or subcontractor who have or will have continuing duties related to the service to be performed at the District and have or will have direct contact with students. The District will be the final arbiter of what constitutes direct contact with students. Disqualifying criminal history: Any conviction or other criminal history information designated by the District, or one of the following offenses, if at the time of the offense, the victim was under 18 or enrolled in a public school:",definitions
Definitions. Terms used but not otherwise defined in this Agreement shall have the meaning assigned to such terms in the Registration Statement.,definitions
Definitions. The following terms shall have the meanings set forth below:,definitions
"Definitions. Capitalized terms used in this Agreement and not defined herein shall have the meanings assigned in the Original Pooling and Servicing Agreement, unless otherwise required by the context herein.",definitions
"Definitions. All capitalized terms used, but not otherwise defined, herein shall have the meanings set forth below, unless otherwise clearly indicated:",definitions
"Definitions. For purposes of this Section 5, the following terms shall have the following meanings:",definitions
"Definitions. For the purposes of this Agreement, the following words and phrases shall have the following meanings:",definitions
"Definitions. Capitalized terms used but not otherwise defined in this Agreement shall have the respective meanings assigned them in Part I of Appendix A to the Sale and Servicing Agreement of even date herewith by and among the Trust, WOAR and World Omni, as Servicer, as it may be amended, supplemented or modified from time to time. All references herein to “the Agreement” or “this Agreement” are to this Receivables Purchase Agreement as it may be amended, supplemented or modified from time to time, the exhibits hereto and the capitalized terms used herein which are defined in such Appendix A, and all references herein to Articles, Sections and subsections are to Articles, Sections or subsections of this Agreement unless otherwise specified. The rules of construction set forth in Part II of such Appendix A shall be applicable to this Agreement.",definitions
"Definitions. For purposes of this Agreement, the following terms have the meanings indicated:",definitions
"Definitions. As used in this Agreement, the following terms shall have the meaning set forth below:",definitions
Definitions. All capitalized terms not otherwise defined herein shall have the respective meanings set forth in the Credit Agreement.,definitions
"Definitions. Whenever used herein, the following words and phrases, unless the context otherwise requires, shall have the following meanings:",definitions
"Definitions. The following words and phrases, unless the context otherwise requires, shall have the following meanings:",definitions
Definitions. The following terms used in this Agreement shall have the meanings set forth below:,definitions
"Definitions. Unless otherwise provided herein, the terms below shall have the following meanings:",definitions
Definitions. For purposes of this Section 1:,definitions
Definitions. The following terms when used in this Agreement shall have the meanings assigned to them below:,definitions
"Definitions. As used herein, unless the context otherwise requires, the following terms have the following respective meanings:",definitions
"Definitions. For the purposes of this Warrant, the following terms have the following meanings:",definitions
"Definitions. The capitalized terms used below in this Section to describe particular procurement methods or methods of review by the Association of particular contracts, refer to the corresponding method described in the Procurement Guidelines, or Consultant Guidelines, as the case may be.",definitions
"Definitions. Any question of interpretation of any term or provision of this Agreement having a counterpart in or otherwise derived from the terms and provisions of the Management Agreement or the 1940 Act, shall have the same meaning as and be resolved by reference to the Management Agreement.",definitions
Definitions. The following words and terms shall have the meanings set forth below for the purposes of this Agreement:,definitions
"Definitions. The following capitalized words and terms shall have the following meanings when used in this Agreement. Unless specifically stated to the contrary, all references to dollar amounts shall mean amounts in lawful money of the United States of America. Words and terms used in the singular shall include the plural, and the plural shall include the singular, as the context may require. Words and terms not otherwise defined in this Agreement shall have the meanings attributed to such terms in the Uniform Commercial Code. Accounting words and terms not otherwise defined in this Agreement shall have the meanings assigned to them in accordance with generally accepted accounting principles as in effect on the date of this Agreement:",definitions
"Definitions. As used in this Agreement, the terms set forth in this Article I shall have the following meanings (such meanings to be equally applicable to both the singular and plural forms of the terms defined).",definitions
Definitions. The following terms shall have the following meanings when used in this Agreement:,definitions
"Definitions. For all purposes of this Agreement, except as otherwise expressly required or unless the context clearly indicates a contrary intent:",definitions
"Definitions. The terms defined in this Section 1.01 (except as herein otherwise expressly provided or unless the context otherwise requires) for all purposes of this Indenture and of any indenture supplemental hereto shall have the respective meanings specified in this Section 1.01. The words “herein,” “hereof,” “hereunder” and words of similar import refer to this Indenture as a whole and not to any particular Article, Section or other subdivision. The terms defined in this Article include the plural as well as the singular.",definitions
"Definitions. The following terms used herein, including in the preamble, recitals, exhibits and schedules hereto, shall have the following meanings:",definitions
"Definitions. Capitalized terms used in this Amendment, to the extent not otherwise defined herein, shall have the same meanings as in the Agreement, as amended hereby.",definitions
"Definitions. As used in this Guarantee Agreement, the terms set forth below shall, unless the context otherwise requires, have the following meanings. Capitalized or otherwise defined terms used but not otherwise defined herein shall have the meanings assigned to such terms in the Trust Agreement as in effect on the date hereof.",definitions
"Definitions. The terms defined in this Section 1.1 (except as herein otherwise expressly provided or unless the context otherwise requires) for all purposes of this Indenture and of any indenture supplemental hereto shall have the respective meanings specified in this Section 1.1. All accounting terms used herein and not expressly defined shall have the meanings assigned to such terms in accordance with generally accepted accounting principles and the term “generally accepted accounting principles” means such accounting principles as are generally accepted in the United States at the time of any computation. The words “herein,” “hereof” and “hereunder” and other words of similar import refer to this Indenture as a whole and not to any particular Article, Section or other subdivision.",definitions
"Definitions. In addition to those terms defined above and elsewhere in this Agreement, for the purposes of this Agreement, the following terms shall have the meanings set forth below:",definitions
"Definitions. For purposes of this Attachment, “Party” shall mean the Contractor, Grantee or Subrecipient, with whom the State of Vermont is executing this Agreement and consistent with the form of the Agreement. “Agreement” shall mean the specific contract or grant to which this form is attached.",definitions
"Definitions. In addition to the terms defined elsewhere in this Agreement, the following terms have the meanings set forth in this Section 1.1:",definitions
"Definitions. (a) Except as otherwise specified herein or as the context may otherwise require, the following terms have the respective meanings set forth below for all purposes of this Indenture.",definitions
Definitions. Terms used but not defined herein shall have the meanings assigned to them in the Mortgage Loan Purchase Agreement.,definitions
"Definitions. In this Agreement, the following words and expressions shall have the following meanings:",definitions
Definitions. Terms used but not otherwise defined in this Agreement shall have the meaning assigned to such terms in the registration statement on Form S-1 the Company plans to file with the U.S. Securities and Exchange Commission under the Securities Act.,definitions
"Definitions. As used in this Agreement, the following terms shall have the meanings ascribed to them below:",definitions
Definitions. Capitalized terms in this Article 4 shall have the following meanings:,definitions
Definitions. Unless the context otherwise requires:,definitions
"Definitions. As used in the Loan Documents, the word “shall” is mandatory, the word “may” is permissive, the word “or” is not exclusive, the words “includes” and “including” are not limiting, the singular includes the plural, and numbers denoting amounts that are set off in brackets are negative. As used in this Agreement, the following capitalized terms have the following meanings:",definitions
"Definitions. As used throughout this Agreement, the capitalized terms set forth below shall have the indicated meanings:",definitions
"Definitions. As used herein, the following terms shall have the meanings herein specified unless the context otherwise requires. Defined terms herein shall include in the singular number the plural and in the plural the singular:",definitions
"Definitions. (a) As used herein, the following terms have the following meanings:",definitions
"Definitions. Covered Damage"": All damages to property of the unit's owner, up to $1,475.00 in the aggregate for each Stay, that occurs during the Covered Guest's stay and that is the result of the inadvertent acts or omissions of the Covered Guest or the Covered Guest's invitee, excluding the damages listed in the conditions section above. • ""Covered Guest"": All registered guests and all persons booked to share the same unit of accommodations, and have paid the required plan cost. • ""Stay"": The stay at an iTrip unit, from the date of a Covered Guest's check-in to the date of check-out.",definitions
"Definitions. In addition to the other terms defined herein, the following terms used herein shall have the meanings herein specified (to be equally applicable to both the singular and plural forms of the terms defined):",definitions
"Definitions. In addition to the terms defined elsewhere in this Warrant, the following terms have the meanings indicated in this Section 1:",definitions
"Definitions. (a) Whenever used in this Supplement, the following words and phrases shall have the following meanings, and the definitions of such terms are applicable to the singular as well as the plural forms of such terms and the masculine as well as the feminine and neuter genders of such terms.",definitions
"Definitions. Unless the context otherwise requires, when used herein the following terms shall have the meanings indicated.",definitions
Definitions. All capitalized terms not otherwise defined herein shall have the meanings given to them in the Loan Agreement.,definitions
Definitions. (a) In this Agreement:,definitions
Definitions. The following terms shall have the following meanings for purposes of this Section 8.,definitions
"Definitions. (a) As used in this Agreement, the following terms have the following meanings:",definitions
"Definitions. The term “Utility Installations” refers to all floor and window coverings, air and/or vacuum lines, power panels, electrical distribution, security and fire protection systems, communication cabling, lighting fixtures, HVAC equipment, plumbing, and fencing in or on the Premises. The term “Trade Fixtures” shall mean Lessee’s machinery and equipment that can be removed without doing material damage to the Premises. The term “Alterations” shall mean any modification of the improvements, other than Utility Installations or Trade Fixtures, whether by addition or deletion. “Lessee Owned Alterations and/or Utility Installations” are defined as Alterations and/or Utility Installations made by Lessee that are not yet owned by Lessor pursuant to Paragraph 7.4(a).",definitions
Definitions. The following terms shall have the following meanings as used in this Agreement:,definitions
"Definitions. As used in this Agreement, the following terms shall have the following meanings specified or indicated below, and such meanings shall be equally applicable to the singular and plural forms of such defined terms.",definitions
"Definitions. 1. For the purposes of this Agreement, unless otherwise defined:",definitions
"Definitions. In addition to terms defined elsewhere herein, the following terms shall have the following meanings for the purposes of this Agreement:",definitions
Definitions. The following terms have the meanings specified or referred to in this Article I:,definitions
Definitions. 1.1 In this Agreement:,definitions
"Definitions. The following defined terms used herein shall, unless the context otherwise requires, have the meanings specified below. Capitalized terms used herein for which no definition is provided herein shall have the meanings set forth in the Original Indenture.",definitions
Definitions. Any capitalized term used but not defined in this Assignment has the same meaning as in the Agreement.,definitions
"Definitions. Except as otherwise defined in this Amendment No. 1, terms defined in the Credit Agreement are used herein as defined therein.",definitions
"Definitions. For all purposes of this Servicing Agreement, except as otherwise expressly provided herein or unless the context otherwise requires, capitalized terms not otherwise defined herein shall have the meanings assigned to such terms in the Definitions contained in Appendix A to the Indenture which is incorporated by reference herein. All other capitalized terms used herein shall have the meanings specified herein.",definitions
Definitions. For purposes of this Agreement the following capitalized terms shall have the respective meanings set forth below.,definitions
"Definitions. (a) Except as otherwise provided herein, the capitalized terms set forth below shall have the following meanings:",definitions
"Definitions. Unless the context otherwise requires, the terms defined in this Section 1 will have the meanings herein specified for all purposes of this Agreement, applicable to both the singular and plural forms of any of the terms herein defined.",definitions
"Definitions. (a) Unless otherwise defined herein, terms defined in the Credit Agreement and used herein shall have the meanings given to them in the Credit Agreement.",definitions
"Definitions. The capitalized terms used in this Single Family Shared-Loss Agreement that are not defined in this Single Family Shared-Loss Agreement are defined in the Purchase and Assumption Agreement. In addition to the terms defined above, defined below are certain additional terms relating to loss-sharing, as used in this Single Family Shared-Loss Agreement.",definitions
"Definitions. The terms defined in this Section (except as in this Indenture otherwise expressly provided or unless the context otherwise requires) for all purposes of this Indenture and of any indenture supplemental hereto shall have the respective meanings specified in this Section and shall include the plural as well as the singular. All other terms used in this Indenture that are defined in the Trust Indenture Act of 1939, as amended, or that are by reference in said Trust Indenture Act defined in the Securities Act of 1933, as amended (except as herein otherwise expressly provided or unless the context otherwise requires), shall have the meanings assigned to such terms in said Trust Indenture Act and in said Securities Act as in force at the date of the execution of this Indenture.",definitions
"Definitions. When used in this Agreement, the following terms not otherwise defined herein have the following meanings:",definitions
"Definitions. Words or phrases which are initially capitalized or are within quotation marks shall have the meanings provided in this Section and as provided elsewhere herein. For purposes of this Agreement, the following definitions apply:",definitions
"Definitions. For the purposes hereof, the following terms shall have the following meanings:",definitions
"Definitions. As used herein, the following terms shall have the following meanings, unless the context shall otherwise require:",definitions
"Definitions. In addition to the terms defined elsewhere in this Agreement, the following terms have the meanings indicated:",definitions
"Definitions. The following capitalized terms used in this Agreement shall have the meanings assigned to them below, which definitions shall apply to both the singular and the plural forms of such terms:",definitions
"Definitions. All capitalized terms used in this Amendment, unless otherwise defined herein, shall have the meaning ascribed to such terms in the Loan Agreement.",definitions
Definitions. The following defined terms used in this Agreement shall have the meanings specified below:,definitions
Definitions. Section 1.01,definitions
Definitions. The following terms shall have the following meanings in this Agreement:,definitions
