clause_text,clause_type
"Definitions. 3.1.1 For purposes of this Agreement, certain terms have been defined in this Agreement to encompass meanings that may differ from, or be in addition to, the normal connotation of the defined word. Unless the context clearly indicates otherwise, any term defined or used in the singular will include the plural. Whenever the context may require, any pronoun shall include the corresponding masculine, feminine and neuter forms. The words “include”, “includes” and “including” shall be deemed to be followed by the phrase “without limitation” and/or “but not limited to”. The words “will” and “shall” are used interchangeably throughout this Agreement and the use of either connotes a mandatory requirement. The use of one or the other will not mean a different degree of right or obligation for either Party. A defined word intended to convey its special meaning is capitalized when used. Other terms that are capitalized and not defined in this Agreement will have the meaning in the Act, or in the absence of their inclusion in the Act, their customary usage in the Telecommunications industry as of the Effective Date.",definitions
"Definitions. Whenever used herein, the following words and phrases, unless the context otherwise requires, shall have the meanings specified in this Article. Accepted Master Servicing Practices: Accepted Master Servicing Practices shall consist of the customary and usual master servicing practices of prudent master servicing institutions which service mortgage loans of the same type as the Mortgage Loans in the jurisdictions in which the related Mortgaged Properties are located, regardless of the date upon which the related Mortgage Loans were originated.",definitions
"Definitions. For the purpose of this Agreement for Sale, unless the context otherwise requires,-",definitions
Definitions. Capitalized terms used in this Replacement Capital Covenant (including the Recitals) have the meanings set forth in Schedule I hereto.,definitions
"Definitions. The terms as defined in this Section 1.01 shall, for all purposes of this Agreement and any amendment hereto (except as herein otherwise expressly provided or unless the context otherwise requires), have the meanings set forth herein:",definitions
"Definitions. Capitalized terms used herein and not otherwise defined herein shall have the meanings ascribed to them in the Loan Agreement, as amended hereby.",definitions
Definitions. The following terms as used herein shall have the following meanings:,definitions
"Definitions. For purposes of this Agreement, the following terms shall be defined as set forth below:",definitions
Definitions. Capitalized terms used and not defined in this Amendment have the respective meanings assigned to them in the Existing Agreement.,definitions
"Definitions. Each capitalized term used herein and not otherwise defined herein shall have the meaning ascribed to it in the Pooling and Servicing Agreement, dated as of November 24, 1998 (the ""Pooling and Servicing Agreement"") among Norwest Asset Securities Corporation, as seller (the ""Seller""), Norwest Bank Minnesota, National Association, as master servicer (the ""Master Servicer""), First Union National Bank, as trust administrator (the ""Trust Administrator"") and the United States Trust Company of New York, as trustee (the ""Trustee""), of Norwest Asset Securities Corporation Mortgage Pass-Through Certificates, Series 1998-32.",definitions
Definitions. For purposes of this Section 2:,definitions
Definitions. 1. For the purpose of this Agreement:,definitions
"Definitions. Whenever the following terms are used in this Agreement, they shall have the meaning specified below unless the context clearly indicates to the contrary. The masculine pronoun shall include the feminine and neuter, and the singular the plural, where the context so indicates.",definitions
"Definitions. As used in this Note, the following capitalized terms have the following meanings:",definitions
Definitions. All capitalized terms used but not otherwise defined in this Agreement have the meanings set forth in 45 CFR Parts 160 and 164 as amended by HITECH and associated federal rules and regulations.,definitions
"Definitions. As used herein, the following terms shall have the following meanings (all terms defined in this Section 2 or in other provisions of this Repurchase Agreement in the singular to have the same meanings when used in the plural and vice versa)",definitions
"Definitions. As used in this Advisory Agreement (the “Agreement”), the following terms have the definitions hereinafter indicated:",definitions
"Definitions. For the purpose of this Article XIII, the following terms shall have the following meanings:",definitions
"Definitions. The following terms, when used in this Agreement, have the following meanings:",definitions
Definitions. The following capitalized terms when used in this Contract shall have the meanings set forth below unless the context otherwise requires:,definitions
Definitions. The following terms shall have the meanings set forth in this Section 1 or elsewhere in the provisions of this Credit Agreement referred to below:,definitions
"Definitions. All references in the Current HPA to the “Agreement” shall mean the Current HPA, as further amended by this Amendment; and all references in the Current HPA to Schedules A, B or C shall mean the Schedules A, B or C attached to this Amendment. All references herein to the “HPA” shall mean the Current HPA, as further amended by this Amendment.",definitions
Definitions. 1.1 In this Agreement unless the context otherwise requires:,definitions
"Definitions. Capitalized terms used but not otherwise defined herein shall have the respective meanings ascribed to such terms in the Merger Agreement. When used in this Agreement, the following terms in all of their tenses, cases and correlative forms shall have the meanings assigned to them in this Section 1 or elsewhere in this Agreement.",definitions
Definitions. All capitalized terms used but not defined herein shall have the meanings set forth in the Agreement.,definitions
Definitions. For the purposes of this Regulation:,definitions
"Definitions. For all purposes of this Agreement, the following terms shall have the meanings specified in this Section unless the context clearly otherwise requires:",definitions
"Definitions. (a) Reference is hereby made to the Securities Purchase Agreement and the Notes for a statement of the terms thereof. All terms used in this Agreement and the recitals hereto which are defined in the Securities Purchase Agreement, the Notes or in the Code, and which are not otherwise defined herein shall have the same meanings herein as set forth therein; provided that terms used herein which are defined in the Code on the date hereof shall continue to have the same meaning notwithstanding any replacement or amendment of the Code except as the Collateral Agent may otherwise determine.",definitions
"Definitions. In this Agreement, the following terms have the meanings specified or referred to in this Section 1.1 and shall be equally applicable to both the singular and plural forms.",definitions
"Definitions. For the purposes hereof, in addition to the terms defined elsewhere in this Debenture, (a) capitalized terms not otherwise defined herein shall have the meanings set forth in the Purchase Agreement and (b) the following terms shall have the following meanings:",definitions
"Definitions. The terms in this Agreement with initial letters capitalized, whether used in the singular or the plural, shall have the meaning set forth below or, if not listed below, the meaning designated in places throughout this Agreement.",definitions
Definitions. Certain terms are used in this Agreement as specifically defined herein. These definitions are set forth or referred to in Section 6 hereof.,definitions
"Definitions. Whenever used in this Agreement or in any Schedules to this Agreement, the following words and phrases, unless the context otherwise requires, shall have the following meanings:",definitions
"Definitions. In addition to the words and terms elsewhere defined in this Agreement, the following words and terms as used herein shall have the following meanings, unless the context or use indicates a different meaning:",definitions
"Definitions. For purposes of this Agreement, the following terms will have the following meanings when used herein with initial capital letters:",definitions
"Definitions. When used in this Agreement, the following terms have the following meanings:",definitions
"Definitions. For the purposes of this Article 7, the following terms shall have the meanings set forth below:",definitions
"Definitions. For all purposes of this Agreement, the following terms shall have the meanings set forth below, unless the context clearly indicates otherwise:",definitions
Definitions. Capitalized terms used in this Amendment and not otherwise defined herein shall have the meanings specified for such terms in the Agreement.,definitions
"Definitions. As used in this Agreement, the following terms have the meanings specified in this Section 1.1.",definitions
Definitions. 1 Act . . . . . . . . . . . . . . . . . . . . . . . . . . . . . . 2,definitions
Definitions. The following definitions shall be in effect under the Agreement:,definitions
"Definitions. In addition to the definitions set forth above, the following terms, as used herein, have the following meanings:",definitions
"Definitions. In this letter (including the acknowledgement set out below) terms defined in the Agreement shall, unless the context otherwise requires, have the same meaning and:",definitions
Definitions. The following definitions apply unless the context requires otherwise.,definitions
Definitions. The following definitions apply for purposes of this Annex I.,definitions
Definitions. The following capitalized terms shall have the respective following meanings:,definitions
"Definitions. Unless the context otherwise requires, the terms hereinafter set forth when used herein shall have the following meanings and the following definitions shall be equally applicable to both the singular and plural forms of any of the terms herein defined:",definitions
"Definitions. Except as otherwise specified herein or as the context may otherwise require, capitalized terms used but not otherwise defined herein have the meanings ascribed thereto in the Trust Agreement, the Sale and Servicing Agreement and the Securities Account Control Agreement, as the case may be, for all purposes of this Indenture. Except as otherwise provided in this Agreement, whenever used herein the following words and phrases, unless the context otherwise requires, shall have the following meanings:",definitions
Definitions. Capitalized terms used and not otherwise defined herein shall have the meaning assigned to such terms in the Rights Agreement.,definitions
Definitions. Capitalized terms used but not otherwise defined herein shall have the meanings assigned to them in the Act.,definitions
Definitions. .1 Section 1.2 Incorporation by Reference of Trust Indenture Act . . . . . . . . . . . . . . . . . . . . . . . . . 11 Section 1.3 Rules of Construction . . . . . . . . . . . . . . . . . . . . . 12,definitions
Definitions. Capitalized terms used in this Agreement shall have the meanings set forth below or in the section of this Agreement referred to below:,definitions
Definitions. Each capitalized term that is used herein and is defined in the Original Indenture shall have the meaning specified in the Original Indenture unless such term is otherwise defined herein.,definitions
"Definitions. (1) An """,definitions
"Definitions. For purposes of this Paragraph 8, the following terms shall have the following meanings:",definitions
"Definitions. Certain capitalized terms used in this Trust Agreement shall have the respective meanings assigned to them in Part I of Appendix A to the Servicing Agreement of even date herewith among the Depositor, the Servicer and the Trust (as amended, supplemented or modified from time to time, the “Servicing Agreement”). All references herein to “the Agreement” or “this Agreement” are to this Trust Agreement. All references herein to Articles, Sections and subsections are to Articles, Sections and subsections of this Agreement unless otherwise specified. The rules of construction set forth in Part II of Appendix A to the Servicing Agreement shall be applicable to this Agreement.",definitions
Definitions. For purposes of this paragraph:,definitions
Definitions. The following terms shall have the respective meanings set forth below throughout this Agreement:,definitions
Definitions. Section 1.01. Definitions.....................................................1,definitions
"Definitions. For purposes of this Agreement, capitalized terms used and not defined herein shall have the respective meanings ascribed to them in the Merger Agreement.",definitions
"Definitions. As used in this Agreement, unless the context requires a different meaning, the following terms shall have the meanings set forth herein:",definitions
"Definitions. Capitalized terms used herein without definition shall have the respective meanings ascribed to them in the Purchase Agreement. As used in this Agreement, the following capitalized defined terms shall have the following meanings:",definitions
"Definitions. All terms used herein which are defined in Article 1 or Article 9 of the Uniform Commercial Code shall have the meanings given therein unless otherwise defined in this Agreement. All references to the plural herein shall also mean the singular and to the singular shall also mean the plural unless the context otherwise requires. All references to Borrower and Lender pursuant to the definitions set forth in the recitals hereto, or to any other person herein, shall include their respective successors and assigns. The words ""hereof"", ""herein"", ""hereunder"", ""this Agreement"" and words of similar import when used in this Agreement shall refer to this Agreement as a whole and not any particular provision of this Agreement and as this Agreement now exists or may hereafter be amended, modified, supplemented, extended, renewed, restated or replaced. The word ""including"" when used in this Agreement shall mean ""including, without limitation"". An Event of Default shall exist or continue or be continuing until such Event of Default is waived in accordance with Section 11.3 or is cured in a manner satisfactory to Lender, if such Event of Default is capable of being cured as determined by Lender. Any accounting term used herein unless otherwise defined in this Agreement shall have the meanings customarily given to such term in accordance with GAAP. For purposes of this Agreement, the following terms shall have the respective meanings given to them below:",definitions
"Definitions. As used in this Agreement, the following terms have the meanings set forth below.",definitions
"Definitions. Unless otherwise defined herein, terms defined in the Credit Agreement are used herein as therein defined.",definitions
"Definitions. In this Agreement, in addition to the terms defined above, the following terms shall have the following meanings:",definitions
"Definitions. Contribution"" means:",definitions
"Definitions. The words and expressions beginning with capital letters and defined in this Agreement (including those in Article 21) shall, unless the context otherwise requires, have the meaning ascribed thereto herein, and the words and expressions defined in the Schedules and used therein shall have the meaning ascribed thereto in the Schedules.",definitions
Definitions. For purposes of this schedule only:,definitions
"Definitions. (a) Whenever used in this Agreement, the following words and phrases shall have the following meanings:",definitions
"Definitions. SECTION 1.01 Scope of Supplemental Indenture 2 SECTION 1.02 Definitions 2 SECTION 2.01 Title and Terms 3 SECTION 2.02 Depository Global Securities 3 SECTION 2.03 Payments 3 SECTION 3.01 Survivor’s Option 3 SECTION 4.01 Trustee Acceptance 5 SECTION 4.02 Governing Law 5 SECTION 4.03 Trust Indenture Act 5 SECTION 4.04 Execution in Counterparts 5 SECTION 4.05 Severability 5 SECTION 4.06 Appointment of Paying Agent, Security Registrar and Place of Payment 5 SECTION 4.07 Ratification of Original Indenture 6 Exhibit A Form of Note A-1 Eighty-Seventh SUPPLEMENTAL INDENTURE, dated as of July 20, 2015 (the “Supplemental Indenture”), between SolarCity Corporation, a Delaware corporation (hereinafter called the “Company”), having its principal executive office located at 3055 Clearview Way, San Mateo, California, 94402, and U.S. Bank National Association, a national banking association duly organized and existing under the laws of the United States of America, as trustee (in such capacity, the “Trustee”), to the indenture, dated as of October 15, 2014, between the Company and the Trustee (as amended or supplemented from time to time in accordance with the terms thereof, the “Original Indenture”).",definitions
"Definitions. As used herein, unless the context otherwise requires, the following terms shall have the meanings indicated:",definitions
"Definitions. Whenever used in this Agreement, the following terms shall have the meanings set forth below.",definitions
"Definitions. In this Indenture and in the Debentures, unless there is something in the subject matter or context inconsistent therewith, the expressions following shall have the following meanings, namely:",definitions
"Definitions. Capitalized terms used, but not otherwise defined in this Agreement shall have the meanings given to such terms in the Management Agreements. The following capitalized terms as used in this Agreement shall have the meanings set forth below:",definitions
"Definitions. For all purposes of and under this Agreement, the following terms shall have the respective meanings below, and such meanings shall be equally applicable to the singular and plural forms of such defined terms.",definitions
"Definitions. As used in this Section 9.20, the following terms shall have the following meanings:",definitions
Definitions. Section 1.1,definitions
Definitions. All capitalized terms used herein and not otherwise defined shall have the same meaning herein as in the Credit Agreement.,definitions
"Definitions. Whenever used in this Agreement with an initial capital letter, the terms defined in this Section 1 shall have the meanings specified.",definitions
Definitions. For purposes of this award term:,definitions
Definitions. As used in this clause—,definitions
"Definitions. For the purpose of this Agreement, the following words and phrases shall have the meanings set forth below:",definitions
"Definitions. Capitalized terms used in this Supplemental Indenture and not otherwise defined shall have the meanings ascribed to them in the Original Indenture. In addition, the following terms shall have the following meanings to be equally applicable to both the singular and the plural forms of the terms defined:",definitions
Definitions. All capitalized terms used herein and not expressly defined herein shall have the respective meanings given to such terms in the Agreement.,definitions
"Definitions. Except as otherwise expressly provided or unless the context otherwise requires, all terms used in this Third Supplemental Indenture which are defined in the Indenture shall have the meanings ascribed to them by the Indenture. The following terms used in this Third Supplemental Indenture have the following respective meanings:",definitions
Definitions. Each of the terms set forth in Annex A is defined in the Section of this Agreement set forth opposite such term.,definitions
"Definitions. As used herein, the following words and phrases shall have the following meanings:",definitions
Definitions. All capitalized terms used herein and not otherwise defined herein are used herein as defined in the Credit Agreement.,definitions
"Definitions. (a) Unless otherwise defined herein, terms defined in the Credit Agreement and used herein shall have the meanings given to them in the Credit Agreement, and the following terms which are defined in the Uniform Commercial Code in effect in the State of New York on the date hereof are used herein as so defined: Accounts, Chattel Paper, Documents, Equipment, Farm Products, Instruments and Inventory.",definitions
Definitions. For the purpose of this Agreement,definitions
Definitions. Capitalized terms used herein shall have the following meanings:,definitions
"Definitions. For all purposes of this Second Supplemental Indenture, the capitalized terms used herein (i) which are defined in this Section 1.02 have the respective meanings assigned hereto in this Section 1.02 and (ii) which are defined in the Base Indenture (and which are not defined in this Section 1.02) have the respective meanings assigned thereto in the Base Indenture. For all purposes of this Second Supplemental Indenture:",definitions
Definitions. ARTICLE II.,definitions
"Definitions. When used in this Agreement, each of the following terms shall have the meanings set forth in this Article I:",definitions
"Definitions. In addition to terms defined elsewhere in this Agreement, the capitalized terms set forth below shall have the following meaning:",definitions
Definitions. The terms set forth below are used herein as so defined:,definitions
Definitions. (a) The definitions stated herein apply equally to both the singular and the plural forms of the terms defined.,definitions
"Definitions. Whenever used in this Agreement, the following words and terms have the meanings set out below:",definitions
Definitions. 1.1 Defined expressions,definitions
Definitions. For purposes of this Section:,definitions
Definitions. Unless otherwise provided or required by the context:,definitions
"Definitions. Capitalized terms not otherwise defined in this Exhibit shall have the same meaning as set forth earlier in this Agreement. In addition to said terms, the following terms shall have the following meanings, unless the context shall indicate another or different meaning or intent:",definitions
"Definitions. Capitalized terms used in this Award Agreement that are not defined in this Award Agreement have the meanings as used or defined in the Plan. As used in this Award Agreement, the following terms have the meanings set forth below:",definitions
Definitions. Words and expressions which are used but not defined in this Agreement shall have the meanings given to them in the Operating Agreement.,definitions
"Definitions. As used in this agreement, the following words and terms shall have the meanings here ascribed to them:",definitions
"Definitions. For purposes hereof, the following terms when used herein shall have the respective meanings set forth below:",definitions
Definitions. The following terms shall have the meanings set forth below.,definitions
"Definitions. Whenever used in this Subscription Agreement, unless there is something in the subject matter or context inconsistent therewith, the following words and phrases shall have the respective meanings ascribed to them as follows:",definitions
"Definitions. Terms used but not otherwise defined in this Agreement shall have the meaning assigned to such terms in the registration statement on Form S-1, which the Company has filed with the SEC under the Securities Act.",definitions
"Definitions. 1.1 The term """,definitions
Definitions. Capitalized terms used herein without definition have the following meanings (such meanings being equally applicable to both the singular and plural form of the terms defined):,definitions
"Definitions. As used herein, the following terms shall have the indicated meanings:",definitions
"Definitions. Unless the context otherwise requires, the terms defined in this Section 1.01 shall for all purposes of this Indenture have the meanings hereinafter set forth: The term “Affiliate,” with respect to any specified Person shall mean any other Person directly or indirectly controlling or controlled by or under direct or indirect common control with such specified Person. For the purposes of this definition, “control” when used with respect to any specified Person means the power to direct the management and policies of such Person, directly or indirectly, whether through the ownership of voting securities, by contract or otherwise; and the terms “controlling” and “controlled” have meanings correlative to the foregoing.",definitions
Definitions. Section 1.01.,definitions
"Definitions. As used herein,",definitions
"Definitions. The following terms have the following meanings, unless the context indicates otherwise:",definitions
"Definitions. Except as otherwise provided herein, the capitalized terms used in this Amendment shall have the definitions set forth in the Lease.",definitions
Definitions. The terms “,definitions
Definitions. Capitalized terms used in this Supplemental Indenture and not otherwise defined herein shall have the meanings assigned to such terms in the Indenture.,definitions
"Definitions. For all purposes of this First Supplemental Indenture and the Notes, except as otherwise expressly provided or unless the subject matter or context otherwise requires:",definitions
"Definitions. For the purposes of this Agreement, in addition to the definitions set forth above, the following terms shall have the respective meanings set forth below:",definitions
Definitions. Certain terms used in this Agreement are defined as follows:,definitions
Definitions. The following terms when used herein have the following meanings:,definitions
"Definitions. For the purpose of this Article, the following definitions shall apply:",definitions
