clause_text,clause_type
"Generally. All accounting terms not specifically or completely defined herein shall be construed in conformity with, and all financial data (including financial ratios and other financial calculations) required to be submitted pursuant to this Agreement shall be prepared in conformity with, GAAP applied on a consistent basis, as in effect from time to time, applied in a manner consistent with that used in preparing the Audited Financial Statements, except as otherwise specifically prescribed herein. Notwithstanding the foregoing, for purposes of determining compliance with any covenant (including the computation of any financial covenant) contained herein, Indebtedness of the Borrower and its Subsidiaries shall be deemed to be carried at 100% of the outstanding principal amount thereof, and the effects of FASB ASC 825 and FASB ASC 470-20 on financial liabilities shall be disregarded.",generally
"Generally. All accounting terms not specifically or completely defined herein shall be construed in conformity with, and all financial data (including financial ratios and other financial calculations) required to be submitted pursuant to this Agreement shall be prepared in conformity with, GAAP applied on a consistent basis, as in effect from time to time, applied in a manner consistent with that used in preparing the Audited Financial Statements, except as otherwise specifically prescribed herein.",generally
"Generally. This Agreement shall be binding upon the parties hereto and their respective successors and assigns and shall inure to the benefit of the parties hereto and the successors and assigns of Lenders. No Credit Party’s rights or obligations hereunder nor any interest therein may be assigned or delegated by any Credit Party without the prior written consent of all Lenders. Nothing in this Agreement, expressed or implied, shall be construed to confer upon any Person (other than the parties hereto, their respective successors and assigns permitted hereby and, to the extent expressly contemplated hereby, Affiliates of each of the Agents and Lenders) any legal or equitable right, remedy or claim under or by reason of this Agreement.",generally
"Generally. Upon receipt of Proper Instructions, which for purposes of this section may also include security trade advices, the Custodian shall facilitate the processing and settlement of foreign exchange transactions. Such foreign exchange transactions do not constitute part of the services provided by the Custodian under this Agreement.",generally
"Generally. (a) If any Event of Default shall have occurred and be continuing, the Collateral Agent may exercise in respect of the Collateral, in addition to all other rights and remedies provided for herein or otherwise available to it at law or in equity, all the rights and remedies of the Collateral Agent on default under the UCC (whether or not the UCC applies to the affected Collateral) to collect, enforce or satisfy any Secured Obligations then owing, whether by acceleration or otherwise, and also may pursue any of the following separately, successively or simultaneously:",generally
"Generally. Except as otherwise expressly provided in this Agreement, (i) any consent or approval required or permitted by this Agreement or any other Loan Document to be given by the Lenders may be given, (ii) any term of this Agreement or of any other Loan Document may be amended, (iii) the performance or observance by the Borrower, any other Loan Party or any other Subsidiary of any terms of this Agreement or such other Loan Document may be waived, and (iv) the continuance of any Default or Event of Default may be waived (either generally or in a particular instance and either retroactively or prospectively) with, but only with, the written consent of the Requisite Lenders (or the Administrative Agent at the written direction of the Requisite Lenders), and, in the case of an amendment to any Loan Document, the written consent of each Loan Party which is party thereto.",generally
"Generally. Except in the case of notices and other communications expressly permitted to be given by telephone (and except as provided in paragraph (b) below), all notices and other communications provided for herein shall be in writing and shall be delivered by hand or overnight courier service, mailed by certified or registered mail or sent by telecopier as follows:",generally
"Generally. No failure or delay by any Agent, the Issuing Bank or any Lender in exercising any right or power hereunder or under any other Loan Document shall operate as a waiver thereof, nor shall any single or partial exercise of any such right or power, or any abandonment or discontinuance of steps to enforce such a right or power, preclude any other or further exercise thereof or the exercise of any other right or power. The rights and remedies of each Agent, the Issuing Bank and the Lenders hereunder and under the other Loan Documents are cumulative and are not exclusive of any rights or remedies that they would otherwise have. No waiver of any provision of any Loan Document or consent to any departure by any Loan Party therefrom shall in any event be effective unless the same shall be permitted by this Section 10.02, and then such waiver or consent shall be effective only in the specific instance and for the purpose for which given. Without limiting the generality of the foregoing, the making of a Loan or issuance of a Letter of Credit shall not be construed as a waiver of any Default, regardless of whether any Agent, any Lender or the Issuing Bank may have had notice or knowledge of such Default at the time. No notice or demand on Borrower in any case shall entitle Borrower to any other or further notice or demand in similar or other circumstances.",generally
"Generally. If for any reason any Lender (a “Defaulting Lender”) shall fail or refuse to perform any of its obligations under this Agreement or any other Loan Document to which it is a party within the time period specified for performance of such obligation or, if no time period is specified, if such failure or refusal continues for a period of two Business Days after notice from the Agent, then, in addition to the rights and remedies that may be available to the Agent or the Borrower under this Agreement or Applicable Law, such Defaulting Lender’s right to participate in the administration of the Loans, this Agreement and the other Loan Documents, including without limitation, any right to vote in respect of, to consent to or to direct any action or inaction of the Agent or to be taken into account in the calculation of the Requisite Lenders, shall be suspended during the pendency of such failure or refusal. If a Lender is a Defaulting Lender because it has failed to make timely payment to the Agent of any amount required to be paid to the Agent hereunder (without giving effect to any notice or cure periods), in addition to other rights and remedies which the Agent or the Borrower may have under the immediately preceding provisions or otherwise, the Agent shall be entitled (i) to collect interest from such Defaulting Lender on such delinquent payment for the period from the date on which the payment was due until the date on which the payment is made at the Federal Funds Rate, (ii) to withhold or setoff and to apply in satisfaction of the defaulted payment and any related interest, any amounts otherwise payable to such Defaulting Lender under this Agreement or any other Loan Document and (iii) to bring an action or suit against such Defaulting Lender in a court of competent jurisdiction to recover the defaulted amount and any related interest. Any amounts received by the Agent in respect of a Defaulting Lender’s Loans shall not be paid to such Defaulting Lender and shall be held uninvested by the Agent and either applied against the purchase price of such Loans under the following subsection (b) or paid to such Defaulting Lender upon the Defaulting Lender’s curing of its default.",generally
Generally. To the fullest extent permitted by the laws of the State of Delaware:,generally
"Generally. This Credit Agreement shall be binding upon and inure to the benefit of and be enforceable by the respective successors and assigns of the parties hereto; provided that none of the Credit Parties may assign or transfer any of its interests without prior written consent of the Lenders; provided further that the rights of each Lender to transfer, assign or grant participations in its rights and/or obligations hereunder shall be limited as set forth in this Section 11.3, provided however that nothing herein shall prevent or prohibit any Lender from (i) pledging its Loans hereunder to a Federal Reserve Bank in support of borrowings made by such Lender from such Federal Reserve Bank, or (ii) granting assignments or selling participations in such Lender's Loans and/or Commitments hereunder to its parent company and/or to any Affiliate or Subsidiary of such Lender.",generally
"Generally. The HSP shall protect itself from and against all Claims that might arise from anything done or omitted to be done by the HSP and the HSP’s Personnel and Volunteers under this Agreement and more specifically all Claims that might arise from anything done or omitted to be done under this Agreement where bodily injury (including personal injury), death or property damage, including loss of use of property is caused.",generally
"Generally. This Credit Agreement shall be binding upon and inure to the benefit of and be enforceable by the respective successors and assigns of the parties hereto; provided that a Borrower may not assign and transfer any of its interests hereunder (except as permitted by Section 9.2) without prior written consent of the Lenders; and provided further that the rights of each Lender to transfer, assign or grant participations in its rights and/or obligations hereunder shall be limited as set forth in this Section 12.3.",generally
"Generally. The terms and provisions of this Agreement and the other Loan Documents shall be binding upon and inure to the benefit of the parties hereto and their respective successors and assigns permitted hereby, except that the Borrower may not assign or otherwise transfer any of its rights or obligations hereunder without the prior written consent of each Lender and no Lender may assign or otherwise transfer any of its rights or obligations hereunder except (i) to an Eligible Assignee in accordance with the provisions of paragraph (b) of this Section, (ii) by way of participation in accordance with the provisions of paragraph (d) of this Section, or (iii) by way of pledge or assignment of a security interest subject to the restrictions of paragraph (f) of this Section and any other attempted assignment or transfer by any party hereto shall be null and void. Nothing in this Agreement, expressed or implied, shall be construed to confer upon any Person (other than the parties hereto, their respective successors and assigns permitted hereby, Participants to the extent provided in subsection (d) of this Section and, to the extent expressly contemplated hereby, the Indemnitees) any legal or equitable right, remedy or claim under or by reason of this Agreement.",generally
"Generally. The LHIN’s ability to enable its local health system to provide appropriate, co-ordinated, effective and efficient health services, as contemplated by LHSIA, is heavily dependent on the timely collection and analysis of accurate information. The HSP acknowledges that the timely provision of accurate information related to the HSP, and its performance of its obligations under this Agreement, is under the HSP’s control.",generally
"Generally. The Borrower hereby authorizes the Administrative Agent to disburse the proceeds of any Loan made by the Lenders or any of their Affiliates pursuant to the Loan Documents as requested by an authorized representative of the Borrower to any of the accounts designated in the Transfer Authorizer Designation Form. The Borrower agrees to be bound by any transfer request: (i) authorized or transmitted by the Borrower; or (ii) made in the Borrower’s name and accepted by the Administrative Agent in good faith and in compliance with these transfer instructions, even if not properly authorized by the Borrower. The Borrower further agrees and acknowledges that the Administrative Agent may rely solely on any bank routing number or identifying bank account number or name provided by the Borrower to effect a wire or funds transfer even if the information provided by the Borrower identifies a different bank or account holder than named by the Borrower. The Administrative Agent is not obligated or required in any way to take any actions to detect errors in information provided by the Borrower. If the Administrative Agent takes any actions in an attempt to detect errors in the transmission or content of transfer requests or takes any actions in an attempt to detect unauthorized funds transfer requests, the Borrower agrees that no matter how many times the Administrative Agent takes these actions the Administrative Agent will not in any situation be liable for failing to take or correctly perform these actions in the future and such actions shall not become any part of the transfer disbursement procedures authorized under this provision, the Loan Documents, or any agreement between the Administrative Agent and the Borrower. The Borrower agrees to notify the Administrative Agent of any errors in the transfer of any funds or of any unauthorized or improperly authorized transfer requests within fourteen (14) days after the Administrative Agent’s confirmation to the Borrower of such transfer.",generally
"Generally. If (i) any “Event of Default” under and as defined in the Credit Agreement has occurred and is continuing, or (ii) after such time as all Obligations shall have been indefeasibly paid in full, and provided, that, the Collateral then secures the payment and performance of any obligations under any Permitted Secured Debt Documents or any Other Permitted Credit Exposure Documents, if any event of default under (A) any obligations under any Permitted Secured Debt Documents which are secured by Collateral, or (B) any obligations under any Other Permitted Credit Exposure Documents which are secured by Collateral, as the case may be (either such occurrence being an “Event of Default” for purposes of this Agreement) shall have occurred and be continuing, Collateral Agent may exercise in respect of the Collateral, in addition to all other rights and remedies provided for herein or otherwise available to it, all the rights and remedies of a secured party on default under the UCC (whether or not the UCC applies to the affected Collateral), and also may (i) require each Grantor to, and each Grantor hereby agrees that it will at its expense and upon request of Collateral Agent forthwith, assemble such of the Collateral as may reasonably be assembled as directed by Collateral Agent and make it available to Collateral Agent at a place or places to be designated by Collateral Agent and reasonably convenient to both parties, (ii) enter onto the property where any Collateral is located and take possession thereof with or without judicial process, (iii) prior to the disposition of the Collateral, store, process, repair or recondition the Collateral or otherwise prepare the Collateral for disposition in any manner to the extent Collateral Agent deems appropriate, (iv) take possession of any Grantor’s premises or place custodians in exclusive control thereof, remain on such premises and use the same and any of such Grantor’s equipment for the purpose of completing any work in process, taking any actions described in the preceding clause (iii) and collecting any Secured Obligation, (v) without notice except as specified below, sell the Collateral or any part thereof in one or more parcels at public or private sale, at Collateral Agent’s offices or elsewhere, for cash, on credit or for future delivery, at such time or times and at such price or prices and upon such other terms as Collateral Agent may deem commercially reasonable, (vi) exercise dominion and control over and refus...",generally
"Generally. Each Revolving Borrowing and Term Loan Borrowing initially shall be of the Type specified in the applicable Borrowing Request and, in the case of a Eurodollar Borrowing, shall have an initial Interest Period as specified in such Borrowing Request. Thereafter, the Borrower may elect to convert such Borrowing to a different Type or to continue such Borrowing and, in the case of a Eurodollar Borrowing, may elect Interest Periods therefor, all as provided in this Section. The Borrower may elect different options with respect to different portions of the affected Borrowing, in which case each such portion shall be allocated ratably among the Lenders holding the Loans comprising such Borrowing, and the Loans comprising each such portion shall be considered a separate Borrowing.",generally
"Generally. The Company shall comply and cause the Bank and each of its other Subsidiaries to comply in all material respects with all applicable statutes, rules, regulations, orders and restrictions in respect of the conduct of its business and the ownership of its properties, except, in each case, where such noncompliance would not reasonably be expected to have a Material Adverse Effect on the Company.",generally
"Generally. Subject to the terms and conditions hereof, as part of the Revolving Credit, the Swing Line Lender may make loans in U.S. Dollars to the Borrower under the Swing Line (individually a “Swing Loan” and collectively the “Swing Loans”) which shall not in the aggregate at any time outstanding exceed the Swing Line Sublimit. Swing Loans may be availed of from time to time and borrowings thereunder may be repaid and used again during the period ending on the Termination Date. Each Swing Loan shall be in a minimum amount of $250,000 or such greater amount which is an integral multiple of $100,000.",generally
"Generally. Each Company has good title to, or valid leasehold interests in, all its property material to its business, free and clear of all Liens except for, in the case of Collateral, Permitted Collateral Liens and, in the case of all other material property, Permitted Liens and minor irregularities or deficiencies in title that, individually or in the aggregate, do not interfere with its ability to conduct its business as currently conducted or to utilize such property for its intended purpose. The property of the Companies, taken as a whole, (i) is in good operating order, condition and repair (ordinary wear and tear excepted) and (ii) constitutes all the property which is required for the business and operations of the Companies as presently conducted.",generally
"Generally. The parties shall have all remedies available at law, in equity or otherwise in the event of any breach or violation of this Agreement or any default hereunder. The parties acknowledge and agree that in the event of any breach of this Agreement, in addition to any other remedies which may be available, each of the parties hereto shall be entitled to specific performance of the obligations of the other parties hereto and, in addition, to such other equitable remedies (including preliminary or temporary relief) as may be appropriate in the circumstances.",generally
"Generally. Maintain with financially sound and reputable insurance companies, insurance with respect to its properties and business against loss or damage of the kinds customarily insured against by Persons engaged in the same or similar business, of such types and in such amounts (after giving effect to any self-insurance reasonable and customary for similarly situated Persons engaged in the same or similar businesses as the Borrower and the Restricted Subsidiaries) as are customarily carried under similar circumstances by such other Persons.",generally
"Generally. The granting and settlement of the RSUs, and any other obligations of the Company under this Agreement, shall be subject to all applicable U.S. federal, state and local laws, rules and regulations, all applicable non-U.S. laws, rules and regulations and to such approvals by any regulatory or governmental agency as may be required. The Participant agrees to take all steps that the Committee or the Company determines are reasonably necessary to comply with all applicable provisions of U.S. federal and state securities law and non-U.S. securities law in exercising the Participant’s rights under this Agreement.",generally
"Generally. To the extent permitted by law and applicable stock exchange rules, the Company, from time to time, may (but is not required to) increase the Conversion Rate by any amount if (i) the Board of Directors determines that such increase is either (x) in the best interest of the Company; or (y) advisable to avoid or diminish any income tax imposed on holders of Common Stock or rights to purchase Common Stock as a result of any dividend or distribution of shares (or rights to acquire shares) of Common Stock or any similar event; (ii) such increase is in effect for a period of at least twenty (20) Business Days; and (iii) such increase is irrevocable during such period.",generally
Generally. If there occurs any:,generally
"Generally. The Notes that are outstanding at any time will be deemed to be those Notes that, at such time, have been duly executed and authenticated, excluding those Notes (or portions thereof) that have theretofore been (i) cancelled by the Trustee or delivered to the Trustee for cancellation in accordance with Section 2.15; (ii) assigned a principal amount of zero by notation on the “Schedule of Exchanges of Interests in the Global Note” forming part of any a Global Note representing such Note; (iii) paid in full (including upon conversion) in accordance with this Indenture; or (iv) deemed to cease to be outstanding to the extent provided in, and subject to, clause (B), (C) or (D) of this Section 2.18.",generally
"Generally. The Company will not consolidate with or merge with or into, or (directly, or indirectly through one or more of its Subsidiaries) sell, lease or otherwise transfer, in one transaction or a series of transactions, all or substantially all of the assets of the Company and its Subsidiaries, taken as a whole, to another Person (a “Business Combination Event”), unless:",generally
"Generally. The Company will send to the Trustee copies of all reports that the Company is required to file with the SEC pursuant to Section 13(a) or 15(d) of the Exchange Act within fifteen (15) calendar days after the date that the Company is required to file the same (after giving effect to all applicable grace periods under the Exchange Act); provided, however, that the Company need not send to the Trustee any material for which the Company has received, or is seeking in good faith and has not been denied, confidential treatment by the SEC. Any report that the Company files with the SEC through the EDGAR system (or any successor thereto) will be deemed to be sent to the Trustee at the time such report is so filed via the EDGAR system (or such successor). Upon the request of any Holder, the Trustee will provide to such Holder a copy of any report that the Company has sent the Trustee pursuant to this Section 3.02(A), other than a report that is deemed to be sent to the Trustee pursuant to the preceding sentence.",generally
"Generally. Notwithstanding anything to the contrary in this Indenture or the Notes, the Company may elect that the sole remedy for any Event of Default (a “Reporting Event of Default”) pursuant to Section 7.01(A)(vi) arising from the Company’s failure to comply with Section 3.02 will, for each of the first one hundred and eighty (180) calendar days on which a Reporting Event of Default has occurred and is continuing, consist exclusively of the accrual of Special Interest on the Notes. If the Company has made such an election, then (i) the Notes will be subject to acceleration pursuant to Section 7.02 on account of the relevant Reporting Event of Default from, and including, the one hundred and eighty first (181st) calendar day on which a Reporting Event of Default has occurred and is continuing or if the Company fails to pay any accrued and unpaid Special Interest when due; and (ii) Special Interest will cease to accrue on any Notes from, and including, such one hundred and eighty first (181st) calendar day (it being understood that interest on any defaulted Special Interest will nonetheless accrue pursuant to Section 2.05(B)).",generally
"Generally. Subject to Sections 8.01, 7.05 and 7.08 and the immediately following sentence, the Company and the Trustee may, with the consent of the Holders of a majority in aggregate principal amount of the Notes then outstanding, amend or supplement this Indenture or the Notes or waive compliance with any provision of this Indenture or the Notes. Notwithstanding anything to the contrary in the foregoing sentence, but subject to Section 8.01, without the consent of each affected Holder, no amendment or supplement to this Indenture or the Notes, or waiver of any provision of this Indenture or the Notes, may:",generally
"Generally. The Company will pay or cause to be paid all the principal of, the Fundamental Change Repurchase Price and Redemption Price for, interest on, and other amounts due with respect to, the Notes on the dates and in the manner set forth in this Indenture.",generally
