clause_text,clause_type
"Generally. Except as provided below, upon the termination of this Agreement for any reason, all compensation and benefits, except benefits provided by law (e.g., COBRA health insurance continuation benefits), will immediately cease to accrue, and all compensation and, except as otherwise required by applicable law, benefits accrued through the date of termination shall be paid to Executive in the manner provided below.",generally
"Generally. Defined terms used in this Service Module and the Schedules hereto and the Appendices thereto, have the meanings set forth in the Master Services Agreement, unless otherwise defined in this Service Module.",generally
Generally. The indemnities in this Agreement are limited to the extent necessary to comply with all Applicable Laws and each indemnity provision is deemed to be amended so as to comply with Applicable Laws but shall be interpreted to give the fullest effect not inconsistent with Applicable Laws.,generally
"Generally. Subject to the terms and conditions of this Agreement and the Plan, each SAR constitutes an unfunded and unsecured promise of the Company to deliver to Participant, at the time such SAR is validly exercised, an amount, payable in the form of Shares, equal to the excess of (i) the Fair Market Value of one Share on the date of exercise, over (ii) the Exercise Price per SAR set forth on the cover page of this Agreement (the “Spread”).",generally
Generally. Interest on the outstanding principal balance of the Loan shall accrue from the Closing Date up to but excluding the Maturity Date at the Interest Rate.,generally
"Generally. In exchange for the Services, you shall pay the Company the then applicable fees and expenses set out below. The Company reserves the right to change the applicable charges and to institute new charges and fees at the end of the Initial Term (as defined below) or then current renewal term, upon 30 days prior notice to you. If you believe that the Company has billed you incorrectly, you must contact Company no later than 60 days after the closing date on the first billing statement in which the error or problem appeared, in order to receive an adjustment or credit. Inquiries should be directed to contact@startengine.com.",generally
Generally. The Partnership has made or shall make the following elections under the Code and the Regulations and any similar state statutes:,generally
"Generally. Subject to Sections 6.2 and 6.3, Bluebird will have the sole right to Prosecute and Maintain Patents within the Licensed IP. Bluebird will use commercially reasonable efforts to, where applicable and upon Celgene’s reasonable request, separate parent Patent applications within the Licensed IP into one or more separate Patent applications for Specific Patents, to the extent permitted under applicable Law, where doing so would not reasonably be expected to materially harm any Patent within the Licensed IP or other Patents owned by Bluebird or its Affiliates, provided that the foregoing limitation will not apply to Licensed IP that is Collaboration IP. [***]",generally
"Generally. Notwithstanding anything else to the contrary in this Agreement or in any Loan Document, Section 6.14(b) is intended to address a specific Collateral request of the Administrative Agent, and in each case shall be in addition to those obligations and requirements of the Borrower and the Nexstar Entities and Mission Entities elsewhere in this Agreement, the Mission Credit Agreement and the other Loan Documents, including but not limited to, those obligations and requirements in Section 6.11 (it being agreed among the Borrower, the other Nexstar Entities, the Mission Entities, the Administrative Agent and the Lenders that Section 6.14(b) shall specifically NOT limit those obligations of the Borrower, the other Nexstar Entities and the Mission Entities under the Collateral and Guarantee Requirement, Section 6.11 and the other provisions of this Agreement and the other Loan Documents).",generally
"Generally. Subject to Section 6.2(a)(ii), the Board of Directors shall consist of not less than four or more than nine natural Persons (each a “Director” and collectively, the “Directors”), unless otherwise fixed from time to time pursuant to a resolution adopted by the Class A Member. A Director need not be a Member.",generally
"Generally. Upon request, Borrower shall furnish Agent with executed copies of all Leases then in effect. All renewals of Leases and all proposed leases shall provide for rental rates and terms reasonably comparable to existing local market rates and shall be arm’s length transactions with bona fide, independent third-party Tenants, provided, however, Borrower may enter into up to five (5) new Leases or renewal Leases with Affiliates of Borrower or of Guarantor or with an on-site property manager provided that each such new Lease or renewal Lease is on terms reasonably comparable to existing local market rates (“Permitted Affiliate Residential Leases”). Within ten (10) days after the execution of a non-residential Lease or any renewals, amendments or modification of a non-residential Lease, Borrower shall deliver to Agent a copy thereof, together with Borrower’s certification that such commercial Lease (or such renewal, amendment or modification) was entered into in accordance with the terms of this Agreement.",generally
"Generally. Subject to the provisions of this Section 39, Landlord’s affiliate, ARE-SD Region No. 17, LLC, a Delaware limited liability company (“Torreyana Landlord”) may construct amenities at the property owned by Torreyana Landlord located at 10996 Torreyana Road, San Diego, California (“Torreyana Project”), which include, without limitation, shared conference facilities (“Shared Conference Facilities”), a fitness center and restaurant (collectively, the “Amenities”) for non-exclusive use by (a) Tenant, (b) other tenants of the Project, (c) Landlord, (d) the tenants of Torreyana Landlord, (e) Torreyana Landlord, (e) other affiliates of Landlord, Torreyana Landlord and Alexandria Real Estate Equities, Inc. (“ARE”), (f) the tenants of such other affiliates of Landlord, Torreyana Landlord and ARE, and (g) any other parties permitted by Torreyana Landlord (collectively, “Users”). Landlord, Torreyana Landlord, ARE, and all affiliates of Landlord, Torreyana and ARE may be referred to collectively herein as the “ARE Parties.” Notwithstanding anything to the contrary contained herein, Tenant acknowledges and agrees that (i) Torreyana Landlord is in the preliminary phase of design and development of the Amenities and does not currently have and may not be able to obtain the governmental approvals necessary for the development and construction of the Amenities, and (ii) Torreyana Landlord’s construction of the Amenities is subject to, among other things, Torreyana Landlord’s ability to obtain, on terms and conditions acceptable to Torreyana Landlord in its sole and absolute discretion, all of the governmental approvals to permit the design and construction of the Amenities, and the availability of materials and labor and all other conditions outside of Torreyana Landlord’s reasonable control. Torreyana Landlord shall have the sole right to determine all matters related to the Amenities including, without limitation, relating to the design and construction thereof. Tenant acknowledges and agrees that Landlord has not made any representations or warranties regarding the development of any of the Amenities and that Tenant is not entering into this Lease relying on the construction and completion of the Amenities or with an expectation that the Amenities will ever be constructed. Tenant acknowledges and agrees that the current plan for the Amenities Center including, without limitation, the type, configuration and locations and the existence of any of the Amenities within the To...",generally
"Generally. This Agreement may not be assigned by either Party, nor may either Party delegate its obligations or otherwise transfer any licenses granted herein or other rights created by this Agreement, except as expressly permitted hereunder, without the prior written consent of the other Party, which consent will not be unreasonably withheld, delayed or conditioned; provided, that either Party may assign this Agreement (i) in whole or in part, to an Affiliate (provided that the Party assigning to an Affiliate will remain fully liable for any acts or omissions, including financial liabilities, of such Affiliate) or (ii) in whole to such Party’s successor in connection with the merger, consolidation, sale of all or substantially all of its assets or that portion of its business pertaining to the subject matter of this Agreement, or any Business Combination of such Party, in each case, without the consent of the other Party. The rights and obligations of the Parties under this Agreement will be binding upon and inure to the benefit of the successors and permitted assigns of the Parties, and the name of a Party appearing herein will be deemed to include the name of such Party’s successors and permitted assigns to the extent necessary to carry out the intent of this Section 15.13. Any attempted assignment not in accordance with this Section 15.13(a) will be void.",generally
"Generally. The management of the business and affairs of the Partnership is fully vested in the Partners. To facilitate the orderly and efficient management of the business and affairs of the Partnership, the Partners shall act (a) collectively as a “committee of the whole” (such committee to be referred to as the Management Committee) pursuant to Section 6.2, and (b) through the delegation by the Management Committee of certain duties and authority to the Officers. Subject to the express provisions of this Agreement, each Partner agrees that it will not exercise any authority it may otherwise have under DRUPA or otherwise to bind or commit the Partnership to agreements, transactions or other arrangements, or to hold itself out as an agent of the Partnership.",generally
"Generally. In the interest of resolving disputes between you and ServiceTitan in the most expedient and cost effective manner, and except as described in Section 19(b) and (c), you and ServiceTitan agree that every dispute arising in connection with this Agreement will be resolved by binding arbitration. Arbitration is less formal than a lawsuit in court. Arbitration uses a neutral arbitrator instead of a judge or jury, may allow for more limited discovery than in court, and can be subject to very limited review by courts. Arbitrators can award the same damages and relief that a court can award. This agreement to arbitrate disputes includes all claims arising out of or relating to any aspect of this Agreement, whether based in contract, tort, statute, fraud, misrepresentation, or any other legal theory, and regardless of whether a claim arises during or after the termination of this Agreement. YOU UNDERSTAND AND AGREE THAT, BY ENTERING INTO THIS AGREEMENT, YOU AND SERVICETITAN ARE EACH WAIVING THE RIGHT TO A TRIAL BY JURY OR TO PARTICIPATE IN A CLASS ACTION.",generally
"Generally. The business and affairs of the Company shall be managed by or under the direction of a committee of the Company (the “Board”) consisting of at least two natural persons designated as directors (the “Directors”) as provided below. The Board shall have discretion to manage and control the business and affairs of the Company, to make decisions affecting the business and affairs of the Company, and to take actions as it deems necessary or appropriate to accomplish the purposes of the Company and to exercise all of the power and authority that limited liability companies may take under the Act, provided, however, to the extent not otherwise provided herein there shall be reserved to the Members the powers that, under the Act, are reserved to the members of a limited liability company organized under the Act.",generally
"Generally. Parent and Merger Sub, jointly and severally, hereby represent and warrant to Company that the statements contained in this Article VIII are correct and complete as of the Effective Date and will be correct and complete as of the Closing Date (as though made then and as though the Closing Date were substituted for the date of this Agreement throughout this Article VIII), except as expressly set forth to the contrary herein and in Schedules attached to this Agreement, corresponding to the lettered and numbered paragraphs contained in this Article VIII.",generally
"Generally. Except as set forth in Schedule 2.16, Ravenswood, Telephone, Long Distance and Gemcell have timely filed all federal, state and local tax reports, returns, information returns and any other documents required to be filed by each (collectively, ""Tax Returns"") and have duly paid all Taxes shown to be due and payable on such Tax Returns and all estimated or advance payments required by law. All Taxes for periods ending on or prior to or including the Closing Date have been fully paid or reserved against on the Unaudited Financial Statements and on the books of Ravenswood, Telephone, Long Distance and Gemcell in accordance with GAAP. All Taxes which are required to be withheld or collected by Ravenswood, Telephone, Long Distance and Gemcell have been duly withheld or collected and, to the extent required, have been paid to the proper federal, state and local authorities or properly segregated or deposited as required by applicable Regulations. There are no Liens for Taxes upon any property or assets of Ravenswood, Telephone, Long Distance or Gemcell except for Liens for Taxes not yet due and payable or for Taxes being contested in a manner permitted by applicable law (all as disclosed on Schedule 2.16 hereto). Except as disclosed in Schedule 2.16, neither Ravenswood, Telephone, Long Distance nor Gemcell have requested an extension of time within which to file any Tax Return and none have waived the statute of limitations on the right of the IRS or any other taxing authority to assess or collect additional Taxes or to contest the information reported on any Tax Return. All Taxes owed by any affiliated group of which Ravenswood, Telephone, Long Distance or Gemcell has at any time been a member (whether or not shown on any Tax Return) have been paid for each taxable period during which Ravenswood, Telephone, Long Distance or Gemcell was a member of the affiliated group. Neither Ravenswood, Telephone, Long Distance nor Gemcell has any liability for the unpaid Taxes of any Person under Treasury Regulation ss. 1.1502-6 (or any similar provision of state and local law), as a transferee or successor, by contract, or otherwise. The merger of the Company and Telephone referred to in Section 2.1 hereof qualified as a tax-free reorganization pursuant to IRC Section 368(a)(2)(E). All filings and/or notifications required to be made with the Internal Revenue Service and/or with the Illinois Department of Revenue and/or with the Illinois Secretary of State as a result of suc...",generally
"Generally. Except in the case of notices and other communications expressly permitted to be given by telephone (and except as provided in clause (b) below), all notices and other communications provided for herein shall be in writing and shall be delivered by hand or overnight courier service, mailed by certified or registered mail or sent by telecopier or electronic mail as follows: if to any Credit Party, to the Borrower at: JAMF Holdings, Inc. 100 Washington Ave S, Suite 1100 Minneapolis, MN 55401 Attn: [***] Fax: [***] with a copy to (which shall not constitute notice): Vista Equity Partners Fund VI, L.P. c/o Vista Equity Partners Management, LLC Four Embarcadero Center, 20th Floor San Francisco, CA 94111 Attention: [***] Phone: [***] Fax: [***] Email: [***] [***] and (which shall not constitute notice): Kirkland & Ellis LLP 555 California Street, Suite 2700 San Francisco, CA 94104 Attention: [***] Fax: [***] Email: [***] if to the Administrative Agent or the Collateral Agent at: Golub Capital Markets LLC 150 South Wacker Drive Chicago, IL 60606 Attention: [***] Phone: [***] Email: [***] and with a copy to (which shall not constitute notice): Latham & Watkins LLP 885 3rd Avenue New York, NY 10022 Attention: [***] Phone: [***] Email: [***] if to a Lender, to it at its address set forth in its Administrative Questionnaire on file with the Administrative Agent. Notices sent by hand or overnight courier service, or mailed by certified or registered mail, shall be deemed to have been given when received; notices sent by facsimile shall be deemed to have been given when sent (except that, if not given during normal business hours for the recipient, they shall be deemed to have been given at the opening of business on the next Business Day for the recipient); notices sent by electronic mail address shall be deemed received upon the sender’s receipt of an acknowledgement from the intended recipient (such as by the “return receipt requested” function, as available, return e-mail or other written acknowledgement); provided that if such notice or other communication is not sent by 6:00 p.m. New York City time on a Business Day for the recipient, such notice or communication shall be deemed to have been sent at the opening of business on the next Business Day for the recipient. Notices delivered through electronic communications (other than electronic mail) to the extent provided in clause (b) below, shall be effective as provided in said clause (b). Any party hereto may cha...",generally
"Generally. Unless this Financing Agreement expressly provides otherwise, so long as no Event of Default shall have occurred and remain outstanding, the Agent agrees to apply (i) all Proceeds of Trade Accounts Receivable to the Revolving Loan Account, and (ii) any other payment received by the Agent with respect to the Obligations, in such order and manner as the Agent shall elect in the exercise of its reasonable business judgment.",generally
"Generally. If a Make-Whole Fundamental Change occurs and the Conversion Date for the conversion of a Note occurs during the related Make-Whole Fundamental Change Conversion Period, then, subject to this Section 5.07, the Conversion Rate applicable to such conversion will be increased by a number of shares (the “Additional Shares”) set forth in the table below corresponding (after interpolation as provided in, and subject to, the provisions below) to the Make-Whole Fundamental Change Effective Date and the Stock Price of such Make-Whole Fundamental Change: May 21, 2021 1.4847 1.1418 0.9620 0.6980 0.6167 0.5188 0.3327 0.3027 0.1863 0.0961 0.0349 0.0126 0.0037 June 1, 2022 1.4847 1.1049 0.9185 0.6483 0.5661 0.4684 0.2868 0.2582 0.1503 0.0714 0.0224 0.0065 0.0011 June 1, 2023 1.4847 1.0579 0.8632 0.5857 0.5030 0.4061 0.2320 0.2056 0.1099 0.0460 0.0114 0.0021 0.0000 June 1, 2024 1.4847 1.0055 0.7977 0.5081 0.4244 0.3286 0.1667 0.1438 0.0665 0.0225 0.0035 0.0001 0.0000 June 1, 2025 1.4847 0.9502 0.7161 0.4001 0.3141 0.2212 0.0852 0.0692 0.0234 0.0051 0.0001 0.0000 0.0000 June 1, 2026 1.4847 0.9369 0.6339 0.1577 0.0000 0.0000 0.0000 0.0000 0.0000 0.0000 0.0000 0.0000 0.0000 If such Make-Whole Fundamental Change Effective Date or Stock Price is not set forth in the table above, then:",generally
"Generally. If a Make-Whole Fundamental Change occurs and the Conversion Date for the conversion of a Note occurs during the related Make-Whole Fundamental Change Conversion Period, then, subject to this Section 5.07, the Conversion Rate applicable to such conversion will be increased by a number of shares (the “Additional Shares”) set forth in the table below corresponding (after interpolation as provided in, and subject to, the provisions below) to the Make-Whole Fundamental Change Effective Date and the Stock Price of such Make-Whole Fundamental Change: September 9, 2019 14.0140 11.8090 9.0187 7.0188 5.5204 3.5630 2.8946 1.9655 0.9666 0.4938 0.2466 0.1091 0.0000 October 1, 2020 14.0140 11.7785 8.8244 6.7346 5.1924 3.2261 2.5734 1.6900 0.7858 0.3830 0.1826 0.0763 0.0000 October 1, 2021 14.0140 11.4745 8.3533 6.1861 4.6236 2.7059 2.0974 1.3083 0.5596 0.2548 0.1123 0.0408 0.0000 October 1, 2022 14.0140 10.9945 7.6347 5.3695 3.7996 2.0003 1.4760 0.8468 0.3236 0.1367 0.0541 0.0144 0.0000 October 1, 2023 14.0140 10.3020 6.4911 4.0592 2.5215 1.0379 0.6906 0.3433 0.1204 0.0503 0.0173 0.0021 0.0000 October 1, 2024 14.0140 9.9600 4.4044 0.0000 0.0000 0.0000 0.0000 0.0000 0.0000 0.0000 0.0000 0.0000 0.0000",generally
"Generally. The Executive shall serve as the Executive Vice President – Business Development and Treasury of the Company and, in such capacity shall be responsible for the general management of the treasury affairs of the Company, shall perform such duties as are customarily performed by an officer with similar title and responsibilities of a company of a similar size and shall have such power and authority as shall reasonably be required to enable him to perform his duties hereunder; provided, however, that in exercising such power and authority and performing such duties, he shall at all times be subject to the authority, control and direction of the Chief Executive Officer of the Company. (b)",generally
"Generally. In the event Executive becomes entitled to receive the payments (the “Severance Payments”) provided under Section 3 or Section 8 hereof or under any other plan or arrangement providing for payments under circumstances similar to those contemplated by such sections, and if any of the Severance Payments will be subject to the tax (the “Excise Tax”) imposed by Section 4999 of the Internal Revenue Code of 1986, as amended (the “Code”), the Company shall pay to Executive at the time specified for such payments, an additional amount (the “Gross-Up Payment”) such that the net amount retained by Executive shall be equal to the amount of the Severance Payments after deducting normal and ordinary taxes but not deducting (a) the Excise Tax and (b) any federal, state and local income tax and Excise Tax payable on the payment provided for by this Section 9.",generally
"Generally. From the date of this Agreement until the closing of the Transactions contemplated hereby or the earlier termination of this Agreement in accordance with Article X (the “Pre-Closing Period”), the Parties and the Consenting Convertible Note Holders shall (and shall cause their respective Affiliates to), in good faith and in a reasonably timely manner, use their respective commercially reasonable efforts to: (i) take or cause to be taken all appropriate action, do or cause to be done all things necessary, proper or advisable, and execute and deliver such documents, and to assist and cooperate with each other, as may be required to carry out the provisions of this Agreement, the other Transaction Document and consummate and make effective the Transactions; and (ii) cause the closing conditions contained herein and in the other Transaction Documents applicable to such Person to be satisfied. Each other Transaction Document, including the Note Holder Transaction Documents, shall contain terms and conditions materially consistent with this Agreement and, to the extent this Agreement or any Note Holder Transaction Document, is amended, amended and restated, supplemented or modified or any provision thereof waived, in a manner that is economically adverse to the Consenting Convertible Note Holders, such amendment, modification or waiver shall be satisfactory to Convertible Note Holders, including the Consenting Convertible Note Holders, that, in the aggregate, hold a majority of the aggregate principal amount of the outstanding Convertible Notes in their reasonable discretion.",generally
"Generally. Commencing as of the Effective Date and continuing throughout the Term, Vendor will provide to Prudential and its Affiliates:",generally
"Generally. This Agreement is intended to comply with Sections 409A and 457A of the Code and the Treasury Regulations and IRS guidance thereunder (collectively referred to as “Section 409A” and “Section 457A,” respectively). Notwithstanding anything to the contrary, this Agreement shall, to the maximum extent possible, be administered, interpreted, and construed in a manner consistent with Section 409A and Section 457A. If any provision of this Agreement provides for payment within a time period, the determination of when such payment shall be made within such time period shall be solely in the discretion of the Company.",generally
"Generally. District shall have the right to review and approve or disapprove all or any part of each of the Project Drawings. District may also grant a conditional approval subject to Developer making certain changes to the Project Drawings. District shall use good faith efforts to complete its review of each submission by Developer and provide a written response thereto, within thirty (30) days after its receipt of the same. Any Project Drawings approved (or any approved portions thereof) pursuant to this Section 4.2 shall be “Approved Plans and Specifications.”",generally
"Generally. Comply with the requirements of all applicable Laws (including all Environmental Laws), except for any noncompliance which could not reasonably be expected to have, either individually or in the aggregate, a Material Adverse Effect.",generally
