clause_text,clause_type
"Generally. The Executive shall serve as the Chief Executive Officer of the Company and, in such capacity shall be responsible for the general management of the business, affairs and operations of the Company, shall perform such duties as are customarily performed by a Chief Executive Officer of a company of a similar size and shall have such power and authority as shall reasonably be required to enable him to perform his duties hereunder; provided, however, that in exercising such power and authority and performing such duties, he shall at all times be subject to the authority, control and direction of the Board of Directors of the Company (the “Board”). The Company agrees that it will use its reasonable best efforts to cause the Executive to be nominated to and continue to be named Chairman of the Board of Directors during the Term, it being acknowledged and agreed that the Nominating Committee (or any successor committee of the Board, or, in the absence of any such committee, the Board) shall retain the ability to apply reasonable and uniform standards consistent with past practices and corporate governance principles to consider the Executive for nomination to the Board and appointment as Chairman of the Board during the Term. Without limitation on any of the foregoing, the Executive shall have senior management authority and responsibility with respect to the management and operations of the Company and its business, including implementation of the business strategy of the Company consistent with strategy and policies approved by the Board.",generally
"Generally. The Borrower agrees (without duplication) to pay all reasonable costs and expenses of the Administrative Agent in connection with the negotiation, preparation, printing, typing, reproduction, execution and delivery of this Agreement and the other Loan Documents and the documents and instruments referred to herein and therein and any amendment, waiver, consent relating hereto or thereto or other modifications of (or supplements to) any of the foregoing and any and all other documents and instruments furnished pursuant hereto or thereto or in connection herewith or therewith, including without limitation, the reasonable fees and out-of-pocket expenses of Shearman & Sterling LLP, special counsel to the Administrative Agent and the UK Security Trustee, and any local counsel retained by the Administrative Agent relative thereto or the reasonable allocated costs of staff counsel as well as the fees and out-of-pocket expenses of counsel, independent public accountants and other outside experts retained by the Administrative Agent or the UK Security Trustee in connection with the administration of this Agreement and the other Loan Documents, and all search fees, appraisal fees and expenses, title insurance policy fees, costs and expenses and filing and recording fees and all costs and expenses (including, without limitation, Attorney Costs), if any, of the Administrative Agent, the UK Security Trustee and the Lenders in connection with the enforcement of this Agreement, any of the Loan Documents or any other agreement furnished pursuant hereto or thereto or in connection herewith or therewith. In addition, the Borrower shall pay any and all present and future stamp, documentary transfer, excise, property, and other similar taxes payable or determined to be payable in connection with the execution, delivery or enforcement of this Agreement, any Loan Document, or otherwise with respect to or in connection with any Loan Document, or the making of any Loan (other than taxes based on the net income of the Lenders), and agrees to save and hold the Administrative Agent, the UK Security Trustee and each Lender harmless from and against any and all liabilities with respect to or resulting from any delay by the Borrower in paying, or omission by the Borrower to pay, such taxes. Any portion of the foregoing fees, costs and expenses which remains unpaid more than thirty (30) days following the Administrative Agent’s, the UK Security Trustee’s, any Agents’ or any Lender’s stat...",generally
"Generally. Notices and other communications provided for herein shall, except as provided below, be in writing and shall be delivered by hand or overnight courier service, mailed by certified of registered mail or sent by facsimile, as follows:",generally
"Generally. All Registration Expenses incident to the Company's performance of or compliance with this Agreement shall be paid by the Company. The term ""Registration Expenses"" includes, without limitation, all registration filing fees, professional fees and other expenses of the Company's compliance with federal and state securities laws (including fees and disbursements of counsel for the underwriter(s) in connection with state securities law qualifications and registrations), printing expenses, messenger, telephone and delivery expenses; fees and disbursements of counsel for the Company and reasonable fees and disbursements of one counsel for MetLife; fees and disbursements of all independent certified public accountants (including the expenses relating to any audit or ""cold comfort"" letters required by or incident to the performance of the obligations contemplated by this Agreement); fees and expenses of the underwriter(s) (excluding discounts and commissions) customarily borne by the issuer in transactions of that kind; fees and expenses of any special experts retained by the Company at the reasonable request of the managing underwriter(s) in connection with the registration and as shall be customary in transactions of that kind; and applicable stock exchange and NASD registration and filing fees. The term ""Registration Expenses"" does not include MetLife's internal expenses (including, without limitation, all salaries and expenses of its officers and employees performing legal or accounting duties), any fees or disbursements of any other counsel for MetLife, or the underwriting discounts or commissions or transfer taxes applicable to the Registrable Securities, all of which shall be paid by MetLife.",generally
"Generally. The Board of Directors shall consist of not less than five nor more than ten natural persons. The members of the Board of Directors shall be appointed by EPE, provided that (i) a majority of such members must meet the independence, qualification and experience requirements of the New York Stock Exchange (each, an “Independent Director”), (ii) at least three Independent Directors shall also meet the independence, qualification and experience requirements of Section 10A(m)(3) of the Securities Exchange Act of 1934 (or any successor Law), the rules and regulations of the SEC, other applicable Law and the charter of the Audit and Conflicts Committee (each, a “Special Independent Director”) and (iii) at least two Special Independent Directors shall also meet the S&P Criteria; provided, however, that if at any time (i) a majority of the members of the Board of Directors are not Independent Directors or (ii) at least three of the Independent Directors are not Special Independent Directors, at least two of whom meet the S&P Criteria, subject to any requirements for Special Approval, the Board of Directors shall still have all powers and authority granted to it",generally
"Generally. Borrower shall not directly or indirectly make, suffer or permit the occurrence of any Transfer other than a Permitted Transfer.",generally
"Generally. All accounting terms not specifically or completely defined herein shall be construed in conformity with, and all financial data (including financial ratios and other financial calculations) required to be submitted pursuant to this Agreement shall be prepared in conformity with, GAAP applied on a consistent basis, as in effect from time to time, applied in a manner consistent with that used in preparing the audited financial statements described in SECTION 3.04, except as otherwise specifically prescribed herein. All amounts used for purposes of financial calculations required to be made shall be without duplication. Notwithstanding anything to the contrary herein, for purposes of determining compliance with any test or covenant contained in this Agreement with respect to any period during which any Specified Transaction occurs, the Consolidated Leverage Ratio, Consolidated Secured Leverage Ratio and Consolidated Interest Coverage Ratio shall be calculated with respect to such period and such Specified Transaction on a Pro Forma Basis.",generally
"Generally. Any Lender that is entitled to an exemption from or reduction of withholding from Tax with respect to payments made under any Loan Document shall deliver to the Loan Party Agent and Agent, at the time or times reasonably requested by the Loan Party Agent or Agent, such properly completed and executed documentation reasonably requested by the Loan Party Agent or Agent as will permit such payments to be made without withholding or at a reduced rate of withholding. In addition, any Lender, if reasonably requested by the Loan Party Agent or Agent, shall deliver such other documentation prescribed by applicable law or reasonably requested by the Loan Party Agent or Agent as will enable the Loan Party Agent or Agent to determine whether or not such Lender is subject to backup withholding or information reporting requirements. Notwithstanding anything to the contrary in the preceding two sentences, the completion, execution and submission of such documentation (other than such documentation set forth in Section 5.9.2(i), (ii)(a), (ii)(b), (ii)(c), (ii)(d) and (iii) below) shall not be required if in the Lender’s reasonable judgment such completion, execution or submission would subject such Lender to any material unreimbursed cost or expense or would materially prejudice the legal or commercial position of such Lender.",generally
"Generally. Without prejudice to the representations, warranties or covenants regarding the status of any party hereto as a Citizen of the United States:",generally
"Generally. Subject to Sections 4.4(b) and 4.4(c), tax items of income, gain, loss, deduction and credit (collectively, “Tax Items”) shall be allocated solely for tax purposes and not for purposes of computing Net Income or Net Loss among the Partners on the same basis as the respective book items.",generally
"Generally. All accounting terms not specifically or completely defined herein shall be construed in conformity with, and all financial data (including financial ratios and other financial calculations) required to be submitted pursuant to this Agreement shall be prepared in conformity with, GAAP, applied on a consistent basis, as in effect from time to time, except as otherwise specifically prescribed herein and without including the effect of any changes to lease accounting that requires the assets and liabilities arising under operating leases to be recognized in any statement of financial position.",generally
"Generally. Unless otherwise agreed to in writing by the RUS, while this Agreement is in effect, the Borrower shall duly observe each of the affirmative covenants contained in this Article V.",generally
"Generally. Subject to terms and conditions herein provided and to the fiduciary duties of the board of directors and officers or representatives of any party, each of the parties agrees to use its commercially reasonable efforts to take, or cause to be taken, all action and to do, or cause to be done, all things necessary, proper or advisable under applicable laws and regulations to consummate and make effective this Agreement and the transactions contemplated hereby. In case at any time any further action, including, without limitation, the obtaining of waivers and consents under any agreements, material contracts or leases and the execution and delivery of any licenses or sublicenses for any software, is necessary, proper or advisable to carry out the purposes of this Agreement, the proper officers and directors or representatives of each party to this Agreement are hereby directed and authorized to use commercially reasonable efforts to effectuate all required action.",generally
"Generally. Any accounting term used in this Agreement shall have, unless otherwise specifically provided herein, the meaning customarily given in accordance with GAAP, as in effect from time to time, and all financial data (including financial ratios and other financial computations) required to be submitted pursuant to this Agreement shall be prepared and computed, unless otherwise specifically provided herein, in accordance with GAAP, as in effect from time to time, applied on a consistent basis in a manner consistent with that used in preparing the Financial Statements as of March 31, 2009, except as otherwise specifically prescribed herein. Notwithstanding any other provision contained herein, all terms of an accounting or financial nature used herein shall be construed, and all computations of amounts and ratios referred to herein shall be made, without giving effect to any election under FASB ASC 825 to value any Debt or other liabilities of the Borrower at “fair value”, as defined therein.",generally
"Generally. In order that the Corporation may determine the --------- stockholders entitled to notice of or to vote at any meeting of stockholders or any adjournment thereof, or to express consent to corporate action in writing without a meeting, or entitled to receive payment of any dividend or other distribution or allotment of any rights, or entitled to exercise any rights in respect of any change, conversion or exchange of stock or for the purpose of any other lawful action, the Board of Directors may fix, in advance, a record date, which shall not precede the date upon which the resolution fixing the record date is adopted by the Board of Directors and which shall not be more than sixty (60) nor less than ten (10) days before the date of such meeting, nor more than sixty (60) days prior to any other action. If no record date is fixed by the Board of Directors, then the record date shall be as provided by applicable law. A determination of stockholders of record entitled to notice of or to vote at a meeting of stockholders shall apply to any adjournment of the meeting; provided, -------- however, that the Board of Directors may fix a new record date for the adjourned ------- meeting.",generally
"Generally. This Agreement has been diligently reviewed by and negotiated by and between the Parties, and in such negotiations each of the Parties has been represented by competent (in-house or external) counsel, and the final agreement contained herein, including the language whereby it has been expressed, represents the joint efforts of the Parties and their counsel. Accordingly, in interpreting this Agreement or any provision hereof, no presumption shall apply against any Party as being responsible for the wording or drafting of this Agreement or any such provision, and ambiguities, if any, in this Agreement shall not be construed against any Party, irrespective of which Party may be deemed to have authored the ambiguous provision.",generally
"Generally. The parties acknowledge that Mercury and its affiliates (individually and collectively, the ""Companies""), have developed and intend to continue the development of and to formulate, acquire and use commercially valuable technical and non-technical information, design and specification documents, concepts, technology, know-how, improvements, proposals, patent applications, techniques, marketing plans, strategies, forecasts, inventions (not limited by the definition of an invention contained in the United States Patent Laws), Trade Secrets (as defined in Sec. 3426.1(d) of the Uniform Trade Secrets Act) and processes which are considered proprietary by the Companies, particularly including, without limitation, customer and supplier lists, books and records, computer programs, pricing information and business plans (collectively, the ""Proprietary Information""). It is necessary for the Companies to protect the Proprietary Information by patents or copyrights or by holding it secret and confidential.",generally
"Generally. If a Make-Whole Fundamental Change occurs and the Conversion Date for the conversion of a Note occurs during the related Make-Whole Fundamental Change Conversion Period, then, subject to this Section 5.07, the Conversion Rate applicable to such conversion will be increased by a number of shares (the “Additional Shares”) set forth in the table below corresponding (after interpolation as provided in, and subject to, the provisions below) to the Make-Whole Fundamental Change Effective Date and the Stock Price of such Make-Whole Fundamental Change: July 27, 2020 32.2401 26.7373 21.6706 16.7740 14.2444 12.6017 11.1500 9.0040 5.9545 4.3500 2.1678 1.0483 0.2481 August 1, 2021 32.2401 25.6893 20.2696 15.1970 12.6646 11.0608 9.6738 7.6847 4.9930 3.6360 1.8193 0.8807 0.1997 August 1, 2022 32.2401 24.3413 18.4490 13.1710 10.6637 9.1342 7.8562 6.1020 3.8920 2.8348 1.4318 0.6940 0.1491 August 1, 2023 32.2401 22.5507 15.9660 10.4610 8.0577 6.6850 5.6023 4.2267 2.6675 1.9596 1.0040 0.4877 0.0979 August 1, 2024 32.2401 19.9053 12.1278 6.5050 4.4941 3.5133 2.8354 2.0960 1.3620 1.0204 0.5308 0.2593 0.0479 August 1, 2025 32.2401 16.0960 0.0000 0.0000 0.0000 0.0000 0.0000 0.0000 0.0000 0.0000 0.0000 0.0000 0.0000 If such Make-Whole Fundamental Change Effective Date or Stock Price is not set forth in the table above, then:",generally
Generally. Executive’s employment under this Agreement may be terminated prior to expiration of the Term in accordance with the following paragraphs.,generally
"Generally. Executive’s entitlement to compensation in the event of a Termination Event, shall be as set forth in this Section 8.",generally
"Generally. Executive and his or her eligible dependents shall be entitled to participate in all pension, welfare, benefits, and fringe benefit programs or other employee perquisite programs approved by Company that now or hereafter may be made generally available to full time officers of Company and for which Executive or such dependents will qualify according to eligibility requirements under the provisions thereof. The Company shall purchase Executive a policy of insurance on the life of Executive in the amount generally available to full time officers of Company, plus an amount equal to two (2) times Executive’s annual Base Compensation. Benefits of any such policy of insurance shall be paid to beneficiaries designated by Executive.",generally
Generally. The Administrative Agent will promptly notify the Lenders of any such notice of termination or reduction of the Aggregate Commitments. Any reduction of the Aggregate Commitments shall be applied to the Commitment of each Lender according to its Applicable Percentage. All fees accrued until the effective date of any termination of the Aggregate Commitments shall be paid on the effective date of such termination.,generally
"Generally. 18.1.1 Except for disputes specifically provided in this Agreement to be referred to Expert Resolution, all claims, demands, controversies, disputes, actions or causes of action of any nature or character arising out of or in connection with, or related to, this Agreement, whether legal or equitable, known or unknown, contingent or otherwise shall be resolved in the United States District Court for the Southern District of New York and any appellate courts thereto, or if federal jurisdiction is lacking, then in the state courts of New York State located in New York County. The Parties agree that service of process for purposes of any such litigation or legal proceeding need not be personally served or served within the State of New York, but may be served with the same effect as if the Party in question were served within the State of New York, by giving notice containing such service to the intended recipient (with copies to counsel) in the manner provided in Section 20.5. This provision shall survive and be binding upon the Parties after this Agreement is no longer in effect.",generally
"Generally. Grantee shall not sell, assign, exchange, pledge, encumber, gift, devise, hypothecate or otherwise transfer (individually and collectively, “Transfer”) any Grant Shares unless and until vested. The transfer restrictions imposed by this Section 2 shall lapse in accordance with the following vesting schedule when the Grant Shares become vested, provided that, subject to Section 3(a), Grantee then is, and continuously from the Grant Date has been, an Employee of the Company and there has been no termination of Employment. The Grant Shares as to which such restrictions have lapsed are referred to herein as “Vested Shares.” First Anniversary of the Grant Date 331/3 % Second Anniversary of the Grant Date 331/3 % Third Anniversary of the Grant Date 331/3 % Total 100 %",generally
"Generally. Settlements will be in U.S. dollars. On any Business Day when the Federal Reserve Wire Transfer System is closed, all communication and processing rules will be suspended for the settlement of Orders. Orders will be settled on the next Business Day on which the Federal Reserve Wire Transfer System is open. Transactions that are the subject of such Orders will be processed at the Share Price for the applicable Portfolio on the Business Day to which the Orders originally relate.",generally
"Generally. Neither Borrower nor any of its Subsidiaries owns or leases (as tenant thereof) any real property, except as described on Schedule 7.16.",generally
Generally. The Parties acknowledge and agree that the Developer’s agreement to perform and abide by the covenants and obligations set forth in this Agreement is material consideration for the Commission’s commitment to perform and abide by the covenants and obligations of the Commission contained in this Agreement.,generally
"Generally. The Board of Directors shall initially consist of five natural persons and, in the discretion of DEFS, may be increased to consist of up to 10 natural persons. The members of the Board of Directors shall be appointed by DEFS, provided that (i) at least one member of the Board of Directors at the time of the closing of the initial public offering of common units representing limited partner interest of the MLP (the “IPO”) shall be a natural person who meets the independence, qualification and experience requirements of the New York Stock Exchange, the independence, qualification and experience requirements of Section 10A(m)(3) of the Securities Exchange Act of 1934 (or any successor Law), the rules and regulations of the SEC and other applicable Law (an “Independent Director”), (ii) at least two members of the Board of Directors shall be natural persons who are Independent Directors at all times from and after the 90th day following the effective date of the registration statement related to the IPO and (iii) at least three members of the Board of Directors shall be natural persons who are Independent Directors at all times from and after the first anniversary of the effective date of the registration statement relating to the IPO; provided, however, that if at any time the Board of Directors does not include the requisite number of Independent Directors as specified above, the Board of Directors shall still have all powers and authority granted to it hereunder, but DEFS shall endeavor to appoint one or more additional Independent Directors as necessary to come into compliance with this Section 6.02(a).",generally
"Generally. This Agreement may not be assigned by any Party, nor may any Party delegate its obligations or otherwise transfer licenses or other rights created by this Agreement, except as expressly permitted hereunder without the prior written consent of the other Party, which consent will not be unreasonably withheld, delayed or conditioned.",generally
"Generally. No notice, notification, demand, request for information, citation, summons or Order has been issued, no complaint has been filed, no penalty has been assessed and no investigation or review is pending or, to the Sellers' and Company's knowledge, threatened by any Authority or other entity with respect to the Company relating to any Environmental Permit, license or authorization required in connection with the conduct of the business of the Company or with respect to the generation, treatment, storage, recycling, transportation, disposal or Release of any substance regulated under Environmental Laws (""HAZARDOUS MATERIALS"").",generally
