clause_text,clause_type
"Generally. Notice of amendments, waivers or consents ratified by the Lenders hereunder shall be forwarded by the Administrative Agent to all of the Lenders. Each Lender or other holder of a Note, or if there is no Note, the holder of the interest as reflected on the books and records of the Administrative Agent (or interest in any Loan or Letter of Credit) shall be bound by any amendment, waiver or consent obtained as authorized by this Section 11.3, regardless of its failure to agree thereto.",generally
"Generally. Each Parent Award granted that is outstanding as of immediately prior to the Effective Time shall be adjusted as described below; provided, however, effective immediately prior to the Effective Time, the Parent Compensation Committee may provide for different adjustments with respect to some or all Parent Awards to the extent that the Parent Compensation Committee deems such adjustments necessary and appropriate. Any adjustments made by the Parent Compensation Committee pursuant to the foregoing sentence shall be deemed incorporated by reference herein as if fully set forth below and shall be binding on the Parties and their respective Affiliates. Before the Effective Time, the SpinCo Omnibus Plan shall be established, with such terms as are necessary to permit the implementation of the provisions of Section 4.02.",generally
"Generally. (A) In addition to any sums to be applied as Recoveries pursuant to subparagraph (ii) below, “",generally
"Generally. If a Fundamental Change occurs at any time prior to the Maturity Date of the Securities, then each Holder shall have the right (the “Fundamental Change Purchase Right”), at such Holder’s option, to require the Company to purchase all of such Holder’s Securities, or any portion thereof that is equal to $1,000 or an integral multiple of $1,000 principal amount, on a date specified by the Company that is not less than 20 Business Days nor more than 35 Business Days after the date of the Fundamental Change Notice (as defined below), subject to extension to comply with applicable law (the “Fundamental Change Purchase Date”), at a purchase price in cash equal to 100% of the principal amount of the Securities to be purchased plus accrued and unpaid interest thereon (including Additional Interest, if any) to, but excluding, the Fundamental Change Purchase Date (the “Fundamental Change Purchase Price”), subject to the satisfaction by the Holder of the requirements set forth in Section 5.01(c); provided, however, if the Fundamental Change Purchase Date occurs after a Regular Record Date and on or prior to the Interest Payment Date to which it relates, the Company will pay the full amount of accrued and unpaid interest (including Additional Interest, if any) due on such Interest Payment Date to the Holder of record as of the corresponding Regular Record Date, and the Fundamental Change Purchase Price payable to the Holder of such Security will be 100% of the principal amount of such Security.",generally
"Generally. From and after the date hereof, interest on the unpaid Principal shall accrue at the Interest Rate and be payable as hereinafter provided. On the date hereof, Borrower shall pay interest on the unpaid Principal from the date hereof through and including May 5, 2007. On June 6, 2007 and each Payment Date thereafter through and including the Maturity Date, the interest on the Principal at the Interest Rate shall be payable in monthly installments (each such installment, the “Monthly Debt Service Payment Amount”). The Monthly Debt Service Payment Amount due on any Payment Date shall be applied to the payment of interest accrued during the preceding Interest Period. All accrued and unpaid interest shall be due and payable on the Maturity Date. If the Loan is repaid on any date other than on a Payment Date (whether prior to or after the Stated Maturity Date), Borrower shall also pay interest that would have accrued on such repaid Principal to but not including the next Payment Date.",generally
"Generally. Awardee is liable and responsible for all taxes owed in connection with the Restricted Stock Units (including taxes owed with respect to any cash payments described in Paragraph 7 hereof), regardless of any action the Company takes with respect to any tax withholding obligations that arise in connection with the Restricted Stock Units. The Company does not make any representation or undertaking regarding the tax treatment or the treatment of any tax withholding in connection with the grant or vesting of the Restricted Stock Units or the subsequent sale of Shares issuable upon settlement of the Restricted Stock Units. The Company does not commit and is under no obligation to structure the Restricted Stock Units to reduce or eliminate Awardee’s tax liability.",generally
"Generally. Executive and the Company hereby agree that any controversy or claim arising out of or relating to this Agreement, the employment relationship between Executive and the Company, or the termination thereof, including the arbitrability of any controversy or claim, which cannot be settled by mutual agreement will be finally settled by binding arbitration in accordance with the Federal Arbitration Act (or if not applicable, the applicable state arbitration law) as follows: Any party who is aggrieved will deliver a notice to the other party setting forth the specific points in dispute. Any points remaining in dispute twenty (20) days after the giving of such notice may, upon ten (10) days’ notice to the other party, be submitted to arbitration in Boston, Massachusetts, to the American Arbitration Association, before a single arbitrator appointed in accordance with the Commercial Dispute Resolution Procedures and Rules of the American Arbitration Association, as such procedures and rules may be amended from time to time and modified only as herein expressly provided. The arbitrator may enter a default decision against any party who fails to participate in the arbitration proceedings.",generally
"Generally. Prepayments permitted or required under this Section 2.07 shall be without premium or penalty, except as required under Section 5.05 for prepayment of LIBOR Loans. Any prepayments on the Loans may be reborrowed subject to the then effective Aggregate Revolving Credit Commitments.",generally
"Generally. The granting and settlement of the RSUs, and any other obligations of the Corporation under this Agreement, shall be subject to all applicable federal, provincial, state, local and foreign laws, rules and regulations and to such approvals by any regulatory or governmental agency as may be required. The Administrator shall have the right to impose such restrictions or delay the settlement of the RSUs as it deems necessary or advisable under applicable federal securities laws, the rules and regulations of any stock exchange or market upon which the Shares are then listed or traded, and/or any blue sky or state securities laws applicable to the Shares; provided that any settlement shall be delayed only until the earliest date on which settlement would not be so prohibited. Participant agrees to take all steps the Administrator or the Corporation determines are necessary to comply with all applicable provisions of federal and state securities law in exercising his or her rights under this Agreement.",generally
"Generally. Subject to the terms and conditions of this Agreement, during the Commitment Period, the Issuing Lender shall, in its own name, on behalf of the Lenders, issue such Letters of Credit for the account of the Borrower or a Guarantor of Payment, as the Borrower may from time to time request. All Letters of Credit shall be denominated in Dollars, and all reimbursement amounts in respect of Letters of Credit, as well as fees and expenses owing in respect of Letters of Credit, shall be paid in Dollars. The Borrower shall not request any Letter of Credit (and the Issuing Lender shall not be obligated to issue any Letter of Credit) if, after giving effect thereto, (A) the Letter of Credit Exposure would exceed the Letter of Credit Commitment, or (B) the Revolving Credit Exposure would exceed the Revolving Credit Commitment. The issuance of each Letter of Credit shall confer upon each Lender the benefits and liabilities of a participation consisting of an undivided pro rata interest in the Letter of Credit to the extent of such Lender’s Commitment Percentage. Notwithstanding the foregoing or anything to the contrary set forth herein, the letters of credit issued pursuant to the Existing Credit Agreement and identified on Schedule 2.2(b) (the “Existing Letters of Credit”) shall be deemed to be “Letters of Credit” for all purposes of the Loan Documents.",generally
"Generally. Each Grantor agrees that from time to time, at the expense of Grantors, such Grantor will promptly execute and deliver all further instruments and documents, and take all further action, that may be necessary or desirable, or that Secured Party may request, in order to perfect and protect any security interest granted or purported to be granted hereby or to enable Secured Party to exercise and enforce its rights and remedies hereunder with respect to any Collateral. Without limiting the generality of the foregoing, each Grantor will: (i) notify Secured Party in writing of receipt by such Grantor of any interest in Chattel Paper and at the request of Secured Party, mark conspicuously each item of Chattel Paper and each of its records pertaining to the Collateral, with a legend, in form and substance satisfactory to Secured Party, indicating that such Collateral is subject to the security interest granted hereby, (ii) deliver to Secured Party all promissory notes and other Instruments and, at the request of Secured Party, all original counterparts of Chattel Paper, duly endorsed and accompanied by duly executed instruments of transfer or assignment, all in form and substance satisfactory to Secured Party, (iii) (A) execute (if necessary) and file such financing or continuation statements, or amendments thereto, (B) execute and deliver, and cause to be executed and delivered, agreements establishing that Secured Party has control over electronic Chattel Paper and Letter-of-Credit Rights of such Grantor, (C) deliver such documents, instruments, notices, records and consents, in each case, as may be necessary or desirable and as Secured Party may request, in order to perfect and preserve the security interests granted or purported to be granted hereby, (iv) furnish to Secured Party from time to time statements and schedules further identifying and describing the Collateral and such other reports in connection with the Collateral as Secured Party may reasonably request, all in reasonable detail, (v) promptly after the acquisition by such Grantor of any item of Equipment that is covered by a certificate of title under a statute of any jurisdiction under the law of which indication of a security interest on such certificate is required as a condition of perfection thereof execute and file with the registrar of motor vehicles or other appropriate authority in such jurisdiction an application or other document requesting the notation or other indication of the secur...",generally
"Generally. All payments made by the Borrower hereunder (including any payments made with respect to the Borrower Guaranteed Obligations under Article X) under any Note or any other Loan Document shall be made without setoff, counterclaim or other defense.",generally
"Generally. The Company shall have a board of directors (the ""BOARD""), comprised of one or more members (each, a ""DIRECTOR""), all of whom shall be appointed by Member. The number of Directors comprising the Board shall initially be two (2), and shall thereafter be set by the Member from time to time. The overall management of the Company shall be vested exclusively in the Board. Except as provided in Section 3.3 or as otherwise provided in this Agreement, the Member hereby specifically delegates to the Board its rights and powers to manage and control the business and affairs of the Company in accordance with the provisions of Section 18-407 of the LLC Act.",generally
"Generally. The Board of Directors, as set forth below, shall appoint officers of the Company (“Officers”), who shall (together with the Directors) constitute “managers” of the Company for the purposes of the Act. Unless provided otherwise by resolution of the Board of Directors, the Officers shall have the titles, power, authority and duties described below in this Section 6.03.",generally
"Generally. Executive shall serve as a senior executive of the Company. Executive shall have and perform such duties, responsibilities, and authorities as shall be specified by the Company from time to time and as are customary for a senior executive of a publicly held corporation of the size, type, and nature of the Company as they may exist from time to time and as are consistent with such position and status. Executive shall devote substantially all of his business time and attention (except for periods of vacation or absence due to illness), and his best efforts, abilities, experience, and talent to his position and the businesses of the Company.",generally
"Generally. Company agrees to pay promptly upon request by Administrative Agent (or any Lender, Issuing Bank or Deposit Bank in connection with any enforcement or atonement as provided below) (i) all reasonable out of pocket costs and expenses in connection with the negotiation, preparation, printing, typing, reproduction, syndication, execution and delivery of this Agreement and the other Loan Documents (including, without limitation, the administration by the Deposit Bank of the Pre-Funded L/C Deposit Account and the Pre-Funded L/C Deposits) and the documents and instruments referred to herein and therein and any amendment, waiver or consent relating hereto or thereto or other modifications of (or supplements to) any of the foregoing and any and all other documents and instruments furnished pursuant hereto or thereto or in connection herewith or therewith (whether or not the transactions contemplated hereby or thereby are consummated), including without limitation, the reasonable fees and out-of-pocket expenses of independent public accountants and other outside experts retained by Administrative Agent with Company’s consent (provided that such consent shall not be required (i) for experts retained prior to the Closing Date or (ii) if an Unmatured Event of Default or Event of Default exists at the time such expert is retained) and of Winston & Strawn LLP, special counsel to Administrative Agent, and any local counsel retained by Administrative Agent relative thereto and other Attorney Costs, in connection with the administration of this Agreement and the other Loan Documents, and all search fees, appraisal fees and expenses, title insurance policy fees, costs and expenses and filing and recording fees, (ii) all costs and expenses incurred by Administrative Agent, any Lender, Issuing Bank or Deposit Bank, including the fees, charges and Attorney Costs, in connection with the enforcement or protection of its rights in connection with this Agreement and the other Loan Documents, including its rights under this Section, or in connection with the Loans made hereunder, including all such out-of-pocket expenses incurred during any workout, restructuring or negotiations in respect of such Loans. In addition, Company shall pay any and all present and future stamp, transfer, excise and other similar taxes payable or determined to be payable in connection with the execution and delivery of this Agreement, any Loan Document, or the making of any Loan, and each agrees to save an...",generally
"Generally. Settlements will be in U.S. dollars, except that each Portfolio reserves the right, in cases of substantial liquidations, to pay redemption proceeds in whole or in part by a distribution in-kind of readily marketable securities that it holds in lieu of cash in accordance with applicable law, and the Portfolio's redemption policy as described in the Prospectus. On any Business Day when the Federal Reserve Wire Transfer System is closed, all communication and processing rules will be suspended for the settlement of Orders. Orders will be settled on the next Business Day on which the Federal Reserve Wire Transfer System is open. Transactions that are the subject of such Orders will be processed at the Share Price for the applicable Portfolio on the Business Day to which the Orders originally relate.",generally
"Generally. Awardee is liable and responsible for all taxes owed in connection with the exercise of the Option, regardless of any action the Company takes with respect to any tax withholding obligations that arise in connection with the Option. The Company does not make any representation or undertaking regarding the tax treatment or the treatment of any tax withholding in connection with the exercise of the Option. The Company does not commit and is under no obligation to structure the Option or the exercise of the Option to reduce or eliminate Awardee’s tax liability.",generally
Generally. This Agreement shall be binding upon the parties hereto and their respective successors and assigns and shall inure to the benefit of the parties hereto and the successors and assigns of Lenders. No Loan Party’s rights or obligations hereunder nor any interest therein may be assigned or delegated by any Loan Party without the prior written consent of all Lenders (and any purported assignment or delegation without such consent shall be null and void).,generally
"Generally. The Trustee accepts and undertakes to discharge the Trust created by this Agreement, upon the terms and conditions thereof on behalf of the Beneficiaries. The Trustee shall exercise such of the rights and powers vested in it by this Agreement, and use the same degree of care and skill in its exercise as a prudent man would exercise or use under the circumstances in the conduct of his own affairs. No provision of this Agreement shall be construed to relieve the Trustee from liability for its own willful misconduct, knowingly and intentionally committed in bad faith, except that:",generally
"Generally. Except as otherwise specifically prescribed herein, all accounting terms not specifically or completely defined herein shall be construed in conformity with, and all financial data (including financial ratios and other financial calculations) required to be submitted pursuant to this Agreement shall be prepared in conformity with, GAAP applied on a consistent basis, as in effect from time to time, applied in a manner consistent with that used in preparing the Audited Financial Statements; provided, however, that calculations of Synthetic Lease Obligations shall be made by the Borrower in accordance with accepted financial practice and consistent with the terms of such Synthetic Lease Obligations and in the event any accounting term is not defined by GAAP, it shall have the definition mutually agreed upon by the Borrower and the Administrative Agent.",generally
"Generally. Without prejudice to the representations, warranties or covenants regarding the status of any party hereto as a Citizen of the United States, each of Owner, WTC and Mortgagee agrees that it will, immediately upon obtaining knowledge of any facts that would cast doubt upon its continuing status as a Citizen of the United States and promptly upon public disclosure of negotiations in respect of any transaction which would or might adversely affect such status, notify in writing all parties hereto of all relevant matters in connection therewith.",generally
"Generally. Upon request, Borrower shall furnish Lender with executed copies of all Leases then in effect. All renewals of Leases and all proposed leases shall provide for rental rates and terms comparable to existing local market rates and shall be arm’s length transactions with bona fide, independent third-party tenants.",generally
"Generally. All accounting terms not specifically or completely defined herein shall be construed in conformity with, and all financial data (including financial ratios and other financial calculations) required to be submitted pursuant to this Agreement shall be prepared in conformity with, GAAP applied on a consistent basis, as in effect from time to time, applied in a manner consistent with that used in preparing the Audited Financial Statements, except as otherwise specifically prescribed herein. Notwithstanding the foregoing, for purposes of determining compliance with any covenant (including the computation of any financial covenant) contained herein, (i) Indebtedness of the Borrower and its Subsidiaries shall be deemed to be carried at 100% of the outstanding principal amount thereof, and the effects of FASB ASC 825 on financial liabilities shall be disregarded. and (ii) all liability amounts shall be determined excluding any liability relating to any operating lease, all asset amounts shall be determined excluding any right-of-use assets relating to any operating lease, all amortization amounts shall be determined excluding any amortization of a right-of-use asset relating to any operating lease, and all interest amounts shall be determined excluding any deemed interest comprising a portion of fixed rent payable under any operating lease, in each case to the extent that such liability, asset, amortization or interest pertains to an operating lease under which the covenantor or a member of its consolidated group is the lessee and would not have been accounted for as such under GAAP as in effect on December 31, 2015.",generally
"Generally. Executive shall serve as the Senior Vice President of the Bank. Executive shall have and perform such duties, responsibilities, and authorities as are prescribed by or under the Bylaws of the Bank and as are customarily associated with such position or, irrespective of the office, title or other designation, if any, a position with responsibilities and powers substantially identical to such position with the Bank. In addition, Executive shall have and perform such additional duties, responsibilities, and authorities as may be from time to time assigned by the President and Chief Executive Officer based on his assessment of the business needs of the Bank, and the Bank reserves the right to change or modify these assignments and any positions and titles associated therewith. Executive shall devote his full business time and attention, and his best efforts, abilities, experience, and talent, to the position of Senior Vice President and other assignments hereunder, and for the business of the Bank, without commitment to other business endeavors, except that Executive (i) may make personal investments which are not in conflict with his duties to the Bank and manage personal and family financial and legal affairs, (ii) may undertake public speaking engagements, and (iii) may serve as a director of (or similar position with) any other business or an educational, charitable, community, civic, religious, or similar type of organization with the approval of the President and Chief Executive Officer, so long as such activities (i.e., those listed in clauses (i) through (iii)) do not preclude or render unlawful Executive’s employment or service to the Bank or otherwise materially inhibit the performance of Executive’s duties under this Agreement or materially impair the business of the Bank or its affiliates.",generally
"Generally. Each Loan Party has good title to, valid leasehold interests in, or licenses in, all its property material to its business and Mortgaged Property, free and clear of all Liens, except for Permitted Liens and minor irregularities or deficiencies in title that, individually or in the aggregate, would not reasonably be expected to result in a Material Adverse Effect. The property of the Loan Parties, taken as a whole, (i) is in good operating order, condition and repair (ordinary wear and tear and damage by casualty excepted) and (ii) constitutes all the property which is required for the business and operations of the Loan Parties as presently conducted, in each case, to the extent that it would not be reasonably likely to have a Material Adverse Effect.",generally
"Generally. The Parties desire to establish several committees (collectively, “Committees”) to oversee the Program and to facilitate communications between the Parties with respect thereto. Each of such Committees shall have the responsibilities and authority allocated to it in this Article 2. Each of the Committees shall have the obligation to exercise its authority consistent with the respective purpose for such Committee as stated herein and any such decisions shall be made in good faith.",generally
