clause_text,clause_type
"NEGATIVE COVENANTS. So long as the Note shall remain unpaid or the Credit Facility shall be outstanding, the Borrower agrees that, without the prior written consent of the Lender:",negative-covenants
"NEGATIVE COVENANTS. So long as any Lender shall have any Commitment hereunder, any Loan or other Obligation (other than in respect of indemnification, expense reimbursement, yield protection or tax gross-up and contingent obligations in each case with respect to which no claim has been made) hereunder shall remain unpaid or unsatisfied, or any Letter of Credit shall remain outstanding, the Loan Parties shall not, nor shall they permit any Subsidiary to, directly or indirectly:",negative-covenants
NEGATIVE COVENANTS. Tenant shall not do the following.,negative-covenants
NEGATIVE COVENANTS. Each Obligor covenants that so long as any of the Notes are outstanding:,negative-covenants
"NEGATIVE COVENANTS. Borrower, until the full and complete payment of the Obligations, covenants and agrees that Borrower shall not:",negative-covenants
"NEGATIVE COVENANTS. The Borrower hereby covenants and agrees that, until all Obligations (whether now existing or hereafter arising) have been paid in full and the Revolving Credit Commitment has been terminated, unless the Lender shall otherwise consent in writing, the Borrower shall not, and shall not permit any Subsidiary to, directly or indirectly:",negative-covenants
"NEGATIVE COVENANTS. Without FINOVA's prior written consent, which consent FINOVA may withhold in its sole discretion, so long as any Obligation remains outstanding and this Agreement is in effect, Borrower shall not:",negative-covenants
"NEGATIVE COVENANTS. No Loan Party shall, or shall cause or permit any of its Subsidiaries to, do any of the following:",negative-covenants
NEGATIVE COVENANTS. Borrower shall not do any of the following without the prior written consent of Agent and Required Lenders:,negative-covenants
"NEGATIVE COVENANTS. Borrower covenants to Lender that from and after the date hereof and so long as any amount remains unpaid on account of any of the Obligations or this Agreement remains effective (whichever is the last to occur), Borrower will not do (and will not permit any Subsidiary to do), without the prior written consent of Lender, any of the things or acts set forth below:",negative-covenants
"NEGATIVE COVENANTS. Borrower agrees that so long as any loans, obligations or liabilities remain outstanding or unpaid to Bank or the commitment of Bank hereunder is in effect, neither Borrower, nor any of its subsidiaries (""Subsidiaries"") will, without the prior written consent of Bank, which will not be unreasonably withheld:",negative-covenants
"NEGATIVE COVENANTS. Company covenants and agrees that, so long as Bank may make any Advances under this Agreement and thereafter so long as any Indebtedness remains outstanding under this Agreement, it will not, and will cause its Subsidiaries not to, without the prior written consent of Bank:",negative-covenants
"NEGATIVE COVENANTS. Each Loan Party hereby agrees that, so long as the Commitments remain in effect or any Loan or other amount (other than contingent indemnification obligations for which no claim has been made) is owing to any Lender or the Administrative Agent hereunder, such Loan Party shall not, and shall not permit any of its Subsidiaries to, directly or indirectly:",negative-covenants
"NEGATIVE COVENANTS. So long as any Loan remains unpaid, or any other Obligation remains unpaid or unperformed under any Loan Document, any Letter of Credit remains outstanding, or any portion of the Commitments remains in force, Borrower shall not, and shall not permit any of its Subsidiaries to, directly or indirectly:",negative-covenants
"NEGATIVE COVENANTS. From the date hereof and for so long as the Commitments shall be in effect, any amount shall remain outstanding under the Notes, any Bankers' Acceptance or Letter of Credit shall remain outstanding or any monetary Obligation then due and payable shall remain unpaid or unsatisfied, each Credit Party agrees that, unless the Required Lenders shall otherwise consent in writing, it will not and will not allow any of its Subsidiaries (other than the Unrestricted Subsidiaries) to:",negative-covenants
"NEGATIVE COVENANTS. So long as any Lender shall have any Commitment hereunder, any Loan or other Obligation hereunder shall remain unpaid or unsatisfied (other than (a) contingent indemnification obligations and (b) obligations and liabilities under Secured Cash Management Agreements and Secured Hedge Agreements), or any Letter of Credit shall remain outstanding (except to the extent Cash Collateralized), the Company shall not, nor shall it permit any Subsidiary to, directly or indirectly:",negative-covenants
NEGATIVE COVENANTS. So long as the Termination Conditions are not satisfied:,negative-covenants
NEGATIVE COVENANTS. The breach of any covenant contained in Article 8 herein.,negative-covenants
"NEGATIVE COVENANTS. So long as any Advance or Exchange Note is Outstanding, the Borrower will not:",negative-covenants
"NEGATIVE COVENANTS. Unless otherwise approved in writing by the Required Lenders, the Borrower covenants and agrees that, until the payment in full of all Borrower Obligations:",negative-covenants
"NEGATIVE COVENANTS. Seller hereby covenants and agrees with Buyer that during the term of this Agreement and for so long as there remain any obligations of Seller to be paid or performed under this Agreement, Seller shall comply with the following:",negative-covenants
"NEGATIVE COVENANTS. So long as any Obligations shall remain unpaid, any Facility LC shall remain outstanding or any Bank shall have any Commitment under this Agreement:",negative-covenants
"NEGATIVE COVENANTS. Until all the later of (i) the date on which all of the Obligations shall have been paid in full and (ii) such later date specified in this Agreement, the Credit Parties covenant and agree with the Lenders that: SECTION 6.01 [Reserved].",negative-covenants
"NEGATIVE COVENANTS. During the term of this Agreement and until the performance of all Obligations, Borrower will not:",negative-covenants
"NEGATIVE COVENANTS. Seller shall not, without the prior written consent of Buyer:",negative-covenants
"NEGATIVE COVENANTS. For so long as Bank has an obligation to lend or there are any outstanding Obligations, Borrower shall not, without Bank’s prior written consent (which shall be a matter of its good faith business judgment), do any of the following:",negative-covenants
"NEGATIVE COVENANTS. The Borrower hereby covenants and agrees (on its own behalf and on behalf of the other Credit Parties, as applicable) that until the Obligations, together with interest, fees and other obligations hereunder, have been paid in full and the Revolving Commitments hereunder shall have terminated:",negative-covenants
"NEGATIVE COVENANTS. So long as any Lender shall have any Commitment hereunder, any Loan or other Obligation hereunder shall remain unpaid or unsatisfied (other than (A) contingent indemnification obligations and (B) obligations and liabilities under Swap Contracts and Treasury Management Agreements not then due and payable), or any Letter of Credit shall remain outstanding (other than Letters of Credit as to which arrangements reasonably satisfactory to the Administrative Agent and the L/C Issuers shall have been made), the U.S. Borrower shall not, and shall not permit any Restricted Subsidiary to:",negative-covenants
"NEGATIVE COVENANTS. The Borrower and the Guarantors, when applicable, covenant and agree that on and after the date hereof and until the Loan and the Note, together with interest, fees and all other obligations incurred hereunder and thereunder, are paid in full:",negative-covenants
"NEGATIVE COVENANTS. So long as any of the Notes shall remain unpaid or any Letter of Credit Obligation shall remain outstanding or any Bank Party shall have any Revolving Credit Commitment hereunder or any other amount is owing by Borrower to any Bank Party hereunder or under any other Loan Document, Borrower and each Guarantor shall not:",negative-covenants
"NEGATIVE COVENANTS. The Borrower hereby agrees that, until all Commitments have been terminated and the principal of and interest on each Loan, all fees and all other expenses or amounts payable under any Loan Document and all other Obligations shall have been paid in full (other than (i) contingent indemnification and reimbursement obligations for which no claim has been made, (ii) Cash Management Obligations as to which arrangements reasonably satisfactory to the Cash Management Providers have been made and (iii) obligations under Qualified Hedging Agreements as to which arrangements reasonably satisfactory to the Qualified Counterparties have been made) and all Letters of Credit have been canceled, have expired or have been Collateralized or, to the reasonable satisfaction of the applicable Issuing Lender, rolled into another credit facility, the Borrower will and will cause the Restricted Subsidiaries to, comply with this Section 7.",negative-covenants
"NEGATIVE COVENANTS. The Lead Borrower and each Restricted Subsidiary (and Holdings in the case of Section 10.09(c)) hereby covenant and agree that on and after the Closing Date and so long as any Lender shall have any Commitment hereunder, any Loan or other Obligation hereunder (other than (i) any indemnification obligations arising hereunder which are not then due and payable and shall remain unpaid or unsatisfied and (ii) Secured Bank Product Obligations) or any Letter of Credit shall remain outstanding (unless Cash Collateralized or backstopped on terms reasonably satisfactory to the Administrative Agent):",negative-covenants
"NEGATIVE COVENANTS. So long as any Lender shall have any Commitment hereunder, any Loan or other Obligation hereunder (other than indemnification obligations which are solely contingent, if any) shall remain unpaid or unsatisfied, or any Letter of Credit shall remain outstanding, the Credit Parties shall not, nor shall they permit any Subsidiary to, directly or indirectly, and solely in the case of Section 7.16, the Partnership and the General Partner shall not:",negative-covenants
"NEGATIVE COVENANTS. So long as Agent or any Lender shall have any Commitment hereunder or there shall be any outstanding Letters of Credit and until payment in full of each Loan and performance of all other obligations of Borrower under this Agreement and the other Loan Documents, Borrower agrees that it will not do any of the following unless Agent shall otherwise consent in writing, such consent not to be unreasonably withheld.",negative-covenants
"NEGATIVE COVENANTS. The Borrowers covenant and agree that until Payment In Full of the Loans and interest thereon, expiration or termination of all Letters of Credit, satisfaction of all of the Borrowers' other Obligations hereunder and termination of the Revolving Credit Commitments, the Borrowers shall comply, and shall cause each of their Subsidiaries to comply, with the following negative covenants:",negative-covenants
NEGATIVE COVENANTS. Until all obligations of the Banks hereunder to make the Revolving Loans and of the LC Bank to issue Letters of Credit shall have expired or been terminated and the Notes and all of the other Obligations have been paid in full and all outstanding Letters of Credit shall have expired or the liability of the LC Bank thereon shall have otherwise been discharged:,negative-covenants
"NEGATIVE COVENANTS. Holdings and the Borrower hereby ------------------ covenant and agree that as of the Effective Date and thereafter for so long as this Agreement is in effect and until the Total Commitments have terminated, no Letters of Credit (other than Letters of Credit, together with all Fees that have accrued and will accrue thereon through the stated termination date of such Letters of Credit, which have been cash collateralized in a cash collateral account in a manner satisfactory to the Letter of Credit Issuer in its sole and absolute discretion) or Notes are outstanding and the Loans, together with interest, Fees and all other Obligations (other than any indemnities described in Section 13.13 which are not then due and payable) incurred hereunder, are paid in full:",negative-covenants
"NEGATIVE COVENANTS. So long as any Notes are Outstanding, the Issuer shall not, unless the Insurer otherwise consents in writing:",negative-covenants
"NEGATIVE COVENANTS. During the term of this Agreement, unless Funding and the Deal Agent shall otherwise consent in writing:",negative-covenants
"NEGATIVE COVENANTS. Except as may be permitted in the Schedule, Borrower shall not, without PFG's prior written consent (which shall be a matter of its good faith business judgment and shall be conditioned on Borrower then being in compliance with the terms of this Agreement), do any of the following:",negative-covenants
NEGATIVE COVENANTS. Each Facility Party agrees that so long as any Lender has any Commitment hereunder or any Obligations or other amount payable hereunder or under any Note or other Loan Document remains unpaid:,negative-covenants
"NEGATIVE COVENANTS. Until the LC Obligations and all other Obligations are paid in full and until the Final Maturity Date, the Borrower agrees that, unless at any time the Required Lenders shall otherwise expressly consent in writing, it will:",negative-covenants
"NEGATIVE COVENANTS. The Borrower covenants and agrees that, so long as the Term Loan Commitment shall remain available and until full and final payment of all Obligations incurred under the Loan Documents, without the prior written consent of either all of the Lenders pursuant to Section 14.13(b)(iii) or the consent of the Required Lenders in all other cases, it will not, and the General Partner will not and, in the case of Sections 9.9, the Borrower’s Subsidiaries will not:",negative-covenants
"NEGATIVE COVENANTS. Until any obligation of the Lender hereunder to make the Term Loan and Revolving Loans has expired or been terminated and the Notes and all of the other Obligations have been paid in full, unless the Lender otherwise consents in writing:",negative-covenants
"NEGATIVE COVENANTS. Each Borrower hereby covenants and agrees that on and after the Closing Date and until the Total Commitment and all Letters of Credit have terminated or expired (or, in the case of Letters of Credit only, are supported by backstop letters of credit or cash collateral, in either case in amounts and on terms reasonably acceptable to the Administrative Agent and the respective Issuing Lenders) and the Loans, Notes and Unpaid Drawings (in each case, together with interest thereon), Fees and all other Obligations (other than any indemnities described in Section 13.13 and similar indemnities in the Credit Documents, in each case which are not then due and payable) incurred hereunder and thereunder, are paid in full:",negative-covenants
"NEGATIVE COVENANTS. From the date hereof until the Effective Time, CenterState shall not and shall not permit any of its Subsidiaries to take any action or knowingly fail to take any action not contemplated by this Agreement that is intended or is reasonably likely to (i) prevent, delay or impair CenterState’s ability to consummate the Merger or the transactions contemplated by this Agreement or (ii) agree to take, make any commitment to take, or adopt any resolutions of its board of directors in support of, any of the actions prohibited by this Section 5.02.",negative-covenants
"NEGATIVE COVENANTS. So long as any Lender shall have any Commitment hereunder, any Loan or other Obligation hereunder shall remain unpaid or unsatisfied, no Credit Party shall directly or indirectly:",negative-covenants
"NEGATIVE COVENANTS. So long as any of the Obligations or the Commitment or Letters of Credit therefor shall be outstanding hereunder, the Borrowers agree with the Lender that without the prior written consent of the Lender:",negative-covenants
"NEGATIVE COVENANTS. SECTION 6.01. Indebtedness.................................................67 SECTION 6.02. Liens........................................................69 SECTION 6.03. Sale and Lease-Back Transactions.............................70 SECTION 6.04. Investments, Loans and Advances..............................71 SECTION 6.05. Mergers, Consolidations, Sales of Assets and Acquisitions....72 SECTION 6.06. Restricted Payments; Restrictive Agreements..................73 SECTION 6.07. Transactions with Affiliates.................................75 SECTION 6.08. Business of Holdings, Borrower and Subsidiaries..............75 SECTION 6.09. Other Indebtedness and Agreements............................75 SECTION 6.10. Capital Expenditures.........................................75 SECTION 6.11. Interest Coverage Ratio......................................76 SECTION 6.12. Fixed Charge Coverage Ratio..................................76 SECTION 6.13. Maximum Leverage Ratio.......................................76 SECTION 6.14. Maximum Senior Leverage Ratio................................76 SECTION 6.15. Fiscal Year..................................................77 SECTION 6.16. Management Fees..............................................77 SECTION 6.17. Indebtedness of Co-investment Subsidiaries...................77",negative-covenants
"NEGATIVE COVENANTS. SECTION 6.01. Indebtedness; Certain Equity Securities......................53 SECTION 6.02. Liens........................................................55 SECTION 6.03. Fundamental Changes..........................................56 SECTION 6.04. Investments, Loans, Advances, Guarantees and Acquisitions....56 SECTION 6.05. Asset Sales..................................................58 SECTION 6.06. Sale and Lease-Back Transactions.............................58 SECTION 6.07. Hedging Agreements...........................................59 SECTION 6.08. Restricted Payments; Certain Payments of Indebtedness........59 SECTION 6.09. Transactions with Affiliates.................................60 SECTION 6.10. Restrictive Agreements.......................................60 SECTION 6.11. Amendment of Material Documents..............................61 SECTION 6.12. Capital Expenditures.........................................61 SECTION 6.13. Leverage Ratio...............................................62 SECTION 6.14. Consolidated Fixed Charge Coverage Ratio.....................62 SECTION 6.15. Minimum Consolidated EBITDA..................................62 SECTION 6.16. Changes in Fiscal Periods....................................62",negative-covenants
NEGATIVE COVENANTS. Borrower shall comply with the following covenants:,negative-covenants
"NEGATIVE COVENANTS. Until Payment in Full, the Borrower covenants and agrees with the Lenders that:",negative-covenants
"NEGATIVE COVENANTS. Until payment and satisfaction in full of all Obligations and the termination of this Agreement, Borrower hereby covenants and agrees as follows:",negative-covenants
NEGATIVE COVENANTS. Each Credit Party covenants and agrees that until the Facility Termination Date:,negative-covenants
"NEGATIVE COVENANTS. Borrower covenants and agrees with Lender that as long as this Agreement remains in effect Borrower shall not, without the prior written consent of Lender:",negative-covenants
"NEGATIVE COVENANTS. So long as any Lender shall have any Commitment hereunder, any Loan or other Obligation hereunder (other than inchoate indemnification liabilities arising under the Loan Documents) shall remain unpaid or unsatisfied, or any Letter of Credit shall remain outstanding, the Borrower shall not, nor shall it permit any other Loan Party (except as limited below) to:",negative-covenants
"NEGATIVE COVENANTS. From the Closing Date and until the Termination Date, the Borrower covenants and agrees with the Lenders that:",negative-covenants
"NEGATIVE COVENANTS. So long as any Lender shall have any Commitment hereunder or any Loan or other Obligation hereunder shall not be Fully Satisfied, the Loan Parties shall not, nor shall they permit any other Consolidated Party (except where expressly limited to the Borrower or the Loan Parties, as applicable), directly or indirectly, to:",negative-covenants
"NEGATIVE COVENANTS. The Borrower covenants and agrees that, until the Termination Date, the Borrower will not, nor will it cause or permit any of the Restricted Subsidiaries to:",negative-covenants
"NEGATIVE COVENANTS. The Lead Borrower and each of its Restricted Subsidiaries (and Holdings in the case of Section 10.09(b)) hereby covenant and agree that on and after the Closing Date and until the Term Loans and Notes (in each case, together with interest thereon), Fees and all other Obligations (other than any indemnification obligations arising hereunder which are not then due and payable and obligations in respect of Interest Rate Protection Agreements, Other Hedging Agreements or Treasury Services Agreements) incurred hereunder and thereunder, are paid in full:",negative-covenants
"NEGATIVE COVENANTS. Without the prior written consent of Bank and so long as any part of the principal or interest on the Note shall remain unpaid or Bank remains obligated to make advances hereunder, Borrower and its Subsidiaries will not:",negative-covenants
"NEGATIVE COVENANTS. So long as any Lender shall have any Commitment hereunder or any principal of any Loan, Unreimbursed LC Disbursement, interest or fees payable hereunder shall remain unpaid or any Letter of Credit shall remain outstanding, no Credit Party will, without the written consent of the Required Lenders:",negative-covenants
"NEGATIVE COVENANTS. During the Term, Dental Group shall not, without ------------------ the prior approval of the Joint Operations Committee, (a) assign, pledge, mortgage or otherwise encumber any of its property, (b) transfer substantially all of its assets, including its goodwill, (c) merge or consolidate with any other entity, (d) allow the transfer or issuance of any of its stock (other than in accordance with the terms and provisions of that certain Share Acquisition Agreement dated June 19, 1997, between GMS Dental Group Management, Inc., a Delaware corporation and Warren M. Francis, Jr., D.D.S.), or (e) take or allow any act that would materially impair the ability of Dental Group to carry on the business of the Practice or to fulfill its obligations under this Agreement.",negative-covenants
"NEGATIVE COVENANTS. Until termination of this Credit Agreement and payment and satisfaction of all Obligations due hereunder, each Borrower shall comply with, and, where required, shall cause each of its Subsidiaries to comply with, the following covenants:",negative-covenants
"NEGATIVE COVENANTS. Until the expiration or termination of the Commitments and thereafter until all Obligations (other than contingent indemnification obligations to the extent no claim giving rise thereto has been asserted) of Borrower and the other Loan Parties hereunder and under the other Loan Documents are Paid in Full, Borrower agrees that, unless at any time Lender shall otherwise expressly consent in writing, it will:",negative-covenants
"NEGATIVE COVENANTS. So long as Lenders have any commitment to lend hereunder or to cause the issuance of any Letters of Credit hereunder or any Letter of Credit Liability exists, and until payment in full of the Notes and the Loans and all interest, fees, and other amounts then owing (other than in respect of contingent indemnification and expense reimbursement obligations for which no claim has been made) under this Credit Agreement and the other Loan Documents, each Borrower Party, as applicable, agrees that, without the written consent of Administrative Agent, based upon the approval of Required Lenders (unless the approval of Administrative Agent alone or a different number of Lenders is expressly permitted below):",negative-covenants
"NEGATIVE COVENANTS. Borrower covenants and agrees that, until all instruments and agreements evidencing each and every loan, Letter of Credit and other financial accommodation by the Bank to the Borrower or any Loan Party are fully discharged and terminated, and thereafter, so long as any Indebtedness remains outstanding, it will not, and it will not allow any Loan Party within its control or under common control to, without the prior written consent of the Bank:",negative-covenants
"NEGATIVE COVENANTS. Borrower covenants and agrees that, while any of the Commitments remains in effect and until all of the Loan Obligations are fully and indefeasibly paid, no Letters of Credit are outstanding and the Letter of Credit Exposure is zero, Borrower shall not, directly or indirectly, do any of the following, or permit any Covered Person to do any of the following, without the prior written consent of Required Lenders:",negative-covenants
"NEGATIVE COVENANTS. Until the Commitments have expired or terminated and the principal of and interest (and premium, if any) on each Loan and all fees payable hereunder have been paid in full and all Letters of Credit and Foreign Credit Instruments have expired (without any pending drawing) or terminated (or been fully cash collateralized or otherwise supported in a manner consistent with the terms of Section 2.5(j) or Section 2.6(o)(iv), as applicable) and all LC Disbursements and Foreign Credit Disbursements shall have been reimbursed, the Parent Borrower covenants and agrees with the Lenders that:",negative-covenants
"NEGATIVE COVENANTS. Until Full Payment of all Obligations, each Borrower (on behalf of itself and its Restricted Subsidiaries) and each Guarantor by its execution of this Agreement, covenants and agrees with the Administrative Agent, Issuing Banks and the Lenders that:",negative-covenants
