clause_text,clause_type
"NEGATIVE COVENANTS. Until the Commitments have expired or terminated and the principal of and interest on each Loan and all fees payable hereunder have been paid in full and all Letters of Credit have expired or terminated and all LC Disbursements shall have been reimbursed, the Borrower covenants and agrees with the Lenders that:",negative-covenants
"NEGATIVE COVENANTS. So long as any Lender shall have any Commitment hereunder, any Loan or other Obligation hereunder shall remain unpaid or unsatisfied, or any Letter of Credit shall remain outstanding, the Borrower shall not, nor shall it permit any Subsidiary to, directly or indirectly:",negative-covenants
"NEGATIVE COVENANTS. So long as any Notes are Outstanding, the Issuer shall not:",negative-covenants
"NEGATIVE COVENANTS. Until the Commitments have expired or terminated and the principal of and interest on each Loan and all fees payable hereunder have been paid in full, the Borrower covenants and agrees with the Lenders that:",negative-covenants
"NEGATIVE COVENANTS. The Borrower hereby agrees that, so long as the Commitments remain in effect, any Letter of Credit remains outstanding or any Loan or other amount is owing to any Lender or the Administrative Agent hereunder, the Borrower shall not, and shall not permit any of its Subsidiaries to, directly or indirectly:",negative-covenants
NEGATIVE COVENANTS. Borrower shall not do any of the following without Bank’s prior written consent:,negative-covenants
"NEGATIVE COVENANTS. Each Loan Party warrants, covenants and agrees with each Lender that, so long as this Agreement shall remain in effect and until the Commitments have been terminated and the principal of and interest on each Loan, all Fees and all other expenses or amounts payable under any Loan Document have been paid in full and all Letters of Credit have been canceled or have expired and all amounts drawn thereunder have been reimbursed in full, unless the Required Lenders shall otherwise consent in writing, no Loan Party will, nor will they cause or permit any Subsidiaries to:",negative-covenants
NEGATIVE COVENANTS. The Company covenants that so long as any of the Notes are outstanding:,negative-covenants
"NEGATIVE COVENANTS. Borrower covenants and agrees with Lender that while this Agreement is in effect, Borrower shall not, without the prior written consent of Lender:",negative-covenants
"NEGATIVE COVENANTS. So long as any Advance shall remain unpaid or any Lender shall have any Commitment hereunder, the Borrower will not:",negative-covenants
"NEGATIVE COVENANTS. The Company covenants and agrees that, from the date hereof until the Obligations have been fully paid and satisfied, the Company shall not, unless the Secured Party shall consent otherwise in writing:",negative-covenants
"NEGATIVE COVENANTS. From the Closing Date until payment and performance in full of all obligations of Borrower under the Loan Documents or the earlier release of the Lien of the Mortgage encumbering the Property in accordance with the terms of this Agreement and the other Loan Documents, Borrower covenants and agrees with Lender that it will not do, directly or indirectly, any of the following:",negative-covenants
"NEGATIVE COVENANTS. Borrower further covenants that so long as Bank remains committed to extend credit to Borrower pursuant hereto, or any liabilities (whether direct or contingent, liquidated or unliquidated) of Borrower to Bank under any of the Loan Documents remain outstanding, and until payment in full of all obligations of Borrower subject hereto, Borrower will not without Bank's prior written consent:",negative-covenants
"NEGATIVE COVENANTS. So long as any Lender shall have any Commitment hereunder, any Loan or other Obligation hereunder shall remain unpaid or unsatisfied, or any Letter of Credit shall remain outstanding (other than contingent indemnification obligations for which a claim has not been asserted), no Loan Party shall, nor shall it permit any Subsidiary to, directly or indirectly:",negative-covenants
"NEGATIVE COVENANTS. So long as any Bank shall have any Commitment hereunder, or any Loan or other Obligation shall remain unpaid or unsatisfied, unless the Majority Banks waive compliance in writing:",negative-covenants
"NEGATIVE COVENANTS. Borrower covenants and agrees that, so long as any credit hereunder shall be available and until payment in full of the outstanding Obligations or for so long as Bank may have any commitment to make any Credit Extensions, Borrower will not do any of the following:",negative-covenants
"NEGATIVE COVENANTS. The Borrower covenants and agrees with each Lender that, so long as this Agreement shall remain in effect (other than in respect of contingent indemnification obligations for which no claim has been made) and until the Commitments have been terminated and the Obligations (including principal of and interest on each Loan, all fees and all other expenses or amounts payable under any Loan Document) have been paid in full, unless the Required Lenders shall otherwise consent in writing, the Borrower will not, and will not permit any of the Material Subsidiaries to:",negative-covenants
"NEGATIVE COVENANTS. For so long as this Agreement is in effect, unless the Requisite Lenders (or, if required pursuant to Section 12.6., all of the Lenders) shall otherwise consent in the manner set forth in Section 12.6., the Borrower shall comply with the following covenants:",negative-covenants
"NEGATIVE COVENANTS. So long as any Lender shall have any Commitment hereunder, any Loan or other Obligation hereunder shall remain unpaid or unsatisfied, or any Letter of Credit shall remain outstanding:",negative-covenants
"NEGATIVE COVENANTS. Borrower covenants and agrees that, so long as any credit hereunder shall be available and until the outstanding Obligations are paid in full or for so long as Bank may have any commitment to make any Credit Extensions, Borrower will not do any of the following without Bank’s prior written consent, which shall not be unreasonably withheld:",negative-covenants
"NEGATIVE COVENANTS. Except as may be permitted in the Schedule, Borrower shall not, without Silicon's prior written consent, do any of the following: (i) merge or consolidate with another corporation or entity; (ii) acquire any assets, except in the ordinary course of business; (iii) enter into any other transaction outside the ordinary course of business; (iv) sell or transfer any Collateral, except for the sale of finished Inventory in the ordinary course of Borrower's business, and except for the sale of obsolete or unneeded Equipment in the ordinary course of business; (v) store any Inventory or other Collateral with any warehouseman or other third party; (vi) sell any Inventory on a sale-or-return, guaranteed sale, consignment, or other contingent basis; (vii) make any loans of any money or other assets; (viii) incur any debts, outside the ordinary course of business, which would have a material, adverse effect on Borrower or on the prospect of repayment of the Obligations; (ix) guarantee or otherwise become liable with respect to the obligations of another party or entity; (x) pay or declare any dividends on Borrower's stock (except for dividends payable solely in stock of Borrower); (xi) redeem, retire, purchase or otherwise acquire, directly or indirectly, any of Borrower's stock; (xii) make any change in Borrower's capital structure which would have a material adverse effect on Borrower or on the prospect of repayment of the Obligations; or (xiii) pay total compensation, including salaries, fees, bonuses, commissions, and all other payments, whether directly or indirectly, in money or otherwise, to Borrower's executives, officers and directors (or any relative thereof) in an amount in excess of the amount set forth on the Schedule; or (xiv) dissolve or elect to dissolve. Transactions permitted by the foregoing provisions of this Section are only permitted if no Default or Event of Default would occur as a result of such transaction.",negative-covenants
"NEGATIVE COVENANTS. Borrower shall not, and shall not permit any of its Subsidiaries to, do any of the following without the prior written consent of the Required Lenders:",negative-covenants
"NEGATIVE COVENANTS. The Borrower agrees with the Facility Agent and each Lender that, from the Effective Date until all Commitments have terminated and all Obligations have been paid and performed in full, the Borrower will perform the obligations set forth in this Section 7.2.",negative-covenants
"NEGATIVE COVENANTS. Until the Commitments have expired or terminated and the principal of and interest on each Loan and all Fees and other amounts payable hereunder or under any other Loan Document have been paid in full and all Letters of Credit have expired or terminated and all LC Disbursements shall have been reimbursed, each of the Loan Parties agrees with the Lenders that:",negative-covenants
"NEGATIVE COVENANTS. Until the Commitments shall have expired or been terminated and the principal of and interest on each Loan and all fees, expenses and other amounts payable under this Agreement or any other Loan Document have been paid in full (other than contingent amounts not yet due) and all Letters of Credit have expired or been terminated or shall have been backstopped or cash collateralized (in each case, in a manner reasonably satisfactory to the applicable Issuing Bank) and all LC Disbursements shall have been reimbursed, the Borrower covenants and agrees with the Lenders that:",negative-covenants
"NEGATIVE COVENANTS. So long as any Advance or any other Obligation of any Loan Party under any Loan Document shall remain unpaid, any Letter of Credit shall be outstanding or any Lender Party shall have any Commitment hereunder, no Loan Party will, at any time:",negative-covenants
"NEGATIVE COVENANTS. Each Credit Party covenants and agrees that, so long as any Commitment is in effect and until payment in full of all Obligations and cancellation or expiration of all Letters of Credit, such Credit Party shall perform, and shall cause each of its Subsidiaries to perform, all covenants in this Section 6.",negative-covenants
NEGATIVE COVENANTS. Borrower will not do any of the following:,negative-covenants
"NEGATIVE COVENANTS. Each Borrower covenants and agrees as to itself and its Subsidiaries that on and after the Effective Date and until the Total Commitment and all Letters of Credit have terminated and the Loans, Notes and Unpaid Drawings, together with interest, Fees and all other Obligations incurred hereunder and thereunder are paid in full:",negative-covenants
NEGATIVE COVENANTS. 46 (a) Net Worth . . . . . . . . . . . . . . . . . . . . . . . . . . . . . . . . . . . . 46 (b) Total Debt to EBITDA Ratio . . . . . . . . . . . . . . . . . . . . . . . . . . . 46 (c) Fixed Charge Coverage Ratio . . . . . . . . . . . . . . . . . . . . . . . . . . . 47 (d) Interest Coverage Ratio . . . . . . . . . . . . . . . . . . . . . . . . . . . . . 47 (e) Indebtedness . . . . . . . . . . . . . . . . . . . . . . . . . . . . . . . . . . 47 (f) Liens . . . . . . . . . . . . . . . . . . . . . . . . . . . . . . . . . . . . . . 47 (g),negative-covenants
"NEGATIVE COVENANTS. Each Borrower covenants and agrees that, so long as any credit hereunder shall be available and until full and final payment of the Obligations, Borrowers will not and will not permit any of their respective Subsidiaries to do any of the following:",negative-covenants
NEGATIVE COVENANTS. Each Credit Party executing this Agreement jointly and severally agrees as to all Credit Parties that from and after the date hereof until the Termination Date:,negative-covenants
"NEGATIVE COVENANTS. Until all of the Obligations have been paid and satisfied in full and the Commitments terminated, unless consent has been obtained in the manner set forth in Section 14.11, the Borrower has not and will not and will not permit any of its Restricted Subsidiaries to:",negative-covenants
"NEGATIVE COVENANTS. The Borrower hereby covenants and agrees that on and after the Effective Date and until the Total Commitment and all Letters of Credit have terminated and the Loans, Notes and Unpaid Drawings (in each case, together with interest thereon), Fees and all other Obligations (other than any indemnities described in Section 13.13 which are not then due and payable) incurred hereunder and thereunder, are paid in full:",negative-covenants
"NEGATIVE COVENANTS. Borrower covenants and agrees that, until termination of all of the Commitments and payment in full of the Obligations, Borrower will not and will not permit any of its Subsidiaries to do any of the following:",negative-covenants
"NEGATIVE COVENANTS. Until the Commitments have expired or terminated and the principal of and interest on each Loan and all fees payable hereunder have been paid in full and all Letters of Credit have been cancelled or expired or cash collateralized on terms satisfactory to the applicable Issuing Banks, each Loan Party covenants and agrees with the Lenders that:",negative-covenants
"NEGATIVE COVENANTS. The Borrower hereby covenants and agrees that on the Effective Date and thereafter for so long as this Agreement is in effect and until such time as the Total Commitment has been terminated, no Notes remain outstanding and the Loans, together with interest, Fees and all other Obligations incurred hereunder are paid in full:",negative-covenants
"NEGATIVE COVENANTS. Until the termination of this Agreement, the Financial Institution will not enter into (i) an agreement relating to a Collateral Account in which it agrees to comply with entitlement orders or instructions of any Person other than the Secured Party or (ii) an agreement limiting or conditioning the Financial Institution’s obligation to comply with Secured Party Orders.",negative-covenants
"NEGATIVE COVENANTS. So long as a Note is outstanding, without the consent of the Subscribers, the Company will not and will not permit any of its Subsidiaries to directly or indirectly:",negative-covenants
"NEGATIVE COVENANTS. The Loan Parties, jointly and severally, covenant and agree that until payment in full of the Loans, Reimbursement Obligations and Letter of Credit Borrowings and interest thereon, expiration or termination of all Letters of Credit, satisfaction of all of the Loan Parties' other Obligations hereunder and termination of the Commitments, the Loan Parties shall comply with the following negative covenants:",negative-covenants
"NEGATIVE COVENANTS. The Company covenants and agrees with each Lender and the Administrative Agent that, so long as this Agreement shall remain in effect or the principal of or interest on any Loan, any Fees or any other expenses or amounts payable under any Loan Document shall be unpaid, unless the Required Lenders shall otherwise consent in writing, the Company will not, and will not cause or permit any of its Subsidiaries to:",negative-covenants
"NEGATIVE COVENANTS. Each Credit Party hereby covenants and agrees that, so long as this Credit Agreement is in effect or any amounts payable hereunder or under any other Credit Document shall remain outstanding, and until all of the Commitments hereunder shall have terminated:",negative-covenants
"NEGATIVE COVENANTS. Each Borrower covenants and agrees that, until termination of all of the Commitments and payment in full of the Obligations:",negative-covenants
"NEGATIVE COVENANTS. So long as any amount payable by the Borrower hereunder shall remain unpaid or any Lender shall have any Commitment or any Letter of Credit shall remain outstanding hereunder, the Borrower will not, without the written consent of the Majority Lenders:",negative-covenants
"NEGATIVE COVENANTS. Until the Termination Date, the Issuer shall not:",negative-covenants
"NEGATIVE COVENANTS. Each of the Loan Parties hereby covenants and agrees that on the Closing Date and thereafter until the Facility Termination Date, no Loan Party shall, nor shall it permit any Subsidiary to, directly or indirectly:",negative-covenants
"NEGATIVE COVENANTS. Each Borrower, severally but not jointly, hereby covenants and agrees that so long as this Credit Agreement is in effect and until the Loans, together with interest, fees and other obligations hereunder, have been paid in full and the Commitments and all Letters of Credit hereunder shall have terminated:",negative-covenants
"NEGATIVE COVENANTS. Until all of the Obligations (other than contingent, indemnification obligations not then due) have been paid and satisfied in full in cash, all Letters of Credit have been terminated or expired (or been Cash Collateralized) and the Commitments terminated, the Credit Parties will not, and will not permit any of their respective Subsidiaries to.",negative-covenants
"NEGATIVE COVENANTS. So long as any Advance remains unpaid, or any other Obligation remains unpaid, or any portion of any of the Commitments remains in force, Borrower shall not, and shall not permit any of its Subsidiaries to, unless the Administrative Agent (with the written approval of the Requisite Lenders or, if required by Section 11.2, all of the Lenders) otherwise consents:",negative-covenants
"NEGATIVE COVENANTS. Each Credit Agreement Party hereby covenants and agrees that as of the Restatement Effective Date and thereafter for so long as this Agreement is in effect and until the Total Commitment has terminated, no Letters of Credit, Bank Guaranties or Notes are outstanding and the Loans, together with interest, Fees and all other Obligations (other than any indemnities described in Section 13.13 which are not then due and payable) incurred hereunder, are paid in full:",negative-covenants
"NEGATIVE COVENANTS. The Borrower covenants and agrees that, until the termination of the Commitments, the termination or expiration of all Letters of Credit and the payment in full of all principal and interest with respect to the Loans and all Reimbursement Obligations together with all other amounts then due and owing hereunder:",negative-covenants
"NEGATIVE COVENANTS. So long as any Note or any amount under any Loan Document shall remain unpaid, any Letter of Credit shall remain outstanding, or any Lender shall have any Commitment, the Borrower agrees, unless the Majority Lenders otherwise consent in writing, to comply with the following covenants.",negative-covenants
"NEGATIVE COVENANTS. So long as any Notes are Outstanding, the Issuing Entity shall not:",negative-covenants
"NEGATIVE COVENANTS. The Borrower covenants and agrees that, so long as any of the Commitments are in effect and until payment in full of Loans hereunder, all interest thereon and all other amounts payable by the Borrower hereunder, without the prior written consent of the Majority Lenders:",negative-covenants
NEGATIVE COVENANTS. The Borrower covenants and agrees that so long as any Lender has a Commitment hereunder or any Obligation remains outstanding:,negative-covenants
"NEGATIVE COVENANTS. So long as any principal of or interest on any Loan or any other Obligation (whether or not due) shall remain unpaid (other than Contingent Indemnity Obligations) or any Lender shall have any Commitment hereunder, each Loan Party shall not, unless the Required Lenders shall otherwise consent in writing:",negative-covenants
"NEGATIVE COVENANTS. No Borrower shall, until satisfaction in full of the Obligations and termination of this Agreement:",negative-covenants
"NEGATIVE COVENANTS. So long as any Advance shall remain unpaid, any Letter of Credit is outstanding or any Lender shall have any Commitment hereunder, the Company will not:",negative-covenants
"NEGATIVE COVENANTS. Each Borrower agrees that, so long as any Credit Exposure exists:",negative-covenants
"NEGATIVE COVENANTS. Until the expiration or termination of the Commitments and thereafter until all Obligations hereunder and under the other Loan Documents are paid in full and all Letters of Credit have been terminated, the Company agrees that, unless at any time the Required Lenders shall otherwise expressly consent in writing, it will:",negative-covenants
"NEGATIVE COVENANTS. Until full payment and performance of all obligations of Borrower under the Loan Documents, Borrower will not, without the prior written consent of Bank (and without limiting any requirement of any other Loan Documents):",negative-covenants
"NEGATIVE COVENANTS. For so long as this Agreement is in effect, the Borrower shall comply with the following covenants:",negative-covenants
"NEGATIVE COVENANTS. Borrower will not do any of the following without Bank's prior written consent, which will not be unreasonably withheld:",negative-covenants
"NEGATIVE COVENANTS. Each Loan Party covenants and agrees that, until termination of all of the Commitments and payment in full of the Obligations, Loan Parties will not and will not permit any of their respective Subsidiaries to do any of the following:",negative-covenants
"NEGATIVE COVENANTS. Borrower covenants and agrees that, so long as any credit hereunder shall be available and until full and final payment of the Obligations, Borrower will not do any of the following without Foothill's prior written consent:",negative-covenants
"NEGATIVE COVENANTS. Until the Termination Date, the Borrower covenants and agrees with the Lenders that:",negative-covenants
"NEGATIVE COVENANTS. Each Credit Party covenants and agrees that, so long as any Lender shall have any Commitment hereunder, or any Loan or other Obligation (other than contingent indemnification Obligations to the extent no claim giving rise thereto has been asserted) shall remain unpaid or unsatisfied:",negative-covenants
"NEGATIVE COVENANTS. From the date of this Agreement until the Closing and thereafter, so long as any of the Notes are outstanding, the Company covenants that:",negative-covenants
"NEGATIVE COVENANTS. Until all of the Secured Obligations shall have been Paid in Full, each Loan Party executing this Agreement covenants and agrees, jointly and severally with all of the other Loan Parties, with the Lenders that:",negative-covenants
"NEGATIVE COVENANTS. Holdings and the Borrower hereby jointly and severally agree that, so long as any Loan or other amount is owing to any Lender or the Administrative Agent hereunder, each of Holdings and the Borrower shall not, and shall not permit any of its Subsidiaries to, directly or indirectly:",negative-covenants
"NEGATIVE COVENANTS. So long as any Advance shall remain unpaid or any Bank shall have any Commitment hereunder, no Borrower will, without the written consent of the Majority Banks:",negative-covenants
"NEGATIVE COVENANTS. Each of Holdings and the Borrower hereby agrees that, so long as the Commitments remain in effect, any Letter of Credit remains outstanding (that has not been cash collateralized or backstopped or otherwise supported, in each case on terms reasonably agreed to by the Borrower and the applicable Issuing Lender) or any Loan or other amount is owing to any Lender or any Agent hereunder (other than (i) contingent or indemnification obligations not then due and (ii) obligations in respect of Specified Hedge Agreements or Cash Management Obligations), each of Holdings and the Borrower shall not, and shall not permit any of the Restricted Subsidiaries to:",negative-covenants
"NEGATIVE COVENANTS. Until the Commitments have expired or been terminated and the principal of and interest on each Loan and all fees, expenses and other amounts payable (other than contingent amounts not yet due) under any Loan Document have been paid in full, the Borrower covenants and agrees with the Lenders that:",negative-covenants
"NEGATIVE COVENANTS. During the term of this Agreement, and thereafter for so long as there are any Obligations to Lender, Borrower covenants that, unless Lender has first consented thereto in writing, it will not:",negative-covenants
"NEGATIVE COVENANTS. Until the Commitments have expired or terminated and the principal of and interest on each Loan and all fees payable hereunder have been paid in full and all Letters of Credit have expired or terminated and all LC Disbursements shall have been reimbursed, each of the Borrower (other than with respect to Section 7.18) and the Holding Company (solely with respect to each of the Designated SBG Subsidiaries and Section 7.18) covenants and agrees with the Lenders that:",negative-covenants
"NEGATIVE COVENANTS. So long as any Lender shall have any Commitment hereunder, any Loan or other Obligation hereunder (other than obligations under Treasury Services Agreements or obligations under Secured Hedge Agreements) which is accrued and payable shall remain unpaid or unsatisfied, or any Letter of Credit shall remain outstanding (unless the Outstanding Amount of the L/C Obligations related thereto has been Cash Collateralized or a backstop letter of credit reasonably satisfactory to the applicable L/C Issuer is in place), then from and after the Closing Date:",negative-covenants
"NEGATIVE COVENANTS. As long as any Commitments or Obligations are outstanding, each Obligor shall not, and shall cause each Subsidiary not to:",negative-covenants
"NEGATIVE COVENANTS. Each of the Credit Parties hereby covenants and agrees that on the Closing Date, and thereafter (a) for so long as this Agreement is in effect, (b) until the Commitments have terminated, (c) the Credit Party Obligations and all other amounts owing to the Administrative Agent or any Lender hereunder are paid in full in cash, that:",negative-covenants
"NEGATIVE COVENANTS. The Borrower hereby covenants and agrees that, so long as any of the Commitments remain in effect or any Loan or LC Obligation remains outstanding and unpaid or any other amount is owing to any Lender or the Administrative Agent hereunder:",negative-covenants
