clause_text,clause_type
"Non-Competition. Heater acknowledges that he has gained, and will gain extensive knowledge in the business conducted by the Company and has had, and will have, extensive contacts with customers of the Company. Accordingly, Heater agrees that he shall not compete directly or indirectly with the Company, either during the Employment Term or during the one (1) year period immediately after the termination of Heater's employment under Section 12 and shall not, during such period, make public statements in derogation of the Company. For the purposes of this Section 11, competing directly or indirectly with the Company shall mean engaging, directly or indirectly, as principal owner, officer, partner, consultant, advisor, or otherwise, either alone or in association with others, in the operation of any entity engaged in a business similar to that of the Company's.",non-competition
"Non-Competition. For a period of two (2) years from and after the Closing Date, the Stockholders will not (i) engage directly or indirectly in any business that the Company conducts as of the Closing Date in the United States; (except that ownership of less than 2% of the outstanding stock of any competing publicly traded corporation shall not constitute a violation of this covenant not to compete) or (ii) solicit, directly or indirectly, any customers, clients, accounts, officers, employees, agents or representatives of the Company, Newco or the Parent. If the final judgment of a court of competent jurisdiction declares that any term or provision of this Section is invalid or unenforceable, the parties hereto agree that the court making the determination of invalidity or unenforceability shall have the power to reduce the scope, duration, or area of the term or provision, to delete specific words or phrases, or to replace any invalid or unenforceable term or provision with a term or provision that is valid and enforceable and that comes closest to expressing the intention of the invalid or unenforceable term or provision, and this Agreement shall be enforceable as so modified after the expiration of the time within which the judgment may be appealed.",non-competition
"Non-Competition. The Executive hereby agrees that he shall not (without the consent in writing of the Board) for a period of 6 months immediately following the Termination Date within either the UK or the Prohibited Area and whether on his own account or in conjunction with or on behalf of any other person, firm, company or other organisation, and whether as an employee, director, principal, agent, consultant or in any other capacity in competition with the Company be directly or indirectly (i) employed or engaged in, or (ii) perform services in respect of, or (iii) be otherwise concerned with:",non-competition
"Non-Competition. Except as set forth in this agreement, during the Employment Agreement Term the Executive will not, without the prior written approval of the Board, (a) become employed by, or become an officer, director, or general partner of, any partnership, corporation or other entity in the media or entertainment sectors (each a “Prohibited Business”) or (b) directly or indirectly, purchase, invest or otherwise participate in any significant manner, in investments, businesses or commercial operations in a Prohibited Business, unless such purchase, investment or participation is conducted by and through Employer or its subsidiaries. Nothing in this Section 14 shall prohibit the Executive from continuing to fulfill his obligations as an officer, director or partner of companies or entities identified in Section 4.",non-competition
"Non-Competition. As a material inducement for Company’s promise to provide the trade secrets and proprietary and confidential information described in Section 2.2, Executive agrees that during the term of his or her employment with Company and during the applicable Severance Period specified in Section 5.14, he or she will not, directly or indirectly, as an employee, consultant or otherwise, compete with Company by providing services relating to retail or non-retail sales of jewelry to any other person, partnership, association, corporation, or other entity that is in a “Competing Business.” As used herein, a “Competing Business” is any business that, in whole or in material part, in the United States, Canada and/or Puerto Rico, (a) engages in the retail sale of jewelry, including, but not limited to, specialty jewelry retailers and other retailers having jewelry divisions or departments, or (b) operates as a vendor of jewelry, including, but not limited to, as a wholesaler, manufacturer or direct importer of jewelry. The restrictions contained in this Section 2.3 will be tolled on a day-for-day basis for each day during which Executive participates in any activity in violation of such restrictions. The parties agree that, subject to the terms of Section 2.1, the above restrictions on competition are completely severable and independent agreements supported by good and valuable consideration and, as such, will survive the termination of this Agreement for whatever reason. The parties further agree that any invalidity or unenforceability of any one or more of such restrictions on competition will not render invalid or unenforceable any remaining restrictions on competition. Additionally, should an arbitrator or a court of competent jurisdiction determine that the scope of any provision of this Section 2.3 is too broad to be enforced as written, the parties intend that the arbitrator or court reform the provision to such narrower scope as it determines to be reasonable and enforceable.",non-competition
"Non-Competition. In order to protect the Confidential Information, Executive agrees that during the term of Executive's employment, and for a period of one year thereafter if Executive employment is terminated by the Company with Cause or by Executive without Good Reason, Executive shall not, directly or indirectly, whether as an owner, partner, shareholder, agent, employee, creditor or otherwise, promote, participate or engage in any activity or other business competitive with the Company's business or the business of any present Affiliate of the Company in Orange or Los Angeles Counties if such activity or other business involves any use by Executive of any of the Confidential Information. The Company shall notify Executive of any perceived violation of this Section 9, and Executive shall have 30 days to cure such violation.",non-competition
"Non-Competition. (a) For a period of five years after the Closing Date, the Seller and its successors and assigns shall not, either directly or indirectly as a stockholder, investor, partner, consultant or otherwise, (i) design, develop, manufacture, market, sell or license any product or provide any service anywhere in the world which is competitive with any product designed, developed (or under development), manufactured, sold or licensed or any service provided by the Seller within the three-year period prior to the Closing Date or (ii) engage anywhere in the world in any business competitive with the business of the Seller as conducted as of the Closing Date or during the three-year period prior to the Closing Date. The Seller shall enforce, for the benefit of the Buyer, all non-competition and similar agreements between the Seller and any other party which are not Assigned Contracts.",non-competition
"Non-Competition. During any period in which or for which Employee receives compensation pursuant to this Agreement, including any period represented by payments under Section 4(a) hereof, Employee will not directly or indirectly, either as a principal, agent, employer, stockholder, co-partner or in any other individual or representative capacity whatsoever, engage in the banking and financial services business, which includes consumer, savings, commercial banking and the insurance and trust businesses, or the savings and loan or mortgage banking business, or any other business in which Employer or its Affiliates are engaged, anywhere in any county in which Employer or its Affiliates have an office, and in any county contiguous to any county in which Employer or its Affiliates have an office, nor will Employee solicit, or assist any other person in soliciting, any depositors or customers of Employer or its Affiliates or induce any then or former employee of Employer or its Affiliates to terminate their employment with Employer or its Affiliates. The term Affiliate as used in this Agreement means a Person that directly or indirectly through one or more intermediaries, controls, or is controlled by, or is under common control with, another Person. The term Person as used in this Agreement means any person, partnership, corporation, group or other entity.",non-competition
"Non-Competition. I acknowledge and agree that the Company’s business competes upon a worldwide basis, and that the degree of competition in that business is high. I recognize that the Company may assign me to duties in a geographic area or specific market. I agree that, unless I first obtain the Company’s written consent, I will not during my employment with the Company and for a period of two (2) years following the termination of my employment (provided, however, that if I am employed by the Company for less than two (2) years, the post-employment period to which this section applies shall be the greater of six (6) months or the length of my employment in any capacity), directly or indirectly or through others, individually, or as a member, officer, director, employee, agent, or investor of any partnership or entity (except ownership of not more than one percent (1%) of the outstanding publicly traded stock of any company):",non-competition
"Non-Competition. Executive further agrees with the Company to the following provisions, all of which Executive acknowledges and agrees are necessary to protect the Company’s legitimate business interests. Executive covenants and agrees with the Company that:",non-competition
"Non-Competition. Simultaneously with his execution of this Agreement, Employee shall execute a Covenant Not to Compete Agreement with the Company, as set forth on Exhibit ""C"" which is attached hereto, incorporated herein and made a part hereof.",non-competition
"Non-Competition. In the event Executive's employment is terminated by the Company for Cause or Executive terminates his employment with the Company without Good Reason, Executive shall not, for a period ending on the earlier of (i) 18 months from the date of such termination or (ii) the Expiration Date, accept any other employment or engage, directly or indirectly, in any other business activity which is competitive with that of the Company or any subsidiary thereof.",non-competition
"Non-Competition. During the period of Executive's employment with the Company and, following any termination thereof, the period ending on the later of (a) six months after the Date of Termination and (b) the last day of the Severance Period (such periods, collectively, the ""Restriction Period""), Executive shall not, directly or indirectly, become employed by, engage in business with, serve as an agent or consultant to, or become a partner, member, principal, stockholder or other owner (other than a holder of less than 1% of the outstanding voting shares of any publicly held company) of, any Person that competes or has a reasonable potential for competing, anywhere in the Restricted Territory, with the Business (as defined below).",non-competition
"Non-Competition. The Restricted Shareholder covenants and agrees that, during the term of Restricted Shareholder’s employment with the Company and for twelve (12) months after the termination thereof, regardless of the reason for the employment termination, the Restricted Shareholder will not, directly or indirectly, anywhere in the Territory, on behalf of any Competitive Business perform the same or substantially the same Job Duties.",non-competition
"Non-Competition. Employee agrees that during the Term hereof and, in the case of a Termination For Cause, for a period of two (2) years thereafter, Employee will not, directly, indirectly, or as an agent on behalf of or in conjunction with any person, firm, partnership, corporation or other entity, own, manage, control, join, or participate in the ownership, management, operation, or control of, or be financially interested in or advise, lend money to, or be employed by or provide consulting services to (i) any person or entity seeking to provide the services or products which the Company provided or planned on providing as of the date of termination, or (ii) any person or entity to whom Employee provided services in any capacity on behalf of the Company, or (iii) any person or entity to whom Employee was introduced or about whom Employee received information through the Company and which person or entity is located within the United States of America; provided, however, that the foregoing restriction regarding financial interest shall not apply to ownership of less than 5% of the common equity of any entity whose common equity is registered under the Securities Exchange Act of 1934, as amended.",non-competition
"Non-Competition. Each of the Members hereby acknowledges that the Company and MLP operate in a competitive business and compete with other Persons operating in the midstream segment of the oil and gas industry for acquisition opportunities. Each of the Members agrees that during the period that it is a Member, it shall not, directly or indirectly, use any of the confidential information it receives as a Member or which its designee receives as a Director of the Company to compete, or to engage in or become interested financially in as a principal, employee, partner, shareholder, agent, manager, owner, advisor, lender, guarantor of any Person that competes in North America with the business conducted by the Company, Plains AAP, PAA GP and the MLP. Each of the Members also acknowledge that EnCap Investments L.L.C. and Persons that it controls (“EnCap”), Kayne Anderson Capital Advisors L.P. and its Affiliates (“Kayne Anderson”) and Wachovia and its affiliates may make and manage investments in the energy industry in the ordinary course of business (such investments “Institutional Investments”). The Members agree that EnCap, Kayne Anderson and Wachovia and its affiliates may make Institutional Investments, even if such Institutional Investments are competitive with the Company’s and its Subsidiaries’ business, so long as such Institutional Investments are not in violation of the provisions of Section 12.6 or the second sentence of this Section 13.1 or obligations owed to the Company under applicable law with respect to usurpation of an opportunity legally belonging to the Company or its Subsidiaries. Each of the Members confirms that the restrictions in this Section 13.1 are reasonable and valid and all defenses to the strict enforcement thereof are hereby waived by each of the Members. The restrictions contained in this Section 13.1 shall in no way impair the rights granted (i) to James C. Flores pursuant to the Flores Employment Agreement or (ii) to John T. Raymond pursuant to any employment agreement between Raymond and Plains Resources, Inc.",non-competition
"Non-Competition. Not render to others, during his or her employment with Silverleaf, service of any kind for compensation or promote, participate or engage in any other business activity which would conflict or interfere with the performance of his or her duties or loyalty under this Agreement, including, but not limited to, participating in the promotion or sale of products or services for a competitor of Silverleaf or otherwise engage in business with such competitor;",non-competition
"Non-Competition. During the Term hereof and for a period of two (2) years thereafter, Executive shall not, except with Company's express prior written consent, directly or indirectly, in any capacity, for the benefit of any Person:",non-competition
Non-Competition. (a) Executive acknowledges and recognizes the highly competitive nature of the businesses of the Company and its affiliates and accordingly agrees that during the Employment Term and for a period of one year after the termination thereof;,non-competition
"Non-Competition. Executive agrees that during the Employment Period and for a period of twelve (12) months after the Termination Date, regardless of the reason for such termination, Executive shall not, directly or indirectly, for Executive’s own benefit or for the benefit of others, render services for a Competing Organization in connection with Competing Products or Services anywhere within the Restricted Territory. These prohibitions apply regardless of where such services physically are rendered. For purposes of this Agreement, “Competing Products or Services” means products, processes, or services of any person or organization other than Allscripts, in existence or under development, which are substantially the same, may be substituted for, or applied to substantially the same end use as any product, process, or service of Allscripts with which Executive works or worked during the time of Executive’s employment with Allscripts or about which Executive acquires or acquired Confidential Information through Executive’s work with Allscripts. For purposes of this Agreement, “Competing Organization” means persons or organizations, including Executive, engaged in, or about to become engaged in research or development, production, distribution, marketing, providing or selling of a Competing Product or Service.",non-competition
"Non-Competition. Executive agrees that for so long as Executive is employed by the Company and for a period of one (1) year thereafter, Executive will not, individually or on behalf of any person, firm, partnership, association, business organization, corporation or other entity engaged in the Business of the Company, engage in or perform, anywhere within the United States, Canada and any other such geography in which the Company operates, which shall constitute the territory, any activities which are competitive with the Business of the Company. Nothing herein shall be construed to prohibit Executive from acquiring shares of capital stock of any public corporation, provided that such investment does not exceed 5% of the stock of such public corporation.",non-competition
"Non-Competition. Grantee acknowledges and agrees that (a) at all times while Grantee is employed with the Company Group, Grantee shall pursue all appropriate business opportunities of the Company Group exclusively through the Company Group and (b) the Company Group would be irreparably damaged if Grantee (or, if applicable, any of Grantee’s controlled Affiliates) were to provide services to any Person (including Grantee) engaged in a Restricted Business (as defined below) and that such competition by Grantee (or, if applicable, any of Grantee’s controlled Affiliates) would result in a significant loss of goodwill by the Company Group. Therefore, Grantee agrees that during the period commencing on the Effective Date and ending on the first (1st) anniversary of the date on which Grantee or any Grantee’s Affiliates cease to be direct or indirect members of EOC Parent or, if earlier, the first (1st) anniversary of the date on which Grantee’s employment or services with the Company Group terminates for any reason, Grantee shall not (and, as applicable, shall cause each of his controlled Affiliates not to) directly or indirectly through another Person own any interest in, manage, control, participate in (whether as an officer, director, manager, employee, partner, equity holder, member, agent, advisor, individual independent contractor, consultant, representative or otherwise), consult with, represent, render services for, or in any other manner engage in the Restricted Business in any geographic area where the Company Group conducts it; provided, that nothing herein shall prohibit Grantee and any of his controlled Affiliates, as applicable from (i) being a passive owner of not more than two percent (2%) of the outstanding stock of any class of a corporation or entity which is publicly traded so long as Grantee (or any of Grantee’s controlled Affiliates, if applicable) does not have any active participation in the management or other business of such corporation or entity or (ii) being employed by or otherwise providing services to any corporation or entity, a division or subsidiary of which is engaged in Restricted Businesses so long as Grantee is",non-competition
"Non-Competition. During the 24-month period that commences on the Termination Date and ends on the second anniversary of the Termination Date, the Executive shall not, without the prior consent of the Company, directly or indirectly own, manage, operate, join, control or participate in the ownership, management, operation or control of, or be employed by or otherwise connected in any substantial manner with any business which directly or indirectly competes to a material extent with any line of business of the Company or its subsidiaries which was operated by the Company or its subsidiaries at the Termination Date; provided that nothing in this paragraph shall prohibit the Executive from acquiring up to 5% of any class of outstanding equity securities of any corporation whose equity securities are regularly traded on a national securities exchange or in the ""over-the-counter market"". The foregoing noncompetition restriction of this Section 11(C) shall not apply following a Change of Control Event if (v) the Executive's employment has been terminated by the Company without Cause within two years following such Change in Control Event, (w) the Executive terminates his employment as the result of a Constructive Termination within two years following such Change in Control Event or (x) the Company elects, within two years following such Change in Control Event, not to extend the term of employment. The foregoing noncompetition restriction of this Section 11(C) shall not apply following a Potential Change in Control if: 1) the Executive's employment is terminated without Cause within two years following such Potential Change in Control, and such termination is at the request or direction of or pursuant to negotiations with a Person who has entered into an agreement with the Company the consummation of which will constitute a Change in Control; 2) the Executive's employment is terminated through a Constructive Discharge without Cause within two years following such Potential Change in Control, and the circumstances or events which constitute the basis for Executive's claim of Constructive Discharge occur at the request or direction of, or pursuant to negotiations with, such Person, 3) the Company elects, within two years following such Potential Change in Control, not to extend the term of employment, and such election was at the request or direction of or pursuant to negotiations with such Person; or 4) the Executive's employment is terminated without Cause within two years fol...",non-competition
"Non-Competition. Employee expressly acknowledges the provisions of Section 8 of the Purchase Agreement relating to Employee's Covenant Not to Compete with Company. Accordingly, such provisions of Section 8 are incorporated herein by reference to the extent as if restated in full herein. In addition to the consideration received under this Agreement, Employee acknowledges that as a shareholder of MICROCARE, he has received substantial consideration pursuant to such Purchase Agreement and that as an inducement for, and in consideration of Company entering into this Agreement, Employee has agreed to be bound by such provisions of Section 8 of the Purchase Agreement. Accordingly, such provisions of Section 8 and Exhibit N-2 and the restrictions on Employee thereby imposed shall apply as stated therein.",non-competition
"Non-Competition. (a) Executive agrees that, for the period commencing on the date hereof and terminating nine months after the date of Executive’s termination of employment with Employer, Executive shall not, and shall cause each of Executive’s affiliates (other than Employer and Intermex LLC) not to, directly or indirectly: (i) engage in or establish any Competitive Business (as defined below), including selling goods or services relating to any Competitive Business that are of the type sold by Employer, (ii) assist any person or entity in any way to engage in or establish, or attempt to engage in or establish, any Competitive Business, (iii) except as provided in Section 5.04(c), be employed by, consult with, advise, permit his or her name to be used by, or be connected in any manner with the ownership, management, operation or control of any person or entity that directly or indirectly engages in any Competitive Business, (iv) engage in any course of conduct that involves any Competitive Business that is substantially detrimental to the business reputation of Employer or (v) engage in or establish any Tier II Business (as defined below) using any sending agent of Employer if either (A) prior to such use of such sending agent, Employer is using such sending agent in the conduct of Employer of the same Tier II Business, or (B) the conduct of Executive or Executive’s affiliates of such Tier II Business, directly or indirectly, restricts or materially impairs the ability of such sending agent to participate with Employer in Employer’s conduct of a Tier II Business.",non-competition
