clause_text,clause_type
"Non-Competition. Except with prior written permission of the Company, you shall not, during your engagement with the Company or any of its affiliates, and, for a period of six (6) months following the termination of your engagement, directly or indirectly (individually or on behalf of other persons): (a) enter the employ of, or render services to, any person, firm or corporation engaged in the insurance or reinsurance business or any other business in which the Company is, or has announced an intention to become, engaged in at any time during your employment or engagement with the Company and in each case within any State in the United States in which Parent or any of its affiliates (including the Company and any subsidiary) does business (hereinafter collectively referred to as the “Business”); (b) engage in such Business on your own account; or (c) become interested in any such Business, directly or indirectly, as an owner, partner, shareholder, member, director, officer, principal, consultant or in any other senior executive or managerial capacity; provided, however, that nothing contained in this Section 7 shall be deemed to prohibit you from acquiring, solely as a passive investment, no more than 5% of the total outstanding securities of any publicly-held corporation.",non-competition
"Non-Competition. (i) In consideration of the Confidential Information provided to Executive and the other benefits provided to him pursuant to this Agreement, Executive agrees that, if his employment ends during the Term, then, during a six- month Non-Compete Period (as defined below), he will not, without the prior written consent of the Company (which shall not be unreasonably withheld), directly or indirectly, either as an individual or as an employee, officer, director, shareholder, partner, equity participant, sole proprietor, independent contractor, consultant or in any other capacity conduct any business, or assist any person in conducting any business, that is directly in competition with the Company’s Business (as defined below) in the Territory (as defined below). The terms of this Section 8(a) shall not apply to the passive ownership by Executive of less than 5% of a class of equity securities of an entity, which securities are publicly traded on any national securities exchange.",non-competition
"Non-Competition. In consideration of the mutual covenants provided for herein and the compensation to be paid to the Seller at the Closing, for a period of five (5) years from the Closing Date, (the “Non-Compete Period”) Seller, except as an employee or consultant to the Company, Buyer and/or any of their Affiliates, shall not engage, directly or indirectly, in the business of designing, manufacturing, marketing, modifying, distributing or selling of refrigeration systems for use in medical, clinical, research and scientific laboratory applications (the “Restricted Business”) worldwide; provided, however, that Seller may acquire or otherwise own less than a five percent (5%) equity interest in a publicly held enterprise engaged in the Restricted Business as long as Seller does not render advice or assistance to such enterprise. In addition, during the Non-Compete Period, Seller shall not, directly or indirectly, persuade or attempt to persuade any employee of the Company to leave the Company’s employ, or to become employed by any Person other than the Company for the purpose of engaging in the Restricted Business; provided that the foregoing shall not restrict the Seller from (i) soliciting employees through general solicitations or (ii) soliciting employees through use of a recruiting firm provided that the Seller did not instruct the recruiting firm to approach employees of the Company. Seller agrees that the provisions of this Section 8.1 are reasonable and necessary for Buyer’s protection and that if any portion thereof shall be held contrary to law or invalid or unenforceable in any respect in any jurisdiction, or as to one or more periods of time, geographic area, areas of business activities, or any part thereof, the remaining provisions shall not be affected but shall remain in full force and effect and that any such invalid or unenforceable provision shall be deemed, without further action on the part of any Person, modified and limited to the extent necessary to render the same valid and enforceable in such jurisdiction. Seller further agrees that the remedies at law in the event of a breach of or a default under this Section 8.1 would be insufficient and that Buyer shall be entitled to the immediate grant of equitable relief including, but not limited to, the remedy of specific performance to enjoin any breach, or the continuation of any breach, of the provisions of this Section 8.1.",non-competition
"Non-Competition. Neither Manager nor any of its Related Parties may offer Sprint PCS Products and Services outside of the Service Area without the prior written approval of Sprint PCS. Within the Service Area, Manager and Manager's Related Parties may offer, market or promote telecommunications products or services only under the following brands:",non-competition
"Non-Competition. Executive acknowledges that his or her services to be rendered hereunder are of a special and unusual character that have a unique value to Company and the conduct of its Business, the loss of which cannot adequately be compensated by damages in an action at law. In view of the unique value to Company of the services of Executive for which Company has contracted hereunder, and because of the confidential information to be obtained by or disclosed to Executive as herein above set forth, and as a material inducement to Company to enter into this Agreement and to pay and make available to Executive the compensation and other benefits referred to herein, Executive covenants and agrees that Executive will not, directly or indirectly, whether as principal, agent, trustee or through the agency of any corporation, partnership, association or agent (other than as the holder of not more than five percent (5%) of the total outstanding stock of any company the securities of which are traded on a regular basis on recognized securities exchanges):",non-competition
"Non-Competition. So long as Executive is employed and thereafter so long as Executive is entitled to and is receiving the benefits to which he is entitled under paragraphs 4 and 5, he may not engage or participate directly or indirectly, either as principal, agent, employee, employer, consultant, stockholder, director, co-partner, or any other individual or representative capacity, in the conduct or management of, or own any stock or other proprietary interest in, any business that competes with the business of the Company or any subsidiary of the Company unless he has obtained prior written consent of the Board, except that Executive shall be free without such consent to make investments in any publicly-owned company so long as he does not become a controlling party in such company.",non-competition
"Non-Competition. Executive agrees that during the Executive’s employment with the Company and for a period of two years thereafter, Executive will not, either for himself or on behalf of any other person or entity, compete with the Business of the Company within the Restricted Territory by performing activities which are the same as or similar to those performed by Executive for the Company or the Company’s subsidiaries.",non-competition
"Non-Competition. (a) Executive acknowledges that, during the Term, Executive has had access to information concerning the Company’s critical business strategies, engineering and technology development plans, competitive analyses, organizational structure. Accordingly, in consideration of the compensation provided under this Agreement, Executive agrees that during the Term and for the one (1) year period thereafter, Executive will not directly or indirectly, own, manage, operate, control (including indirectly through a debt or equity investment), provide services to, or be employed by, any person or entity engaged in any business that is (i) located in or provides services or products to a region in which the Company does business, and (ii) competitive with the business activities of the Company as they existed during the period that Executive provided services to the Company.",non-competition
"Non-Competition. As a condition to, and in consideration of, the Company’s entering into this Agreement, and giving Executive access to certain confidential and proprietary information, which Executive recognizes is valuable to the Company and, therefore, its protection and maintenance constitutes a legitimate interest to be protected by the provisions of this Section 6 as applied to Executive and other employees similarly situated to Executive, and for ten ($10) other good and valuable consideration, the receipt and sufficiency of which Executive hereby acknowledges, Executive acknowledges and hereby agrees as follows:",non-competition
"Non-Competition. The Employee agrees that, during the Term of Employment and any Severance Period (as defined below), and for a period of one (1) year thereafter, he will not engage, directly or indirectly, in any business that competes with the business of the Company. For purposes of this paragraph, a business competes with the business of the Company if it is engaged in the research, development, production, sales or marketing of any diagnostic or therapeutics process or product that is directed at any molecular targets or related to any therapeutic candidate compound that the Company developed, produced or sold, or planned to develop, produce or sell, while the Employee was employed with the Company. The Employee will be deemed to be directly or indirectly engaged in a competitive business if he is engaged in such competitive business as proprietor, partner, joint venturer, stockholder (other than the holder of less than two percent (2%) of the outstanding shares of any publicly owned corporation), director, officer, manager, member, employee, consultant, independent contractor, adviser, marketer, or agent or if he otherwise controls such business.",non-competition
"Non-Competition. Employee recognizes and agrees that there are certain property rights such as trade secrets and products of Employer which are critical to Employer's continued success. Because of their importance to Employer and to Employee and other employees who are dependent on Employer for their livelihood, it is necessary for Employer to take all permissible steps to protect these property rights. This being the case, Employee agrees that during the Employee's employment with Employer and for a continuous period of two (2) years thereafter commencing upon termination of such employment, in the event of any voluntary or involuntary termination or resignation by Employee, Employee shall not, individually or jointly with others, directly or indirectly, manage, operate, control, render services related to Prohibited Activities to, participate in the management or control of, or own or hold any ownership or voting interest in, any person or entity engaged in Prohibited Activities (except for the ownership of up to 5% of the outstanding stock issued by publicly traded companies); and Employee shall not act as an officer, director, employee, partner, independent contractor, consultant, principal, agent, proprietor, or in any other capacity for, nor lend any assistance (financial, managerial, professional or otherwise) or cooperation to, nor perform any services for, any such person or entity or any business that provides consulting services to any person or entity engaged in Prohibited Activities anywhere in the Territory.",non-competition
"Non-Competition. During the Term, without the consent of the Board, and thereafter as specifically provided in Subsection 6.A.(2), 6.B.(4) or 6.C.(2), the Executive may not directly or indirectly engage in, or have any interest in, any business (whether as employee, officer, director, agent, security holder, creditor, consultant, or otherwise) that competes with the vaccine and/or antibody business of the Company or any subsidiary thereof (as such business may exist during the Term).",non-competition
"Non-Competition. You acknowledge that Tyson performs services throughout the United States and that your duties and services impact Tyson’s performance of services throughout the United States. Accordingly, you acknowledge the need for certain restrictions contained in this Agreement to be without limitation as to location or geography within the United States. You agree that during your employment with Tyson, and for a period of 12 months thereafter, you will not directly or indirectly, on behalf of yourself or in conjunction with any other person, company or entity, own (other than less than 5% ownership in a publicly traded company), manage, operate, or participate in the ownership, management, operation, or control of, or be employed by or a consultant to any person, company or entity which is in competition with Tyson, with which you would hold a position with responsibilities similar to any position you held with Tyson during the 24 months preceding your Termination Date or in which you would utilize or disclose confidential methodologies, techniques, customer lists or information of Tyson. You agree that during your employment with Tyson and for a period of 12 months thereafter you will not directly or indirectly, on behalf of you or any other person, company or entity, participate in the planning, research or development of any strategies or methodologies, similar to strategies or methodologies, utilized or developed by Tyson, excluding general industry knowledge, for which you had access to, utilized or developed during the 36 months preceding your Termination Date. You agree that nothing in this Section shall limit your confidentiality obligations in this Agreement. Further, you understand and agree that during your employment and the restricted time periods thereafter designated in this Agreement, while you may gather information to investigate other employment opportunities, you shall not make plans or prepare to compete, solicit or take on activities which are in violation of this Agreement. Should you leave Tyson and accept employment or a consulting position with a competitor, you are required beforehand to inform Tyson of the identity of your new employer and your responsibilities for the new employer. You are also required to show this Agreement to all new employers prior to accepting new employment and Tyson shall also be permitted to show this Agreement to all new employers as well.",non-competition
"Non-Competition. In consideration of this Agreement, and other good and valuable consideration provided hereunder, the receipt and sufficiency of which are hereby acknowledged by Executive, Executive hereby agrees and covenants that, during Executive’s employment hereunder and for a period of twenty-four (24) months thereafter (the “Restricted Period”), Executive shall not, without the prior written consent of the Company, directly or indirectly, engage in or become associated with a Competitive Activity.",non-competition
"Non-Competition. In consideration for the protections provided to the Executive under this Agreement, the Executive agrees that from the Date of Termination until the first anniversary thereof (the “Covenant Period”), the Executive will not, directly or indirectly, own, manage, operate, control or participate in the ownership, management, operation or control of, or be connected as an officer, employee, partner, director or otherwise with, or (other than through the ownership of not more than five percent (5%) of the voting stock of any publicly held corporation) have any financial interest in, or aid or assist anyone else in the conduct of, a business which at the time of such termination competes in the United States with a business conducted by the Company or any group, division or subsidiary of the Company (“Company Group”) as of the Date of Termination. Notwithstanding the foregoing, the Executive’s employment by a business that competes with the business of the Company, or the retention of the Executive as a consultant by any such business shall not violate this Section 9(b) if the Executive’s duties and actions for the business are solely for groups, divisions or subsidiaries that are not engaged in a business that competes with a business conducted by the Company. No business shall be deemed to be a business conducted by the Company unless the Company was engaged in the business as of the Date of Termination and continues to be engaged in the business and at least twenty-five percent (25%) of the Company’s consolidated gross sales and operating revenues, or net income, is derived from, or at least twenty-five percent (25%) of the Company’s consolidated assets are devoted to, such business and no business shall be deemed to compete with a business conducted by the Company unless at least twenty-five percent (25%) of the consolidated gross sales and operating revenues, or net income, of any consolidated group that includes the business, is derived from, or at least twenty-five percent (25%) of the consolidated assets of any such consolidated group are devoted to, such business.",non-competition
"Non-Competition. During the term of my employment agreement with Changyou.com Limited and continuing after the termination of such employment agreement for the longer of (i) one year after the termination of such employment agreement for any reason and (ii) such period of time as Changyou is paying to me any severance benefits (the “Noncompete Period”), I will not, on my own behalf, or as owner, manager, stockholder (other than as stockholder of less than 2% of the outstanding stock of a company that is publicly traded or listed on a stock exchange), consultant, director, officer or employee of or in any other manner connected with any business entity, participate or be involved in any Competitor without the prior written authorization of Changyou. “Competitor” means any business of the type and character of business in which Changyou engages or proposes to engage and may include, without limitation, an individual, company, enterprise, partnership enterprise, government office, committee, social organization or other organization that, in any event, produces, distributes or provides the same or substantially similar kind of product or service as Changyou. On the date of this Employee Non-competition, Non-solicitation, Confidential Information and Work Product Agreement (this “Agreement”), “Competitors” of Changyou include all competitors listed in Changyou’s annual reports on Form 20-F filed from time to time with the U.S. Securities and Exchange Commission.",non-competition
"Non-Competition. Executive acknowledges that as a result of Executive’s position at Sears or any Sears Affiliate, Executive has learned or developed, or will learn or develop, Sears Confidential Information and that use or disclosure of Sears Confidential Information is likely to occur if Executive were to render advice or services to any Sears Competitor.",non-competition
"Non-Competition. For a period of twenty-four (24) months immediately following the Employee’s termination of employment hereunder (the “Non-Competition Period”), the Employee shall not enter into endeavors that are competitive with the business or operations of the Corporation in the beauty industry, and shall not own an interest in, manage, operate, join, control, lend money or render financial or other assistance to or participate in or be connected with, as an officer, employee, director, partner, member, stockholder (except for passive investments of not more than a one percent (1%) interest in the securities of a publicly held corporation regularly traded on a national securities exchange or in an over-the-counter securities market), consultant, independent contractor, or otherwise, any individual, partnership, firm, corporation or other business organization or entity that engages in a business which competes with the Corporation.",non-competition
"Non-Competition. The Executive recognizes and understands that in performing the duties and responsibilities of his employment as outlined in this Agreement, he will occupy a position of high fiduciary trust and confidence, pursuant to which he has developed and will develop and acquire wide experience and knowledge with respect to the businesses carried on by the Corporation and its affiliates and the manner in which such businesses are conducted. It is the expressed intent and agreement of the Executive and of the Corporation that such knowledge and experience shall be used solely and exclusively in the furtherance of the business interests of the Corporation and its affiliates and not in any manner detrimental to them. The Executive therefore agrees that so long as he is employed by the Corporation pursuant to this Agreement he shall not engage in any practice or business in competition with the business of the Corporation or any of its affiliates.",non-competition
"Non-Competition. Notwithstanding the foregoing, all such payments and benefits otherwise due under Section 2(a) shall cease to be paid, and the Bank shall have no further obligation due with respect thereto, in the event Employee engages in any conduct prohibited in this Section 3. In exchange for this Agreement and other valuable consideration, Employee agrees that Employee will not engage in Competition for a period of twelve (12) months after Employee’s employment with the Bank ceases for any reason, regardless of whether any benefits are due under Section 2(a). For purposes hereof, “Competition” means Employee’s performing duties that are the same as or substantially similar to those duties performed by Employee for the Bank during the last twelve (12) months of Employee’s employment, as an officer, a director, an employee, a partner or in any other capacity, within twenty-five (25) miles of the headquarters of the Bank (or any Virginia headquarters of any successor) or any branch office of the Bank (or any successor (as to its Virginia branches only) as they are located as of the date Employee’s employment ceases, if those duties are performed for a bank of other financial institution that provides products or services that are the same as or substantially similar to, and competitive with, any of the products or services provided by the Bank at the time Employee’s employment ceases.",non-competition
"Non-Competition. Perisano agrees that he will not (a) during the period he is employed by the Company engage in, or otherwise directly or indirectly be employed by, or act as a consultant or lender to, or be a director, officer, employee, owner or partner of, any other business or organization that is or shall then be competing with the Company, and (b) for a period of one year after he ceases to be employed by the Company, directly or indirectly compete with or be engaged in the same business as the Company, or be employed by, or act as consultant or lender to, or be a director, officer, employee, owner or partner of, any business or organization which, at the time of such cessation, competes with or is engaged in the same business as the Company, except that in each case the provisions of this Section 7 will not be deemed breached merely because Perisano owns not more than five percent (5.0%) of the outstanding common stock of a corporation, if, at the time of its acquisition by Perisano, such stock is listed on a national securities exchange, is reported on NASDAQ, or is regularly traded in the over-the-counter market by a member of a national securities exchange. Nothing in this Section 7 shall preclude Perisano from continuing in his role as a director and consultant to The Big Party Corporation or being a stockholder of The Big Party Corporation, provided, however, that it is agreed and understood that Perisano may not be employed by The Big Party Corporation in the event it acquires a presence on the World Wide Web that competes with or is engaged in the same business as the Company.",non-competition
"Non-Competition. You covenant and agree that during your employment with the Company or any of its Affiliates and for the twelve (12) months following termination of employment for any reason, you will not, in any geographic market in which you worked on behalf of the Company or any of its Affiliates, or for which you had any sales, marketing, operational, logistical or other management or oversight responsibility, engage in or carry on, directly or indirectly, as an owner, employee, agent, associate, consultant, partner or in any other capacity, a business competitive with the Business of the Company.",non-competition
"Non-Competition. Participant agrees that, during the Restricted Period, he/she will not, without prior written consent of the Company, directly or indirectly (i) carry on or engage in Competitive Services within the Restricted Territory on his/her own or on behalf of any Person or any Principal or Representative of any Person, or (ii) own, manage, operate, join, control or participate in the ownership, management, operation or control, of any business, whether in corporate, proprietorship or partnership form or otherwise where such business is engaged in the provision of Competitive Services within the Restricted Territory.",non-competition
