clause_text,clause_type
"Officer’s Certificate. At Closing Time, there shall not have been, since the date hereof or since the respective dates as of which information is given in the Prospectus or the Disclosure Package, any material adverse change in the condition, financial or otherwise, or in the earnings, business affairs or business prospects of the Company and its consolidated subsidiary, considered as one enterprise, whether or not arising in the ordinary course of business, from that set forth in the Prospectus and the Disclosure Package (a “Material Adverse Change”), and the Representatives shall have received a certificate of the President or a Vice President of the Company and of the chief financial officer, chief accounting officer or treasurer of the Company, dated as of Closing Time, to the effect that (i) there has been no such Material Adverse Change, (ii) the representations and warranties in Section 1(a) hereof are true and correct in all material respects, with the same force and effect as though expressly made at and as of Closing Time, (iii) the Company has complied with all agreements and satisfied all conditions on its part to be performed or satisfied at or prior to Closing Time, and (iv) no stop order suspending the effectiveness of the Registration Statement has been issued and no proceedings for that purpose or pursuant to Section 8A of the 1933 Act against the Company or related to the offering have been instituted or are pending or are, to the knowledge of such officers, contemplated by the Commission.",officers-certificate
Officer’s Certificate. Purchaser shall have received a certificate signed by the chief executive officer and the chief financial or principal accounting officer of the Company to the effect that the conditions set forth in Sections 6.2(a) and (b) have been satisfied.,officers-certificate
"Officer’s Certificate. At the Closing Time, there shall not have been, since the date hereof or since the respective dates as of which information is given in the Registration Statement, the General Disclosure Package or the Prospectus, any material adverse change in the condition, financial or otherwise, or in the earnings, business affairs or business prospects of the Company and its subsidiaries, considered as one enterprise, whether or not arising in the ordinary course of business, and the Representative shall have received a certificate of the Chief Executive Officer and the Chief Financial Officer of the Company, dated the Closing Time, to the effect set forth in Exhibit B-1 hereto.",officers-certificate
"Officer’s Certificate. Signet shall be furnished with a certificate dated the Closing date and signed by a duly authorized officer of SIG to the effect that: (a) the representations and warranties of SIG set forth in the Agreement and in all Exhibits, Schedules and other documents furnished in connection herewith are in all material respects true and correct as if made on the Effective Date; and (b) SIG had performed all covenants, satisfied all conditions, and complied with all other terms and provisions of the Agreement to be performed, satisfied or complied with by it as of the Effective Date.",officers-certificate
"Officer’s Certificate. Acquiror shall have delivered to the Company a certificate signed by an officer of Acquiror, dated the Closing Date, certifying that, to the knowledge and belief of such officer, the conditions specified in Section 9.03(a) and Section 9.03(b) have been fulfilled.",officers-certificate
"Officer’s Certificate. The Company will have received a certificate, signed by an officer of Parent, certifying as to the matters set forth in Section 6.03(a) and Section 6.03(b).",officers-certificate
"Officer’s Certificate. (“HWI”) shall have been furnished with a certificate dated the Closing Date and signed by a duly authorized executive officer of IVTW to the effect that no litigation, proceeding, investigation, or inquiry is pending or, to the best knowledge of IVTW threatened, which might result in an action to enjoin or prevent the consummation of the transactions contemplated by this Agreement.",officers-certificate
"Officer’s Certificate. The Company shall have delivered to Parent a certificate, dated the date of the Closing, signed by an officer of the Company and certifying as to the satisfaction of the conditions specified in Sections 7.02(a) and 7.02(b).",officers-certificate
"Officer’s Certificate. On the date of delivery of each Put Notice, the Investor shall have received the Closing Certificate executed by an executive officer of the Company and to the effect that all the conditions to such Closing shall have been satisfied as of the date of each such certificate.",officers-certificate
"Officer’s Certificate. The Representative shall have received on and as of the Closing Date a certificate of an executive officer of each Issuer and of each Guarantor, in such officer’s capacity as such and not in his or her individual capacity, who has specific knowledge of the Issuers’ or such Guarantor’s financial matters and is reasonably satisfactory to the Representative (i) confirming that such officer has carefully reviewed the Registration Statement, the Time of Sale Information and the Prospectus and, to the knowledge of such officer, the representations set forth in Sections 4(b) and 4(d) hereof are true and correct, (ii) confirming that the other representations and warranties of the Issuers and the Guarantors in this Agreement are true and correct and that the Issuers and the Guarantors have complied in all material respects with all agreements and satisfied all conditions on their part to be performed or satisfied hereunder at or prior to the Closing Date and (iii) to the effect set forth in paragraphs (c) and (d) above.",officers-certificate
"Officer’s Certificate. For the period from and after the date of this Agreement and prior to the Closing Date, or since the respective dates as of which information is given in the Disclosure Package or the Prospectus, there shall not have been any material adverse change in the condition, financial or otherwise, or in the earnings, business affairs or business prospects of the Company and its subsidiaries considered as one enterprise, whether or not arising in the ordinary course of business, and the Representatives shall have received a certificate of the President or a Vice President of the Company and of the chief financial officer or chief accounting officer of the Company, dated as of the Closing Date, to the effect that (i) there has been no such material adverse change, (ii) the representations and warranties in Section 1(a) are true and correct with the same force and effect as though expressly made at and as of the Closing Date, (iii) the Company has complied with all agreements and satisfied all conditions on its part to be performed or satisfied at or prior to the Closing Date, and (iv) no stop order suspending the effectiveness of the Registration Statement has been issued and no proceedings for that purpose have been instituted, are pending or, to the best of such officer’s knowledge, are threatened by the Commission.",officers-certificate
"Officer’s Certificate. Parent will have received a certificate, signed by the chief executive officer or chief financial officer of the Company, certifying as to the matters set forth in Section 6.02(a), Section 6.02(b) and Section 6.02(c) hereof.",officers-certificate
"Officer’s Certificate. On the applicable Closing Date, the Underwriters shall have received a certificate signed by an officer of the Company, dated the Closing Date, to the effect that (i) the representations and warranties of the Company contained in Section 1 hereof are true and correct (or, with respect to the representations and warranties contained in Section 1 that are not qualified as to materiality, true and correct in all material respects) with the same force and effect as though expressly made at and as of the date of such certificate and (ii) the Company has complied with all agreements and satisfied all conditions required by this Agreement or the Indenture on its part to be performed or satisfied at or prior to the date of such certificate.",officers-certificate
"Officer’s Certificate. At Closing Time, there shall not have been, since the date hereof or since the respective dates as of which information is given in the Prospectuses, any material adverse change in the condition, financial or otherwise, or in the earnings, business affairs or business prospects of the Company, CHS and their subsidiaries considered as one enterprise, whether or not arising in the ordinary course of business, and the Lead Managers shall have received a certificate of the President and Chief Executive Officer and the Executive Vice President and Chief Financial Officer of the Company, dated as of Closing Time, to the effect that (i) there has been no such material adverse change, (ii) the representations and warranties in Section 1(a) hereof are true and correct with the same force and effect as though expressly made at and as of Closing Time, (iii) the Company and CHS have complied with all agreements and satisfied all conditions on their part to be performed or satisfied at or prior to Closing Time, and (iv) no stop order suspending the effectiveness of the Registration Statement has been issued and, to such person's knowledge after due inquiry, no proceedings for that purpose have been instituted or are pending or are contemplated by the Commission.",officers-certificate
"Officer’s Certificate. The Administrative Agent shall have received a certificate, dated the Effective Date and signed by an authorized signatory of the Borrower, certifying (i) compliance with the conditions precedent set forth in this Section 4.01 and Section 4.03(b) and (c), (ii) that no Default has occurred and is continuing and (iii) that each of the representations and warranties made by any Loan Party set forth in ARTICLE III hereof or in any other Loan Document were true and correct in all material respects on and as of the Effective Date, except to the extent such representations and warranties expressly related to an earlier date, in which case such representation and warranty shall have been true and correct in all material respects as of such earlier date.",officers-certificate
"Officer’s Certificate. The Purchasers shall have received certificates, dated the Closing Date, of an executive officer of the Company and the Guarantors and a principal financial or accounting officer of the Company and the Guarantors in which such officers shall state that the representations and warranties of the Company and the Guarantors in this Agreement are true and correct, that the Company and the Guarantors have complied with all agreements and satisfied all conditions on their part to be performed or satisfied hereunder at or prior to the Closing Date, and that, subsequent to the respective dates of the most recent financial statements in the General Disclosure Package, there has been no material adverse change, nor any development or event involving a prospective material adverse change, in the condition (financial or otherwise), results of operations, business, properties or prospects of the Company, the Guarantors and their respective Subsidiaries taken as a whole except as set forth in the General Disclosure Package or as described in such certificate.",officers-certificate
"Officer’s Certificate. At Closing Time, there shall not have been, since the date hereof or since the respective dates as of which information is given in the Prospectuses, any material adverse change in the condition, financial or otherwise, or in the earnings, business affairs or business prospects of the Company and its subsidiaries considered as one enterprise, whether or not arising in the ordinary course of business, and the Lead Managers shall have received a certificate of the Chief Executive Officer, the Chief Financial Officer or an Executive Officer of the Company and of the chief financial (unless he is already certifying) or chief accounting officer of the Company, on behalf of the Company dated as of Closing Time, to the effect that (i) there has been no such material adverse change, (ii) the representations and warranties in Section 1(a) hereof are true and correct with the same force and effect as though expressly made at and as of Closing Time, (iii) the Company has complied with all agreements and satisfied all conditions on its part to be performed or satisfied at or prior to Closing Time, and (iv) no stop order suspending the effectiveness of the Registration Statement has been issued to the knowledge of the Company and no proceedings for that purpose have been instituted or are pending or are contemplated by the Commission.",officers-certificate
"Officer’s Certificate. A certificate of the Secretary or an Assistant Secretary of TBC or the Subsidiary Borrower which certifies the names of the officers of the Subsidiary Borrower authorized to sign the Notes and the other documents to be delivered hereunder, together with true specimen signatures of such officers and facsimile signatures of officers authorized to sign by facsimile signature (on which certificate each Lender may conclusively rely until it receives a further certificate of the Secretary or an Assistant Secretary of TBC or the Subsidiary Borrower canceling or amending the prior certificate and submitting signatures of the officers named in such further certificate);",officers-certificate
"Officer’s Certificate. ONB shall have delivered to LSB a certificate signed by its Chairman or President and its Secretary, dated as of the Effective Time, certifying that: (i) the representations and warranties of ONB contained in Article IV are true, accurate and correct in all respects on and as of the Effective Time, subject to the standard specified in Section 7.02(a) above; (ii) all the covenants of ONB have been complied with in all material respects from the date of this Agreement through and as of the Effective Time; and (iii) ONB has satisfied and fully complied with all conditions necessary to make this Agreement effective as to it.",officers-certificate
"Officer’s Certificate. A certificate, dated the Effective Date and signed by a Financial Officer of the Borrower, confirming compliance with the conditions set forth in Sections 4.02(a), (b), (c) and (d).",officers-certificate
"Officer’s Certificate. Each offer to prepay the Notes pursuant to this Section 8.3 shall be accompanied by a certificate, executed by a Senior Financial Officer of the Company and dated the date of such offer, specifying:",officers-certificate
Officer’s Certificate. Any certificate signed by an officer of the Company or any of its subsidiaries and delivered to the Underwriters or to counsel for the Underwriters in connection with the offering of the Securities shall be deemed a representation and warranty by the Company to each Underwriter as to the matters covered thereby on the date of such certificate.,officers-certificate
Officer’s Certificate. The Company shall have furnished Parent with a certificate dated the Closing Date signed on its behalf by an executive officer to the effect that the conditions set forth in Section 7.2(a) and Section 7.2(b) have been satisfied.,officers-certificate
"Officer’s Certificate. On each Closing Date, the Company shall have delivered to the Purchasers a certificate signed by an executive officer on behalf of the Company, dated as of each Closing Date, confirming the accuracy of the Company's representations, warranties and covenants as of such Closing Date and confirming the compliance by the Company with the conditions precedent set forth in paragraphs (b)-(e) and (l) of this Section 4.2 as of each Closing Date (provided that, with respect to the matters in paragraphs (d) and (e) of this Section 4.2, such confirmation shall be based on the knowledge of the executive officer after due inquiry).",officers-certificate
"Officer’s Certificate. At the Closing Time, the Representatives shall have received a certificate of an Executive Vice President, a Senior Vice President or a Vice President of the Company and of the chief financial officer or chief accounting officer of the Company, dated as of the Closing Time, to the effect that (i) the representations and warranties in Section 1 are true and correct with the same force and effect as though expressly made at and as of the Closing Time, (ii) the Company has complied with all agreements and satisfied all conditions on its part to be performed or satisfied in this Underwriting Agreement at or prior to the Closing Time, and (iii) no stop order suspending the effectiveness of the Registration Statement has been issued and no proceedings for that purpose have been instituted, are pending or, to the best of such officer’s knowledge, are threatened by the Commission.",officers-certificate
"Officer’s Certificate. The Administrative Agent shall have received a certificate, dated the Closing Date and signed by a Financial Officer of Borrower, confirming compliance with the conditions precedent set forth in paragraphs (b), (c) and (d) of Section 4.01.",officers-certificate
"Officer’s Certificate. At the Closing Time, there shall not have been, since the date hereof or since the respective dates as of which information is given in the Time of Sale Prospectus, any material adverse change in the condition, financial or otherwise, or in the results of operations, general business affairs or business prospects of the Group, and the Representatives shall have received certificates of an executive of the Company, dated as of the Closing Time, to the effect that (i) there has been no such material adverse change, (ii) the representations and warranties in Section 1 hereof were true and correct when made and are true and correct with the same force and effect as though expressly made at and as of the Closing Time, (iii) the Company shall have complied in all material respects with all agreements and satisfied all conditions on its part to be performed or satisfied at or prior to the Closing Time, and (iv) no stop order suspending the effectiveness of the Registration Statement has been issued and, to such officer’s knowledge, no proceedings for that purpose have been instituted or are pending or are contemplated by the Commission.",officers-certificate
"Officer’s Certificate. The Stockholders shall have been furnished with a certificate signed by the president of ISI, in his capacity as President and personally, attached hereto as Exhibit G attached hereto and incorporated herein by reference, dated as of the Closing, certifying (1) that all representations and warranties of ISI contained herein are true and correct; and (2) that since the date of the financial statements (Exhibit B hereto) there has been no material adverse change in the financial condition, business or properties of ISI taken as a whole.",officers-certificate
"Officer’s Certificate. Together with each delivery of any financial statement (i) pursuant to clauses (i) or (ii) of Section 6.01(a), an Officer’s Certificate of the Company, substantially in the form of Exhibit F attached hereto and made a part hereof, stating that as of the date of such Officer’s Certificate no Default or Event of Default exists, or if any Default or Event of Default exists, stating the nature and status thereof and (ii) pursuant to clauses (a) and (b) of this Section 6.01, a Compliance Certificate signed by a Responsible Officer, which demonstrates compliance with the tests contained in Section 7.18, and which calculates the Applicable Rate.",officers-certificate
"Officer’s Certificate. On each anniversary of the date of this Agreement, the Borrower shall deliver an Officer’s Certificate, in form and substance acceptable to the Administrative Agent, providing (i) a certification, based upon a review and summary of UCC search results, that there is no other interest in the Collateral Portfolio perfected by filing of a UCC financing statement other than in favor of the Collateral Agent and (ii) a certification, based upon a review and summary of tax and judgment lien searches satisfactory to the Administrative Agent, that there is no other interest in the Collateral Portfolio based on any tax or judgment lien.",officers-certificate
"Officer’s Certificate. There shall have been delivered to Parent on the Closing Date a certificate executed by the Chief Executive Officer and the Chief Financial Officer of Company certifying, to the best of their knowledge, compliance with all of the provisions of Sections 11.1 and 11.2.",officers-certificate
"Officer’s Certificate. The Company shall have received a certificate, dated as of the Closing Date, executed on behalf of Acquiror by a duly authorized officer of Acquiror, to the effect that the conditions set forth in Section 6.2(a) and Section 6.2(b) have been satisfied.",officers-certificate
"Officer’s Certificate. The Representatives shall have received on and as of the Closing Date or the Additional Closing Date, as the case may be, a certificate in form and substance reasonably satisfactory to the Representatives of an authorized officer of the Company (i) confirming that such officer has carefully reviewed the Registration Statement, the Pricing Disclosure Package and the Prospectus and, to the knowledge of such officer, the representations set forth in Sections 3(b) and 3(d) hereof are true and correct, (ii) confirming that the other representations and warranties of the Company in this Agreement are true and correct and that the Company has complied with all agreements and satisfied all conditions on its part to be performed or satisfied hereunder at or prior to the Closing Date or the Additional Closing Date, as the case may be, and (iii) to the effect set forth in paragraphs (a), (c) and (d) above.",officers-certificate
"Officer’s Certificate. At the Closing Time, there shall not have been, since the respective dates as of which information is given in the Disclosure Package and the Prospectus, any material adverse change in the business, property, financial condition or results of operations of the Company and its consolidated subsidiaries taken as a whole; and you shall have received a certificate of the President or any Vice President of the Company and of each Significant Guarantor, dated as of the date of the Closing Time, to the effect (i) in the case of the certificate to be provided by the President or a Vice President of the Company, that there has been no such material adverse change, (ii) that the other representations and warranties of the Company or such Significant Guarantor contained in Section 1 hereof are true and correct with the same force and effect as though expressly made at and as of the Closing Time, except to the extent that such representations and warranties expressly relate to an earlier date or later date (in which case such representations and warranties are true and correct on and as of such earlier date or will be true and correct on and as of such later date, as the case may be), (iii) that the Company or such Significant Guarantor, as the case may be, has complied in all material respects with all agreements and satisfied all conditions on their respective parts to be performed or satisfied at or prior to the Closing Time and (iv) no order suspending the effectiveness of the Registration Statement has been issued and no proceedings for that purpose have been instituted or threatened by the Commission. The officer signing and delivering each such certificate may rely upon the best of his or her knowledge as to the proceedings threatened.",officers-certificate
"Officer’s Certificate. Buyer shall have received a certificate dated as of the Closing Date, executed by a duly authorized officer of Seller, to the effect that the conditions set forth in subsection (a) of this Section 9.2 have been satisfied.",officers-certificate
"Officer’s Certificate. The Indenture Trustee shall receive at least seven Business Days' notice when requested by the Issuer to take any action pursuant to Section 8.05(a) hereof, accompanied by copies of any instruments to be executed, and the Indenture Trustee shall also require, as a condition to such action, an Officer's Certificate, in form and substance satisfactory to the Indenture Trustee, stating the legal effect of any such action, outlining the steps required to complete the same, and concluding that all conditions precedent to the taking of such action have been complied with.",officers-certificate
"Officer’s Certificate. On the Closing Date the Underwriters shall have received a written certificate executed by one of the Chief Financial Officer, Treasurer or Chief Accounting Officer of the Company or the Guarantor, in his capacity as such officer only, dated as of the Closing Date, to the effect set forth in Section 5(c)(ii) hereof, and further to the effect that:",officers-certificate
Officer’s Certificate. The Backstop Parties shall have received on and as of the Effective Date a certificate of the chief executive officer or chief financial officer of the Company confirming that the conditions set forth in Sections 6.1.10 and 6.1.11 and have been satisfied.,officers-certificate
