clause_text,clause_type
"Officer’s Certificate. Together with each delivery of financial statements required by Section 10.1 (a), (b) and (c), a certificate of each Borrower's President or Financial Officer (a) stating that, based on an examination sufficient to enable him to make an informed statement, no Default or Event of Default exists or, if such is not the case, specifying such Default or Event of Default and its nature, when it occurred, whether it is continuing and the steps being taken by each Borrower with respect to such Default or Event of Default, and (b) setting forth the calculations necessary to establish whether or not each Borrower was in compliance with the covenants contained in Sections 11.1, 11.2, 11.5, 11.6, 11.10 and 11.12 as of the date of such statements.",officers-certificate
"Officer’s Certificate. The Company shall deliver to Seller a certificate signed by the Chief Executive Officer of the Company, dated as of the Closing Date, to the effect set forth in Section 6.3(b).",officers-certificate
"Officer’s Certificate. The Representatives shall have received on and as of the Closing Date, (i) a certificate of the chief financial officer or chief accounting officer of the Corporation and one additional senior executive officer of the Corporation (A) confirming that such officers have reviewed the Registration Statement, the Pricing Disclosure Package and the Prospectus and, to the knowledge of such officers, the representations set forth in Sections 3(b) and 3(d) hereof are true and correct, (B) confirming that the other representations and warranties of the Corporation in this Agreement are true and correct and that the Corporation has complied with all agreements and satisfied all conditions on its part to be performed or satisfied hereunder at or prior to the Closing Date, (C) to the effect set forth in paragraphs (a), (c) and (d) above; (ii) a certificate of the chief financial officer or chief accounting officer of ESH REIT and one additional senior executive officer of ESH REIT (A) confirming that such officers have reviewed the Registration Statement, the Pricing Disclosure Package and the Prospectus and, to the knowledge of such officers, the representations set forth in Sections 3(b) and 3(d) hereof are true and correct, (B) confirming that the other representations and warranties of ESH REIT in this Agreement are true and correct and that ESH REIT has complied with all agreements and satisfied all conditions on its part to be performed or satisfied hereunder at or prior to the Closing Date, and (C) to the effect set forth in paragraphs (a), (c) and (d) above; and (iii) a certificate of each of the Selling Stockholders, in form and substance reasonably satisfactory to the Representatives, (A) confirming that the representations of such Selling Stockholders set forth in Section 4(e) hereof are true and correct and (B) confirming that the other representations of such Selling Stockholders in this Agreement are true and correct and that the Selling Stockholders have complied with all agreements and satisfied all conditions on its part to be performed or satisfied hereunder at or prior to the Closing Date.",officers-certificate
"Officer’s Certificate. Whenever the Company shall determine the fair market value of the Common Stock pursuant to Paragraph 4 hereof, the Company shall forthwith file in the custody of its secretary at its principal office, with its stock transfer agent and with the Holder, an officer’s certificate showing the such fair market value and the date as of which it was determined, and setting forth in reasonable detail the facts requiring such determination and the facts, assumptions, methodology and calculations employed in determining such value. The Company shall forthwith deliver a copy of each such officer’s certificate to the Holder, and the Company shall make all such officer’s certificates available at all reasonable times for inspection by and copying by the Holder.",officers-certificate
"Officer’s Certificate. Parent shall have received a certificate dated the Closing Date and signed by an executive officer of the Company certifying as to the matters set forth in paragraphs (a), (b) and (c) above.",officers-certificate
"Officer’s Certificate. The Company shall deliver to the --------------------- Purchaser an Officer's Certificate, stating that (i) the conditions described in Sections 6A, 6B, 6D 6E and 6F have been satisfied; (ii) the Company has made all ----------- -- -- -- -- filings under all applicable federal and state securities laws necessary to consummate the transactions contemplated by this Agreement in compliance with such laws; and (iii) all corporate and other proceedings required to be taken by such party in connection with the transactions contemplated hereby to be consummated at or prior to the Closing have been taken.",officers-certificate
"Officer’s Certificate. The Company shall have delivered to the Investor a certificate in form and substance satisfactory to the Investor and the Investor's Counsel, executed by an officer of the Company, certifying as to satisfaction of closing conditions, satisfaction of the Put Conditions (if a Put Closing), incumbency of signing officers, and the true, correct and complete nature of the Certificate of Incorporation, By-Laws, good standing and authorizing resolutions of the Company.",officers-certificate
"Officer’s Certificate. The Company shall have received a certificate signed by an executive officer of Parent certifying as to the matters set forth in Section 7.3(a), Section 7.3(b), and Section 7.3(d).",officers-certificate
"Officer’s Certificate. PIF on behalf of the Acquiring Fund shall have delivered to WM II on behalf of the Acquired Fund a certificate executed in its name by its President or Vice President and its Chief Financial Officer, in form and substance satisfactory to WM II and dated as of the Closing Date, to the effect that the representations and warranties of PIF on behalf of the Acquiring Fund made in this Agreement are true and correct at and as of the Closing Date, except as they may be affected by the transactions contemplated by this Agreement, and that PIF and the Acquiring Fund have complied with all the covenants and agreements and satisfied all of the conditions on their parts to be performed or satisfied under this Agreement at or prior to the Closing Date.",officers-certificate
"Officer’s Certificate. The Purchaser shall have received a --------------------- certificate, dated the Closing Date and signed by the President or the Chief Financial Officer of the Company, certifying that the conditions set forth in Sections 3.1 and 3.2 hereof have been satisfied on and as of such date.",officers-certificate
"Officer’s Certificate. The Administrative Agent shall have received a certificate dated the Effective Date signed on behalf of each Loan Party by any Authorized Officer of such Loan Party stating that (A) on the Effective Date and after giving effect to the Loans and Letters of Credit being made or issued on the Effective Date, no Default shall have occurred and be continuing, and (B) the representations and warranties of such Loan Party contained in the Loan Documents are true and correct on and as of the Effective Date, except to the extent that such representations and warranties specifically refer to an earlier date, in which case they were true and correct as of such earlier date.",officers-certificate
"Officer’s Certificate. Belden shall have received an officer's certificate duly executed by each of the Chief Executive Officer and Chief Operating Officer of CDT to the effect that the conditions set forth in Sections 7.3(a), (b), (c) and (d) have been satisfied.",officers-certificate
"Officer’s Certificate. SmartFinancial shall have received a certificate, dated as of the Closing Date, signed by the chief executive officer and the chief financial officer of each of Bancorp and the Bank, and otherwise in form and substance reasonably satisfactory to SmartFinancial, to the effect that the conditions set forth in Section 8.3(a) and Section 8.3(b) have been satisfied.",officers-certificate
"Officer’s Certificate. A certificate, dated the Effective Date and signed by a senior executive officer of the Borrower, confirming compliance with the conditions set forth in paragraphs (a) and (b) of the first sentence of Section 5.02.",officers-certificate
"Officer’s Certificate. Parent shall have delivered to the Company a certification of the Chief Executive Officer, the Chief Financial Officer or another executive officer of Parent to the effect that each of the conditions specified above in Sections 6.3(a) and (b) is satisfied in all respects.",officers-certificate
"Officer’s Certificate. The Agent shall have received, with a counterpart for each Lender, a certificate of a duly authorized officer of each of the Borrower and each of the other Credit Parties dated the Closing Date, substantially in the form of Exhibit 5.1(f) with appropriate insertions and attachments.",officers-certificate
"Officer’s Certificate. Purchaser shall have delivered to Seller a certificate of an executive officer dated the Closing Date, certifying on behalf of Purchaser that the conditions set forth in Sections 6.1 and 6.2 have been fulfilled.",officers-certificate
"Officer’s Certificate. Parent shall have received an officer’s certificate duly executed by an authorized officer of the Company to the effect that the conditions set forth in Sections 6.2(a), 6.2(b) and 6.2(c) have been satisfied.",officers-certificate
"Officer’s Certificate. On the Restatement Effective Date, the Administrative Agent shall have received a certificate, dated the Restatement Effective Date, and signed on behalf of the Borrower by an Authorized Representative, stating that all conditions in Sections 5.07, 5.08, 5.09, 5.12 and 6.02 have been satisfied on such date.",officers-certificate
"Officer’s Certificate. Each time financial statements are furnished pursuant to clause (i) or (ii) of this Section 5.1(a), a compliance certificate (in substantially the form of Exhibit G) signed by a Designated Financial Officer, dated the date of such financial statements;",officers-certificate
"Officer’s Certificate. You shall have received, on the Closing Date, a certificate of the Company dated the Closing Date, signed on its behalf by the President, the Governor or a Vice President of the Company, to the effect that the signer of such certificate has examined the Registration Statement and the Prospectus and that (i) in his opinion, as of the effective date of the Registration Statement, the Registration Statement did not contain an untrue statement of a material fact and did not omit to state a material fact required to be stated therein or necessary to make the statements therein not misleading, and the Prospectus did not contain an untrue statement of a material fact and did not omit to state a material fact necessary to make the statements therein, in the light of the circumstances under which they were made, not misleading, (ii) since the effective date of the Registration Statement no event has occurred which should have been set forth in an amendment or supplement to the Prospectus but which has not been so set forth, (iii) since the respective dates as of which information is given in the Registration Statement and the Prospectus, there has not been any material adverse change in the condition, financial or other, or earnings of the Company, whether or not arising from transactions in the ordinary course of business, other than changes which the Registration Statement and the Prospectus indicate might occur after the effective date of the Registration Statement, (iv) the Company has no material contingent obligations which are required to be disclosed in the Registration Statement and the Prospectus and are not disclosed therein, (v) no stop order suspending the effectiveness of the Registration Statement is in effect on the Closing Date and no proceedings for the issuance of such an order have been taken or to the knowledge of the Company are contemplated by the Commission at or prior to the Closing Date, (vi) there are no material legal proceedings to which the Company is a party or of which property of the Company is the subject which are required to be disclosed and which are not disclosed in the Registration Statement and the Prospectus, (vii) there are no material contracts to which the Company is a party which are required to be disclosed and which are not disclosed in the Registration Statement or the Prospectus, (viii) the representations and warranties of the Company herein are true and correct as of the Closing Date and (ix) the Pledged Property c...",officers-certificate
"Officer’s Certificate. The Administrative Agent, Buyer and the Indenture Trustee shall have received in form and substance reasonably satisfactory to the Administrative Agent an officer’s certificate from AmeriHome and a certificate of an Responsible Officer of the Issuer, dated the Closing Date, each certifying to the satisfaction of the conditions set forth in the preceding paragraphs (a) and (b), in each case together with incumbency, by-laws, resolutions and good standing.",officers-certificate
"Officer’s Certificate. On the Restatement Effective Date, the Administrative Agent shall have received a certificate dated such date signed by the President or any Vice President of the Company stating that all of the applicable conditions set forth in clauses (h), (j) and (p) have been met.",officers-certificate
"Officer’s Certificate. Purchaser shall have received a certificate from Seller, executed on its behalf by an authorized officer, dated the Closing Date, to the effect that the conditions set forth in Section 8.1, Section 8.3 (to the extent relating to Seller’s Required Regulatory Approvals) and Section 8.4 have been satisfied.",officers-certificate
Officer’s Certificate. The Representative shall have received on and as of the Closing Date a certificate of an executive officer of the Company who has specific knowledge of the Company’s financial matters and is satisfactory to the Representative to the effect that:,officers-certificate
"Officer’s Certificate. PRI shall have received a certificate executed by an executive officer of ATP, dated as of Closing, reasonably satisfactory in form and substance to PRI, certifying that the conditions stated in subparagraphs (a) and (b) of this Section have been satisfied.",officers-certificate
"Officer’s Certificate. If there occurs an event referred to in Section 10.04 or 10.05, the relevant Subsidiary Guarantor shall promptly give to the Trustee an Officers' Certificate (on which the Trustee may conclusively rely) identifying all holders of Subsidiary Guarantor Senior Indebtedness or their Representatives and the principal amount of Subsidiary Guarantor Senior Indebtedness then outstanding held by each such holder and stating the reasons why such Officers' Certificate is being delivered to the Trustee.",officers-certificate
"Officer’s Certificate. The Agent shall have received a certificate executed by the chief financial officer of the Borrower as of the Closing Date stating that (A) the Borrower and each of the Borrower’s Subsidiaries are in compliance with all existing financial obligations, (B) all governmental, shareholder and third party consents and approvals, if any, with respect to the Credit Documents and the transactions contemplated thereby have been obtained, (C) no action, suit, investigation or proceeding is pending or threatened in any court or before any arbitrator or governmental instrumentality that purports to effect the Borrower, any of the Borrower’s Subsidiaries or any transaction contemplated by the Credit Documents, or could have or might be reasonably expected to have a Material Adverse Effect, and (D) immediately after giving effect to this Credit Agreement, the other Credit Documents and all the transactions contemplated herein or therein to occur on such date, (1) the Borrower and each of its Subsidiaries is Solvent, (2) no Default or Event of Default exists, (3) all representations and warranties contained herein and in the other Credit Documents are true and correct in all material respects, and (4) the Credit Parties are in compliance with each of the financial covenants set forth in Section 7.12.",officers-certificate
Officer’s Certificate. The Lenders shall have received a certificate from a Responsible Officer documenting the Borrower’s compliance with the conditions set forth in paragraphs (a) and (b) of Section 5.2 after giving effect to the financing contemplated hereby.,officers-certificate
"Officer’s Certificate. (a) By February 28th of each year beginning in 2005 or such other date specified in a written notice within 15 days prior to the date on which a Form 10-K is required to be filed with a certification by the Depositor, an officer of the Servicer shall execute and deliver an Officer's Certificate substantially in the form of Exhibit R attached hereto, signed by the senior officer in charge of servicing of the Servicer or any officer to whom that officer reports, to the Trustee and Depositor for the benefit of such parties and their respective officers, directors and affiliates.",officers-certificate
Officer’s Certificate. The certificate referred to in Section 10.03 of this Agreement.,officers-certificate
Officer’s Certificate. The certificate described in Section 7.1(c).,officers-certificate
Officer’s Certificate. The Representatives shall have received on and as of the Closing Date a certificate of its Chief Executive Officer and its Chief Financial Officer in the form attached as Annex B hereto.,officers-certificate
"Officer’s Certificate. Each party shall have furnished to the other a certificate of its Chief Executive Officer dated as of the Effective Date, in which such officers shall certify that, to their best knowledge, the conditions set forth in Section 6.2(a) and 6.2(b) or 6.3(a) and 6.3(b) (as applicable) have been fulfilled and are true and correct.",officers-certificate
"Officer’s Certificate. The Company shall have delivered a certificate, dated the Closing Date, duly executed on behalf of the Company by its Chief Executive Officer to the effect set forth in clause (b) above;",officers-certificate
"Officer’s Certificate. Concurrently with any delivery of financial statements in accordance with this Lease, an Officer's Certificate of the Lessee (i) certifying as to whether an Event of Default has occurred and, if an Event of Default has occurred, specifying the details thereof and any action taken or proposed to be taken with respect thereto, (ii) setting forth in reasonable detail calculations demonstrating compliance with Sections 14.13 through 14.17, and (iii) stating whether any change in GAAP or in the application thereof has occurred since the date referred to in paragraph 14.24 and, if any such change has occurred, specifying the effect of such change on the financial statements accompanying such Officer's Certificate.",officers-certificate
Officer’s Certificate. The Company shall have received a certificate signed on behalf of the Purchaser by a duly authorized officer certifying to the effect that the conditions set forth in Sections 5.2(a) and (b) have been satisfied.,officers-certificate
"Officer’s Certificate. Parent shall have received a certificate of the Chief Executive Officer and the Chief Financial Officer of the Company to the effect that the statements set forth in paragraphs (a), (b) and (c) of this Section 8.3 are true and correct.",officers-certificate
"Officer’s Certificate. The Representatives shall have received on and as of the Closing Date, a certificate of the chief financial officer or chief accounting officer of the Company (i) confirming that the representations and warranties of the Company set forth in Section 3 of this Agreement are true and correct and that the Company has complied with all agreements and satisfied all conditions on its part to be performed or satisfied hereunder at or prior to the Closing Date, and (ii) to the effect set forth in paragraphs (a), (c) and (d) above.",officers-certificate
Officer’s Certificate. Seller shall have received a certificate signed on behalf of Buyer by an executive officer of Buyer certifying the satisfaction by Buyer of the conditions set forth in Section 7.2 and Section 7.3.,officers-certificate
"Officer’s Certificate. There shall have been delivered to Parent a certificate, dated as of such Closing Date and signed by a duly authorized officer of Purchaser, certifying the satisfaction of the conditions in Section 6.3(a) and Section 6.3(b).",officers-certificate
"Officer’s Certificate. The Representatives shall have received on and as of the Closing Date a certificate of any Senior Vice President or any Vice President, and the Treasurer or any Assistant Treasurer of the Company to the effect that (i) the representations and warranties of the Company in this Agreement are true and correct and that the Company has complied with all agreements and satisfied all conditions on its part to be performed or satisfied hereunder at or prior to the Closing Date, (ii) since the respective dates as of which information is given in the Time of Sale Information and the Prospectus, as then amended or supplemented, and prior to the Closing Date, there has not been any material decrease in the stockholders’ equity of the Company, any material decrease in the capital stock of the Company or any material increase in the consolidated long-term debt of the Company (other than as a result of the sale of (u) the Securities, (v) notes issued pursuant to the Company’s Medium-Term Note program, Retail Medium-Term Note Program, or InterNotes® retail note program, (w) notes issued pursuant to the Commercial Paper Program of either the Company or Prudential Funding, LLC, (x) borrowings with the Federal Home Loan Bank of New York by the Principal Subsidiary, (y) borrowings by subsidiaries of the Company in the ordinary course of business pursuant to securities lending, repurchase or reverse repurchase arrangements and (z) borrowings by the Company from its five-year revolving credit facility to fund working capital needs); (iii) since the respective dates as of which information is given in the Time of Sale Information and the Prospectus, as then amended or supplemented, there has not been any Material Adverse Change, or any development that will involve a prospective Material Adverse Change, and (iv) the conditions set forth in paragraphs (a), (c) and (d) above have been satisfied.",officers-certificate
"Officer’s Certificate. Seller shall have received a certificate in the form of Exhibit 7.3 hereto, dated as of the Closing Date, of the President or a Vice President of Buyer certifying as to the matters specified in Sections 7.1 and 7.2.",officers-certificate
"Officer’s Certificate. The Purchaser shall have delivered to the Sellers a certificate, dated as of the Closing Date, executed by a duly authorized officer of the Purchaser, certifying to the satisfaction of the conditions set forth in subsections 6.3(a) and (b) hereof.",officers-certificate
Officer’s Certificate. The Administrative Agent shall have received a certificate of a Responsible Officer of the Borrower dated the Amendment No. 1 Effective Date certifying as to the accuracy of the representation and warranty set forth in Section 2; and,officers-certificate
"Officer’s Certificate. The Commitment Parties shall have received on and as of the Closing Date a certificate of the chief executive officer or chief financial officer of the Company confirming that the conditions set forth in Sections 7.1(h) (Representations and Warranties), (i) (Covenants) and (j) (Material Adverse Effect) have been satisfied.",officers-certificate
"Officer’s Certificate. FGH shall have furnished to Pacific and Pacific Merger Corp a certificate of the Chief Executive Officer and the Chief Financial Officer of FGH, dated as of the Effective Date, in which such officers shall certify that, to their best Knowledge, the conditions set forth in Section 7.2(a) have been fulfilled.",officers-certificate
"Officer’s Certificate. At the time of delivery of the financial statements provided for in Sections 7.1(a)(i) and 7.1(a)(ii) above, a certificate of the chief financial officer or treasurer of the Maker, stating that no Default or Event of Default exists, or if any such Default or Event of Default does exist, specifying the nature and extent thereof and what action the Maker proposes to take with respect thereto.",officers-certificate
"Officer’s Certificate. The Administrative Agent shall have received a certificate, dated the Effective Date and signed by a senior executive officer of the Borrower, to the effect that (i) the representations and warranties of the Borrower set forth in Article III, and of each Loan Party in each of the other Loan Documents to which it is a party, shall be true and correct in all material respects (without duplication of any materiality qualifier contained therein) on and as of the Effective Date (or, if any such representation or warranty is expressly stated to have been made as of a specific date, as of such specific date) and (ii) at the time of and immediately after giving effect to the Effective Date, no Default or Event of Default shall have occurred and be continuing.",officers-certificate
"Officer’s Certificate uMember shall have delivered to Art Cards a certificate, dated the Closing Date, and signed by the Chief Executive Officer of uMember, certifying that each of the conditions specified in Sections 5.2 through 5.6 hereof have been fulfilled.",officers-certificate
