clause_text,clause_type
Officer’s Certificate. Any certificate signed by any duly authorized officer of the Company and delivered to you or to Representative Counsel shall be deemed a representation and warranty by the Company to the Underwriters as to the matters covered thereby.,officers-certificate
"Officer’s Certificate. A certificate, dated such Date of Delivery, of the President or a Vice President of the Company and of the chief financial or chief accounting officer of the Company confirming that the certificate delivered at the Closing Time pursuant to Section 5(d) hereof remains true and correct as of such Date of Delivery.",officers-certificate
"Officer’s Certificate. At each of the Closing Date and the Option Closing Date, if any, the Representative shall have received a certificate of the Company signed by the Chairman of the Board or the Chief Executive Officer and the Secretary or Assistant Secretary of the Company (in their capacities as such), dated the Closing Date or the Option Closing Date, as the case may be, respectively, to the effect that the Company has performed all covenants and complied with all conditions required by this Agreement to be performed or complied with by the Company prior to and as of the Closing Date, or the Option Closing Date, as the case may be, and that the conditions set forth in Section 4 hereof have been satisfied as of such date and that, as of Closing Date and the Option Closing Date, as the case may be, the representations and warranties of the Company set forth in Section 2 hereof are true and correct. In addition, the Representative will have received such other and further certificates of officers of the Company (in their capacities as such) as the Representative may reasonably request.",officers-certificate
"Officer’s Certificate. The Representatives shall have received on and as of the Closing Date or the Additional Closing Date, as the case may be, a certificate of the chief financial officer or chief accounting officer of the Company and one additional senior executive officer of the Company who is satisfactory to the Representatives (i) confirming that such officers have carefully reviewed the Registration Statement, the Pricing Disclosure Package and the Prospectus and, to the knowledge of such officers, the representations set forth in Sections 3(b) and 3(c) hereof are true and correct, (ii) confirming that the other representations and warranties of the Company in this Agreement are true and correct and that the Company has complied with all agreements and satisfied all conditions on its part to be performed or satisfied hereunder at or prior to the Closing Date or the Additional Closing Date, as the case may be, and (iii) to the effect set forth in paragraphs (a) and (c) above.",officers-certificate
"Officer’s Certificate. At Closing Time, there shall not have been, since the date hereof or since the respective dates as of which information is given in the Prospectus, any material adverse change in the condition, financial or otherwise, or in the earnings, business affairs or business prospects of the Company and its subsidiaries considered as one enterprise, whether or not arising in the ordinary course of business, and the Representatives shall have received a certificate of the President or a Vice President of the Company and of the chief financial or chief accounting officer of the Company, dated as of Closing Time, to the effect that (i) there has been no such material adverse change, (ii) the representations and warranties in Section 1(a) hereof are true and correct with the same force and effect as though expressly made at and as of Closing Time, (iii) the Company has complied with all agreements and satisfied all conditions on its part to be performed or satisfied at or prior to Closing Time, and (iv) no stop order suspending the effectiveness of the Registration Statement has been issued and no proceedings for that purpose have been instituted or are pending or are contemplated by the Commission.",officers-certificate
"Officer’s Certificate. On each of the First Closing Date and each Option Closing Date, the Representatives shall have received a certificate executed by the Chief Executive Officer or President of the Company and the Chief Financial Officer of the Company, dated as of such date, to the effect set forth in Section 6(b)(ii) and further to the effect that:",officers-certificate
"Officer’s Certificate. The Company shall have furnished to the Representative a certificate, dated the Closing Date and any Option Closing Date (if such date is other than the Closing Date), of its Chief Executive Officer, its President and its Chief Financial Officer stating that (i) such officers have carefully examined the Registration Statement, the Pricing Disclosure Package, any Issuer Free Writing Prospectus and the Prospectus and, in their opinion, the Registration Statement and each amendment thereto, as of the Applicable Time and as of the Closing Date (or any Option Closing Date if such date is other than the Closing Date) did not include any untrue statement of a material fact and did not omit to state a material fact required to be stated therein or necessary to make the statements therein not misleading, and the Pricing Disclosure Package, as of the Applicable Time and as of the Closing Date (or any Option Closing Date if such date is other than the Closing Date), any Issuer Free Writing Prospectus as of its date and as of the Closing Date (or any Option Closing Date if such date is other than the Closing Date), the Prospectus and each amendment or supplement thereto, as of the respective date thereof and as of the Closing Date, did not include any untrue statement of a material fact and did not omit to state a material fact necessary in order to make the statements therein, in the light of the circumstances in which they were made, not misleading, (ii) since the effective date of the Registration Statement, no event has occurred which should have been set forth in a supplement or amendment to the Registration Statement, the Pricing Disclosure Package or the Prospectus, (iii) to the best of their knowledge after reasonable investigation, as of the Closing Date (or any Option Closing Date if such date is other than the Closing Date), the representations and warranties of the Company in this Agreement are true and correct and the Company has complied with all agreements and satisfied all conditions on its part to be performed or satisfied hereunder at or prior to the Closing Date (or any Option Closing Date if such date is other than the Closing Date), and (iv) there has not been, subsequent to the date of the most recent audited financial statements included or incorporated by reference in the Pricing Disclosure Package, any material adverse change in the financial position or results of operations of the Company, or any change or development that, singularly or in ...",officers-certificate
"Officer’s Certificate. At the Closing Time, there shall not have been, since the date hereof or since the respective dates as of which information is given in the Registration Statement, the General Disclosure Package or the Prospectus, any material adverse change in the condition, financial or otherwise, or in the earnings, business affairs or business prospects of the Company and its subsidiaries considered as one enterprise, whether or not arising in the ordinary course of business, and the Representatives shall have received a certificate of the Chief Executive Officer or the President of the Company and of the chief financial or chief accounting officer of the Company, dated the Closing Time, to the effect that (i) there has been no such material adverse change, (ii) the representations and warranties of the Company in this Agreement are true and correct with the same force and effect as though expressly made at and as of the Closing Time, (iii) the Company has complied with all agreements and satisfied all conditions on its part to be performed or satisfied at or prior to the Closing Time, and (iv) no stop order suspending the effectiveness of the Registration Statement under the 1933 Act has been issued, no order preventing or suspending the use of any preliminary prospectus or the Prospectus has been issued and no proceedings for any of those purposes have been instituted or are pending or, to their knowledge, contemplated.",officers-certificate
"Officer’s Certificate. The Representatives shall have received on and as of the Closing Date a certificate of an executive officer of the Company who has specific knowledge of the Company’s financial matters and is satisfactory to the Representatives (i) confirming that such officer has carefully reviewed the Registration Statement, the Time of Sale Information and the Prospectus and, to the best knowledge of such officer, the representations set forth in Sections 3(b) and 3(d) hereof are true and correct, (ii) confirming that the other representations and warranties of the Company in this Agreement are true and correct and that the Company has complied with all agreements and satisfied all conditions on its part to be performed or satisfied hereunder at or prior to the Closing Date and (iii) to the effect set forth in paragraphs (a), (c) and (d) above.",officers-certificate
"Officer’s Certificate. The Company shall have delivered to such Purchaser an Officer’s Certificate, dated the date of the Closing, certifying that the conditions specified in Sections 4.1, 4.2 and 4.9 have been fulfilled.",officers-certificate
"Officer’s Certificate. Each offer to prepay the Notes pursuant to this Section 8.7 shall be accompanied by a certificate, executed by a Senior Financial Officer of the Company and dated the date of such offer, specifying: (i) the Proposed Prepayment Date; (ii) that such offer is made pursuant to this Section 8.7; (iii) the principal amount of each Note offered to be prepaid; (iv) the interest that would be due on each Note offered to be prepaid, accrued to the Proposed Prepayment Date; (v) that the conditions of this Section 8.7 have been fulfilled; and (vi) in reasonable detail, the nature and date or proposed date of the Change in Control.",officers-certificate
"Officer’s Certificate. On each of the First Closing Date and the Second Closing Date the Representatives shall have received a written certificate executed by the Chairman of the Board, Chief Executive Officer or President of the Company and the Chief Financial Officer or Chief Accounting Officer of the Company, dated as of such Closing Date, to the effect set forth in subsections (b)(ii) and (c)(ii) of this Section 5, and further to the effect that:",officers-certificate
"Officer’s Certificate. At the Closing Time, there shall not have been, since the date hereof or since the respective dates as of which information is given in the Registration Statement, the General Disclosure Package or the Prospectus, any Material Adverse Effect, and the Representatives shall have received a certificate of the Chief Executive Officer or the President of the Company and of the chief financial or chief accounting officer of the Company, dated the Closing Time, to the effect that (i) there has been no such Material Adverse Effect, (ii) the representations and warranties of the Company in this Agreement are true and correct with the same force and effect as though expressly made at and as of the Closing Time, (iii) the Company has complied with all agreements and satisfied all conditions on its part to be performed or satisfied at or prior to the Closing Time, and (iv) no stop order suspending the effectiveness of the Registration Statement under the 1933 Act has been issued, no order preventing or suspending the use of any preliminary prospectus or the Prospectus has been issued and no proceedings for any of those purposes have been instituted or are pending or, to their knowledge, contemplated.",officers-certificate
Officer’s Certificate. Each set of financial statements delivered to a holder of Notes pursuant to Section 7.1(a) or Section 7.1(b) hereof shall be accompanied by a certificate of a Senior Financial Officer setting forth:,officers-certificate
"Officer’s Certificate. At the time of delivery of the financial statements provided for in Sections 7.1(a) and 7.1(b) above, a certificate of a Financial Officer substantially in the form of Exhibit 7.1(c): (i) setting forth calculations demonstrating compliance by the Borrower with the financial covenant set forth in Section 7.2 as of the end of such fiscal period and (ii) stating that no Default or Event of Default exists, or if any Default or Event of Default does exist, specifying the nature and extent thereof and what action the Borrower proposes to take with respect thereto.",officers-certificate
"Officer’s Certificate. The Representatives shall have received on and as of the Closing Date or the Additional Closing Date, as the case may be (x) a certificate of the chief financial officer or chief accounting officer of the Company and one additional executive officer of the Company who is satisfactory to the Representatives (i) confirming that such officers have carefully reviewed the Registration Statement, the Pricing Disclosure Package and the Prospectus and, to the best knowledge of such officers, the representations of the Company set forth in Sections 3(b) and 3(d) hereof are true and correct, (ii) confirming that the other representations and warranties of the Company in this Agreement are true and correct and that the Company has complied with all agreements and satisfied all conditions on its part to be performed or satisfied hereunder at or prior to the Closing Date or the Additional Closing Date, as the case may be, and (iii) to the effect set forth in paragraphs (a), (c) and (d) above and (y) a certificate of the Selling Stockholder, in form and substance reasonably satisfactory to the Representatives, (A) confirming that the representations of such Selling Stockholder set forth in Sections 4(e), 4(f) and 4(g) hereof is true and correct and (B) confirming that the other representations and warranties of such Selling Stockholder in this agreement are true and correct and that the such Selling Stockholder has complied with all agreements and satisfied all conditions on their part to be performed or satisfied hereunder at or prior to such Closing Date.",officers-certificate
"Officer’s Certificate. IMGL shall have been furnished with a certificate dated the Closing Date and signed by a duly authorized officer of IMGL to the effect that no litigation, proceeding, investigation, or inquiry is pending, or to the best knowledge of IMGL threatened, which might result in an action to enjoin or prevent the consummation of the transactions contemplated by this Agreement, or, to the extent not disclosed in the IMGL Disclosure Schedules, which might result in any material adverse change in any of the assets, properties, business, or operations of the Group.",officers-certificate
"Officer’s Certificate. The Representatives shall have received a certificate, dated such Closing Date, of an executive officer of the Company and a principal financial or accounting officer of the Company in which such officers shall state that: the representations and warranties of the Company in this Agreement are true and correct; the Company has complied with all agreements and satisfied all conditions on its part to be performed or satisfied hereunder at or prior to such Closing Date; no stop order suspending the effectiveness of the Registration Statement has been issued and no proceedings for that purpose have been instituted or, to the best of their knowledge and after reasonable investigation, are contemplated by the Commission; and, subsequent to the date of the most recent financial statements in the General Disclosure Package, there has been no material adverse change, nor any development or event involving a prospective material adverse change, in the condition (financial or otherwise), results of operations, business, properties or prospects of the Company and its subsidiaries taken as a whole except as set forth in the General Disclosure Package or as described in such certificate.",officers-certificate
"Officer’s Certificate. The Company shall have delivered to the Purchasers a certificate of an executive officer of the Company, dated as of the Closing Date, confirming the accuracy of the Company’s representations, warranties and covenants as of the Closing Date and confirming the compliance by the Company with the conditions precedent set forth in this Section 4.2 as of the Closing Date.",officers-certificate
"Officer’s Certificate. On each Closing Date, there shall have been furnished to you, as Representatives of the Underwriters, a certificate, dated such Closing Date and addressed to you, signed by the chief executive officer and by the chief financial officer of the Company, to the effect that:",officers-certificate
"Officer’s Certificate. The Placement Agent shall have received on each Closing Date a certificate of the Company, dated as of such Closing Date, signed by the Chief Executive Officer and Chief Financial Officer of the Company, to the effect that, and the Placement Agent shall be satisfied that, the signers of such certificate have reviewed the Registration Statement, the Incorporated Documents, any Prospectus Supplement, and this Agreement and to the further effect that:",officers-certificate
"Officer’s Certificate. At the Closing Time, there shall not have been, since the date hereof or since the respective dates as of which information is given in the Registration Statement, the General Disclosure Package or the Prospectus, any Material Adverse Change, and the Representatives and the Selling Shareholder shall have received a certificate of the Chief Executive Officer or the President and of the chief financial or chief accounting officer of each of the Company and the Bank, dated the Closing Time, to the effect that (i) there has been no Material Adverse Change, (ii) the representations and warranties of the Company or the Bank, as the case may be, in this Agreement are true and correct with the same force and effect as though expressly made at and as of the Closing Time, (iii) the Company has complied with all agreements and satisfied all conditions on its part to be performed or satisfied at or prior to the Closing Time, and (iv) the conditions specified in Section 6(a) hereof have been satisfied.",officers-certificate
"Officer’s Certificate. A certificate, dated such Date of Delivery, of the Chief Executive Officer and the Chief Financial Officer of the Company confirming that the certificate delivered at the Closing Time pursuant to Section 5(g) hereof remains true and correct as of such Date of Delivery.",officers-certificate
"Officer’s Certificate. The Representatives shall have received a certificate, dated such Closing Date, of an executive officer of the Company and a principal financial or accounting officer of the Company in which such officers shall state that: the representations and warranties of the Company in this Agreement are true and correct; the Company has complied with all agreements and satisfied all conditions on its part to be performed or satisfied hereunder at or prior to such Closing Date; no stop order suspending the effectiveness of any Registration Statement has been issued and no proceedings for that purpose have been instituted or, to the best of their knowledge, are contemplated by the Commission; the Additional Registration Statement (if any) satisfying the requirements of subparagraphs (1) and (3) of Rule 462(b) was timely filed pursuant to Rule 462(b), including payment of the applicable filing fee in accordance with Rule 111(a) or (b) of Regulation S-T of the Commission; and, subsequent to the date of the most recent financial statements in the General Disclosure Package, there has been no material adverse change, nor any development or event involving a prospective material adverse change, in the condition (financial or otherwise), results of operations, business, properties or prospects of the Company and its subsidiaries taken as a whole except as set forth in the General Disclosure Package and the Final Prospectus or as described in such certificate.",officers-certificate
"Officer’s Certificate. On each of the First Closing Date and each Subsequent Closing Date, the Representative shall have received a written certificate executed by the Chairman of the Board, Chief Executive Officer or President of the Company and the Chief Financial Officer or Chief Accounting Officer of the Company, dated as of such Closing Date, to the effect that the signers of such certificate have reviewed the Registration Statement, the Prospectus and any amendment or supplement thereto, any Issuer Free Writing Prospectus and any amendment or supplement thereto and this Agreement, to the effect set forth in subsection (b)(ii) of this Section 5, and further to the effect that:",officers-certificate
"Officer’s Certificate. On the Closing Date, the Representative shall have received a written certificate executed by the Chairman of the Board or the Chief Executive Officer or a Senior Vice President of the Company and the Chief Financial Officer or Chief Accounting Officer of the Company, dated as of such Closing Date, to the effect that:",officers-certificate
"Officer’s Certificate. The Company shall have furnished to the Representative a certificate of the Company, signed by the Chief Executive Officer and the principal financial or accounting officer of the Company, dated the Closing Date, to the effect that the signers of such certificate have carefully examined the Registration Statement, each Preliminary Prospectus, the Prospectus and any amendment or supplement thereto, as well as each electronic road show used in connection with the Offering, and this Agreement and that:",officers-certificate
"Officer’s Certificate. Each set of financial statements delivered to a holder of Notes pursuant to Section 7.1(a) or Section 7.1(b) shall be accompanied by a certificate of a Senior Financial Officer setting forth (which, in the case of Electronic Delivery of any such financial statements, shall be by separate concurrent delivery of such certificate to each holder of Notes):",officers-certificate
"Officer’s Certificate. A certificate, dated the Effective Date and signed by the President, the Chief Executive Officer, a Vice President or a Financial Officer of the Borrower, confirming compliance with the conditions set forth in the lettered clauses of the first sentence of Section 4.02.",officers-certificate
"Officer’s Certificate. At Closing Time, there shall not have been, since the date hereof or since the respective dates as of which information is given in the Registration Statement, the General Disclosure Package and the Prospectus, any material adverse change in the condition, financial or otherwise, or in the earnings, business affairs or business prospects of the Company and its subsidiaries considered as one enterprise, whether or not arising in the ordinary course of business, and the Representatives shall have received a certificate of the Chief Executive Officer, President or a Vice President of the Company and of the Treasurer, the Assistant Treasurer, the principal financial officer or the principal accounting officer of the Company, dated as of Closing Time, to the effect that (i) there has been no such material adverse change, (ii) the representations and warranties in Section 1(a) are true and correct with the same force and effect as though expressly made at and as of Closing Time and (iii) the Company has performed or complied with all agreements and satisfied all conditions on its part to be performed or satisfied at or prior to Closing Time.",officers-certificate
"Officer’s Certificate. Whenever the Exercise Price shall be adjusted as required by the provisions of the foregoing Section, the Company shall forthwith file in the custody of its Secretary or an Assistant Secretary at its principal office and with its stock transfer agent, if any, an officer's certificate showing the adjusted Exercise Price determined as herein provided, setting forth in reasonable detail the facts requiring such adjustment, including a statement of the number of additional shares of Common Stock, if any, and such other facts as shall be necessary to show the reason for and the manner of computing such adjustment. Each such officer's certificate shall be made available at all reasonable times for inspection by the holder or any holder of a Warrant executed and delivered pursuant to Section (a) and the Company shall, forthwith after each such adjustment, mail a copy by certified mail of such certificate to the Holder or any such holder.",officers-certificate
