clause_text,clause_type
"Officer’s Certificate. Buyer shall have delivered to Seller at the Closing a certificate of an officer of Buyer, dated as of the Closing Date, as to the matters set forth in Sections 8.1 and 8.2.",officers-certificate
"Officer’s Certificate. Purchaser shall have delivered to Seller a certificate, dated the Closing Date and signed by a senior officer of Purchaser, as to the fulfillment of the conditions set forth in Section 7.1.1.",officers-certificate
"Officer’s Certificate. Buyer shall have delivered to Seller a certificate, dated as of the Closing Date, executed by an executive officer of Buyer, certifying the fulfillment of the conditions specified in Sections 8.1(a) and 8.1(b) hereof.",officers-certificate
"Officer’s Certificate. Together with each delivery of any financial statement (a) pursuant to CLAUSES (I) and (II) of this SECTION 7.1(A), an Officer's Certificate of the Borrower, substantially in the form of EXHIBIT H attached hereto and made a part hereof, stating that no Default or Unmatured Default exists, or if any Default or Unmatured Default exists, stating the nature and status thereof and (b) pursuant to CLAUSES (I) and (II) of this SECTION 7.1(A), a compliance certificate, substantially in the form of EXHIBIT I attached hereto and made a part hereof, signed by the Borrower's chief financial officer or treasurer, setting forth calculations for the period then ended, which demonstrate compliance, when applicable, with the provisions of SECTION 7.4, and which calculate the Leverage Ratio for purposes of determining the then Applicable Eurodollar Margin, Applicable Floating Rate Margin and Applicable Commitment Fee Percentage.",officers-certificate
"Officer’s Certificate. The Manager shall have received a certificate, on each Representation Date, dated such date, of an executive officer of the Company and a principal financial or accounting officer of the Company substantially in the form set forth on Schedule G hereto.",officers-certificate
"Officer’s Certificate. Buyer shall have delivered to Seller a certificate, dated the date of Closing and executed by an officer of Buyer, certifying to the fulfillment of all conditions specified in this Section 9.2.",officers-certificate
"Officer’s Certificate. At the Closing Time, there shall not have been, since the date hereof or since the respective dates as of which information is given in the Disclosure Package and the Prospectus, any material adverse change in the condition, financial or otherwise, or in the earnings, business affairs or business prospects of the Company and its subsidiaries considered as one enterprise, whether or not arising in the ordinary course of business, and the Representatives shall have received a certificate of the President or a Vice President of the Company and of the chief financial officer, chief accounting officer or treasurer of the Company, dated as of the Closing Time, to the effect that (i) there has been no such material adverse change, (ii) the representations and warranties in Section 1(a) hereof are true and correct with the same force and effect as though expressly made at and as of the Closing Time, (iii) the Company has complied with all agreements and satisfied all conditions on its part to be performed or satisfied at or prior to the Closing Time, and (iv) no stop order suspending the effectiveness of the Registration Statement or any written or oral notice to the Company objecting to its use has been issued by the Commission and no proceedings for that purpose have been instituted or are pending or, to their knowledge, contemplated by the Commission.",officers-certificate
"Officer’s Certificate. A certificate, dated such Option Closing Date, to the effect set forth in, and signed by the Chief Executive Officer and the Chief Financial Officer of the Company, as specified in Section 5(e) hereof, except that the references in such certificate to the Closing Date shall be changed to refer to such Option Closing Date.",officers-certificate
"Officer’s Certificate. The Company shall have delivered to the Investors a certificate in form and substance reasonably satisfactory to the Investors, executed by the Secretary or an Assistant Secretary of the Company on behalf of the Company, certifying as to the satisfaction of all closing conditions, incumbency of signing officers, charter, Bylaws, good standing and authorizing resolutions of the Company.",officers-certificate
"Officer’s Certificate. Whenever in the performance of its duties hereunder the Warrant Agent shall reasonably deem it necessary that any fact or matter be proved or established by the Company prior to taking, suffering or omitting any action hereunder, the Warrant Agent may (unless other evidence in respect thereof be herein specifically prescribed), in the absence of bad faith on its part, require and conclusively rely upon a certificate signed by the Chairman of the Board of Directors, the Vice Chairman of the Board of Directors, the President, an Executive Vice President, the Treasurer, an Assistant Treasurer, the Secretary or an Assistant Secretary of the Company delivered by the Company to the Warrant Agent.",officers-certificate
"Officer’s Certificate. The Private Company shall have been furnished with a certificate (dated as of the Closing Date and in form and substance reasonably satisfactory to the Private Company), executed by an executive officer of the Purchaser, certifying to the fulfillment of the conditions specified in subsections 7.1 and 7.2 hereof.",officers-certificate
"Officer’s Certificate. Seller shall have received a certificate --------------------- executed by an executive officer of Buyer, dated as of Closing, reasonably satisfactory in form and substance to Seller, certifying that the conditions specified in Sections 7.2(a) and (b) have been satisfied.",officers-certificate
"Officer’s Certificate. The Company shall have furnished to Parent and Merger Sub a certificate of the Chief Executive Officer of the Company, dated as of the Effective Date, in which such officer shall certify that, to the best of his Knowledge, the conditions set forth in Section 7.2(a) have been fulfilled.",officers-certificate
"Officer’s Certificate. The Administrative Agent shall have received a certificate, dated the Closing Date and signed by a Responsible Officer of Parent on behalf of each Loan Party, confirming compliance with the conditions precedent set forth in Sections 4.01(f)(i), (g) and (m).",officers-certificate
"Officer’s Certificate. The Partnership Parties shall have furnished to the Representatives a certificate, dated such Delivery Date, of the Chief Executive Officer and Chief Financial Officer of the General Partner as to such matters as the Representatives may reasonably request, including, without limitation, a statement:",officers-certificate
"Officer’s Certificate. The Company will have received a certificate of the Purchaser, validly executed for and on behalf of the Purchaser and in its name by a duly authorized officer thereof, certifying that the conditions set forth in Section 7.3(a) and Section 7.3(b) have been satisfied.",officers-certificate
"Officer’s Certificate. At Closing Time, there shall not have been, since the date hereof or since the respective dates as of which information is given in the Prospectus, any material adverse change in the condition, financial or otherwise, or in the earnings, business affairs or business prospects of the Company and its subsidiaries considered as one enterprise,",officers-certificate
"Officer’s Certificate. Parent shall have received a certificate signed on behalf of the Company by an executive officer of the Company certifying the satisfaction by the Company of the conditions set forth in Section 7.03(a), Section 7.03(b) and Section 7.03(c).",officers-certificate
"Officer’s Certificate. If there occurs an event referred to in the first sentence of Section 7.04(c) or the first sentence of Section 7.04, the Guarantor shall promptly give to the Trustee an Officers' Certificate (on which the Trustee may conclusively rely) identifying all holders of Senior Indebtedness of the Guarantor and the principal amount of Senior Indebtedness of the Guarantor then outstanding held by each such holder and stating the reasons why such Officers' Certificate is being delivered to the Trustee.",officers-certificate
"Officer’s Certificate. Tower shall have delivered to FNB a certificate, dated the Closing Date and signed, without personal liability, by its Chairman or President, to the effect that the conditions set forth in subsections (a) through (d) and (h) of this Section 6.01 have been satisfied.",officers-certificate
"Officer’s Certificate. The Administrative Agent shall have received a certificate signed by a Responsible Officer or director of the Borrower Representative, certifying as of the Closing Date to the matters set forth in Section 4.01(e), Section 4.01(m) and Section 4.01(n). For purposes of determining whether the conditions specified in this Section 4.01 have been satisfied on the Closing Date, by funding the Loans hereunder, the Administrative Agent and each Lender that has executed this Agreement (or an Assignment and Assumption on the Closing Date) shall be deemed to have consented to, approved or accepted, or to be satisfied with, each document or other matter required hereunder to be consented to or approved by or acceptable or satisfactory to the Administrative Agent or such Lender, as the case may be. Notwithstanding the foregoing, to the extent any Lien on any Collateral (including the creation or perfection of any security interest) is not or cannot be provided and/or perfected on the Closing Date (other than, to the extent required under the Loan Documents, (i) a Lien on Collateral of any Loan Party that may be perfected by the filing of a financing statement under the UCC or PPSA and (ii) a pledge of the Capital Stock of the Borrowers or any Subsidiary Guarantor with respect to which a Lien may be perfected on the Closing Date by the delivery to the Administrative Agent of a stock or equivalent certificate (other than, in the case of the Target and its subsidiaries, with respect to any such certificate that has not been made available to the Borrowers at least one Business Day prior to the Closing Date, to the extent the Borrower Representative has used commercially reasonable efforts to procure delivery thereof, in which case, such stock or equivalent certificate may instead be delivered within (x) five Business Days after the Closing Date (or such later date as the Administrative Agent may agree, in its sole discretion) in the case of the Capital Stock of the Target and (y) ten Business Days after the Closing Date (or such later date as the Administrative Agent may agree, in its sole discretion) in the case of Capital Stock of any Subsidiary Guarantor) after the Borrower Representative’s use of commercially reasonable efforts to do so without undue burden or expense, then the provision and/or perfection of such Collateral shall not constitute a condition precedent to the availability and initial funding of the Loans on the Closing Date but may, if required, instead b...",officers-certificate
"Officer’s Certificate. Parent shall have received a certificate, signed by the chief executive officer or chief financial officer of the Company, certifying as to the matters set forth in Sections 6.2(a) and 6.2(b).",officers-certificate
"Officer’s Certificate. On the Initial Borrowing Date, the Administrative Agent shall have received a certificate dated such date signed by an Authorized Officer of the Borrower stating that all of the applicable conditions set forth in Sections 5.02, 5.06, 5.07, 5.08, 5.09 and 5.16 have been satisfied as of such date.",officers-certificate
Officer’s Certificate. The Company shall have received a certificate signed on behalf of Parent by an executive officer of Parent certifying the satisfaction by Parent and Merger Sub of the conditions set forth in Section 6.3(a) and Section 6.3(b).,officers-certificate
Officer’s Certificate. Acquiror shall have received a certificate signed on behalf of the Company by an executive officer of the Company certifying as to the matters set forth in Sections 8.1 and 8.2.,officers-certificate
"Officer’s Certificate. The Administrative Agent shall have received a certificate, dated the Closing Date and signed by the President, a Vice President or a Financial Officer of the Borrower, confirming compliance with the conditions set forth in paragraphs (a) and (b) of Section 4.02.",officers-certificate
"Officer’s Certificate. At the time of delivery of the financial statements provided for in Sections 7.1(a) and (b), a certificate of a Senior Financial Officer of the Company substantially in the form of Exhibit I to the effect that no Default or Event of Default exists, or if any Default or Event of Default does exist specifying the nature and extent thereof and what action the Borrowers propose to take with respect thereto. In addition, for each fiscal quarter and, if the Fixed Charge Coverage Ratio is required to be complied with in accordance with Section 8.1, monthly, such certificate shall (i) demonstrate compliance with the financial covenants contained in Article VIII by calculation thereof as of the end of each such fiscal period and (ii) contain information regarding expenditures made by the Credit Parties as to Permitted Investments and Capital Expenditures during the prior fiscal quarter. In addition to the foregoing, at the time of delivery of the financial statements provided for in Sections 7.1(a) and (b), a certificate of the Company substantially in the form of Exhibit L demonstrating the adjustments made to Consolidated Net Income pursuant to subsection (iii) of Consolidated Net Income.",officers-certificate
Officer’s Certificate. Each Monthly Report delivered pursuant to Section 9.01 shall be accompanied by a certificate of a Servicing Officer certifying the accuracy of the Monthly Report.,officers-certificate
"Officer’s Certificate. Public Company shall have received an officers’ certificate duly executed by each of the Chief Executive Officer and Chief Financial Officer of Merger Partner to the effect that the conditions of Sections 7.2(a), (b) and (c) have been satisfied.",officers-certificate
"Officer’s Certificate. Parent shall have received a certificate from the Company (the “Officer’s Certificate”), validly executed by the Chief Executive Officer of the Company for and on the Company’s behalf, to the effect that, as of the Closing the conditions set forth in Sections 6.2(a), 6.2(b) and 6.2(c) have been satisfied.",officers-certificate
"Officer’s Certificate. Whenever the number of shares of Common Stock issuable upon exercise of this Warrant or the Exercise Price shall be adjusted as required by the provisions hereof, the Company shall forthwith file in the custody of its Secretary at its principal office, an officer’s certificate showing the adjusted number of shares of Common Stock or Exercise Price determined as herein provided and setting forth in reasonable detail the facts requiring such adjustment. Each such officer’s certificate shall be made available at all reasonable times for inspection by the Holder(s) and the Company shall, forthwith after each such adjustment, deliver a copy of such certificate to the Holder(s). Such certificate shall be conclusive as to the correctness of such adjustment.",officers-certificate
"Officer’s Certificate. An Officer's Certificate dated the First Closing Date and signed by an executive officer of the Company confirming the accuracy of the Company's representations, warranties and covenants as of such First Closing Date and confirming the compliance by the Company with the conditions precedent set forth in this Section 4.1 as of the First Closing Date;",officers-certificate
"Officer’s Certificate. A certificate dated the applicable Closing Date, signed by (1) the Chief Executive Officer and (2) the Chief Financial Officer, on behalf of the Company, to the effect that (a) the representations and warranties set forth in Section 4 hereof are true and correct with the same force and effect as though expressly made at and as of the applicable Closing Date, (b) the Company has performed and complied with all agreements and satisfied all conditions on its part to be performed or satisfied at or prior to the applicable Closing Date, (c) at the applicable Closing Date, since the date hereof or since the date of the most recent financial statements in the Time of Sale Document and the Final Offering Memorandum (exclusive of any amendment or supplement thereto after the date hereof), no event or events have occurred, no information has become known nor is the officer aware that any condition exists that, individually or in the aggregate, would have a Material Adverse Effect, (d) since the date of the most recent financial statements in the Time of Sale Document and the Final Offering Memorandum (exclusive of any amendment or supplement thereto after the date hereof), other than as described in the Time of Sale Document and the Final Offering Memorandum or contemplated hereby, neither the Company nor any Subsidiary has incurred any liabilities or obligations, direct or contingent, not in the ordinary course of business, that are material to the Company and the Subsidiaries, taken as a whole, or entered into any transactions not in the ordinary course of business that are material to the business, condition (financial or otherwise) or results of operations or prospects of the Company and the Subsidiaries, taken as a whole, and there has not been any change in the capital stock or long-term indebtedness of the Company or any Subsidiary of the Company that is material to the business, condition (financial or otherwise) or results of operations or prospects of the Company and the Subsidiaries, taken as a whole, and (e) the sale of the Securities has not been enjoined (temporarily or permanently).",officers-certificate
Officer’s Certificate. Any certificate signed by any duly authorized officer of the Company and delivered to you or to Representative Counsel on the Closing Date or on the Option Closing Date shall be deemed a representation and warranty by the Company to the Underwriters as to the matters covered thereby.,officers-certificate
"Officer’s Certificate. The Placement Agent shall receive a certificate of the Company, signed by the Chief Executive Officer and Chief Financial Officer thereof, that the representations and warranties contained in Section 2 hereof are true and accurate in all material respects at such Closing with the same effect as though expressly made at such Closing.",officers-certificate
"Officer’s Certificate. The Administrative Agent shall have received a certificate executed by a Responsible Officer of the Company as of the Closing Date stating that immediately after giving effect to this Credit Agreement, the other Credit Documents, and all the transactions contemplated therein to occur on such date, (i) no Default or Event of Default exists, (ii) all representations and warranties contained herein and in the other Credit Documents are true and correct, and (iii) the Company is in compliance with each of the financial covenants set forth in Section 6.6, as demonstrated by covenant calculations on a schedule attached thereto.",officers-certificate
"Officer’s Certificate. A certificate of the Company signed by an Authorized Officer of the Company, dated the date hereof stating that (A) all representations and warranties of the Borrowers set forth in the Credit Agreement are true and correct in all material respects (unless any such representation or warranty is qualified to materiality, in which case such representation or warranty is true and correct in all respects), except for representations and warranties made as of a specified date (which were true and correct in all material respects, as applicable, as of such date), (B) the Borrowers are in compliance with each of the covenants and conditions hereunder, and (C) no Event of Default or Potential Default exists.",officers-certificate
"Officer’s Certificate. At the Closing Time (and, if any Option Securities are purchased, at the Date of Delivery), there shall not have been, since the date hereof or since the respective dates as of which information is given in the Prospectus or the General Disclosure Package, (i) any downgrading, nor shall any notice have been given of any intended or potential downgrading or of any review for a possible change that does not indicate the direction of the possible change, in the rating according any of the Company’s securities by any “nationally recognized statistical rating organization,” as such term is defined for purposes of Section 3(a)(62) of the 1934 Act, (ii) any adverse change, or any development involving a prospective adverse change, in the condition, financial or otherwise, or in the earnings, assets, business affairs, business prospects, or operations of the Company and its subsidiaries, taken as a whole, or in the fee, ground lease, and mortgage interests, in the properties which the Company and its subsidiaries will own and/or operate as of the Closing Time or the Date of Delivery, as applicable, whether or not arising in the ordinary course of business, which would be material to the Company and its subsidiaries, taken as a whole, (iii) transactions or acquisitions entered into by the Company or any of its subsidiaries, other than those in the ordinary course of business which would reasonably be expected to be material to the Company and its subsidiaries, taken as a whole, (iv) any dividend or distribution of any kind, declared, paid or made by the Company on any class of its capital stock, or (v) any change in the capital stock of the Company or the issued and outstanding membership units of the Operating Partnership or any increase in indebtedness of Company or any of its subsidiaries or in the indebtedness encumbering the properties which the Company and its subsidiaries will own and/or operate as of the Closing Time or the Date of Delivery, as applicable, which would reasonably be expected to have a Material Adverse Effect, and the Underwriter shall have received a certificate of the President or a Vice President of the Company and of the chief financial or chief accounting officer of the Company, dated as of the Closing Time (and, if any Option Securities are purchased, such a certificate dated as of the Date of Delivery), to the effect that (a) the statements above are true and correct as of the Closing Time or the Date of Delivery, as applicable, (b) th...",officers-certificate
"Officer’s Certificate. The Administrative Agent shall have received a certificate of the chief executive officer or chief financial officer or chief accounting officer of the Borrower certifying, as of the Closing Date, compliance with the conditions set forth in paragraphs (b) and (c) of Section 4.2.",officers-certificate
"Officer’s Certificate. The Company shall furnish to the Placement Agent a certificate signed by the President and Chief Financial Officer of the Company, dated as of each Closing Date, to the effect that:",officers-certificate
"Officer’s Certificate. At least five Business Days before the Company Notice Date, the Company shall deliver an Officers’ Certificate to the Trustee specifying whether the Company desires the Trustee to give the Company Notice required by Section 11.03(a) herein.",officers-certificate
"Officer’s Certificate. At any time and from time to time upon Tenant’s receipt of not less than ten (10) days’ prior written request by Landlord, Tenant shall furnish to Landlord an Officer’s Certificate certifying (a) that this Lease is unmodified and in full force and effect, or that this Lease is in full force and effect as modified and setting forth the modifications; (b) the dates to which the Rent has been paid; (c) whether or not, to the best knowledge of Tenant, Landlord is in default in the performance of any covenant, agreement or condition contained in this Lease and, if so, specifying each such default of which Tenant may have knowledge; and (d) responses to such other questions or statements of fact as Landlord, any ground or underlying lessor, any purchaser or any current or prospective Mortgagee shall reasonably request. Tenant’s failure to deliver such statement within such time shall constitute an acknowledgment by Tenant that (i) this Lease is unmodified and in full force and effect except as may be represented to the contrary by Landlord; (ii) Landlord is not in default in the performance of any covenant, agreement or condition contained in this Lease; and (iii) the other matters set forth in such request, if any, are true and correct. Any such certificate furnished pursuant to this Section may be relied upon by Landlord and any current or prospective Mortgagee, ground or underlying lessor or purchaser of the Premises or any portion thereof.",officers-certificate
