clause_text,clause_type
"Power and Authority. The Company has the Business power and authority to execute, deliver and perform the terms and provisions of each of the Transaction Documents and has taken all necessary Business action to authorize the execution, delivery and performance by it of such Transaction Documents. The Company has duly executed and delivered each of the Transaction Documents, and the Transaction Documents constitute legal, valid and binding obligations of the Company enforceable against the Company in accordance with their respective terms, except to the extent that the enforceability thereof may be limited by applicable bankruptcy, insolvency, reorganization, moratorium or other similar laws generally affecting creditors’ rights and by equitable principles (regardless of whether enforcement is sought in equity or at law).",power-and-authority
"Power and Authority. The execution, delivery and performance of this Loan Agreement and the Note and Security Agreements, executed pursuant thereto by the Borrower or the Borrowing Base Obligors as applicable, have been duly authorized by all requisite action and will not violate any provision of law, any order of any court or other agency of government, the Articles of Incorporation or Bylaws of the Borrower or any Borrowing Base Obligor, any provision of any indenture, agreement or other instrument to which Borrower or any Borrowing Base Obligor is a party, or by which Borrower’s or any Borrowing Base Obligor’s properties or assets are bound, or be in conflict with, result in a breach of, or constitute (with due notice or lapse of time or both) a default under any such indenture, agreement or other instrument, or result in the creation or imposition of any lien, charge or encumbrance of any nature whatsoever upon any of the properties or assets of Borrower or any Borrowing Base Obligor, except for liens and other encumbrances provided for and securing the indebtedness covered by this Loan Agreement.",power-and-authority
"Power and Authority. The Depositor has and will continue to have all requisite limited liability company power and authority to own the Receivables, and the Depositor has and will continue to have all requisite limited liability company power and authority to execute and deliver this Agreement, the initial Designated Servicing Agreement Schedule and each subsequent Designated Servicing Agreement Schedule, each other Transaction Document to which it is a party and any and all other instruments and documents necessary to consummate the transactions contemplated hereby or thereby (collectively, the “Depositor’s Related Documents”), and to perform each of its obligations under this Agreement and under the Depositor’s Related Documents, and to consummate the transactions contemplated hereby and thereby. The execution and delivery of this Agreement by the Depositor, and the execution and delivery of each of the Depositor’s Related Documents by the Depositor, the performance by the Depositor of its obligations hereunder and thereunder, and the consummation of the transactions contemplated hereby and thereby have each been duly authorized by the Depositor and no further limited liability company action or other actions are required to be taken by the Depositor in connection therewith.",power-and-authority
"Power and Authority. Each of the Loan Parties has the requisite power and authority to own its assets and carry on its business and execute and deliver the Loan Documents to which it is a party and to perform its obligations thereunder. The execution, delivery, and performance by each Loan Party of this Agreement and the other Loan Documents to which it is a party and the consummation of the transactions contemplated hereby (a) have been duly authorized by all necessary organizational action of the Loan Parties, (b) do not and will not (i) contravene the terms of any such Person’s organizational documents, (ii) violate any Legal Requirement in any material respect, or (iii) conflict with or result in any breach or contravention of, or the creation of any Lien under (A) the provisions of any material indenture, instrument or agreement to which such Loan Party is a party or is subject, or by which it, or its Property, is bound or (B) any order, injunction, writ or decree of any Governmental Authority or any arbitral award to which such Person or its property is subject.",power-and-authority
"Power and Authority. It has the power and authority to execute and deliver this Agreement and its Related Documents and to perform its obligations pursuant thereto; and the execution, delivery and performance of this Agreement and its Related Documents have been duly authorized by all necessary corporate action.",power-and-authority
"Power and Authority. Such Party has all requisite power and authority to enter into this Amendment and to carry out the transactions contemplated by, and perform its respective obligations under, the Management Agreement as amended by this Amendment.",power-and-authority
"Power and Authority. The execution, delivery and performance by the Borrowers of the Loan Documents have been duly authorized by all necessary corporate actions and do not and will not (a) require any consent or approval of, or filing or registration with, any governmental agency or authority or the stockholders of a Borrower, other than the filing of financing statements as required by the UCC and filings required by the Assignment of Claims Act; (b) contravene a Borrower’s articles or certificate of incorporation, articles or certificate of organization, or bylaws or operating agreement, as applicable; (c) result in a breach of or constitute a default under any material agreement or instrument to which a Borrower is a party or by which it or its material properties may be bound or affected other than those that would not, in any individual case or in the aggregate, have a Material Adverse Effect; (d) result in or require the creation or imposition of any Lien upon or with respect to any of the properties now owned or hereafter acquired by a Borrower, except in favor of the Administrative Agent, for the ratable benefit of the Lenders; or (e) cause a Borrower to be in default under any material law, rule, regulation, order, writ, judgment, injunction, decree, determination or award applicable to the Borrower, except, in the cases of clauses (a), (c) and (e), compliance with, and filings and notices under, the Assignment of Claims Act.",power-and-authority
"Power and Authority. GMAC has the power and authority to execute and deliver this Agreement and the First Step Receivables Assignment and to carry out its terms; GMAC has full power and authority to sell and assign the property to be sold and assigned to CARI and to service the Receivables as provided herein and in the Further Transfer and Servicing Agreements, and has duly authorized such sale and assignment to CARI by all necessary limited liability company action; and the execution, delivery and performance of this Agreement and the First Step Receivables Assignment have been duly authorized by GMAC by all necessary limited liability company action;",power-and-authority
"Power and Authority. It has the power and authority to execute and deliver this Agreement and each other Transaction Document to which it is a party and to carry out their respective terms. It has duly authorized the execution, delivery and performance of this Agreement and each other Transaction Document to which it is a party by all requisite action.",power-and-authority
Power and Authority. Lender has the requisite power and authority to execute and deliver this Agreement and to perform its obligations under this Agreement.,power-and-authority
"Power and Authority. Borrower has full power and authority to borrow the indebtedness evidenced by the Note and to incur the Loan Obligations provided for herein, all of which have been authorized by all proper and necessary action. All consents, approvals authorizations, orders or filings of or with any court or governmental agency or body, if any, required for the execution, delivery and performance of the Loan Documents by Borrower have been obtained or made.",power-and-authority
"Power and Authority. The Adviser has full power and authority to enter into this Agreement, the Advisory Agreement and the Accounting Agreement; the execution and delivery of, and the performance by the Adviser of its obligations under this Agreement, the Advisory Agreement and the Accounting Agreement have been duly and validly authorized by the Adviser; and this Agreement, the Advisory Agreement and the Accounting Agreement have been duly executed and delivered by the Adviser and constitute the valid and legally binding agreements of the Adviser, enforceable against the Adviser in accordance with their terms, except as rights to indemnity and contribution may be limited by federal or state securities laws and subject to the qualification that the enforceability of the Adviser’s obligations hereunder and thereunder may be limited by bankruptcy, insolvency, reorganization, moratorium, fraudulent conveyance and other laws relating to or affecting creditors’ rights generally and by general equitable principles.",power-and-authority
"Power and Authority. Purchaser has the necessary corporate power and authority to execute and deliver this Agreement and the other Operative Agreements to which it is a party and to perform its obligations hereunder and thereunder and to consummate the transactions contemplated hereby and thereby. The execution and delivery by Purchaser of this Agreement and the other Operative Agreements to which it is a party, and the performance by Purchaser of its obligations hereunder and thereunder, have been duly and validly authorized by all necessary corporate action. This Agreement and the other Operative Agreements to which Purchaser is a party (when such other Operative Agreements are executed and delivered by Purchaser) have been duly and validly executed and delivered by Purchaser and constitute legal, valid and binding obligations of Purchaser enforceable against Purchaser in accordance with their respective terms, in each case subject to applicable bankruptcy, insolvency, reorganization, moratorium and other laws relating to or affecting creditors’ rights and to general equity principles.",power-and-authority
"Power and Authority. The Borrower has the corporate power and the authority to execute and deliver the Credit Documents to which it is a party and to carry out their respective terms; and the execution, delivery and performance of each Credit Document to which it is a party have been duly authorized by the Borrower by all necessary corporation action.",power-and-authority
"Power and Authority. To facilitate the Adviser’s performance of these undertakings, but subject to the restrictions contained herein, the Company hereby delegates to the Adviser, and the Adviser hereby accepts, the power and authority on behalf of the Company to effectuate its investment decisions for the Company, including the execution and delivery of all documents relating to the Company’s investments and the placing of orders for other purchase or sale transactions on behalf of the Company. In the event that the Company determines to acquire debt financing, the Adviser shall arrange for such financing on the Company’s behalf, subject to the oversight and approval of the Board.",power-and-authority
"Power and Authority. The Company has all requisite limited liability company power and authority to execute and deliver this Agreement and each other Transaction Agreement to which it is party and to perform its obligations hereunder and thereunder and to consummate the transactions contemplated hereby and thereby. The execution and delivery by the Company of this Agreement and each other Transaction Agreement to which it is a party, and the consummation of the transactions contemplated hereby and thereby, have been duly and validly authorized by all necessary action on the part of the Company, and no other or further action or proceeding on the part of the Company is necessary to authorize the execution and delivery by the Company of this Agreement and the consummation by the Company of the transactions contemplated hereby. This Agreement has been duly and validly executed and delivered by the Company and, assuming the due and valid authorization, execution and delivery of this Agreement by Merger Sub, Parent and each Seller, constitutes a valid and binding obligation of the Company, enforceable against it in accordance with its terms and conditions, subject to the Bankruptcy Exception.",power-and-authority
"Power and Authority. Borrower is duly authorized and empowered to create and issue the Notes; and Borrower and each Guarantor is duly authorized and empowered to execute, deliver and perform their respective Loan Documents, including this Agreement; and all corporate action on Borrower's and each Guarantor's part requisite for the due creation and issuance of the Notes and for the due execution, delivery and performance of the Loan Documents, including this Agreement, has been duly and effectively taken.",power-and-authority
"Power and Authority. Case Credit has the power and authority to execute and deliver this Agreement and to carry out its terms; Case Credit has full power and authority to sell and assign the property to be sold and assigned to CNHCR hereby and has duly authorized such sale and assignment to CNHCR by all necessary corporate action; and the execution, delivery and performance of this Agreement have been, and the execution, delivery and performance of each Case Subsequent Transfer Assignment have been or will be on or before the related Subsequent Transfer Date, duly authorized by Case Credit by all necessary corporate action.",power-and-authority
"Power and Authority. The Servicer has the power and authority as a limited liability company to execute and deliver this Agreement and to carry out its terms; and the execution, delivery and performance of this Agreement has been duly authorized by the Servicer by all necessary action as a limited liability company.",power-and-authority
"Power and Authority. It has full power, authority and legal right to execute, deliver and perform its obligations as Issuer under this Indenture and the Notes (the foregoing documents, the “Issuer Documents”) and under each of the other Transaction Documents to which the Issuer is a party.",power-and-authority
"Power and Authority. It has the power, authority and legal right to execute and deliver this Agreement and the other Transaction Documents to which it is a party and to perform its obligations hereunder and thereunder; has full power, authority and legal right to grant to the Collateral Agent, for the benefit of the Secured Parties, a valid and enforceable security interest in the Collateral Obligations and the other Collateral and has duly authorized such grant by all necessary action.",power-and-authority
"Power and Authority. The Selling Stockholder has all requisite power and authority to enter into and to carry out all of the terms of this Agreement and all other documents executed and delivered in connection herewith (collectively, the ""Documents""). All individual action on the part of the Selling Stockholder necessary for the authorization, execution, delivery and performance of the Documents by the Selling Stockholder has been taken and no further authorization on the part of the Selling Stockholder is required to consummate the transactions provided for in the Documents. When executed and delivered by the Selling Stockholder, the Documents shall constitute the valid and legally binding obligation of the Selling Stockholder enforceable in accordance with their respective terms.",power-and-authority
"Power and Authority. The Offeror has the requisite corporate power and authority to enter into this Agreement and to carry out its obligations hereunder. This Agreement has been duly executed and delivered by the Offeror and constitutes the legal, valid and binding obligation of the Offeror enforceable against it in accordance with its terms, subject to bankruptcy and insolvency and other laws affecting the enforcement of creditors’ rights generally and subject to the qualification that equitable remedies may only be granted in the discretion of a court of competent jurisdiction.",power-and-authority
"Power and Authority. Manager has the requisite corporate power and authority to execute and deliver this Agreement and to provide the Services, whether by itself or through authorized service providers. All corporate action on the part of Manager necessary to approve or to authorize the execution and delivery of this Agreement and the performance of the transactions contemplated hereby to be performed by it has been duly taken. This Agreement is a valid and binding agreement enforceable against Manager in accordance with its terms, subject to the effect of principles of equity and the applicable bankruptcy, insolvency or other similar laws, now or hereafter in effect, affecting creditors’ rights generally and other customary qualifications.",power-and-authority
"Power and Authority. The execution, delivery and performance of this Agreement have been duly authorized by all necessary action on the part of the Servicer under its organizational or governing documents and laws.",power-and-authority
"Power and Authority. The Purchaser has full power and --------------------- authority to execute, deliver and perform this Agreement and the Other Agreements.",power-and-authority
"Power and Authority. (a) It has the power to enter into, perform and deliver, and has taken all necessary action to authorise:",power-and-authority
"Power and Authority. The Borrower has the power and authority, and the legal right, to execute and deliver this Note and to perform its obligations hereunder.",power-and-authority
"Power and Authority. The Company Shareholder has all requisite power and authority, or legal capacity, as the case may be, to enter into and to carry out all of the terms of this Agreement and all other documents executed and delivered in connection herewith (collectively, the “Documents”). Any action on the part of the Company Shareholder necessary for the authorization, execution, delivery and performance of the Documents by the Company Shareholder has been taken and no further authorization on the part of the Company Shareholder is required to consummate the transactions provided for in the Documents. When executed and delivered by the Company Shareholder, the Documents shall constitute the valid and legally binding obligation of the Company Shareholder enforceable in accordance with their respective terms, subject to bankruptcy, moratorium, principles of equity and other limitations limiting the rights of creditors generally. Each Company Shareholder who is a natural person is over the age of 21, has not been declared incompetent, and has the right to execute, deliver and perform this Agreement without the consent or joinder of any other person or entity.",power-and-authority
"Power and Authority. Each of the Loan Parties has the requisite power and authority (i) to execute, deliver and perform each of the Loan Documents which are to be executed by it as required by this Agreement and the other Loan Documents and (ii) to file the Loan Documents which must be filed by it as required by this Agreement, the other Loan Documents or otherwise with any Governmental Authority.",power-and-authority
"Power and Authority. The Company has all requisite corporate power and authority, and has taken all corporate action necessary, to execute, deliver and perform this Warrant Agreement, to grant, issue, and deliver the Warrants and to authorize and reserve for issuance and, upon payment from time to time of the Exercise Price, to issue and deliver the shares of Common Stock or other securities issuable upon exercise of the Warrants. This Warrant Agreement has been duly executed and delivered by the Company.",power-and-authority
"Power and Authority. Seller has the legal power, right and authority to enter into this Agreement and to consummate the transactions contemplated hereby.",power-and-authority
"Power and Authority. Tenant guarantees, warrants and represents that the individual or individuals signing this Work Letter have the power, authority and legal capacity to sign this Work Letter on behalf of and to bind all entities, corporations, partnerships, limited liability companies, joint venturers or other organizations and entities on whose behalf said individual or individuals have signed.",power-and-authority
"Power and Authority. (a) Each Obligor has power to enter into, perform and deliver and comply with its obligations under, and has taken all necessary action to authorise its entry into, performance and delivery of each Transaction Document to which it is or is to be a party and the transactions contemplated by those Transaction Documents.",power-and-authority
"Power and Authority. Dentist has the legal capacity to enter into and perform this Agreement and the other agreements to be executed and delivered in connection herewith. This Agreement and all agreements and documents executed and delivered in connection herewith have been, or will be as of the Closing Date, duly executed and delivered by Dentist and constitute or will constitute the legal, valid and binding obligations of Dentist in accordance with their respective terms, except as may be limited by applicable bankruptcy, insolvency or similar laws affecting creditors' rights generally or the availability of equitable remedies. The execution and delivery of this Agreement, and the agreements executed and delivered pursuant to this Agreement or to be executed and delivered on the Closing Date, do not, and, subject to the receipt of consents described on EXHIBIT 2.4, the consummation of the actions contemplated hereby will not, result in the acceleration of, any obligation under any mortgage, lien, lease, agreement, rent, instrument, order, arbitration award, judgment or decree to which Dentist is a party or by which Dentist is bound, or violate any material restrictions of any kind to which Dentist is subject, or result in any lien or encumbrance on any of Dentist's assets or the Assets.",power-and-authority
"Power and Authority. It has the power to enter into, perform and deliver, and has taken all necessary action to authorise its entry into, performance and delivery of, the Transaction Documents to which it is a party and the transactions contemplated by those Transaction Documents, and no limit on its powers will be exceeded as a result of the borrowing, grant of security, or giving of guarantees or indemnities contemplated by the Transaction Documents to which it is a party.",power-and-authority
"Power and Authority. Buyer has all requisite power and authority to carry on its business as presently conducted, to enter into this Agreement and each of the documents contemplated to be executed by Buyer at Closing, and to perform its obligations under this Agreement and under such documents. The consummation of the transaction contemplated by this Agreement and each of the documents contemplated to be executed by Buyer at Closing will not violate, nor be in conflict with: (i) any provision of Buyer’s organizational or governing documents, (ii) any agreement or instrument to which Buyer is a party or is bound, or (iii) any judgment, decree, order, statute, rule or regulation applicable to Buyer.",power-and-authority
"Power and Authority. It has the power to enter into and perform, and has taken all necessary partnership action to authorise its entry into, performance and delivery of this Bond Agreement and any other Finance Document to which it is a party and the transactions contemplated by those Finance Documents. This Bond Agreement and any other Finance Document to which it is a party constitute (or will constitute, when executed by the respective parties thereto) legal, valid and binding obligations of the Issuer, enforceable in accordance with their terms, and (save as provided for therein) no further registration, filing, payment of Tax or fees or other formalities are necessary to render the said documents enforceable against the Issuer.",power-and-authority
"Power and Authority. The SUBI Trustee has full power, authority and right to execute, deliver and perform this Transaction SUBI Supplement and has taken all necessary action to authorize the execution, delivery and performance by it of this Transaction SUBI Supplement.",power-and-authority
"Power and Authority. The Company shall have the power and authority to take any and all actions necessary, appropriate, proper, advisable, incidental or convenient to accomplish or for the furtherance of the purposes set forth in this Article.",power-and-authority
"Power and Authority. The Company has the power and authority to execute and deliver this Agreement, to perform its obligations hereunder and to consummate the transactions contemplated hereby. The Company has taken all action necessary to authorize its execution and delivery of this Agreement, the performance of its obligations hereunder and the consummation of the transactions contemplated hereby. This Stock Purchase Agreement has been approved by the Board of Directors of the Company, pursuant to a unanimous written consent.",power-and-authority
