clause_text,clause_type
"Power and Authority. The Transferor has the power and authority to execute and deliver this Agreement and to carry out its terms; the Transferor has full power and authority to sell and assign the property sold and assigned to the Purchaser and has duly authorized such sale and assignment to the Purchaser by all necessary corporate or other action; the execution, delivery, and performance of this Agreement have been duly authorized by the Transferor by all necessary corporate or other action, do not require any approval or any consent of any Person, do not conflict with any material provision of the Articles of Incorporation or bylaws of the Transferor, and do not and will not conflict with or result in a breach which would constitute a material default under any agreement for borrowed money binding upon or applicable to it or such of its property which is material to it, or any law or governmental regulation or court decree applicable to it or such material property, and this Agreement is the legal, valid and binding obligation of the Transferor enforceable in accordance with its terms except as the same may be limited by insolvency, bankruptcy, reorganization or other laws relating to or affecting the enforcement of creditors' rights or by general equity principles.",power-and-authority
"Power and Authority. The Buyer has the full power and authority to execute, deliver and perform this Agreement. This Agreement, when executed and delivered by the Buyer, will constitute a valid and legally binding obligation of the Buyer, enforceable in accordance with its terms.",power-and-authority
Power and Authority. Owner has the power to enter into this Agreement and to perform its obligations hereunder and all such actions have been duly authorized by all necessary proceedings on its part.,power-and-authority
"Power and Authority. Each StoneMor Entity that owns or holds properties or conducts business in the States of Delaware, Florida or New Jersey, or the Commonwealth of Pennsylvania, has all requisite corporate, limited liability company or partnership, as the case may be, power and authority necessary to own or hold such properties, to be liable for its obligations and to conduct such business under the laws of such jurisdiction, in each case, in all material respects as described in the General Disclosure Package and Prospectus.",power-and-authority
"Power and Authority. The Company has the full company power and authority to carry on its business as now being conducted, and the authority to execute, deliver and perform this Agreement and to carry out its obligations hereunder and otherwise to consummate the transactions contemplated hereby. This Agreement has been duly authorized, executed and delivered by the Company and no other company proceedings on the part of the Company is necessary to authorize this Agreement or to consummate and perform the transactions contemplated hereby. This Agreement is a legal, valid and binding obligation of the Company, enforceable in accordance with its terms, except as enforceability may be limited by bankruptcy, reorganization, insolvency or similar laws and subject to general principles of equity.",power-and-authority
"Power and Authority. PEM has all requisite power and authority to own its interest in the Assets, to carry on its businesses as presently conducted, to execute and deliver this Agreement, and to perform its obligations under this Agreement.",power-and-authority
"Power and Authority. Seller has all requisite power and authority to execute, deliver and perform its obligations under this Agreement and to consummate Transactions.",power-and-authority
"Power and Authority. The Issuer and the Asset SPV has the power and authority to enter into, perform and deliver, and has taken all necessary action to authorise its entry into, and performance and delivery, of the REIT NCD Transaction Documents to which it is or will be a party, and the transactions contemplated by those REIT NCD Transaction Documents.",power-and-authority
"Power and Authority. Merger Sub has the power and authority to execute and deliver this Agreement and the Ancillary Agreements to which it is or will be a party and to perform its obligations hereunder and thereunder. This Agreement and the Ancillary Agreements to which it is or will be a party have been duly executed and delivered by Merger Sub, and constitute the legal, valid and binding obligations of Merger Sub, enforceable against it in accordance with their terms except as such enforceability may be limited by bankruptcy, insolvency, reorganization, moratorium or similar laws affecting creditors’ rights generally and by general principles of equity.",power-and-authority
"Power and Authority. Shire has all requisite corporate power and authority to execute, deliver, and perform this Agreement, and the other Transaction Agreements, and the other agreements and instruments to be executed and delivered by it pursuant hereto and thereto, and to consummate the transactions contemplated herein and therein.",power-and-authority
"Power and Authority. (a) The Company has the requisite corporate power and authority to execute, deliver and perform its obligations under this Agreement and the Voting Agreements and, subject to the Required Company Vote and the filing of the Certificates of Merger with the Secretary of State of the State of Delaware, to consummate the Merger Transactions. Subject to the Required Company Vote, this Agreement and the Merger Transactions have been duly and validly authorized by all necessary corporate action by the Company. This Agreement and the Voting Agreements have been duly and validly executed and delivered by the Company and constitutes a valid and binding agreement of the Company (assuming the due execution and delivery of this Agreement by, or on behalf of, the Other Parties and the due execution and delivery of the Voting Agreements by the other parties thereto), enforceable against it in accordance with its terms (except as such enforceability may be limited by applicable bankruptcy, insolvency, reorganization, moratorium, fraudulent transfer and similar Laws of general applicability relating to or affecting creditors’ rights or by general equity principles (regardless of whether such enforceability is considered in a proceeding in equity or at law) (collectively, “Creditors’ Rights”)).",power-and-authority
"Power and Authority. Purchaser now has, and at Closing will have, the requisite power and authority to enter into and perform the terms of this Agreement. The execution and delivery of this Agreement and the consummation of the transaction contemplated hereby have been duly authorized by all necessary parties and no other proceeding on the part of Purchaser is necessary in order to permit Purchaser to consummate the transaction contemplated hereby. This Agreement has been duly executed and delivered by Purchaser and (assuming valid execution and delivery on the part of Seller) is a legal, valid and binding obligation of Purchaser and enforceable against it in accordance with the terms hereof.",power-and-authority
"Power and Authority. The Borrower has the lawful power to own or lease its properties and to engage in the business it now conducts or proposes to conduct. The Borrower is duly authorized to execute, deliver and perform the terms and provisions of the Loan Documents and to incur the Obligations. All corporate action necessary to authorize the execution, delivery and performance the Loan Documents and to incur the Obligations has been properly taken by the Borrower. The Borrower is and will continue to be duly authorized to borrow hereunder and to perform all of the terms and provisions of the Loan Documents.",power-and-authority
"Power and Authority. Karmoya is a corporation duly organized, validly existing, and in good standing under the laws of the People’s Republic of China, and has the corporate power and authority to carry on its business as now conducted and to own, lease and operate its properties and assets. Karmoya is duly qualified or licensed to transact business as a foreign corporation in good standing in the states of the United States and/or foreign jurisdictions where the character of its assets or the nature or conduct of its business requires it to be so qualified or licensed. Karmoya has all requisite corporate power and authority to execute and deliver this Agreement and each instrument to be executed and delivered by Karmoya in connection with the Closing, to perform its obligations hereunder and thereunder, and to consummate the transactions contemplated hereby. The execution and delivery of this Agreement and each instrument required hereby to be executed and delivered by Karmoya prior to or at the Closing, the performance of its obligations hereunder and thereunder and the consummation by Karmoya of the transactions contemplated hereby have been duly and validly authorized by all necessary corporate action on the part of Karmoya, and no other corporate proceedings on the part of Karmoya are necessary to authorize this Agreement or to consummate the transactions contemplated hereby. This Agreement has been duly and validly executed by Karmoya, and, assuming this Agreement has been duly executed by GTEC, this Agreement constitutes a valid and binding agreement of Karmoya, enforceable against Karmoya in accordance with its terms, subject to bankruptcy, insolvency, fraudulent transfer, reorganization, moratorium and similar laws of general applicability relating to or affecting creditors' rights and to general equity principles.",power-and-authority
Power and Authority. It has all requisite corporate power and authority to execute and deliver the Finance Documents and to carry out and perform its obligations under such Finance Documents and to consummate the transactions contemplated thereby. The entry of the Borrower into this Agreement is for the benefit of the Borrower based upon business considerations and in order to maximize the Borrower's profits.,power-and-authority
"Power and Authority. The Affiliate has full power and authority to execute this Agreement, to make the representations, warranties and covenants herein contained and to perform Affiliate's obligations hereunder.",power-and-authority
Power and Authority. The Buyer has the authority to make and carry out this Contract and to perform its obligations hereunder.,power-and-authority
"Power and Authority. Each party represents and warrants to the other that (i) it has all requisite power and authority to execute and deliver this Agreement and perform its obligations hereunder, (ii) all corporate, board, body politic, or other approvals necessary for its execution, delivery, and performance of this Agreement have been or will be obtained, and (iii) this Agreement constitutes its legal, valid, and binding obligation.",power-and-authority
"Power and Authority. The Servicer has the corporate power and authority to execute and deliver this Agreement and to carry out its terms. The Servicer has duly authorized the execution, delivery and performance of this Agreement by all requisite corporate action. The execution, delivery and performance of this Agreement does not contravene the Servicer's Certificate of Incorporation or by-laws.",power-and-authority
Power and Authority. It has the legal power and authority to execute and deliver this Amendment and perform its obligations hereunder and under the Credit Agreement as amended and otherwise modified hereby.,power-and-authority
"Power and Authority. Guarantor has full power and authority to incur the Guaranty Obligations provided for herein, all of which have been authorized by all proper and necessary action.",power-and-authority
Power and Authority. Debtor has full power and authority to make this agreement.,power-and-authority
"Power and Authority. Such Purchaser has all requisite power, authority and legal right to execute, deliver, enter into, consummate and perform this Agreement and the Loan Documents to which it is a party. The execution, delivery and performance of this Agreement and the Loan Documents to which it is a party by such Purchaser have been duly authorized by all required corporate and other actions. Such Purchaser has duly executed and delivered this Agreement and the Loan Documents to which it is a party, and this Agreement and the Loan Documents to which it is a party constitute the legal, valid and binding obligation of such Purchaser enforceable against such Purchaser in accordance with their respective terms, subject to bankruptcy, insolvency, reorganization, moratorium and other similar laws relating to the rights of creditors generally and subject to the availability of equitable remedies and the application of equitable principles.",power-and-authority
"Power and Authority. The Servicer has the limited liability company power and authority to execute and deliver this Agreement and the Intercreditor Agreement and to carry out the terms of each; and the execution, delivery and performance of this Agreement and the Intercreditor Agreement have been duly authorized by the Servicer by all necessary limited liability company action.",power-and-authority
"Power and Authority. Each of the Backup Servicer and the Collateral Custodian has the corporate power and authority to execute and deliver this Agreement and to carry out its terms. Each of the Backup Servicer and the Collateral Custodian has duly authorized the execution, delivery and performance of this Agreement by all requisite corporate action.",power-and-authority
"Power and Authority. Purchaser has the full organizational power and authority to carry on its business as presently conducted, to own, lease, or otherwise acquire the Acquired Assets, to execute and deliver the Transaction Documents to which Purchaser is or will become a party, to perform its obligations under such Transaction Documents, and to consummate the Contemplated Transactions.",power-and-authority
Power and Authority. Purchaser has full power and authority to enter into this Agreement and to perform all of Purchaser's obligations under this Agreement and that the execution and delivery of this Agreement and the performance by Purchaser of Purchaser's obligations under this Agreement have been duly authorized by all requisite action and no further action or approval is required in order to constitute this Agreement as a binding and enforceable obligation of Purchaser.,power-and-authority
"Power and Authority. Each party executing this Agreement hereby covenants, represents and warrants that such party has full power and authority to execute this Agreement, that no other consents or approvals of any other third parties are required or necessary for this Agreement to be so binding (except as otherwise herein expressly stated) and that this Agreement shall be fully enforceable in accordance with its terms.",power-and-authority
"Power and Authority. Borrower has the full limited liability company power and authority to execute the Loan Documents and to undertake and consummate the transactions contemplated hereby and thereby, and to pay, perform and observe the conditions, covenants, agreements and obligations herein and therein contained; and the Loan Documents have been duly and validly executed by Borrower and constitute the legal, valid and binding obligations of Borrower and are enforceable against Borrower in accordance with their respective terms, except as such enforcement may be qualified or limited by bankruptcy, insolvency or other similar laws affecting creditors’ rights generally and general principles of equity.",power-and-authority
"Power and Authority. Such Person has the requisite power and authority (a) to execute and deliver this Agreement, the Notes and the other Transaction Documents to which it is a party and (b) to perform its obligations under this Agreement, the Notes and the other Transaction Documents to which it is a party.",power-and-authority
"Power and Authority. The Guarantor has the full power and authority to execute, deliver and perform this Guaranty, and to own and lease its properties and to carry on its business as now conducted and as contemplated hereby;",power-and-authority
Power and Authority. Manager has all power and authority necessary or appropriate to execute and deliver this Agreement and in so doing will not violate any Applicable Law or any of its governing documents.,power-and-authority
"Power and Authority. The Company is a corporation duly incorporated, validly existing and in good standing under the laws of the State of Nevada. The Company has the corporate power and authority to execute, deliver and perform all of its obligations under the Agreement, and to issue, sell and deliver the Exchange Securities. The execution, delivery and performance of the Agreement have been duly authorized by all necessary corporate action on the part of the Company and the Agreement has been duly executed and delivered by the Company.",power-and-authority
"Power and Authority. The execution, delivery and performance by the party of this Agreement and the consummation by the party of the transactions contemplated hereby have been duly authorized by all necessary action on the part of the party. This Agreement has been duly and validly executed and delivered by the party and constitutes the valid and binding obligation of the party, enforceable against the party in accordance with its terms, except to the extent that such enforceability (i) may be limited by bankruptcy, insolvency, reorganization, moratorium or other similar laws relating to creditors’ rights generally and (ii) is subject to general principles of equity.",power-and-authority
"Power and Authority. The Company has all corporate power and authority necessary to own, operate or lease its properties and assets and to conduct its business as now conducted by it. The Company has all corporate power and authority necessary to issue the Securities, and to execute, deliver, and perform its obligations under this Agreement (including without limitation Exhibit D hereto) and the Securities (collectively, the ""Transaction Documents"").",power-and-authority
"Power and Authority. Purchaser has the full right, power and authority to enter into and perform its obligations under this Agreement and each of the other Transaction Documents to which it is a party, and this Agreement and each of the other Transaction Documents to which it is a party constitute valid and binding obligations of Purchaser, enforceable in accordance with their terms, subject to applicable bankruptcy, insolvency, reorganization, fraudulent transfer, moratorium or similar Laws affecting creditors’ rights generally and general principles of equity.",power-and-authority
"Power and Authority. The Selling Stockholder has, and on each Closing Date will have, full legal right, power and authority, and all authorization and approval required by law, to enter into this Agreement and to sell, assign, transfer and deliver the Offered Securities to be sold by the Selling Stockholder in the manner provided herein.",power-and-authority
"Power and Authority. Buyer has all requisite power and authority to execute and deliver this Agreement and perform its obligations under this Agreement. The execution and delivery of this Agreement and consummation of the Transaction and the fulfillment of and compliance with the terms and conditions hereof will not violate, or be in conflict with, any material provision of its governing documents or any material provision of any agreement or instrument to which it is a party or by which it is bound, or, to its knowledge, any judgment, decree, order, statute, rule or regulation applicable to it, subject, however, to the approval by the Bankruptcy Court in connection with the Bankruptcy Case.",power-and-authority
"Power and Authority. Each Member that is an entity has the legal power and authority to execute and deliver this Agreement and to perform its obligations hereunder. All acts required to be taken by the Member to enter into this Agreement and to carry out the Transactions have been properly taken. This Agreement constitutes a legal, valid and binding obligation of the Member, enforceable against such Member in accordance with the terms hereof.",power-and-authority
"Power and Authority. The 1998-C Securitization Trustee has full power, authority and right to execute, deliver and perform this 1998-C Securitization Trust Agreement and has taken all necessary action to authorize the execution, delivery and performance by it of this 1998-C Securitization Trust Agreement.",power-and-authority
"Power and Authority. (a) Each Borrower has full power and authority under the law of the state of its organization and under its organizational documents to enter into, execute and deliver and perform the Credit Documents; to borrow monies hereunder, to incur the obligations herein provided for and to pledge and grant to Agent, for the ratable benefit of Lenders, a security interest in the Collateral; and",power-and-authority
"Power and Authority. The Investor has full right, power, authority and capacity to enter into this Agreement and the Registration Rights Agreement and to consummate the transactions contemplated hereby and thereby and has taken all necessary action to authorize the execution, delivery and performance hereof and thereof.",power-and-authority
"Power and Authority. The execution, delivery and performance by Purchaser of this Agreement and the Transaction Documents to which it is a Party and the consummation of the transactions contemplated hereby and thereby are within Purchaser's corporate power and authority and have been duly authorized by all necessary corporate action.",power-and-authority
"Power and Authority. Compass Auto has the power, authority and legal right to execute and deliver this Agreement and to carry out its terms and to sell and assign the Compass Auto Assets; and the execution, delivery and performance of this Agreement has been duly authorized by Seller by all necessary corporate action.",power-and-authority
"Power and Authority. (i) The Company has the requisite corporate power and authority to enter into, execute and deliver this Agreement and any other agreements contemplated herein or in the Plan and, subject to entry of the Confirmation Order and consummation of the Plan, to perform its obligations hereunder, including to cause the Issuer to issue the Subscription Rights and the Rights Offering Securities. The Company has taken all necessary corporate action required for the due authorization, execution, delivery and performance by it of this Agreement and any other agreements contemplated herein or in the Plan, and following the entry of the Confirmation Order will have taken all necessary corporate action required for the issuance of the Subscription Rights and the Rights Offering Securities.",power-and-authority
"Power and Authority. Distributor has the corporate power an authority to enter into and to carry the terms and provisions of this Agreement; and this Agreement is the legal, valid and binding obligation of Distributor and is enforceable against Distributor in accordance with its terms.",power-and-authority
"Power and Authority. Each of the Partnership Parties has all requisite corporate, limited liability company or limited partnership power and authority to execute and deliver this Agreement and to perform its obligations hereunder. Each of the Rice Entities has or had, as applicable, all requisite corporate, limited liability company or limited partnership power and authority to execute and deliver each of the Operative Agreements to which such Rice Entity is a party and to perform its obligations thereunder. The Partnership has or had, as applicable, all requisite limited partnership power and authority to issue, sell and deliver (i) the Units, in accordance with and upon the terms and conditions set forth in this Agreement, the Partnership Agreement, the Registration Statement and the most recent Preliminary Prospectus, and (ii) the General Partner Interest, the Sponsor Units, the Incentive Distribution Rights and any Common Units issued to Rice Midstream Holdings as a part of the Deferred Issuance and Distribution, in accordance with and upon the terms and conditions set forth in the Partnership Agreement and the Contribution Agreement. At each Delivery Date, all corporate, limited partnership or limited liability company action, as the case may be, required to be taken by any of the Rice Entities or any of their respective stockholders, members, partners or unitholders for the authorization, issuance, sale and delivery of the Units, the Sponsor Units, the Incentive Distribution Rights and any Common Units issued to Rice Midstream Holdings as a part of the Deferred Issuance and Distribution, the execution and delivery of the Operative Agreements and the consummation of the Transactions and any other transactions contemplated by this Agreement and the Operative Agreements, shall have been validly taken.",power-and-authority
"Power and Authority. Purchaser has the requisite corporate or other power and authority to enter into this Agreement, to perform its obligations hereunder and to consummate the transactions contemplated hereby. The execution, delivery and performance of this Agreement by Purchaser and the consummation by Purchaser of the transactions contemplated hereby have been duly and validly approved by all necessary corporate or other action and no other proceedings on the part of Purchaser or its shareholders are necessary to authorize the execution, delivery and performance of this Agreement by Purchaser and the consummation by Purchaser of the transactions contemplated hereby.",power-and-authority
