clause_text,clause_type
"Power and Authority. Each of FNB and its subsidiaries has all requisite power and authority (corporate and other) to own, lease and operate its properties and conduct its business as now being conducted, is duly qualified to do business and is in good standing in each other jurisdiction in which the character of the properties owned or leased by it therein or in which the transaction of its business makes such qualification necessary, except where failure so to qualify would not have a Material Adverse Effect (as defined herein) on FNB and its subsidiaries, and is not transacting business, or operating any properties owned or leased by it, in violation of any provision of federal or state law or any rule or regulation promulgated thereunder, which violation would have a Material Adverse Effect on FNB and its subsidiaries. For purposes of this Article III, “Material Adverse Effect” shall mean: (a) with respect to references to FNB, any change in the business of FNB that is or could be materially adverse to the financial condition, results of operations, prospects, business, assets, investments, properties or operations of FNB, or (b) with respect to references to FNB and its subsidiaries, any change in the business of FNB or its subsidiaries that is or could be materially adverse to the financial condition, results of operations, prospects, business, assets, loan portfolio, investments, properties or operations of FNB and its subsidiaries considered as one enterprise.",power-and-authority
"Power and Authority. Seller has all corporate power and authority to enter into and to carry out all of the terms of this Agreement and all other documents executed and delivered in connection herewith, including, but not limited to, those instruments of Transfer described in Section 4 of this Agreement (collectively “Documents”). All corporate action on the part of Seller, its officers, directors and shareholders necessary for the authorization, execution, delivery and performance of the Documents by Seller has been taken and no further corporate or other authorization on the part of Seller is required to consummate the transactions provided for in the Documents. When executed and delivered by Seller, the Documents shall constitute the valid and legally binding obligations of Seller enforceable in accordance with their respective terms. Neither the execution, delivery nor performance of the Documents by Seller shall (i) violate or result in a breach of any provisions of Seller’s articles of incorporation or bylaws, (ii) constitute a default or result in a breach of any contract or agreement to which it is a party or its assets or properties are bound, or (iii) violate any order, writ, injunction, decree, judgment or other restriction of any court, administrative agency or governmental body.",power-and-authority
"Power and Authority. The Shareholder has the legal power, capacity and authority to execute and deliver this Agreement and each Transaction Document to be delivered by it hereunder and to perform its obligations hereunder and thereunder, and to consummate the Transactions. All acts required to be taken by the Shareholder to enter into this Agreement, to deliver each Transaction Document to which it is a party and to carry out the Transactions have been properly taken. This Agreement constitutes a legal, valid and binding obligation of the Shareholder, enforceable against such Shareholder in accordance with the terms hereof.",power-and-authority
"Power and Authority. Buyer has all requisite corporate power and authority to execute and deliver this Agreement and the Ancillary Documents to which it is party, to perform its obligations hereunder and thereunder and to consummate the transactions contemplated hereby and thereby. All acts or proceedings required to be taken by Buyer to authorize the execution and delivery of this Agreement and the Ancillary Documents to which it is party and the performance of Buyer’s obligations hereunder and thereunder have been properly taken.",power-and-authority
"Power and Authority. Assignor represents and warrants to Assignee that it is fully empowered and authorized to execute and deliver this Assignment, and the individual signing this Assignment on behalf of Assignor represents and warrants to Assignee that he or she is fully empowered and authorized to do so.",power-and-authority
"Power and Authority. Manager shall have, and is hereby granted, full power and authority to exercise all functions and perform all duties in connection with the operation and management of the Properties, subject to the right retained by Company to supervise the activities of Manager pursuant to this Agreement. The power and authority of Manager shall include but not be limited to:",power-and-authority
"Power and Authority. Each party warrants and represents that it has full power and authority to enter into and perform this Agreement, and the person signing this Agreement on behalf of such party has been properly authorized and empowered to enter into this Agreement.",power-and-authority
"Power and Authority. It has all requisite corporate, partnership, or limited liability company power and authority to enter into this Agreement and to carry out the transactions contemplated hereby, and to perform its obligations hereunder.",power-and-authority
"Power and Authority. Each Seller has the requisite power and authority to execute and deliver this Agreement, to perform its obligations hereunder and to consummate the transactions contemplated hereby, including the execution, delivery and performance of all of the Transaction Documents to which such Seller is a party.",power-and-authority
"Power and Authority. Lilly has all requisite corporate power and authority to execute, deliver, and perform this Agreement and to consummate the transactions contemplated herein. The execution, delivery, and performance of this Agreement by Lilly does not, and the consummation of the transactions contemplated hereby will not, violate any provisions of Lilly’s organizational documents, bylaws, or any Applicable Law applicable to Lilly, or any material agreement, mortgage, lease, instrument, order, judgment, or decree to which Lilly is a party or by which Lilly is bound.",power-and-authority
"Power and Authority. The Company has all requisite power and authority to execute, deliver and perform its obligations under this Agreement and to consummate the transactions contemplated hereby.",power-and-authority
"Power and Authority. The Borrower has the power to enter into, perform and deliver, and has taken all necessary action to authorise its entry into, performance and delivery of, the Finance Documents and the transactions contemplated thereby.",power-and-authority
"Power and Authority. The Borrower has full legal right, power and authority to carry on its present business, to own its property and assets and to execute, deliver and perform this Credit Agreement, the Note and each other Loan Document to which it is a party. The Borrower is duly qualified or licensed as a foreign corporation authorized to conduct its activities and is in good standing in all jurisdictions in which the character of the properties owned or leased by it or the nature of the activities conducted by it makes such qualification or licensing necessary except where the failure to be so qualified or licensed could not reasonably be expected to have a Material Adverse Effect.",power-and-authority
"Power and Authority. Buyer has the corporate power and authority to execute, deliver and perform this Agreement, and as of the Closing, Buyer will have the corporate power and authority to execute and deliver the Transaction Documents required to be delivered by it to the Sellers at the Closing.",power-and-authority
"Power and Authority. It has full power and authority to make the covenants and representations referred to herein and to sale the Sale Shares and to execute, deliver and perform this Agreement.",power-and-authority
"Power and Authority. Each of the Company and the Partnership has full right, power and authority to execute and deliver this Agreement and to perform its obligations hereunder; and all action required to be taken for the due and proper authorization, execution and delivery by each of them of this Agreement and the consummation by each of them of the transactions contemplated hereby has been duly and validly taken.",power-and-authority
"Power and Authority. Monarch has all requisite corporate power and authority to execute, deliver, and perform this Agreement and the other agreements and instruments to be executed and delivered by it pursuant hereto and to consummate the transactions contemplated herein and therein. The execution, delivery, and performance of this Agreement by Monarch does not, and the consummation of the transactions contemplated hereby will not, violate any provision of Monarch's Articles of Incorporation, Bylaws, any law or regulation applicable to Monarch, or any agreement, mortgage, lease, instrument, order, judgment, or decree to which Monarch is a party or by which Monarch is bound.",power-and-authority
Power and Authority. The Company has all requisite corporate power and authority to enter into and perform its obligations under this Amendment Agreement.,power-and-authority
"Power and Authority. The Company has full corporate power and authority to make, execute, deliver and perform this Agreement and the transactions contemplated hereby.",power-and-authority
Power and Authority. Such party has the legal capacity and all other power and authority necessary to enter into this Agreement and to consummate the transactions contemplated hereby.,power-and-authority
"Power and Authority. Each Loan Party is duly authorized to own and operate its properties, to carry on its business as now conducted and as proposed to be conducted, and to execute, deliver and perform the Loan Documents to which it is a party. The execution, delivery and performance of the Loan Documents by each Loan Party have been duly authorized by all necessary action, and do not (a) require any consent or approval of any holders of Capital Stock of any Loan Party, other than those already obtained; (b) contravene the Organizational Documents of any Loan Party; (c) violate or cause a material default under any Applicable Law or Material Contract; or (d) result in or require the imposition of any Lien (other than Permitted Liens and Liens granted hereunder) on any Property of any Loan Party.",power-and-authority
"Power and Authority. Each party represents and warrants to the other that it is fully empowered and authorized to execute and deliver this Assignment, and the individual signing this Assignment on behalf of such party represents and warrants to the other party that he or she is fully empowered and authorized to do so.",power-and-authority
Power and Authority it has all legal power and authority to enter into this Deed and perform its obligations under this Deed and all action (including any corporate action) required to authorise the execution and delivery of this Deed and the performance of its obligations under this Deed has been duly taken;,power-and-authority
"Power and Authority. PIVOT represents and warrants that (i) PIVOT has all requisite corporate power and authority to execute, deliver, and perform this Agreement and the other agreements and instruments to be executed and delivered by it and to consummate the transactions contemplated herein; (ii) the execution, delivery, and performance of this Agreement by PIVOT does not, and the consummation of the transactions contemplated hereby will not, violate any provisions of PIVOT’s organizational documents, bylaws, any Applicable Law applicable to PIVOT, or any agreement, mortgage, lease, instrument, order, judgment, or decree to which PIVOT is a party or by which PIVOT is bound.",power-and-authority
"Power and Authority. The Purchaser has the power and authority to execute and deliver this Agreement and to perform its obligations hereunder and the execution, delivery and performance of this Agreement have been duly authorized by all necessary action on the part of the Purchaser.",power-and-authority
"Power and Authority. The execution, delivery and performance by such Obligor of this Amendment (i) are within such Obligor’s power and authority; (ii) have been duly authorized by all necessary corporate and shareholder action; (iii) are not in contravention of any provision of such Obligor’s certificate of incorporation or bylaws or other organizational documents; (iv) do not violate any law or regulation, or any order or decree of any Governmental Authority; (v) do not conflict with or result in the breach or termination of, constitute a default under or accelerate any performance required by, any indenture, mortgage, deed of trust, lease, agreement or other instrument to which such Obligor or any of its Subsidiaries is a party or by which such Obligor or any such Subsidiary or any of their respective property is bound; (vi) do not result in the creation or imposition of any Lien upon any of the property of such Obligor or any of its Subsidiaries; and (vii) do not require the consent or approval of any Governmental Authority or any other person.",power-and-authority
"Power and Authority. Such Selling Stockholder has full right, power and authority to execute, deliver and perform its obligations under this Agreement, its Power of Attorney and its Custody Agreement and to sell, transfer and deliver the Securities to be sold by such Selling Stockholder under this Agreement.",power-and-authority
"Power and Authority. Each Borrower has the power and authority under the laws of its jurisdiction of formation and under its respective formation documents to enter into and perform this Seventh Amendment and the other documents and agreements required hereunder (collectively, the “Seventh Amendment Documents”); all necessary actions (corporate or otherwise) for the execution and performance by each Borrower of the Seventh Amendment Documents have been taken; and each of the Seventh Amendment Documents and the Credit Agreement, as amended, constitute the valid and binding obligations of Borrowers, enforceable in accordance with their respective terms.",power-and-authority
Power and Authority. The Seller has the authority to execute and carry out this Contract and to perform its obligations hereunder and all such actions have been duly authorized by all necessary corporate action on its part.,power-and-authority
"Power and Authority. Each of the Loan Parties has all requisite corporate or limited liability company power and authority to enter into this Amendment and to carry out the transactions contemplated by, and to perform its obligations under or in respect of, the Credit Agreement.",power-and-authority
Power and Authority. The Company has the power and authority to execute and deliver this Agreement and consummate the transactions contemplated hereby.,power-and-authority
"Power and Authority. The Borrower has the corporate, company or partnership power, capacity and authority, as the case may be, (i) to enter into, and to exercise its rights and perform its obligations under, the Loan Documents to which it is a party and all other instruments and agreements delivered by it pursuant to any of the Loan Documents, and (ii) to own its Property and carry on its business as currently conducted or as will be conducted after giving effect to the FNL Transaction.",power-and-authority
"Power and Authority. The Depositor has the power and authority to execute and deliver this Agreement and to carry out its terms; and the execution, delivery and performance of this Agreement have been duly authorized by the Depositor by all necessary action. 3 (20[__]-[_] Receivables Purchase Agreement)",power-and-authority
"Power and Authority. Each of the Principal Shareholders has the requisite capacity and authority, and the Company has all requisite corporate or other power and authority to enter into, execute, deliver and perform its respective obligations under, this Agreement and all Company Ancillary Agreements and to consummate the Merger. The execution, delivery and performance by Company of this Agreement, each of the Company Ancillary Agreements and all other agreements, transactions and actions contemplated hereby or thereby have been duly and validly approved and authorized by all necessary corporate action on the part of the Company, subject only to the approval and adoption of this Agreement and the approval of the Merger by Company Shareholders holding a majority of the outstanding Company Common Stock and a majority of the outstanding shares of Company Preferred Stock.",power-and-authority
"Power and Authority. The Servicer has the power and authority to execute and deliver this Agreement and the Trust Sale and Servicing Agreement, to carry out the terms of each such agreement and to service the Accounts in the Pool of Accounts and the Receivables arising therein as provided herein and in the Trust Sale and Servicing Agreement, and the execution, delivery and performance of this Agreement and the Trust Sale and Servicing Agreement have been duly authorized by the Servicer by all necessary corporate action on the part of the Servicer.",power-and-authority
"Power and Authority. (a) Seller has the corporate power and authority to enter into and perform this Agreement. The execution and delivery of this Agreement has been duly authorized by all necessary corporate action by Seller. Upon execution and delivery by both parties, this Agreement will constitute a valid and binding obligation of Seller, enforceable in accordance with its terms, subject to conservatorship, receivership, and a court's right under general principles of equity to refuse to direct specific performance.",power-and-authority
Power and Authority. Such Participant has the requisite power and authority to enter into and perform its obligations under the Operative Documents to which it is a party.,power-and-authority
"Power and Authority. AmeriCredit has all necessary corporate power and authority to conduct its business as currently conducted, to execute, deliver and perform its obligations under this Agreement and each other Transaction Document to which it is a party and to carry out the terms of each such Document and has full power and authority to consummate the Transaction.",power-and-authority
"Power and Authority. The Concessionaire has the power and authority to enter into this Agreement and to do all acts and things and execute and deliver all other documents as are required hereunder to be done, observed or performed by it in accordance with the terms hereof.",power-and-authority
"Power and Authority. Borrower has the requisite power and authority: to own the Mortgaged Property and to carry on its business as now conducted and as contemplated to be conducted in connection with the performance of its obligations under this Loan Agreement and under the other Loan Documents to which it is a party; and to execute and deliver this Loan Agreement and the other Loan Documents to which it is a party, and to carry out the transactions contemplated by this Loan Agreement and the other Loan Documents to which it is a party.",power-and-authority
"Power and Authority. First Union has the corporate power and authority to execute and deliver this Agreement, any Subsequent Transfer Agreement and any other Transaction Document to which it is a party, and to carry out their respective terms; and the execution, delivery, and performance of this Agreement and any other Transaction Document to which it is a party, has been duly authorized by First Union by all necessary corporate action;",power-and-authority
"Power and Authority. The Company has all requisite corporate power and authority to execute and deliver this Agreement, to perform its obligations hereunder and to consummate the transactions contemplated by this Agreement. The execution, delivery and performance of this Agreement by the Company and the consummation by the Company of the transactions contemplated by this Agreement have been duly and validly authorized by all necessary corporate action on the part of the Company, and no other corporate proceedings on the part of the Company and no stockholder votes are necessary to authorize this Agreement or to consummate the transactions contemplated hereby, except, in the case of the Merger, the receipt of the Requisite Company Vote, if required by Applicable Law, and except for the filing of the Certificate of Merger with the Secretary of State of the State of Delaware in accordance with the DGCL. The affirmative vote of the holders of at least a majority in voting power of the shares of Company Common Stock outstanding on the record date of the Stockholders Meeting, voting together as a single class, to adopt this Agreement (the “Requisite Company Vote”), if required by Applicable Law, is the only vote of the holders of any class or series of the Company’s capital stock necessary to adopt this Agreement, approve the Merger and consummate the Merger and the other Transactions. This Agreement has been duly executed and delivered by the Company and, assuming due execution and delivery by Parent and Merger Sub, constitutes the legal, valid and binding obligation of the Company enforceable against the Company in accordance with its terms, except as such enforceability may be limited by bankruptcy, insolvency (including all Applicable Laws related to fraudulent transfers), reorganization, moratorium and other similar Applicable Laws affecting creditors rights generally and by general principles of equity.",power-and-authority
"Power and Authority. Such Member has all requisite power and authority to enter into this Agreement and to carry out its obligations hereunder. The execution, delivery and performance by such Member of this Agreement have been duly authorized by all requisite action on the part of such Member, and no other action or proceeding on the part of such Member or any Affiliate thereof is necessary to consummate the transactions contemplated by this Agreement.",power-and-authority
"Power and Authority. Each party hereto respectively represents and warrants that such party has full power and authority to enter into this Agreement and that, upon request of the Company, each Shareholder will execute any additional documents necessary in connection with the enforcement hereof.",power-and-authority
"Power and Authority. Except for such consents of Authorities as may ------------------- be necessary in connection with change-of-control transactions with respect to Governmental Authorities listed in Section 3.1(c) of the Disclosure Schedule, each of VIALOG and VIALOG Merger Subsidiary has all requisite power and authority (corporate and other) and has in full force and effect all Governmental Authorizations and Private Authorizations in order to enable it to execute and deliver, and to perform its obligations under, this Agreement and each Collateral Document executed or required to be executed pursuant hereto or thereto and to consummate the Merger and the Transactions. The execution, delivery and performance of this Agreement and each Collateral Document executed or required to be executed pursuant hereto or thereto have been duly authorized by all requisite corporate or other action. This Agreement has been duly executed and delivered by each of VIALOG and VIALOG Merger Subsidiary and constitutes, and each Collateral Document executed or required to be executed pursuant hereto or thereto when executed and delivered by it will constitute, legal, valid and binding obligations of VIALOG and VIALOG Merger Subsidiary, respectively, enforceable in accordance with their respective terms, except as such enforceability may be subject to bankruptcy, moratorium, insolvency, reorganization, arrangement, voidable preference, fraudulent conveyance and other similar laws relating to or affecting the rights of creditors and except as the same may be subject to the effect of general principles of equity.",power-and-authority
"Power and Authority. It has the power and authority to execute and deliver this Agreement and the Performance Guaranty and to perform its obligations hereunder and thereunder; and the execution, delivery and performance of this Agreement and the Performance Guaranty, and the consummation by it of the transactions provided for or contemplated thereby, have been duly authorized by it by all necessary corporate action.",power-and-authority
"Power and Authority. The Titling Trust has the power and authority to execute and deliver the Basic Documents to which it is a party and to perform its obligations thereunder and the execution, delivery and performance of the Basic Documents to which it is a party have been duly authorized by the Titling Trust.",power-and-authority
"Power and Authority. The City Council has (i) duly adopted an ordinance authorizing the Transaction, which remains in full force and effect, (ii) duly authorized and approved the execution and delivery of this Agreement and (iii) duly authorized and approved the performance by the City of its obligations contained in this Agreement. The City has the power and authority to enter into this Agreement and to do all acts and things and execute and deliver all other documents as are required hereunder to be done, observed or performed by it in accordance with the terms hereof.",power-and-authority
