clause_text,clause_type
"Procedure. A Party (the “Indemnitee”) that intends to claim indemnification under this Article 16 shall promptly provide notice to the other Party (the “Indemnitor”) of any Liability or action in respect of which the Indemnitee intends to claim such indemnification, which notice shall include a reasonable identification of the alleged facts giving rise to such Liability, and the Indemnitor shall have the right to participate in, and, to the extent the Indemnitor so desires, jointly with any other Indemnitor similarly noticed, to assume the defense thereof with counsel selected by the Indemnitor; provided, however, that the Indemnitee shall have the right to retain its own counsel, with the fees and expenses to be paid by the Indemnitor, if representation of such Indemnitee by the counsel retained by the Indemnitor would be inappropriate due to actual or potential differing interests between such Indemnitee and any other Party represented by such counsel in such proceedings. Any settlement of a Liability for which any Indemnitee seeks to be reimbursed, indemnified, defended or held harmless under this Article 16 shall be subject to prior consent of such Indemnitee, such consent shall be withheld unreasonably.",procedure
"Procedure. Upon receipt by an Indemnified Person of actual notice of an action against such Indemnified Person with respect to which indemnity may reasonably be expected to be sought under this Agreement, such Indemnified Person shall promptly notify the Company in writing; provided that failure by any Indemnified Person so to notify the Company shall not relieve the Company from any obligation or liability which the Company may have on account of this Section 9 or otherwise to such Indemnified Person, except to the extent (and only to the extent) that its ability to assume the defense is actually impaired by such failure or delay. The Company shall, be entitled to participate therein and, to the extent that it shall wish, jointly with any other indemnifying person similarly notified, assume the defense of any such action (including the employment of counsel and reasonably satisfactory to the Placement Agent) and, after notice from the Company to such Indemnified Person of its election so to assume the defense thereof, the Company shall not be liable to such Indemnified Person for any legal expenses of other counsel or any other expenses, in each case subsequently incurred by such Indemnified Person, in connection with the defense thereof other than reasonable costs of investigation. Any Indemnified Person shall have the right to employ separate counsel in any such action and participate in the defense thereof, but the fees and expenses of such counsel shall be at the expense of such Indemnified Person unless and only to the extent that: (i) the Company has failed promptly to assume the defense and employ counsel for the benefit of the Placement Agent and the other Indemnified Persons or (ii) such Indemnified Person shall have been advised that in the opinion of counsel that there is an actual or potential conflict of interest that prevents (or makes it imprudent for) the counsel engaged by the Company for the purpose of representing the Indemnified Person, to represent both such Indemnified Person and any other person represented or proposed to be represented by such counsel, it being understood, however, that the Company shall not be liable for the expenses of more than one separate counsel (together with local counsel), representing the Placement Agent and all Indemnified persons who are parties to such action. The Company shall not be liable for any settlement of any action effected without its written consent (which shall not be unreasonably withheld). In additi...",procedure
Procedure. All presentations shall be short and concise and are to include a comprehensive opening statement. The parties shall make limited use of authorities during their presentations.,procedure
"Procedure. If after such reasonable period such general counsels are unable to settle such Agreement Dispute (and in any event after 60 days have elapsed from the time the relevant parties began such negotiations), such Agreement Dispute shall be determined, at the request of any relevant party, by arbitration conducted in New York City, before and in accordance with the then-existing Rules for Commercial Arbitration of the American Arbitration Association (the ""Rules""), and any judgment or award rendered by the arbitrator shall be final, binding and nonappealable (except upon grounds specified in 9 U.S.C. ss. 10(a) as in effect on the date hereof), and judgment may be entered by any state or federal court having jurisdiction thereof in accordance with Section 6.16 hereof. Unless the arbitrator otherwise determines, the pre-trial discovery of the then-existing Federal Rules of Civil Procedure and the then-existing Rules 46 and 47 of the Civil Rules for the United States District Court for the Southern District of New York shall apply to any arbitration hereunder. Any controversy concerning whether an Agreement Dispute is an arbitrable Agreement Dispute, whether arbitration has been waived, whether an assignee of this Agreement is bound to arbitrate, or as to the interpretation of enforceability of this Article V shall be determined by the arbitrator. The arbitrator shall be a retired or former judge of any United States District Court or Court of Appeals or such other qualified person as the relevant parties may agree to designate, provided, however, such individual has had substantial professional experience with regard to settling sophisticated commercial disputes. The parties intend that the provisions to arbitrate set forth herein be valid, enforceable and irrevocable. The designation of a situs or a governing law for this Agreement or the arbitration shall not be deemed an election to preclude application of the Federal Arbitration Act, if it would be applicable. In his or her award the arbitrator shall allocate, in his or her discretion, among the parties to the arbitration all costs of the arbitration, including, without limitation, the fees and expenses of the arbitrator and reasonable attorneys' fees, costs and expert witness expenses of the parties. The undersigned agree to comply with any award made in any such arbitration proceedings that has become final in accordance with the Rules and agree to the entry of a judgment in any jurisdiction upon any award ...",procedure
"Procedure. Upon the threat or filing of any Third Party Claim, the Indemnified Party shall promptly notify the Indemnifying Party thereof and shall give information and reasonable assistance in the defense or settlement of such Third Party Claim, and the Indemnifying Party shall have the right to, at its own cost, handle and control the defense of such Third Party Claim, except as expressly provided herein; provided, however, that if the Indemnifying Party exercises its right to, at its own cost, handle and control the defense of a Third Party Claim, then the Indemnified Party may, at its own expense, retain such additional attorneys as it may deem necessary. The Indemnified Party’s attorneys will be permitted by the Indemnifying Party and their attorneys to reasonably observe the defense of such Third Party Claim, and the Indemnifying Party shall keep such Indemnified Party informed of actions taken in respect thereof. The Indemnifying Party shall have the right, after consultation with the Indemnified Party, to resolve and settle any such Third Party Claim; provided that, in no event may the Indemnifying Party compromise or settle any such Third Party Claim in a manner which admits fault or negligence on the part of any Indemnified Party or includes injunctive relief or includes the payment of money or other property by any Indemnified Party or diminishes or has a material adverse effect on the rights or interests of any Indemnified Party without the prior written consent of each such Indemnified Party. If a settlement contains an absolute waiver of liability for the Indemnified Party, then the Indemnified Party’s consent shall be deemed given. Notwithstanding anything to the contrary, in the event that Receptos is the Indemnifying Party and AbbVie is the Indemnified Party with respect to a given Third Party Claim for which the reasonably foreseeable Losses exceed the resources of Receptos and its Affiliates (an “Exceptional Claim”), then AbbVie shall handle and control the defense of such Exceptional Claim and shall have the right to resolve and settle such Exceptional Claim on terms acceptable to AbbVie and with the consent of Receptos. Receptos shall remain the Indemnifying Party for an Exceptional Claim in all other respects, including but not limited to with regard to liability for Losses; provided, however, that AbbVie shall have the right, but not the obligation, at its sole discretion, to elect to pay some, all, or none of the Losses incurred or rendered in...",procedure
Procedure. Where an expert is appointed:,procedure
Procedure. The arbitrator will determine his/her own procedure in accordance with the Labour Relations Code of B.C. and shall give full opportunity to all parties to present evidence and make representations. The arbitrator shall hear and determine the dispute or allegation and shall make every effort to render a decision within a reasonable time.,procedure
"Procedure. If the Owner or the Servicer (either, the ""Indemnified Party) receives notice of the commencement of any action for which a claim for indemnity under this Section 20 may be made, the Indemnified Party shall promptly notify the Servicer or the Owner, as the case may be (the party so notified, the ""Indemnitor"") thereof; provided, that any delay in notification shall not reduce the extent of indemnity and defense hereunder except to the extent that the delay prejudices the Indemnitor. Following receipt of notice of the commencement of any action, the Indemnitor shall be entitled to participate in such action, and upon notice delivered to the Indemnified Party, to assume the defense thereof, with counsel reasonably acceptable to the Indemnified Party, who shall not unreasonably withhold such acceptance. If, however, the defendants in such action include both the Owner and the Servicer, and the Indemnified Party shall have reasonably concluded that there may be legal defenses available to it that are different from or additional to those available to the Indemnitor, the Indemnified Party shall be entitled, at the expense of the Indemnitor, to separate counsel to assert such defenses. If the Indemnitor shall have given notice of its assumption of the defense of such action and following the approval by the Indemnified Party of counsel, the Indemnitor shall not be liable under this Section 20 for any legal expenses incurred by the Indemnified Party in retaining separate counsel in connection with such defense unless (i) the Indemnified Party shall have employed separate counsel in accordance with the preceding sentence; (ii) the Indemnitor shall not have employed counsel reasonably acceptable to the Indemnified Party within a reasonable time after notice of the commencement of action; or (iii) the Indemnitor shall have otherwise authorized the employment of separate counsel for the Indemnified Party at the Indemnitor's expense; and except that, if clause (i) or (iii) is applicable, such liability shall be only in respect of the separate counsel referred to in such clause (i) or (iii).",procedure
"Procedure. In the event that any person (an “Indemnitee”) entitled to indemnification under Section 11.1 or Section 11.2 is seeking such indemnification, such Indemnitee shall (i) inform, in writing, the indemnifying Party of the claim as soon as reasonably practicable after such Indemnitee receives notice of such claim, (ii) permit the indemnifying Party to assume direction and control of the defense of the claim (including the sole right to settle it at the sole discretion of the indemnifying Party, taking into consideration in good faith any reasonable concerns or objections raised by the Indemnitee; provided that such settlement does not impose any obligation on, or otherwise adversely affect, the Indemnitee or other Party), (iii) cooperate as reasonably requested (at the expense of the indemnifying Party) in the defense of the claim, and (iv) undertake all reasonable steps to mitigate any loss, damage or expense with respect to the claim(s).",procedure
"Procedure. Each Party will promptly notify the other Party in writing in the event it becomes aware of a claim for which indemnification may be sought hereunder. In case any proceeding (including any governmental investigation) shall be instituted involving any Party in respect of which indemnity may be sought pursuant to this Article 9, such Party will promptly notify the other Party (the “Indemnifying Party”) in writing. The Indemnifying Party shall have sole control of any such claim. The Indemnified Party will reasonably cooperate with the Indemnifying Party in defense of such matter. In any such proceeding, the Indemnified Party will have the right to retain its own counsel, but the fees and expenses of such counsel shall be at the expense of the Indemnified Party. The Indemnifying Party shall not be liable for any settlement of any proceeding effected without its written consent, but, if settled with such consent or if there be a final judgment for the plaintiff, the Indemnifying Party agrees to pay any such settlement or final judgment. The Indemnifying Party shall not, without the written consent of the Indemnified Party, effect any settlement of any pending or threatened proceeding in respect of which the Indemnified Party is, or arising out of the same set of facts could have been, a party and indemnity could have been sought hereunder by the Indemnified Party, unless such settlement includes a release of the Indemnified Party from all liability on claims that are the subject matter of such proceeding.",procedure
"Procedure. Subject to the provisions of Clause 12.1, any Dispute which is not resolved amicably shall be finally settled by binding arbitration under the Arbitration and Conciliation Act, 1996.",procedure
"Procedure. (a) In order for an Indemnified Party to be entitled to any indemnification provided for under this Agreement, such Indemnified Party will, within a reasonable period of time following the discovery of the matters giving rise to any Losses, notify the indemnifying party under this Article XII (the “Indemnifying Party”) in writing of its claim for indemnification for such Losses, specifying in reasonable detail the nature of such Losses and the amount of the liability estimated to accrue therefrom; provided, however, that failure to give such notification will not affect the indemnification provided hereunder, except to the extent the Indemnifying Party will have been prejudiced as a result of such failure. Thereafter, the Indemnified Party will deliver to the Indemnifying Party, within a reasonable period of time after the Indemnified Party’s receipt of such request, all information and documentation reasonably requested by the Indemnifying Party with respect to such Losses.",procedure
"Procedure. Each committee, except the executive committee, shall elect a presiding officer from its members and may fix its own rules of procedure which shall not be inconsistent with these By-Laws. It shall keep regular minutes of its proceedings and report the same to the board of directors for its information at the meeting thereof held next after the proceedings shall have been taken.",procedure
"Procedure. Every time the Corporation delivers to the Applicable Member an applicable Schedule under this Agreement, including any Amended Schedule delivered pursuant to Section 2.04(b), but excluding any Early Termination Schedule or amended Early Termination Schedule, the Corporation also shall (x) deliver to the Applicable Member schedules and work papers providing reasonable detail regarding the preparation of such Schedule and an Advisory Firm Letter supporting such Schedule and (y) allow the Applicable Member reasonable access, at no cost, to the appropriate representatives at the Corporation and the Advisory Firm in connection with a review of such Schedule. The applicable Schedule shall become final and binding on all parties unless the Applicable Member, within 30 calendar days after receiving an Exchange Basis Schedule or amendment thereto or a Tax Benefit Schedule or amendment thereto, provides the Corporation with notice of a material objection to such Schedule (“Objection Notice”) made in good faith. If the parties, for any reason, are unable to successfully resolve the issues raised in such notice within 30 calendar days of receipt by the Corporation of an Objection Notice with respect to such Exchange Basis Schedule or Tax Benefit Schedule, the Corporation and the Applicable Member shall employ the reconciliation procedures as described in Section 7.09 of this Agreement (the “Reconciliation Procedures”).",procedure
"Procedure. If the grant reduction does not lead to a recovery, the granting authority will formally notify the coordinator or beneficiary concerned of the reduction, the amount to be reduced and the reasons why. The coordinator or beneficiary concerned may — within 30 days of receiving notification — submit observations if it disagrees with the reduction (payment review procedure). If the grant reduction leads to a recovery, the granting authority will follow the contradictory procedure with pre-information letter set out in Article 22.",procedure
"Procedure. The Borrower shall make each payment under any Loan Document not later than 2:00 p.m. on the day when due to the Administrative Agent by wire transfer to the following account (or at such other account or by such other means to such other address as the Administrative Agent shall have notified the Borrower in writing within a reasonable time prior to such payment) in immediately available Dollars without condition or deduction for any counterclaim, defense, recoupment or setoff: ABA No. 021-000021 Account Number: 920-1033363 For further credit to A/C 293-7464, Transit 01269 RBCCM Agency Services, New York Account Name: Royal Bank of Canada, New York Reference: Francesca’s Collections, Inc The Administrative Agent shall promptly thereafter cause to be distributed immediately available funds relating to the payment of principal, interest or fees to the Lenders, in accordance with the application of payments set forth in Section 2.12. The Lenders shall make any payment under any Loan Document in immediately available Dollars and without setoff or counterclaim. Each Revolving Credit Lender shall make each payment for the account of any L/C Issuer required pursuant to Section 2.4 (A) if the notice or demand therefor was received by such Lender prior to 2:00 p.m. on any Business Day, on such Business Day and (B) otherwise, on the Business Day following such receipt. Payments received by the Administrative Agent after 2:00 p.m. shall be deemed to be received on the next Business Day.",procedure
"Procedure. Any party that proposes to assert the right to be indemnified under this Section 10 will, promptly after receipt of notice of commencement of any action against such party in respect of which a claim is to be made against an indemnifying party or parties under this Section 10, notify each such indemnifying party of the commencement of such action, enclosing a copy of all papers served, but the omission so to notify such indemnifying party will not relieve the indemnifying party from (i) any liability that it might have to any indemnified party otherwise than under this Section 10 and (ii) any liability that it may have to any indemnified party under the foregoing provision of this Section 10 unless, and only to the",procedure
"Procedure. (a) A Person entitled to indemnification hereunder (an “Indemnified Party”) will give the Person from whom indemnification is sought (an “Indemnifying Party”) written notice of any matter that an Indemnified Party has determined has given or may give rise to a claim for indemnification under this Agreement (an “Indemnification Claim”), prior to the expiration of any applicable survival period set forth in Section 11.1 and, in the event of a claim by a third party, within thirty (30) days after receiving written notice from a third party which may give rise to an Indemnification Claim (a “Third Party Claim”). Such notice will state the nature of the claim, the amount of the Loss, if known, the method of computation thereof, and contain a reference to the provisions of this Agreement in respect of which such right of indemnification is claimed or arises; provided, however, that the failure to provide the aforementioned information in such notice will not relieve the Indemnifying Party from any of its obligations under this Article 11, except to the extent, and then only to the extent, that the Indemnifying Party is prejudiced by such failure, including by forfeiture of its rights or defenses by reason of such failure.",procedure
Procedure. 1. Level One,procedure
"Procedure. In the event that an Indemnitee under this Section 2 is made a party to an action, suit or proceeding alleging both matters for which indemnification can be made hereunder and matters for which indemnification may not be made hereunder, such Indemnitee shall be indemnified only for that portion of the Losses incurred in such action, suit or proceeding which relates to the matters for which indemnification can be made.",procedure
"Procedure. Each of the two parties will appoint one arbitrator, and these two arbitrators will select the third arbitrator. Upon the selection of the third arbitrator, the arbitration tribunal will be constituted, and the third arbitrator will act as chairman of the tribunal. If either party fails to appoint an arbitrator within sixty (60) days after the other party has given notice of appointing an arbitrator, then the American Arbitration Association will appoint an arbitrator for the party that has failed to do so. The party that has failed to appoint an arbitrator will be responsible for all expenses levied by the American Arbitration Association for such appointment. Should the two arbitrators be unable to agree on the choice of the third arbitrator, then the American Arbitration Association will appoint the third arbitrator. All expenses levied by the American Arbitration Association for such appointment shall be borne equally by each party to this Agreement. The tribunal may in its sole discretion make orders and directions as it considers to be necessary for the final determination of the matters in dispute. Such orders and directions may be necessary with regard to pleadings, discovery, inspection of documents, examination of witnesses and any other matters relating to the conduct of the arbitration. The tribunal will have the widest discretion permissible under the law, and practice of the place of arbitration, when making such orders or directions.",procedure
"Procedure. The parties to each Transfer made in reliance on clause (b) above (other than those described in clause (e) or (f) below) shall execute and deliver to the Administrative Agent (which shall keep a copy thereof) an Assignment, together with any existing Note subject to such Transfer (or any affidavit of loss therefor acceptable to the Administrative Agent), any tax forms required to be delivered pursuant to Section 2.11(f) and payment by the assignee to the Administrative Agent of an assignment fee in the amount of $3,500. Upon receipt of all the foregoing, and conditioned upon such receipt and upon the Administrative Agent consenting to such Assignment, from and after the effective date specified in such Assignment, the Administrative Agent shall record or cause to be recorded in the Register the information contained in such Assignment.",procedure
"Procedure. Upon termination of the Plan, the distribution provisions of Article VI remain operative, with the following exceptions:",procedure
"Procedure. The party intending to claim indemnification under this Section 10 (an “Indemnitee”) shall promptly notify the other party (the “Indemnitor”) of any Claim in respect of which the Indemnitee intends to claim such indemnification, and the Indemnitor shall assume the defense thereof whether or not such Claim is rightfully brought; provided, however, that an Indemnitee shall have the right to retain its own counsel, with the fees and expenses to be paid by the Indemnitee, unless Indemnitor does not assume the defense, in which case the reasonable fees and expenses of counsel retained by the Indemnitee shall be paid by the Indemnitor. The Indemnitee, and its employees and agents, shall cooperate fully with the Indemnitor and its legal representatives in the investigations of any Claim. The Indemnitor shall not be liable for the indemnification of any Claim settled or compromised by the Indemnitee without the written consent of the Indemnitor.",procedure
