clause_text,clause_type
"Procedure. Any controversy or claim arising out of or relating to this Agreement, or the breach thereof, will be settled by arbitration in accordance with the Commercial Rules of the American Arbitration Association (""AAA""), and those provisions of the AAA Employment Arbitration Rules determined by the arbitrators as necessary under applicable law. The arbitration will be binding and judgment upon the award rendered by the arbitrators may be entered in any court having jurisdiction thereof. For controversies or claims involving employment matters only, there will be one (1) arbitrator mutually selected by the parties within ten (10) business days from the date of notification made to one of the parties of the other party's request for arbitration. If the parties fail to agree upon an arbitrator within such ten (10) days, the AAA will promptly appoint the arbitrator in accordance with its rules. For all other controversies or claims, there will be three (3) arbitrators, one arbitrator selected by the Company and one arbitrator selected by Employee, which arbitrators will then jointly select the third arbitrator. If any party fails to nominate an arbitrator within thirty (30) days from the date of notification made to it of a party's request for arbitration, then the AAA will appoint the arbitrator in accordance with its rules. The place of the arbitration will be Los Angeles, California. All arbitrators will have at least ten (10) years experience in commercial or employment-related transactions. The arbitration will commence within sixty (60) days after appointment of the arbitrators and will continue uninterrupted, unless otherwise suspended by the arbitrators for good cause, for not longer than one hundred twenty (120) days (including without limitation any discovery permitted by the arbitrators). The arbitrators will, within such one hundred twenty (120) day period, render a written decision with findings of fact and conclusions of law and deliver such decision to the parties.",procedure
"Procedure. With respect to the indemnification obligations hereunder, the indemnified party should (a) give the indemnifying party prompt written notice of any claim, action, suit or proceeding; (b) granting sole control of the defense and settlement to the indemnifying party; and (c) reasonably cooperate with indemnifying party at the indemnifying party’s expense. The indemnified party may participate in the defense of the claim at its own expense and in a manner not disruptive to indemnifying party’s conduct of the defense. Non-compliance with this procedure does not constitute a waiver of the indemnification obligations set forth hereunder.",procedure
Procedure. You may at any time notify us of your intention to withdraw Gold standing to the credit of the Account. A withdrawal may be made (in the manner and accompanied by such documentation as we may require) by:,procedure
"Procedure. In order to be eligible for repair or replacement under this warranty Customer must (i) promptly contact Illumina’s customer support department to report the non-conformance, (ii) cooperate with Illumina in the diagnosis of the non-conformance, and (iii) return the Product, transportation charges prepaid, to Illumina following Illumina’s instructions or, if agreed by Illumina, grant Illumina’s authorized repair personnel access to this Product in order to confirm the non-conformance and make repairs.",procedure
"Procedure. Subject to the provisions of Article 8.1, any Dispute which is not resolved amicably in the manner set forth hereinbefore shall be referred to arbitration under the Arbitration Act, 1996. The arbitral tribunal shall consist of 3 (Three) arbitrators. Each Party shall appoint one arbitrator within 30 days of receipt of request for settlement of dispute by arbitration. The two appointed Arbitrators shall within 30 (Thirty) days of their appointment, appoint a third arbitrator who shall act as the presiding arbitrator. In case a Party fails to appoint an arbitrator within 30 (Thirty) days from the date of receipt of request or the two appointed arbitrators fail to agree on a third arbitrator within 30 (Thirty) days of their appointment, the appointment of such Arbitrator, as the case may be, shall be made in accordance with Arbitration Act, 1996.",procedure
"Procedure. The number of days indicated at each level should be considered as maximum. The time limits specified may, however, be extended by mutual agreement of the grievant and school employer.",procedure
"Procedure. Within 10 days after receipt of such a demand, the Company will give written notice of such requested registration to all other holders of Registrable Securities and will include in such registration, subject to the allocation provisions below, all other Registrable Securities with respect to which the Company has received written requests for inclusion within 20 days after the Company's mailing of such notice, plus any securities of the Company that the Company chooses to include on its own behalf.",procedure
"Procedure. The JSC shall determine the overall strategy for publication and presentation of results of pre-clinical and clinical studies of Cell Therapy Products and Collaboration Products. [**]. Each Party to this Agreement recognizes that the publication of papers regarding results of and other information regarding the activities under this Agreement, including oral presentations and abstracts, may be beneficial to both Parties provided such publications are subject to reasonable controls to protect Confidential Information and other interests of the Parties. In particular, it is the intent of the Parties to maintain the confidentiality of any Confidential Information included in any patent application until such patent application has been published. Accordingly, each Party will have the right to review and approve any paper proposed for publication by the other Party, including oral presentations and abstracts, which utilizes data generated under this Agreement and/or includes Confidential Information of the other Party. Before any such paper is submitted for publication or an oral presentation is made, the Party publishing or presenting will deliver a complete copy of the paper or materials and abstracts for oral presentation to the other Party at least [**] prior to submitting the paper to a publisher or making the presentation. The other Party will review any such paper and give its comments to the publishing Party within [**] after the delivery of such paper to the other Party. With respect to oral presentation materials and abstracts, the other Party will make reasonable efforts to expedite review of such materials and abstracts, and will return such items as soon as practicable to the presenting Party with appropriate comments, if any, but in no event later than [**] after the date of delivery to the other Party. The publishing Party will comply with the other Party's request to delete references to the other Party's Confidential Information in any such paper, materials and abstracts and agrees to withhold publication of same for an additional [**] in order to permit the Parties to obtain patent protection, if either of the Parties deems it necessary, in accordance with the terms of this Agreement.",procedure
"Procedure. The time of the coaching meetings and/or location will be determined by Coach and Client based on a mutually agreed upon time. The Client will initiate all scheduled calls and will call the Coach at the following number for all scheduled phone meetings . Other means of communication methods may be used such as: . If the Coach will be at any other number for a scheduled call, the Client will be notified prior to the scheduled appointment time.",procedure
"Procedure. The indemnities set forth in this Article XIII are subject to the condition that the Party seeking indemnity shall forthwith notify the other Party on being notified or otherwise made aware of a suit, action or claim and that the indemnifying Party defend and control any proceedings, with the other Party being permitted to participate at its own expense (unless there shall be a conflict of interest which would prevent representation by joint counsel, in which event the indemnifying Party shall pay for the other Party’s counsel); provided that the indemnifying Party may not settle the suit or otherwise consent to any judgment in such suit without the written consent of the indemnified Party (such consent not to be unreasonably withheld, conditioned or delayed). The Parties shall cooperate in the defense of any Third Party claim. The Parties acknowledge and agree that the indemnity provisions of Section 13.1 shall comprise the Parties’ sole remedy relating solely to the items for which indemnity is described and provided in Sections 13.1(a) and (b) above.",procedure
"Procedure. Any arbitration will be administered by the American Arbitration Association (“AAA”) and a neutral arbitrator will be selected in a manner consistent with its National Rules for the Resolution of Employment Disputes. The arbitration proceedings will be conducted in Richardson, Texas, and will allow for discovery according to the rules set forth in the National Rules for the Resolution of Employment Disputes. The arbitrator shall have the power to decide any motions brought by any party to the arbitration, including motions for summary judgment and/or adjudication and motions to dismiss and demurrers, prior to any arbitration hearing. The arbitrator shall issue a written decision including findings of fact and conclusions of law on the merits of its award. The arbitrator shall have the power to award any",procedure
"Procedure. 21.2.1 Tenant must request Landlord's consent to any such assignment or sublease in writing at least thirty (30) days prior to the commencement date of the proposed sublease or assignment, which written request (a ""Proposal Notice"") must include (1) the name and address of the proposed assignee or subtenant, (2) the nature and character of the business of the proposed assignee or subtenant, (3) financial information (including financial statements) of the proposed assignee or subtenant, (4) the proposed effective date of the assignment or sublease, which shall be not less than thirty (30) days thereafter, and (5) a copy of the proposed sublease or assignment agreement. Tenant shall also provide any additional information Landlord reasonably requests regarding such proposed assignment or subletting. Within thirty (30) days after Landlord receives Tenant's Proposal Notice (with all required information included), but subject to Section 21.5, below, Landlord shall have the option (i) to grant its consent to such proposed assignment or subletting, or (ii) to deny its consent to such proposed assignment or subletting on a reasonable basis. If Landlord does not exercise one of the above options (or the termination right set forth in Section 21.5, below) within thirty (30) days after Landlord receives such Proposal Notice, then Tenant may assign or sublease the Premises upon the terms stated in the Proposal Notice.",procedure
"Procedure. (a) Subject to Clause 29.2 (Exceptions), any term of the Finance Documents may be amended or waived with the agreement of the Borrowers’ Agent and the Majority Banks. The Agent may effect, on behalf of any Finance Party, an amendment or waiver permitted under this Clause 29.",procedure
"Procedure. The Withdrawing Employer and the Lead Employer will agree upon procedures for the orderly withdrawal of the Withdrawing Employer from the Plan. Such procedures, as they relate to the Accounts of the Employees of the Withdrawing Employer, may include any alternative described in Sections 12.12(B) and (C).",procedure
"Procedure. On the request of any person requesting indemnification under this Article VIII, the Board or a committee thereof shall determine whether such indemnification is permissible or such determination shall be made by independent legal counsel if the Board or such committee so directs or if the Board or such committee is not empowered by statute to make such determination.",procedure
Procedure. Step One Step Two Step Three,procedure
"Procedure. Subject to CLAUSE 25 of the Funding 1 Deed of Charge (Supplemental Provisions Regarding the Security Trustee), any term of the Funding 1 Liquidity Documents may be amended or waived with the written agreement of Funding 1, the Security Trustee and the Funding 1 Liquidity Facility Provider.",procedure
Procedure. The following shall apply with respect to all claims by the Indemnified Party for indemnification:,procedure
"Procedure. In any such arbitration, the arbitrators shall consist of a panel of three arbitrators, which shall act by majority vote and which shall consist of one arbitrator selected by each party subject to the arbitration and a third arbitrator selected by the two arbitrators so selected, who shall be either a certified public accountant or an attorney at law licensed to practice in the State of Ohio and who shall act as chairman of the arbitration panel; provided that, if one party selects its arbitrator for the panel and the other party fails to so select its arbitrator within ten (10) business days after being requested by the first party to do so, then the sole arbitrator shall be the arbitrator selected by the first party. A decision in any such arbitration shall apply both to the particular question submitted and to all similar questions arising thereafter and shall be binding and conclusive upon both parties and shall be enforceable in any court having jurisdiction over the party to be charged. Each party shall bear the cost of its own attorney’s fees. However, if any party prevails on a claim, which, according to applicable law, affords the prevailing party attorney’s fees, the arbitrator may award reasonable attorney’s fees to the prevailing party. All other costs and expenses of arbitration shall be borne by the Company. All rights and remedies of each party under this Agreement are cumulative and in addition to all other rights and remedies that may be available to that party from time to time, whether under any other agreement, at law or in equity. Any arbitration under this Agreement shall be conducted in Cincinnati, Ohio.",procedure
"Procedure. Except to the extent necessary to confirm an award or as may be required by law, neither a Party nor an arbitrator may disclose the existence, content, or results of an arbitration without the prior written consent of both Parties. In no event will an arbitration be initiated after the date when commencement of a legal or equitable proceeding based on the dispute, controversy or claim would be barred by the applicable Province of British Columbia statute of limitations.",procedure
Procedure. You may at any time notify us of your intention to deposit Gold. A deposit must be made (in the manner and accompanied by such documentation as we may require) by:,procedure
Procedure. 1) Standard procedure: A request shall be made in writing and give the employee’s departure date and the reason for and the probable duration of the intended absence. Such request shall be received by the employer at least 5 working days prior to the planned departure of the employee.,procedure
Procedure. All presentations are to be short and concise and are to include a comprehensive opening statement. The parties agree to make limit- ed use of authorities during their presentations.,procedure
"Procedure. Each Partnership meeting shall be held at the principal place of business of the Partnership, unless the Partners otherwise agree. Attendance of a Person at a meeting shall constitute a waiver of notice of such meeting, unless such Person attends the meeting for the purpose of objecting to the transaction of any business on the ground that the meeting is not lawfully called or convened. A Person may vote at such meeting by written proxy executed by that Person and delivered to a General Partner or Partner. A proxy shall be revocable unless it is stated to be irrevocable. Any action required or permitted to be taken at such meeting may be taken without a meeting, without prior notice, and without a vote if a consent or consents in writing, setting forth the action so taken, is signed by the General Partner and the Partners that would be necessary to take the action at a meeting at which all Partners were present and voted. Any meeting may take place by means of telephone conference, video conference, or similar communication equipment by means of which all Persons participating therein can hear each other.",procedure
"Procedure. Condition the test piece at the specified temperature for at least four hours immediately preceding the test. Place the test piece in the fixture (paragraph 2.1.1.3.). The plane of the test piece shall be perpendicular, within 3°, to the incident direction of the ball. In the case of flexible plastic glazing the test piece shall be clamped to the support. The point of impact shall be within 25 mm of the geometric centre of the test piece for a drop height less than or equal to 6 m, and within 50 mm of the centre of the test piece for a drop height greater than 6 m. The ball shall strike that face of the test piece which represents the outside face of the safety glazing pane when mounted on the vehicle. The ball shall be allowed to make only one impact.",procedure
"Procedure. The Arbitration shall be conducted before a panel of arbitrators selected in accordance with the rules of the American Arbitration Association. Each Party shall bear separately the cost of their respective attorneys, witnesses and experts in connection with such arbitration. Time is of the essence of this arbitration procedure, and the arbitrators shall be instructed and required to render their decision within ten (10) days following completion of the Arbitration.",procedure
"Procedure. The Indemnified Party will promptly notify the Indemnifying Party in writing, of any Third Party Claim for which defense and indemnification is sought, provided that the failure to promptly notify the Indemnifying Party will relieve the Indemnifying Party of its obligations hereunder only to the extent that the Indemnifying Party is prejudiced by such failure. The Indemnified Party will allow the Indemnifying Party or its authorized representative, at the Indemnifying Party’s cost and expense to control the defense and settlement of the claim. The Indemnified Party will be entitled to participate reasonably in the defense and settlement of the claim with counsel of its choice at its own expense, and will reasonably cooperate with the Indemnifying Party with respect to such defense and settlement. The Indemnifying Party will not settle any claim without the written consent of the Indemnified Party (which consent will not be unreasonably withheld or delayed).",procedure
"Procedure. A. An employee with regular status who meets all university eligibility requirements may apply for a change in assignment to a different position in the same class or in a different class having the same pay range minimum, different work unit, or different shift at the university according to university recruitment procedures. Prior to filling a vacancy, except by demotion or department promotion, the university shall consider all applicable change in assignment requests. When making a decision regarding the granting of a request for a change in assignment, the university shall consider appropriate factors, including, but not limited to, the applicant’s length of continuous university service, performance evaluations, work-related awards and achievements, relevant work experience, and education/training.",procedure
"Procedure. Arbitration of Arbitrable Claims shall be in accordance with the Employment Dispute Resolution Rules of the American Arbitration Association (""AAA Employment Rules""), except as provided otherwise in the Agreement. Arbitration shall be initiated by providing written notice to the other party with a statement of the claim(s) asserted, the facts upon which the claim(s) are based, and the remedy sought. The burden of proof in any arbitration shall be allocated as provided by applicable law, unless otherwise specified in the Agreement. Either party may bring an action in court to compel arbitration under the Agreement and to enforce an arbitration award. Otherwise, neither party shall initiate or prosecute any lawsuit or administrative action in any way related to any Arbitrable Claim. The Federal Arbitration Act shall govern the interpretation and enforcement of the Section 6.",procedure
"Procedure. 1. Within each school or center, the administrator or his/her administrative designee shall be responsible for evaluation of employees assigned to that school or center. Observations by a teacher may form part of the evaluation, provided that teacher has worked directly with the employee in the educational setting during the evaluation period. Evaluation of employees by any other persons shall not be conducted or condoned by the Board or District Administrator, nor will any action be taken against an employee based on such unauthorized evaluation. When teacher input indicates need for improvement, an administrative observation will be conducted as in B-4(a) of this Article.",procedure
Procedure. 10.3.1 Level 1: School Principal,procedure
"Procedure. (a) At the beginning of the season, employees will be called back to work in seniority order. When offering a position, the Employer will inform the employee of the number of hours each area/unit worked the previous year. Employees will have the right to turn down a position or start date once.",procedure
"Procedure. Subject to the provisions of Article 17.1, any Dispute which is not resolved amicably shall be finally settled by reference to arbitration by a Sole Arbitrator to be appointed by the Authority. Such arbitration shall be held in accordance with the provisions of the Arbitration Act. The expenses of arbitration shall be borne equally by both the Parties.",procedure
"Procedure. The Department shall submit a Change Service Request to the Contractor, which shall include a detailed description of the requested service, the priority of the service, a date the service is needed, and a date for submission of a proposal by the Contractor. In its proposal, the Contractor shall describe the procedure and schedule to be employed for the requested service and identify the number of hours necessary to complete the service by labor category and the associated cost to implement the change request. If necessary, the Contractor and the Department shall meet to discuss and clarify any issues related to the requested service. Upon written approval by the Department, the Contractor shall perform the requested service and receive payment according to the terms agreed to by the parties and based upon the rate specified in the Contractor’s cost proposal. If the Department does not accept the Contractor’s proposal, the Department may withdraw or modify its Change Service Request. If the Department modifies its Change Service Request, the procedures set forth above shall apply.",procedure
Procedure. The following procedure will be used when a teacher requests 46 personal leave charged to sick leave:,procedure
"Procedure. Within fifteen (15) days following its receipt of the Redemption Election, the Company shall mail a written notice, first class postage prepaid, to the Purchaser (at the close of business on the second business day next preceding the day on which notice is given) at the address last shown on the records of the Company for such Purchaser, notifying such Purchaser of the redemption to be effected, specifying the number of shares to be redeemed from such Purchaser, the Redemption Date, the applicable Redemption Price, the place at which payment may be obtained and calling upon such Purchaser to surrender to the Company, in the manner and at the place designated, such Purchaser's certificate or certificates representing the shares to be redeemed (the ""Redemption Notice""). Except as provided in Section 10.5(c), on or after the Redemption Date, the holder of Shares to be redeemed shall surrender to the Company the certificate or certificates representing such shares, in the manner and at the place designated in the Redemption Notice, and thereupon the Redemption Price of such shares shall be payable to the order of the person whose name appears on such certificate or certificates as the owner thereof and each surrendered certificate shall be cancelled. In the event less than all the shares represented by any such certificate are redeemed, a new certificate shall be issued representing the unredeemed shares.",procedure
"Procedure. It is contemplated that the arbitration proceeding will be self-administered by the parties and conducted in accordance with procedures jointly determined by the Panel and the Parties; provided, however, that if either or both Parties believes the process will be enhanced if it is administered by the CPR, then either or both Parties shall have the right to cause the process to become administered by the CPR and, thereafter, the arbitration shall be conducted, where applicable or appropriate, pursuant to the administration of the CPR. In determining the extent of discovery, the number and length of depositions, and all other pre-hearing matters, the Panel shall endeavor to the extent possible to streamline the proceedings and minimize the time and cost of the proceedings.",procedure
