clause_text,clause_type
Records and other documentation to support the costs declared,records
Records. Any reference in this Agreement to the records of an ICSD shall be to the records that each of the ICSDs holds for its customers which reflect the amount of such customers' interests in the Notes (but excluding any interest in any Notes of one ICSD shown in the records of another ICSD).,records
"Records. A. UMBFS shall keep those records specified in Schedule D hereto in the form and manner, and for such period, as it may deem advisable but not inconsistent with the rules and regulations of appropriate government authorities, in particular Rules 31a-2 and 31a-3 under the 1940 Act. UMBFS shall only destroy records at the direction of the Trust, and any such destruction shall comply with the provisions of Section 248.30(b) of Regulation S-P (17 CFR 248.1-248.30). UMBFS may deliver to the Trust from time to time at UMBFS' discretion, for safekeeping or disposition by the Trust in accordance with law, such records, papers and documents accumulated in the execution of its duties as transfer agent, as UMBFS may deem expedient, other than those which UMBFS is itself required to maintain pursuant to applicable laws and regulations. The Trust shall assume all responsibility for any failure thereafter to produce any record, paper, or other document so returned, if and when required. To the extent required by Section 31 of the 1940 Act and the rules and regulations thereunder, the records specified in Schedule D hereto maintained by UMBFS, which have not been previously delivered to the Trust pursuant to the foregoing provisions of this paragraph, shall be considered to be the property of the Trust, shall be made available upon request for inspection by the officers, employees, and auditors of the Trust, and shall be delivered to the Trust promptly upon request and in any event upon the date of termination of this Agreement, in the form and manner kept by UMBFS on such date of termination or such earlier date as may be requested by the Trust. Notwithstanding anything contained herein to the contrary, UMBFS shall be permitted to maintain copies of any such records, papers and documents to the extent necessary to comply with the recordkeeping requirements of federal and state securities laws, tax laws and other applicable laws.",records
Records. Retention Contractors and Subcontractors must preserve such certified transcripts for a period of three years from the date of completion of work on the awarded contract.,records
"Records. Upon termination of Executive’s relationship with the Company, Executive shall deliver to the Company any property of the Company which may be in Executive’s possession including products, materials, memoranda, notes, records, reports, or other documents or photocopies of the same.",records
"Records. Upon termination of your employment hereunder for any reason or for no reason and at any other time requested by the Company, you will deliver to the Company any property of the Company which may be in your possession, including products, materials, memoranda, notes, records, reports, or other documents or photocopies of the same.",records
"Records. The Sub-Administrator/Accounting Agent shall create and maintain all records relating to its activities and obligations under this Agreement in such a manner as, with respect to each Fund, will meet the obligations of such Fund under, as applicable, the 1940 Act, the Securities Exchange Act of 1934, the 1933 Act, fee Employee Retirement Income Security Act of 1974, the Commodity Exchange Act, and the regulations promulgated under each of such Acts, including, without limitation, the pronouncements of the Securities Exchange Commission on electronic recordkeeping requirements. All such records shall be the property of the applicable Fund and shall at all reasonable times (considering the particular circumstances) be available to duly authorized officers, employees or agents of the Administrator, the applicable Fund and employees and agents of applicable regulatory authorities. Subject to Section 11 hereof, the Sub-Administrator/Accounting Agent shall preserve for the period required by law the records required to be maintained hereunder. All such similar records that were maintained for the Funds by the Administrators for periods prior to the date of this Agreement shall at all reasonable times (considering the particular circumstances) be available to duly authorized officers, employees or agents of the Sub-Administrator/Accounting Agent and employees and agents of applicable regulatory authorities.",records
"Records. Designer shall maintain complete and accurate records with respect to all costs and expenses incurred under this Agreement. All such records shall be clearly identifiable. Designer shall allow a representative of City during normal business hours to examine, audit, and make transcripts or copies of such records and any other documents created pursuant to this Agreement. Designer shall allow inspection of all work, data, documents, proceedings, and activities related to the Agreement for a period of five (5) years from the date of final payment under this Agreement.",records
"Records. Each Party shall keep complete and accurate records and all other data required by each of them for the purposes of proper administration of this agreement and the operation of the Power Plant. Among such other records and data, the Power Producer shall maintain an accurate and up-to-date operating log at the Power Plant with records of:-",records
"Records. The date, amount, interest rate, Type and duration of Interest Periods (if applicable) of each Loan made by each Lender to the Borrower, and each payment made on account of the principal thereof, shall be recorded by such Lender on its books and such entries shall be binding on the Borrower absent manifest error.",records
"Records. All memoranda, books, records, documents, papers, plans, information, letters and other data relating to Confidential Information or the business and customer accounts of Employer, whether prepared by Executive or otherwise, coming into Executive’s possession shall be and remain the exclusive property of Employer and Executive shall not, during the term of Executive’s employment with Employer or thereafter, directly or indirectly assert any interest or property rights therein. Upon termination of employment with Employer for any reason, Executive will immediately return to Employer all such memoranda, books, records, documents, papers, plans, information, letters and other data, and all copies thereof or therefrom, and Executive will not retain, or cause or permit to be retained, any copies or other embodiments of the materials so returned. Executive further agrees that he will not retain or use for Executive’s account at any time any trade names, trademark or other proprietary business designation used or owned in connection with the business of Employer.",records
"Records. The Custodian shall create and maintain complete and accurate records relating to its activities under this Agreement with respect to the Securities, cash or other property held for the Company under this Agreement, with particular attention to Section 31 of the 1940 Act, and Rules 31a-1 and 31a-2 thereunder. To the extent that the Custodian, in its sole opinion, is able to do so, the Custodian shall provide assistance to the Company (at the Company’s reasonable request made from time to time) by providing sub-certifications regarding certain of its services performed hereunder to the Company in connection with the Company’s certification requirements pursuant to the Sarbanes-Oxley Act of 2002, as amended. All such records shall be the property of the Company and shall at all times during the regular business hours of the Custodian be open for inspection by duly authorized officers, employees or agents of the Company (including its independent public accountants) and employees and agents of the Securities and Exchange Commission, upon reasonable request and prior notice and at the Company’s expense. The Custodian shall, at the Company’s request, supply the Company with a tabulation of Securities owned by the Company and held by the Custodian and shall, when requested to do so by the Company and for such compensation as shall be agreed upon between the Company and the Custodian, include, to the extent applicable, the certificate numbers in such tabulations, to the extent such information is available to the Custodian.",records
"Records. Company will maintain, and will cause its Affiliates and sublicensees to maintain, complete and accurate books, records and related background information to verify Sales, Net Sales, and all of the royalties, fees, and other payments due or paid under this Agreement, as well as the various computations reported under Section 4.1. The records for each Quarter will be maintained for at least [**] years after submission of the applicable report required under Section 4.1.",records
"Records. Each party shall maintain its own respective records and documents associated with this Agreement in accordance with the records retention requirements applicable to public records. Each party shall be responsible for compliance with any public documents request served upon it pursuant to Section 119.07, Florida Statutes, and any resultant award of attorney’s fees for non-compliance with that law.",records
"Records. The Contractor shall maintain documentation for all charges against the Institution under this Contract. The books, records, and documents of the Contractor, insofar as they relate to work performed or money received under this Contract, shall be maintained for a period of three (3) full years from the date of the final payment and shall be subject to audit at any reasonable time and upon reasonable notice by the Institution, the Comptroller of the Treasury, or their duly appointed representatives. The financial statements shall be prepared in accordance with generally accepted accounting principles.",records
"Records. Licensee will maintain complete and accurate books and records which enable the royalties payable hereunder to be verified. The records for each Calendar Quarter shall be maintained for three years. Upon reasonable prior notice to Licensee, the Licensor and its accountants shall have access to the books and records of Licensee necessary to enable Licensor to verify the royalties paid hereunder. Such access shall be available during normal business hours from time to time during the term of this Agreement, and, during the period from expiration or termination of this Agreement until three years after such date, not more often than once each calendar year. If it is ultimately determined that Licensee has underpaid royalties by 10% or more, Licensee will pay the costs and expenses of the Licensor’s accountant in connection with its review or audit of the sales records of the Product, together with any interest as provided in Section 3.4 (c) above.",records
"Records. Xenogen Cranbury shall keep for three (3) years from the ------- conclusion of each calendar year complete and accurate records of its costs and expenses incurred hereunder. The records shall conform to good accounting principles as applied to a similar company similarly situated. Pfizer shall have the right, at its own expense, during the term of this Agreement and during the _________________________ *** CONFIDENTIAL TREATMENT REQUESTED subsequent three-year period to appoint an independent certified public accountant reasonably acceptable to Xenogen Cranbury to inspect said records to verify the accuracy of such expenditures of efforts, pursuant to each Research Plan. Upon reasonable notice by Pfizer, Xenogen Cranbury shall make its records available for inspection by the independent certified public accountant during regular business hours at the place or places where such records are customarily kept, to verify the accuracy of the expenditures of efforts. This right of inspection shall not be exercised more than once in any calendar year and not more than once with respect to records covering any specific period of time. All Xenogen Cranbury information concerning such expenditures of efforts, and all information learned in the course of any audit or inspection, shall be Xenogen Cranbury Confidential Information and not used or disclosed by Pfizer except to the extent necessary for Pfizer to enforce its rights under this Agreement or to comply with law. The failure of Pfizer to request verification of any expenditures of efforts before or during the three-year period shall be considered acceptance by Pfizer of the accuracy of such expenditures of efforts, and Xenogen Cranbury shall have no obligation to maintain any records pertaining to such report or statement beyond such three-year period. The findings of such inspection, if any, shall be binding on the parties.",records
"Records. The unpaid principal amount of the Loans owing to each Lender, the unpaid interest accrued thereon, the interest rate or rates applicable to such unpaid principal amount, the duration of such applicability, each Lender’s Revolving Credit Committed Amount and the accrued and unpaid Commitment Fees and fees pursuant to Section 3.02 hereof shall at all times be ascertained from the records of the Agent, which shall be conclusive absent manifest error.",records
Records of expenses pertaining to Additional Services and services performed on the basis of a Worker Wage Rate or Monthly Salary Rate shall be kept on the basis of generally accepted accounting principles and in accordance with cost accounting standards promulgated by the Federal Office of Management and Budget Cost Accounting Standards Board and shall be available for audit by the Owner or the Owner's authorized representative on reasonable notice.,records
Records. Each Party shall keep complete and accurate records and all other data required by each of them for the purposes of proper administration of this Agreement and the operation of the Rooftop Solar PV System.,records
"Records of Reimbursable Expenses, expenses pertaining to Additional Services, and services performed on the basis of hourly rates shall be available to the Owner at mutually convenient times.",records
"Records. COMPANY shall maintain, and shall cause its AFFILIATES and SUBLICENSEES to maintain, complete and accurate records relating to the rights and obligations under this Agreement and any amounts payable to THE PARTIES in relation to this Agreement, which records shall contain sufficient information to permit THE PARTIES to confirm the accuracy of any reports delivered to THE PARTIES and compliance in other respects with this Agreement. The relevant party shall retain such records for at least five (5) years following the end of the calendar year to which they pertain, during which time THE PARTIES, or THE PARTIES’s appointed agents, so long as such agents are reasonably acceptable to such party, shall have the right, at THE PARTIES’s expense, to inspect once during any consecutive twelve month period such records during normal business hours to verify any reports and payments made or compliance in other respects under this Agreement. In the event that any audit performed under this Section reveals an underpayment in excess of the higher of (a) **** or (b) of ***, COMPANY shall bear the full cost of such audit and shall remit any amounts due to THE PARTIES within thirty (30) days of receiving notice thereof from THE PARTIES.",records
"Records. The Records accurately reflect in all material respects as of their respective dates the Net Book Value of the Assets and Assumed Liabilities being transferred to Purchaser hereunder. The Records include all customary Branch, customer and customer-related information reasonably necessary to service the Deposits and Loans on an ongoing basis and as may be required under applicable law in all material respects.",records
"Records as necessary under Board approved Virtus Mutual Funds policies and procedures, including without limitation those related to valuation determinations. *Such information might include: current financial information, annual and quarterly reports, press releases, reports by analysts and from brokerage firms (including their recommendations, i.e., buy, sell, hold) or any internal reports or subadviser review.",records
"Records. Licensee shall keep, and shall include in each Sublicense agreement an obligation of each Sublicensee to keep, complete, continuous and accurate records of Products that are made, used, sold, leased or transferred under this Agreement, any amounts payable to University in relation to such Products, and all Sublicense Revenue received by Licensee and its Affiliates in sufficient and customary detail such that the calculations and payment amounts may be verified. During the Term and for a period of three (3) years following the expiration or termination of this Agreement, Licensee shall permit, and shall include in each Sublicense agreement an obligation of each Sublicensee to permit, an independent, certified public accountant engaged by University to audit and copy their respective books and records for the purposes of verifying the accuracy of any reports and payments delivered under this Agreement and Licensee’s compliance with the terms of this Agreement, during normal business hours. Such audit shall be conducted after reasonable prior notice by University to Licensee, shall not be more frequent than once during each calendar year and may cover only the three (3) years immediately preceding the date of the audit. Any such independent certified accountant shall be reasonably acceptable to Licensee and, if reasonably requested by Licensee, shall execute Licensee’s standard form of confidentiality agreement, and shall be permitted to share with University solely its findings with respect to the accuracy of the royalties and Sublicense Revenue payments reported as payable under this Agreement. The examinations shall be made at University’s expense, unless the examination shows a shortage of five percent (5%) or more in the amount of payments made to University prior to notice of the audit, in which case, Licensee shall reimburse University for all costs and expenses, including attorneys’ or professionals fees incurred in connection therewith.",records
"Records. Upon the termination of employment hereunder, the Employee shall deliver to the Company all correspondence, reports, customer lists, office keys, manuals, advertising brochures, sample contracts, price lists, employee lists, prospective employee lists, mailing lists, letters, records and any and all other documents pertaining to or containing information relative to the business of the Company, and the Employee shall not remove any of such records either during the course of employment or upon the termination thereof. The Employee understands that in the event of a violation of the provisions of this Paragraph 13, the Company shall have the right to seek injunctive relief, in addition to any other existing rights provided herein or by operation of law, without the requirement of posting bond. The remedies provided in this Paragraph 13 shall be in addition to any legal or equitable remedies existing between the Employee and the Company, and shall not be construed as a limitation upon, or as alternative or in lieu of, such remedies.",records
"Records. DR and Vendor agree to maintain adequate books and records relating to the distribution of the Products to end Users and Dealers, including without limitation, books, records, and tax returns relating to returns, refunds, and sales and use taxes. Such books and records shall be available at the principal office of each party for inspection by the other party or its representative during normal business hours, for the purpose of determining the accuracy of the payments required to be made pursuant to the provisions of this Agreement. Each party shall have the right to conduct such an audit upon twenty (20) days advance written notice not more than twice each year. In the event that such an audit discloses an underpayment which is greater than five percent (5%), then the party responsible for the underpayment shall pay the underpayment and reasonable costs of such audit, otherwise the party requesting the audit shall pay the costs of such audit.",records
"Records. The Borrower shall hold its books and records relating to the Collateral segregated from all the Borrower’s other books and records in a manner satisfactory to the Bank; and shall deliver to the Bank from time to time promptly at its request all invoices, original documents of title, contracts, chattel paper, instruments and any other writings relating thereto, and other evidence of performance of contracts, or evidence of shipment or delivery of the merchandise or of the rendering of services; and the Borrower will deliver to the Bank promptly at the Bank’s request from time to time additional copies of any or all of such papers or writings, and such other information with respect to any of the Collateral and such schedules of inventory, schedules of accounts and such other writings as the Bank may in its sole discretion deem to be necessary or effectual to evidence any loan hereunder or the Bank’s security interest in the Collateral.",records
Records. 10.4.1. Escrow Funds Records........................................ 10.4.2. Escrow Obligations Records..................................,records
"Records. The books of account and minute books of the Company are complete and correct, and reflect all those transactions involving its business which properly should have been set forth in such books.",records
"Records. See Section 5(o). Registrable Notes: Each Note upon original issuance thereof and at all times subsequent thereto, each Note as to which Section 2(c)(iv) hereof is applicable upon original issuance thereof and at all times subsequent thereto and each Private Exchange Security upon original issuance thereof and at all times subsequent thereto, until, in the case of any such Note, Exchange Note or Private Exchange Security, as the case may be, the earliest to occur of (i) a Registration Statement covering such Note, Exchange Note or Private Exchange Security, as the case may be, has been declared effective by the Commission and such Note, Exchange Note or Private Exchange Security, as the case may be, has been disposed of in accordance with such effective Registration Statement, (ii) such Note, Exchange Note or Private Exchange Security, as the case may be, is sold in compliance with Rule 144, (iii) in the case of any Note, such Note has or could have been exchanged pursuant to the Exchange Offer for an Exchange Note or Exchange Notes which may be resold without restriction under federal securities laws, or (iv) such Note, Exchange Note or Private Exchange Security, as the case may be, ceases to be outstanding for purposes of the Indenture.",records
"Records a. Maintain at the Site orderly files for correspondence, reports of job conferences, copies of Construction Contract Documents including all Change Orders, Field Orders, Work Change Directives, Addenda, additional Drawings issued subsequent to the execution of the Construction Contract, RFIs, Engineer’s clarifications and interpretations of the Construction Contract Documents, progress reports, Shop Drawing and Sample submittals received from and delivered to Contractor, and other Project-related documents.",records
"Records. The Administrator shall keep those records specified in Schedule C hereto in the form and manner, and for such period, as it may deem advisable but not inconsistent with the rules and regulations of appropriate government authorities, in particular Rules 31a-2 and 31a-3 under the 1940 Act. The Administrator shall only destroy records at the direction of the Fund, and any such destruction shall comply with the provisions of Section 248.30(b) of Regulation S-P (17 CFR 248.1-248.30). The Administrator may deliver to the Fund from time to time at the Administrator’s discretion, for safekeeping or disposition by the Fund in accordance with law, such records, papers and documents accumulated in the execution of its duties hereunder, as the Administrator may deem expedient, other than those which the Administrator is itself required to maintain pursuant to applicable laws and regulations. The Fund shall assume all responsibility for any failure thereafter to produce any record, paper, or other document so returned, if and when required.",records
"Records. DST will maintain customary records in connection with its agency, and particularly will maintain those records required to be maintained pursuant to subparagraph (2) (iv) of paragraph (b) of Rule 31a-1 under the 1940 Act, as amended, if any. Notwithstanding anything in this Agreement to the contrary, the records to be maintained and preserved by DST on the TA2000 System under this Agreement shall be maintained and preserved in accordance with the following:",records
Records. See Section 5(o).,records
"Records. In connection with his engagement hereunder, Employee shall accurately maintain and preserve all notes and records generated by Employer which relate to Employer and its business and shall make all such reports, written if required, as Employer may reasonably require.",records
