clause_text,clause_type
"Records. Upon termination of Danforth’s relationship with the Company, Danforth shall deliver to the Company any property or Confidential Information of the Company relating to the Services which may be in its possession including products, project plans, materials, memoranda, notes, records, reports, laboratory notebooks, or other documents or photocopies and any such information stored using electronic medium.",records
"Records. MCM agrees to maintain and to preserve for the periods prescribed under the 1940 Act any such records as are required to be maintained by MCM with respect to the Fund by the 1940 Act. MCM further agrees that all records which it maintains for the Fund are the property of the Fund and it will promptly surrender any of such records upon request, provided that MCM may maintain a copy for its own records.",records
"Records. The Trustee, and any investment manager appointed pursuant to Section 2.2, shall maintain accurate and detailed records and accounts of all investments, receipts, disbursements and other transactions made by it with respect to the Trust Fund, and all accounts, books and records relating thereto shall be open at all reasonable time to inspection and audit by the Committee and the Employer.",records
"Records. At all times, the Advisor shall keep books of account and records relating to services performed hereunder, which books of account and records shall be accessible for inspection by the Advisees and the Advisee’s appointees at any time during the ordinary business hours of the Advisor.",records
"Records. Fund Services shall keep records relating to the services to be performed hereunder in the form and manner, and for such period, as it may deem advisable and is agreeable to the Trust, but not inconsistent with the rules and regulations of appropriate government authorities, in particular, as required by the Securities Exchange Act of 1934, as amended, the rules of the stock exchange on which the Funds’ shares are listed, 17 C.F.R. 4.23 (specifically, the records specified in 17 C.F.R. 4.23(a)(1) through (8), (10) through (12) and (b)(1)), and other applicable federal securities laws and created pursuant to the performance of the Administrator’s obligations under this Agreement. Fund Services will also maintain those records of the Trust and the Funds including any changes, modifications or amendments thereto (the “Fund Records”) and will act as document repository for such Fund Records. Upon receipt of such Fund Records, Fund Services will issue a receipt for such Fund Records. Fund Services shall maintain a complete and orderly inventory of all Fund Records for which it has issued a receipt. Fund Services shall be under no duty or obligation to audit or reconcile the content, nor shall it be responsible for the accuracy or completeness of those Fund Records not created by it. Upon written request in a form to be determined by Fund Services and the Trust, Fund Services will return or release the requested Fund Records to such persons or entities pursuant to the Instructions provided by the Trust. Once one or more Fund Records have been returned or released by Fund Services, Fund Services shall have no further duty or obligation to act as repository for said previously released Fund Records. The Sponsor represents and warrants that: (a) promptly after the date of this Agreement, it will, at its own expense, deliver, cause to be delivered or make available to Fund Services all of the Fund Records in effect as of the date of this Agreement; (b) it will, on a continuing basis and at its own expense, promptly deliver, cause to be delivered or make available to Fund Services any Fund Records created after the date of this Agreement; (c) it has adequate record-keeping policies and procedures in effect to ensure that all Fund Records are promptly provided to Fund Services pursuant to the terms of this Agreement; (d) it shall be responsible for the accuracy and completeness of any Fund Records not created by Fund Services; and (e) it shall be responsible for ensur...",records
"Records maintain a record of all quotations obtained by it and of all amounts, rates and other items determined or calculated by it and make such records available for inspection at all reasonable times by the Issuer and the Paying Agents.",records
"Records. The unpaid amount of the Loan and the amount of any other credit extended by Administrative Agent or Lenders to or for the account of Borrower set forth on the books and records of Administrative Agent shall be presumptive evidence of the amount thereof owing and unpaid, but failure to record any such amount on Administrative Agent’s books and records shall not limit or affect the obligations of Borrower under the Loan Documents to make payments on the Loan when due.",records
"Records. Bank hereby agrees that Bank shall create, maintain, and retain all records relating to its activities and obligations under this Agreement in such manner as will meet the obligations of Customer under the Investment Company Act, particularly Section 31 thereof and Rules 31a-1, 31a-2 and 31a-3 thereunder, and applicable Federal, state and foreign tax laws and other laws or administrative rules or procedures, in each case as currently in effect, which may be applicable to Customer. All records so maintained in connection with the performance of its duties under this Agreement shall be preserved and maintained as required by regulation and, in the event of termination of the Agreement, shall be available to Customer or its agent upon request.",records
"Records. Licensee shall keep, and cause its Affiliates and sublicensees to keep, full, complete and proper records and accounts of all sales of Licensed Products in sufficient detail to enable the royalties payable on Net Sales of each Licensed Product to be determined. Scripps shall have the right to appoint an independent certified public accounting firm approved by Licensee, which approval shall not be unreasonably withheld, to audit the records of Licensee, its Affiliates and sublicensees as necessary to verify the royalties payable pursuant to this Agreement. Any auditing firm appointed by Scripps shall execute a confidentiality agreement with Licensee prior to performing such audit. Licensee, its *** Certain information on this page has been omitted and filed separately with the Commission. Confidential treatment has been requested with respect to the omitted portions. Affiliates and sublicensees shall pay to Scripps an amount equal to any additional royalties to which Scripps is entitled as disclosed by the audit, plus interest thereon at the rate of one and one-half percent (1.5%) per month. Such audit shall be at Scripps' expense; provided, however, that if the audit discloses that Scripps was underpaid royalties with respect to any Licensed Product by at least five percent (5%) for any calendar quarter, then Licensee, its Affiliates or sublicensee, as die case may be shall reimburse Scripps for any such audit costs. Scripps may exercise its right of audit as to each of Licensee, its Affiliates or sublicensees no more frequently than once in any calendar year. The accounting firm shall disclose to Scripps only information relating to the accuracy of the royalty payments. Licensee, its Affiliates and sublicensees shall preserve and maintain all such records required for audit for a period of three (3) years after the calendar quarter to which the record applies.",records
Records. AUDIT ACCESS AND OPEN BOOK DATA CHANGE Variation Procedure,records
Records. Copies of gauging and measurement records shall be furnished to Seller immediately upon completion of loading.,records
"Records. (a) Except as otherwise provided in a related Servicing Supplement, the Servicer shall maintain accurate and complete accounts, records and computer systems with respect to all funds and other receipts with respect to (i) the Lending Facility and the Lending Facility Pool, (ii) each Exchange Note and the related Designated Pool, (iii) the Trust Assets and (iv) all matters related directly to the servicing of the Lease Agreements and the Leased Vehicles, in each case as are consistent with the Customary Servicing Practices. Such accounts, records and computer systems shall indicate, among other things, the Pool to which each Lease Agreement, Leased Vehicle or other Trust Asset is allocated and reflect the interest of the Settlor or the Related Beneficiary, as applicable, therein. Except where otherwise noted in the definition of “Lease Documents”, the Servicer may originate and/or maintain each Lease Document as an image, fiche or electronic record rather than in original form. The Servicer shall not be required to physically segregate the Lease Documents and related accounts, records and computer systems from any other leases, leased vehicle and related information and related documentation from other leases or leased vehicles that it services. In accordance with the Customary Servicing Practices, the Servicer shall conduct, or cause to be conducted, periodic examinations of a representative sample of the Lease Documents and of the related accounts, records and computer systems to verify compliance with the Customary Servicing Practices. The Servicer shall promptly report to the Titling Trust, the Administrative Agent and the Collateral Agent any material failure on the part of the Servicer to hold or retain possession of the Lease Documents and maintain its accounts, records and computer systems in accordance with the requirements of this Agreement. The Servicer shall promptly take appropriate action to remedy any such failure.",records
"Records. 5.3.1 All documents and information relating to the participation in this Program will be regarded as a personnel matter and subject to the personnel record exemption of the California Public Records Act (Government Code Section 6250, et seq.). The annual evaluation of the Program’s impact, excluding any information on identifiable individuals, shall be subject to disclosure under the Public Records Act.",records
"Records. (A) Custodian shall maintain complete and accurate records with respect to securities, funds and other assets held for the Company, including (I) journals or other records of original entry containing an itemized daily record in detail of all receipts and deliveries of securities and all receipts and disbursements of funds; (II) ledgers (or other records) reflecting (A) securities in transfer, if any, (B) securities in physical possession, (C) monies and securities borrowed and monies and securities loaned (together with a record of the collateral therefor and substitutions of such collateral), (D) dividends and interest received, and (E) dividends receivable and interest accrued; and (III) canceled checks and bank records related thereto. Custodian shall keep such other books and records with respect to securities, funds and other assets of the Company which are held hereunder as Custodian may reasonably request.",records
"Records. 13.1 Subject to Clauses 13.3 and 13.4 below, the Bank's record of the amount of any Charge, howsoever incurred shall, whether or not authorised by a Cardmember, in the absence of manifest error, be final and binding on the Account Holder and such Cardmember, and the Bank's record of the amount of any Charge incurred using a PIN, over the internet, or by means of an ATM, point of sale terminal, other computer terminal or any telecommunication devices shall be binding on the Account Holder and each Cardmember.",records
"Records. Each Party shall maintain complete and accurate records of all work conducted and all results, data and developments made pursuant to its activities hereunder. Such records shall be complete and accurate and shall fully and properly reflect all work done and results achieved in the performance hereof in sufficient detail and in good scientific manner appropriate for patent and regulatory purposes. Each Party shall maintain such records for a period of [ * ] after such records are created; provided that the following records may be maintained for a longer period, in accordance with each Party’s internal policies on record retention: (a) scientific notebooks; and (b) any other records that the other Party reasonably requests be retained in order to ensure the preservation, prosecution, maintenance or enforcement of intellectual property rights. Either Party shall have the right to review and copy such records of the other Party at reasonable times to the extent necessary or useful for it to conduct its obligations or enforce its rights under this Agreement; provided, however, that no Party shall have the right to audit the other Party more than [ * ]. [ * ] = Certain confidential information contained in this document, marked by brackets, has been omitted and filed separately with the Securities and Exchange Commission pursuant to Rule 24b-2 of the Securities Exchange Act of 1934, as amended.",records
Records. The State of New Mexico will require that the gaming devices and gaming machines be connected to its central accounting system which monitors the operation of those devices and machines. Proprietor agrees it will cooperate fully with the State (or any of its agencies) and with Kachina in facilitating this connection. Kachina and Proprietor will each maintain separate full and complete books and records regarding the operation and use of the Property as required by law. Each party may inspect those books and records of the other party which pertain to the operation and use of the Property upon reasonable written notice to that party. Reasonable notice is a minimum of seven (7) days.,records
"Records. A. The Provider and TIBH agree to maintain all books, papers, drawings, accounting records, and evidence pertaining to costs incurred and work performed hereunder, hereinafter called the records, and shall make such records available at its office during the contract period and for four (4) years from the date of final payment under this contract. The Provider and TIBH shall allow access to the records by duly authorized representatives of the State for the purpose of making audits, examinations, excerpts, and transactions.",records
Records for real property and equipment acquired with Federal funds must be retained for 5 years after final disposition.,records
"Records. Impax shall maintain complete and accurate records of all work it conducts under the Development Program and all results, data and developments made in connection therewith. Such records shall be complete and accurate and shall fully and properly reflect all work done and results achieved in the performance of the Development Program in sufficient detail and in good scientific manner appropriate for patent and regulatory purposes. Medicis shall have the right to review and copy such records (including raw data and scientific notebooks) at reasonable times to the extent necessary for Medicis to exercise its rights under this Agreement with respect to New Product Technology and the development and commercialization of the New Product.",records
"Records. The CONSULTANT shall maintain an accurate cost keeping system as to all costs incurred in connection with the subject to this Agreement and shall produce for examination books of accounts, bills, invoices and other vouchers or certified copies there under if originals be lost at such reasonable time and place as may be designated by the OWNER and shall permit extracts and copies thereof to be made during the contract period and for three years after the date of final payment to CONSULTANT. All personnel employed by CONSULTANT shall maintain time records for time spent performing work on study described in this Agreement for a period of three years from the conclusion of the study. Time records and payroll records for said personnel shall be similarly retained by CONSULTANT for a period of three years from the conclusion of the study. Upon reasonable notice, the CONSULTANT will allow OWNER auditors to audit all records of the CONSULTANT related to this Agreement. These records shall be clearly identified and readily accessible. All records shall be kept for a period of three (3) years after final payment under Agreement is made and all other pending matters are closed.",records
"Records. Agency shall maintain records for all Referred Accounts, which shall contain at least the following information: date of referral, balance owing, records of all collection activity, all payments made on the Referred Account and Contingent Fee deducted. The foregoing information shall be provided upon reasonable request to Client",records
"Records. At the expense of the Company, the Managers shall maintain records and accounts of all operations of the Company. At a minimum, the Company shall keep at its principal place of business the following records:",records
"Records separately in respect of each Series of Notes, maintain a record of all Temporary Global Notes, Permanent Global Notes, Definitive Notes and Coupons delivered hereunder and of their redemption, payment, exchange, cancellation, mutilation, defacement, alleged destruction, theft or loss or replacement provided, however, that no record need be maintained of the serial numbers of Coupons (save insofar as that a record shall be maintained of the serial numbers of unmatured Coupons and/or unexchanged Talons missing at the time of redemption or other cancellation of the relevant Definitive Notes and, in the case of Coupons, of any subsequent payments against such Coupons) and shall send forthwith to the other Paying Agents a list of any unmatured Coupons and/or unexchanged Talons missing upon redemption of the relevant Definitive Note;",records
"Records. The Trustee shall maintain accurate records and detailed accounts of all investments, receipts, disbursements and other transactions hereunder. Such records shall be available at all reasonable times for inspection by the Company and Subsidiaries or their authorized representative. The Trustee, at the direction of the Committee, shall submit to the Committee and to any insurer such valuations, reports or other information as the Committee may reasonably require and, in the absence of fraud or bad faith, the valuation of the Trust Fund by the Trustee shall be conclusive.",records
"Records. The Servicer shall maintain all data for which it is responsible (including, without limitation, computerized tapes or disks) relating directly to or maintained in connection with the servicing of the Timeshare Loans (which data and records shall be clearly marked to reflect that the Timeshare Loans have been Granted to the Indenture Trustee on behalf of the Noteholders and constitute property of the Trust Estate) at the address specified in Section 13.3 hereof or, upon 15 days’ notice to the Issuer and the Indenture Trustee, at such other place where any Servicing Officer of the Servicer is located (or upon 24 hours’ written notice if an Event of Default or Servicer Event of Default shall have occurred).",records
"Records. The Administrator shall maintain appropriate books of account and records relating to services performed hereunder, which books of account and records shall be accessible for inspection by the Issuer, the Owner Trustee and the Depositor and their respective agents at any time during normal business hours.",records
"Records. Seller, at Buyer’s cost and expense, shall deliver (a) all electronic Records to Buyer as soon as practical on or following the Closing Date (and shall use commercially reasonable efforts to deliver such electronic Records no later than three (3) Business Days following the Closing Date) and (b) originals (or copies where no original exists) of all other Records to Buyer (FOB Seller’s office) within thirty days after the Closing; provided that Seller is entitled to retain the original Records related to accounting and Asset Taxes prior to the Effective Time and may provide Buyer with a copy in lieu of the original Record. With respect to any other original Records delivered to Buyer, subject to Section 13.13, (a) Seller shall be entitled to retain copies of such Records, and (b) Buyer shall retain any such original Records for at least seven (7) years beyond the Closing Date, during which seven (7)-year period Seller shall be entitled to obtain access to such Records, at reasonable business hours and upon prior notice to Buyer, so that Seller may make copies of such original Records, at its own expense, as may be reasonable or necessary for Tax purposes or in connection with any Proceeding or Threatened Proceeding against Seller.",records
"Records. See Section 4(n) hereof. Registrable Securities: All Convertible Notes and all Underlying Shares upon original issuance thereof and at all times subsequent thereto until the earliest to occur of (i) a Registration Statement covering such Convertible Notes and Underlying Shares having been declared effective by the SEC and such Convertible Notes and Underlying Shares have been disposed of in accordance with such effective Registration Statement, (ii) such Convertible Notes and Underlying Shares having been sold in compliance with Rule 144 or could (except with respect to affiliates of the Company within the meaning of the Securities Act) be sold in compliance with Rule 144(k) and (iii) such Convertible Notes and any Underlying Shares cease to be outstanding. Registration Default: See Section 3(a) hereof.",records
"Records of Reimbursable Services and expenses pertaining to Additional Services and services performed on the basis of hourly rates shall be kept on the basis of Generally Accepted Accounting Principles and shall be available to the Owner or the Owner’s authorized representative at mutually convenient times for a period of at least three (3) years after final completion of the Project. Owner shall have the right to verify the details set forth in Architect/Engineer’s billings, certificates, and statements, either before or after payment by (1) inspecting the books and records of Architect/Engineer during normal business hours; (2) examining any reports with respect to this Project; (3) interviewing Architect/Engineer’s business employees; (4) visiting the Project site; and (5) other reasonable action.",records
"Records. Employee will keep complete, accurate and authentic accounts, notes, data and records of all the Inventions in the manner and form requested by the Company. Such accounts, notes, data and records shall be the property of the Company, and upon its request, Employee will promptly surrender the same to it. Upon the termination of his employment hereunder, Employee agrees to deliver promptly to the Company all equipment (including computers, etc.), records, manuals, books, blank forms, documents, letters, memoranda, notes, notebooks, reports, data, tables, accounts, calculations and copies thereof, which are the property of the Company or which relate in any way to the business, products, practices or techniques of the Company, and all other property, trade secrets and confidential information of the Company, including, but not limited to, all documents which in whole or in part contain any trade secrets or confidential information of the Company, which in any of these cases are in his possession or under his control.",records
"Records of Defined Cost, payments & assessments of compensation events to be kept by the Contractor",records
"Records. The copies of the Articles of Incorporation, Bylaws and all Securities & Exchange filings of the Company, which are available for review by the Buyer are true, accurate and complete and reflect all amendments made through the date of this Agreement. All material corporate actions relating to the Company's business or relating to the transactions contemplated by this Agreement taken by the Company have been duly authorized or ratified. All accounts, books, ledgers and official and other records of the Company and relating to its business or relating to the transactions contemplated by this Agreement have been fully, properly and accurately kept and completed in all material respects, and there are no material inaccuracies or discrepancies of any kind contained therein.",records
"Records. “supporting obligations” (as defined in Article 9 of the UCC) and related Letters of Credit, commercial tort claims or other claims and causes of action, in each case, to the extent directly related to the foregoing; provided however, in the event that any such Records, “supporting obligations” and related Letters of Credit, commercial tort claims or other claims and causes of action directly relate to both the Revolving Credit Primary Collateral and the Notes Collateral, then only those which primarily relate to the Revolving Credit Primary Collateral shall be included in this definition; and",records
