clause_text,clause_type
"Records. The Custodian shall with respect to each Portfolio create and maintain all records relating to its activities and obligations under this Contract in such manner as will meet the obligations of the Fund under the Investment Company Act of 1940, with particular attention to Section 31 thereof and Rules 31a-1 and 31a-2 thereunder. All such records shall be the property of the Fund and shall at all times during the regular business hours of the Custodian be open for inspection by duly authorized officers, employees or agents of the Fund and employees and agents of the Securities and Exchange Commission. The Custodian shall, at the Fund's request, supply the Fund with a tabulation of securities owned by each Portfolio and held by the Custodian and shall, when requested to do so by the Fund and for such compensation as shall be agreed upon between the Fund and the Custodian, include certificate numbers in such tabulations.",records
"Records. USBFS shall keep records relating to the services to be performed hereunder in the form and manner, and for such period, as it may deem advisable and is agreeable to the Trust, but not inconsistent with the rules and regulations of appropriate government authorities, in particular, Section 31 of the 1940 Act and the rules thereunder. USBFS agrees that all such records prepared or maintained by USBFS relating to the services to be performed by USBFS hereunder are the property of the Trust and will be preserved, maintained, and made available in accordance with such applicable sections and rules of the 1940 Act and will be promptly surrendered to the Trust or its designee on and in accordance with its request.",records
"Records. The Servicer shall maintain appropriate books of account and records relating to services performed under this Agreement, which books of account and records shall be accessible for inspection by the Issuer at any time during normal business hours.",records
"Records. The Company shall make available for inspection by the holders of Registrable Securities included in such Registration Statement, any Underwriter participating in any disposition pursuant to such registration statement and any attorney, accountant or other professional retained by any holder of Registrable Securities included in such Registration Statement or any Underwriter, all financial and other records, pertinent corporate documents and properties of the Company, as shall be necessary to enable them to exercise their due diligence responsibility, and cause the Company’s officers, directors and employees to supply all information requested by any of them in connection with such Registration Statement.",records
"Records. The records relating to the services provided under this Agreement shall be the property of the Trust and shall be under its control; however, the Trust shall furnish to the Sub-Adviser such records and permit it to retain such records (either in original or in duplicate form) as it shall reasonably require in order to carry out its business or to comply with applicable laws and regulations. In the event of the termination of this Agreement, such other records shall promptly be returned to the Trust by the Sub-Adviser free from any claim or retention of rights therein, provided that the Sub-Adviser may retain any such records that are required by law or regulation.",records
"Records. (a) The Custodian shall maintain complete and accurate records with respect to Securities, cash or other property held for the Fund, including (i) journals or other records of original entry containing an itemized daily record in detail of all receipts and deliveries of Securities and all receipts and disbursements of cash; (ii) ledgers (or other records) reflecting (A) Securities in transfer, (B) Securities in physical possession, (C) monies and Securities borrowed and monies and Securities loaned (together with a record of the collateral therefor and substitutions of such collateral), (D) dividends and interest received, and (E) dividends receivable and interest receivable; (iii) canceled checks and bank records related thereto; and (iv) all records relating to its activities and obligations under this Agreement. The Custodian shall keep such other books and records of the Fund as the Trust shall reasonably request, or as may be required by the 1940 Act, including, but not limited to, Section 31 of the 1940 Act and Rule 31a-2 promulgated thereunder.",records
"Records associated with signing the TLD zone (i.e., RRSIG, DNSKEY, NSEC, and NSEC3) (Note: The above language effectively does not allow, among other things, the inclusion of DNS resource records that would enable a dotless domain name (e.g., apex A, AAAA, MX records) in the TLD zone.) If Registry Operator wishes to place any DNS resource record type into its TLD DNS zone (other than those listed in Sections 1.1 through 1.5 above), it must describe in detail its proposal and submit a Registry Services Evaluation Process (RSEP) request. This will be evaluated per RSEP to determine whether the service would create a risk of a meaningful adverse impact on security or stability of the DNS. Registry Operator recognizes and acknowledges that a service based on the use of less-­‐common DNS resource records in the TLD zone, even if approved, might not work as intended for all users due to lack of software support.",records
"Records associated with signing the TLD zone (i.e., RRSIG, DNSKEY, NSEC, and NSEC3)",records
"Records. The Administrator shall maintain appropriate books of account and records relating to services performed hereunder, which books of account and records shall be accessible for inspection by the Issuer, the Owner Trustee and the Indenture Trustee at any time during normal business hours upon reasonable advance written notice.",records
"Records. The Contractor shall establish and maintain complete and accurate books, records, documents, accounts and other evidence directly pertinent to performance under this contract (hereinafter, collectively, ""the Records""). The Records must be kept for the balance of the calendar year in which they were made and for six (6) additional years thereafter. The State Comptroller, the Attorney General and any other person or entity authorized to conduct an examination, as well as the agency or agencies involved in this contract, shall have access to the Records during normal business hours at an office of the Contractor within the State of New York or, if no such office is available, at a mutually agreeable and reasonable venue within the State, for the term specified above for the purposes of inspection, auditing and copying. The State shall take reasonable steps to protect from public disclosure any of the Records which are exempt from disclosure under Section 87 of the Public Officers Law (the ""Statute"") provided that: (i) the Contractor shall timely inform an appropriate State official, in writing, that said records should not be disclosed; and (ii) said records shall be sufficiently identified; and (iii) designation of said records as exempt under the Statute is reasonable. Nothing contained herein shall diminish, or in any way adversely affect, the State's right to discovery in any pending or future litigation.",records
"Records. The Sub-Adviser shall, with respect to orders the Sub-Adviser places for the purchase and sale of portfolio securities of the Funds, maintain or arrange for the maintenance of the documents and records required pursuant to Rule 31a-1 under the 1940 Act as well as trade tickets and confirmations of portfolio trades and such other records as the Adviser or the Funds' Administrator reasonably requests to be maintained. All such records shall be maintained in a form acceptable to the Funds and in compliance with the provisions of Rule 31a-1 or any successor rule. All such records will be the property of the Funds, and will be available for inspection and use by the Funds and their authorized representatives (including the Adviser). The Sub-Adviser shall promptly, upon the Trust's request, surrender to the Funds those records which are the property of the Trust or any Fund. The Sub-Adviser will promptly notify the Funds' Administrator if it experiences any difficulty in maintaining the records in an accurate and complete manner.",records
"Records. I agree to keep and maintain adequate and current records (in the form of notes, sketches, drawings and in any other form that may be required by the Company) of all Proprietary Information developed by me and all Inventions made by me during the period of my employment at the Company, which records shall be available to and remain the sole property of the Company at all times.",records
"Records. FAS shall create and maintain all necessary books and records in accordance with all applicable laws, rules and regulations, including but not limited to records required by Section 31(a) of the 1940 Act, pertaining to the Administrative Services performed by it and not otherwise created and maintained by another party pursuant to contract with the Investment Company. Where applicable, such records shall be maintained by FAS for the periods and in the places required by Rule 31a-2 under the 1940 Act. The books and records pertaining to the Investment Company which are in the possession of FAS shall be the property of the Investment Company. The Investment Company, or the Investment Company's authorized representatives, shall have access to such books and records at all times during FAS's normal business hours. Upon the reasonable request of the Investment Company, copies of any such books and records shall be provided promptly by FAS to the Investment Company or the Investment Company's authorized representatives.",records
"Records. The Trust agrees to maintain and to preserve for the periods prescribed under the 1940 Act any such records as are required to be maintained by the Trust with respect to the Series by the 1940 Act. The Adviser further agrees that all records of the Series are the property of the Trust and, to the extent held by the Adviser, it will promptly surrender any of such records upon request.",records
"Records. The date, amount, interest rate, Type and duration of Interest Periods (if applicable) of each Loan made by each Lender to the Borrower, and each payment made on account of the principal thereof, shall be recorded by such Lender on its books and such entries shall be binding on the Borrower absent manifest error; provided, however, that (i) the failure of a Lender to make any such record shall not affect the obligations of the Borrower under any of the Loan Documents and (ii) if there is a discrepancy between such records of a Lender and the statements of accounts maintained by the Administrative Agent pursuant to Section 3.8., in the absence of manifest error, the statements of account maintained by the Administrative Agent pursuant to Section 3.8. shall be controlling.",records
"Records. The books and records pertaining to the Fund which are in the possession of U.S. Trust shall be the property of the Fund. Such books and records shall be prepared and maintained as required by the 1940 Act, as amended, and other applicable securities laws and rules and regulations. The Fund, or the Fund's authorized representative, shall have access to such books and records at all times during U.S. Trust's normal business hours, and such books and records shall be surrendered to the Fund promptly upon request. Upon reasonable request of the Fund, copies of any such books and records shall be provided by U.S. Trust to the Fund or the Fund's authorized representative at the Fund's expense.",records
"Records. The Administrator agrees to maintain and keep all books, accounts and other records of the Company that relate to activities performed by the Administrator hereunder and will maintain and keep such books, accounts and records in accordance with the Investment Company Act. In compliance with the requirements of Rule 31a-3 under the Investment Company Act, the Administrator agrees that all records which it maintains for the Company shall at all times remain the property of the Company, shall be readily accessible during normal business hours, and shall be promptly surrendered upon the termination of the Agreement or otherwise on written request. The Administrator further agrees that all records which it maintains for the Company pursuant to Rule 31a-1 under the Investment Company Act will be preserved for the periods prescribed by Rule 31a-2 under the Investment Company Act unless any such records are earlier surrendered as provided above. Records shall be surrendered in usable machine-readable form. The Administrator shall have the right to retain copies of such records subject to observance of its confidentiality obligations under this Agreement.",records
"Records. All working papers and such other information and materials as may have been accumulated by the Contractor in performing the Contract, including but not limited to, documents, data, plans, books, computations, drawings, specifications, notes, reports, records, estimates, summaries and correspondence, kept or stored in any form.",records
Records. PFPC shall maintain records of the accounts for each shareholder showing the following information:,records
"Records. The Custodian shall with respect to each Portfolio create and maintain all records relating to its activities and obligations under this Agreement in such manner as will meet the obligations of each Fund under the 1940 Act, with particular attention to Section 31 thereof and Rules 31a-1 and 31a-2 thereunder. All such records shall be the property of the Fund and shall at all times during the regular business hours of the Custodian be open for inspection by duly authorized officers, employees or agents of the Fund and employees and agents of the SEC or other regulators with jurisdiction over the Funds with respect to the Portfolios. The Custodian shall, at the Fund’s request, supply the Fund with a tabulation of securities owned by each Portfolio and held by the Custodian and shall, when requested to do so by the Fund and for such compensation as shall be agreed upon between the Fund and the Custodian, include certificate numbers in such tabulations. In the event that the Custodian is requested or authorized by a Fund, or required by subpoena, administrative order, court order or other legal process, applicable law or regulation, or required in connection with any investigation, examination or inspection of the Fund by state or federal regulatory agencies, to produce the records of the Fund or the Custodian’s personnel as witnesses, the Fund will pay the Custodian for the Custodian’s time and expenses incurred in responding to a non-routine request, order or requirement as reasonably agreed by the Fund and the Custodian, taking into account past practices.",records
"Records. The Servicer shall, during the period it is servicer hereunder, maintain such books of account and other records as will enable the Owner Trustee and the Indenture Trustee to determine the status of each Contract.",records
"Records. The Administrator shall maintain appropriate books of account and records relating to services performed under this Agreement, which books of account and records shall be accessible for inspection by the Issuer, the Indenture Trustee, the Securities Administrator and the Owner Trustee at any time during normal business hours.",records
"Records. Company shall maintain, and shall cause its Affiliates and Sublicensees to maintain, complete and accurate records of Licensed Products that are made, used, sold, or performed under this Agreement and any amounts payable to Medical School in relation to such Licensed Products, which records shall contain sufficient information to permit Medical School to confirm the accuracy of any reports delivered to Medical School under Section 5.2. The relevant party shall retain such records relating to a given Royalty Period for at least three (3) years after the conclusion of that Royalty Period, during which time Medical School shall have the right, at its expense, to cause its internal accountants or an independent, certified public accountant to inspect such records during normal business hours for the sole purpose of verifying any reports and payments delivered under this Agreement. Such accountant shall not disclose to Medical School any information other than information relating to accuracy of reports and payments delivered under this Agreement. The parties shall reconcile any underpayment or overpayment within thirty (30) days after the accountant delivers the results of the audit. In the event that any audit performed under this Section reveals an underpayment in excess of the greater of (a) five thousand dollars ($5,000) or (b) ten percent (10%) in any Royalty Period, Company shall bear the full cost of such audit. Medical School may exercise its rights under this Section only once every year and only with reasonable prior notice to Company.",records
"Records. The Accounting Agent shall create and maintain all records relating to its activities and obligations under this Agreement in such a manner as will meet the obligations of the Trust under the 1940 Act, specifically Section 31 thereof and Rules 31a-1 and 31a-2 thereunder. All such records shall be the property of the Trust and shall at all times during the regular business hours of the Accounting Agent be open for inspection by duly authorized officers, employees or agents of the Trust and employees and agents of the SEC. Subject to Section XVII.B below, the Accounting Agent shall preserve for the period required by law the records required to be maintained thereunder.",records
"Records. The Administrator shall comply with Section 5.4 of the Trust Agreement, including maintaining appropriate books of account and records relating to services performed hereunder, which books of account and records shall be accessible for inspection by the Issuing Entity and the Depositor at any time during normal business hours.",records
"Records. Records of Contractor’s costs, reimbursable expenses pertaining to the Project and payments shall be available to Owner or its authorized representative during business hours and shall be retained for four (4) years after final Payment or abandonment of the Project, unless Owner otherwise instructs Contractor in writing.",records
"Records. Manager shall maintain all office records and books of account and shall record therein, and keep copies of, each invoice received from services, work and supplies ordered in connection with the maintenance and operation of the Properties. Such records shall be maintained on a double entry basis. Owner and persons designated by Owner shall at all reasonable time have access to and the right to audit and make independent examinations of such records, books and accounts and all vouchers, files and all other material pertaining to the Properties and this Management Agreement, all of which Manager agrees to keep safe, available and separate from any records not pertaining to the Properties, at a place recommended by Manager and approved by Owner.",records
"Records. Transfer Agent may adopt as part of its records all lists of holders, records of Fund’s shares, books, documents and records which have been employed by any former agent of Fund for the maintenance of the ledgers for the Fund’s shares, provided such ledger is certified by an officer of Fund or the prior transfer agent to be true, authentic and complete.",records
"Records. The Transfer Agent shall prepare and keep records relating to the services to be performed hereunder, in the form, manner and for such periods, as it may deem advisable and as may be required by (i) the laws and regulations applicable to its business as a Transfer Agent, including, but not limited to, those set forth in 17 CFR 240.17Ad-6 and 17 CFR 240.17Ad-7, and those set forth in IRS regulations with respect to any services as information reporting and withholding agent for the Funds, in each case as such regulations may be amended from time to time; and (ii) its record retention policies. The Transfer Agent shall also maintain customary records in connection with its agency for the Fund; particularly those records required to be maintained pursuant to subparagraph (2)(iv) of paragraph (b) of Rule 31a-1 under 1940 Act. Records maintained by the Transfer Agent on behalf of the Funds are the property of the Funds and shall be made available for reasonable examinations by the Funds’ governmental regulators upon reasonable request and shall be preserved and maintained by the Transfer Agent for such period as required by applicable law or until such earlier time as the Transfer Agent has delivered such records into the Fund’s possession or destroyed them at the Fund’s request.",records
Records. The Contractor and any Sub-contractors appointed by it shall maintain the records referred to in clause E9.1 and such other documents as the Authority may reasonably require throughout the period of this Contract; and the Contractor and any Sub-contractors appointed by it shall maintain such records and documents until at least 31 December 2022.,records
"Records. The unpaid principal of and interest on the Loans, the interest rate or rates applicable to such unpaid principal and interest, the duration of such applicability, the Commitments, and the accrued and unpaid fees payable pursuant to Section 2.06 hereof, shall at all times be ascertained from the records of the Agents, which shall be conclusive and binding absent manifest error.",records
Records. This Agreement and the performance by Processor of the Services hereunder shall not relieve Processor of any obligation imposed by law or contract regarding the maintenance of records.,records
"Records. Escrow Agent shall maintain accurate records of all transactions hereunder. Promptly after the termination of this Make Good Agreement or as may reasonably be requested by the parties hereto from time to time before such termination, Escrow Agent shall provide the parties hereto, as the case may be, with a complete copy of such records, certified by Escrow Agent to be a complete and accurate account of all such transactions. The authorized representatives of each of the parties hereto shall have access to such books and records at all reasonable times during normal business hours upon reasonable notice to Escrow Agent and at the requesting party’s expense.",records
"Records. DST will maintain customary records in connection with its agency, and particularly will maintain those records required to be maintained pursuant to subparagraph (2) (iv) of paragraph (b) of Rule 31a-1 under the Investment Company Act of 1940, if any.",records
"Records. Executive will keep complete, accurate and authentic accounts, notes, data and records of all Developments in the manner and form requested by the Company. Such accounts, notes, data and records shall be the property of the Company, and, upon its request, Executive will promptly surrender same to it or, if not previously surrendered upon its request or otherwise, Executive will surrender the same, and all copies thereof, to the Company upon the conclusion of his employment.",records
"Records. The Servicer will maintain and implement administrative and operating procedures (including an ability to recreate records evidencing Pool Receivables and related Contracts in the event of the destruction of the originals thereof), and keep and maintain all documents, books, records, computer tapes and disks and other information reasonably necessary or advisable for the collection of all Pool Receivables (including records adequate to permit the daily identification of each Pool Receivable and all Collections of and adjustments to each existing Pool Receivable).",records
"Records. Subadviser will maintain proper and complete records relating to the furnishing of services under this Agreement, including records with respect to the acquisition, holding and disposition of securities for Client in accordance with applicable laws and rules and such reasonable instructions as shall be provided to Subadviser by Client from time to time. All records maintained pursuant to this Agreement shall be subject to examination by Client and by persons authorized by it during normal business hours upon reasonable notice. Except as may be required by applicable law, rule or as requested by regulatory authorities having jurisdiction over a party to this Agreement or as directed by other party in writing, Subadviser and Client shall keep confidential the records and other information obtained by reason of this Agreement. Upon termination of this Agreement, Subadviser shall promptly, upon demand, return to Client all records Client reasonably believes are necessary in order to discharge its responsibilities to The Vantagepoint Funds. Subadviser shall be entitled to retain originals or copies of records pursuant to the requirements of applicable laws or regulations.",records
"Records. Transfer Agent shall maintain those records required by the Securities Laws and any laws, rules and regulations of governmental authorities having jurisdiction with respect to the duties to be performed by Transfer Agent hereunder with respect to Shareholder accounts or by transfer agents generally, including records of the accounts for each Shareholder showing the following information:",records
