clause_text,clause_type
"Records. Contractor shall keep, and require subcontractors to keep, such books and records as shall be necessary to perform the services required by this Agreement and enable the Contract Officer to evaluate the performance of such services. The Contract Officer shall have full and free access to such books and records at all times during normal business hours of City, including the right to inspect, copy, audit and make records and transcripts from such records. Such records shall be maintained for a period of three (3) years following completion of the services hereunder, and the City shall have access to such records in the event any audit is required.",records
"Records. (a) Notwithstanding the provisions of Section 5.24, but subject to the provisions of Section 5.6, (i) after the Closing Date, the Purchaser, the Designated Purchasers and the Companies, on the one hand, and the Sellers, on the other hand, will make available to the other, as reasonably requested, and to any Tax Authority, all information, records or documents relating to liability for Taxes with respect to the Assets, the Assumed Liabilities, the Business or the Companies for all periods prior to or including the Closing Date (including Straddle Periods), and will preserve such information, records or documents until the expiration of any applicable statute of limitations or extensions thereof, and (ii) in the event that one party needs access to records in the possession of a second party relating to any of the Assets, the Assumed Liabilities, the Business or the Companies for purposes of preparing Tax Returns or complying with any Tax audit request, subpoena or other investigative demand by any Tax Authority, or for any other legitimate Tax-related purpose not injurious to the second party, the second party will allow representatives of the other party access to such records during regular business hours at the second party’s place of business for the sole purpose of obtaining information for use as aforesaid and will permit such other party to make extracts and copies",records
Records. The Registrar shall:,records
"Records. Trust Company shall keep records relating to the services to be performed hereunder, in the form and manner as it may deem advisable.",records
"Records which relate to appeals or litigation or settlement of claims arising out of the performance of this Contract shall be made available for the period of four (4) years from the date of final disposition of such appeals, litigation, or claims.",records
"Records. I will make and maintain adequate and current written records of all Inventions covered by Section 5.1. These records may be in the form of notes, sketches, drawings, flow charts, electronic data or recordings, notebooks and any other format. These records shall be and remain the property of the Company at all times and shall be made available to the Company at all times.",records
"Records. A stock ledger consisting of one or more records in which the names of all of the Corporation’s stockholders of record, the address and number of shares registered in the name of each such stockholder, and all issuances and transfers of stock of the corporation are recorded in accordance with Section 224 of the DGCL shall be administered by or on behalf of the Corporation. Any records administered by or on behalf of the Corporation in the regular course of its business, including its stock ledger, books of account, and minute books, may be kept on, or by means of, or be in the form of, any information storage device, or method, or one or more electronic networks or databases (including one or more distributed electronic networks or databases), provided that the records so kept can be converted into clearly legible paper form within a reasonable time and, with respect to the stock ledger, that the records so kept (i) can be used to prepare the list of stockholders specified in Sections 219 and 220 of the DGCL, (ii) record the information specified in Sections 156, 159, 217(a) and 218 of the DGCL, and (iii) record transfers of stock as governed by Article 8 of the Uniform Commercial Code as adopted in the State of Delaware.",records
"Records. The Administrator shall retain copies of invoices submitted by it under Section 4.02, and of any third party invoices or similar documentation contained or reflected therein, for a minimum period of three (3) years or such longer period as required by applicable law. Records maintained by the Administrator pursuant to this Section 4.03 shall be the property of the Company or the Project Company, as applicable, and shall not be destroyed, unless the Company or the Project Company, as applicable, shall have consented to such destruction in writing or declined in writing to accept possession of the records after the Administrator has advised the Company or the Project Company, as applicable, that the records will be destroyed.",records
"Records. Relating to SpinCo Employees and Former SpinCo Employees. All records and data in any form relating to SpinCo Employees and Former SpinCo Employees shall be the property of the SpinCo Group, except that records and data pertaining to such an employee and relating to any period that such employee was (i) employed by any member of the RemainCo Group or (ii) covered under any employee benefit plan sponsored by any member of the RemainCo Group (to the extent that such records or data relate to such coverage) prior to the Employee Transfer Date shall be jointly owned by those members of the RemainCo Group and the SpinCo Group.",records
"Records. (a) Within ten (10) days after the Closing Date, Sellers shall deliver or cause to be delivered to Purchaser any Records that are in the possession of Sellers or its Affiliates, subject to Section 13.6(b).",records
"Records. Upon termination of your relationship with the Company, you shall deliver to the Company any property of the Company which may be in your possession including products, materials, memoranda, notes, records, reports, laboratory notebooks, or other documents or photocopies of the same, including without limitation any of the foregoing recorded on any computer or any machine readable medium.",records
"Records. The Managers shall keep or cause to be kept at the Principal Office of the Company the following: (a) a written record of the full name and business, residence or mailing address of the Member; (b) a copy of the initial Articles of Organization and all amendments thereto; (c) copies of all written operating agreements and all amendments to such agreements, including any prior written operating agreements no longer in effect; (d) copies of any written and signed promises by the Member to make capital contributions to the Company; (e) copies of the Company’s federal, state and local income tax returns and reports, if any, for the three most recent years; (f) copies of any prepared financial statements of the Company for the three most recent years; and (g) minutes of every meeting as well as any written consents or actions taken without a meeting.",records
"Records. Within ten (10) Business Days after the Closing, Seller shall furnish Buyer the Records in its possession or under its control. All reasonable out-of-pocket costs associated with delivering the Records shall be borne solely by Buyer. Insofar as Seller reasonably believes the Records may be needed or useful in connection with federal, state or local regulatory or Tax matters or resolution of disputes, litigation, or contract compliance issues, Buyer (for a period of seven (7) years after the Closing) shall further make available to Seller Group (at the location of such Records in Buyer’s organization) access to the Records during normal business hours, upon not less than two (2) Business Days prior written request by Seller Group, and Seller Group shall have the right to copy at its own expense and retain such copies of the Records as Seller Group, in good faith, believes may be useful or needed in connection with the above-described matters.",records
"Records. The Lender’s Revolving Credit Facility Committed Amount, the unpaid principal amount of the Loans, Letter of Credit Obligations, the unpaid interest accrued thereon, the interest rate or rates applicable to such unpaid principal amount, the duration of such applicability, the Revolving Unused Fee and the Letter of Credit Fee shall at all times be ascertained from the records of the Lender, which shall be conclusive absent manifest error.",records
"Records. The books and records pertaining to the Trust that are in the possession or under the control of TNC shall be the property of the Trust. The Trust, Board of Trustees, officers of the Trust and their designated representatives shall have access to such books and records during TNC’s normal business hours. Upon reasonable request of the Trust, copies of any such books and records shall be provided by TNC. TNC shall preserve and maintain all books and records relating to its duties hereunder and all other books and records as TNC is required to maintain pursuant to applicable federal securities laws.",records
"Records. The Subcontractor agrees to maintain all reports, documents, papers, accounting records, books, and other evidence pertaining to costs incurred and work performed under this agreement (called the “Records”), and shall make the Records available at its office for the time period authorized within the Grant Period, as specified in this Grant Agreement. The Subcontractor further agrees to retain the Records for seven (7) years from the date of final payment under this agreement, until completion of all audits, or until pending litigation has been completely and fully resolved, whichever occurs last. The records to be thus maintained and retained by the Subcontractor shall include (without limitation): (1) personnel and payroll records, including social security numbers and labor classifications, accounting for total time distribution of the Subcontractor's employees working full or part time on the work, as well as cancelled payroll checks, signed receipts for payroll payments in cash, or other evidence of disbursement of payroll payments; (2) invoices for purchases, receiving and issuing documents, and all other unit inventory records for the Subcontractor's stocks or capital items; and (3) paid invoices and cancelled checks for materials purchased and for ' and any other third parties' charges. Duly authorized representatives of the H-GAC, TXDoT, the USDOT, the Office of the Inspector General, Texas State Auditor, and the Comptroller General shall have access to the Records. This right of access is not limited to the four (4) year period but shall last as long as the Records are retained.",records
"Records. 4.1 The Licensee shall keep at its normal place of business detailed and up to date records and accounts showing the quantity, description and value of Licensed Products and Services sold by it, and the amount of sublicensing revenues received by it in respect of Licensed Products, on a country by country basis, and being sufficient to ascertain the payments due under this Agreement.",records
Records information and audit,records
"Records. Usage, Duplication, and Redisclosure Restrictions",records
Records. The Managers must keep the following at the Company’s principal place of business:,records
"Records. Selling Broker-Dealer and General Agent shall have the responsibility for maintaining the records of its Sub-agents and representatives licensed, registered and otherwise qualified to sell the Contracts. Selling Broker-Dealer and General Agent shall maintain such other records as are required of them by applicable laws and regulations. The books, accounts and records of Selling Broker-Dealer and General Agent relating to the sale of the Contracts shall be maintained so as to clearly and accurately disclose the nature and details of the transactions. Selling Broker-Dealer and General Agent each agree to make the books and records relating to the sale of the Contracts available to Pacific Mutual or PEN upon their written request.",records
Records relating to real property acquired shall be retained for five years after the closing on the transfer of title.,records
"Records. All memoranda, notes, lists, records and other documents (and all copies thereof) made or compiled by the Employee or made available to the Employee by the Company concerning the Company’s business or the Company shall be the Company’s property and shall be delivered to the Company at any time on request.",records
Records. The Borrower shall retain all of its accounting records relating to the funds established under this Borrower Loan Agreement and all calculations made in preparing the statements described in this Section 5.35 for at least six years after the later of the final maturity of the Governmental Lender Note or the date the Funding Loan is retired in full.,records
Records. Employee agrees to make and maintain adequate and current written records of all Inventions covered by this Employment Contract. These records shall be and remain the property of the Company.,records
"Records. All supporting evidence and documents relating to any of the above-described property, including, without limitation, computer programs, disks, tapes and related electronic data processing media, and all rights of such Debtor to retrieve the same from third parties, written applications, credit information, account cards, payment records, correspondence, delivery and installation certificates, invoice copies, delivery receipts, notes and other evidences of indebtedness, insurance certificates and the like, together with all books of account, ledgers and cabinets in which the same are reflected or maintained, all whether now existing or hereafter arising;",records
"Records. GROWER shall keep accurate and correct records of Licensed Product made, used, sold, or otherwise Commercialized by Grower under this Agreement appropriate to determine the amount of royalties due and compliance with the terms and conditions hereunder. Such records shall be retained for at least three (3) years following a given reporting period. Such records shall be made available during normal business hours for inspection, upon at least five (5) days prior notice, by PVMI or a Tri-State Partner Institution, or by a Certified Public Accountant (“CPA”) selected by PVMI or a Tri-State Partner Institution and approved by GROWER, for the sole purpose of verifying reports and payments hereunder. Such CPA shall not disclose any information other than information relating to accuracy of reports and payments made under this Agreement. In the event that any such inspection shows an underreporting and underpayment, then GROWER shall pay any additional sum that would have been payable to PVMI had GROWER reported correctly, with interest at the rate provided in Section 3, plus any out-of-pocket costs associated with the audit.",records
"Records. ADM shall keep the records described on the Activities List, including but not limited to the following: (a) accounts for each Shareholder showing the following information: (i) name, address and United States Tax Identification or Social Security number; (ii) number of Shares held and number of Shares for which certificates, if any, have been issued, including certificate numbers and denominations; (iii) historical information regarding the account of each Shareholder, including dividends and distributions paid and the date and the price, if applicable, for all transactions in a Shareholder's account; (iv) any stop or restraining order placed against a Shareholder's account; (v) any correspondence relating to the current maintenance of a Shareholder's account; (vi) information with respect to withholdings in the case of a foreign account; and (vii) information with respect to withholding in the case of an account subject to backup withholding; (ix) any information required in order for ADM to perform any calculations contemplated or required by this Agreement. (b) If agreed between the Fund and ADM, subaccounts may be maintained for each Shareholder requesting such services in connection with shares held by such Shareholder for separate accounts containing the same information for each subaccount as required by subparagraph (a) above. The books and records pertaining to the Fund which are in the possession of ADM shall be the property of the Fund. Such books and records shall be prepared and maintained as required by the 1940 Act and other applicable securities laws and rules and regulations in effect from time to time. ADM will, if so requested by the counsel to the Fund, modify the manner in which such books and records are prepared and maintained so as to comply with the reasonable opinion of such counsel as to such laws and rules. The Fund, or the Fund's authorized representatives, shall have access to such books and records at all times during ADM's normal business hours. Upon the reasonable request of the Fund, copies of any such books and records shall be provided by ADM to the Fund or the Fund's authorized representative at the Fund's expense.",records
"Records. TFS recognizes and agrees that, pursuant to Rule 31a-3 under the 1940 Act, records required to be maintained by the Fund pursuant to Rule 31a-1 and/or Rule 31a-2 under the 1940 Act that are maintained by TFS, for and on behalf of the Fund, are the property of the Fund; shall be maintained, updated, preserved, and made available in accordance with the 1940 Act and rules thereunder; and will be surrendered promptly to the Fund upon request.",records
"Records. The Dealer Agreements, Contracts, Contract Files, certificates of title (and applications therefor) and all other documents, books, records and other information (including, without limitation, computer programs, tapes, discs, punch cards, data processing software and related contracts, records and other media for storage of information) in each case whether tangible or electronic that are maintained with respect to the Loans and the Contracts and the related Obligors. Reference Bank: Any bank that furnishes information for purposes of determining the Adjusted LIBOR Rate. Register: Defined in Section 13.1(c).",records
"Records. During the term of this Agreement and for a period of three years thereafter, Purchaser and its Affiliates shall keep, and shall cause its licensees and sublicensees to keep, complete and accurate records of their Net Sales in sufficient detail to enable the amounts payable under this Section 2.06(a) to be determined. Upon Aradigm’s written request, but not more frequently than once per calendar year, Purchaser shall permit representatives or agents of Aradigm, at Aradigm’s expense, to examine such records during Purchaser’s regular business hours for the purpose of and to the extent necessary to verify any report required under this Agreement with respect to Net Sales received not more than three years prior to the date of Aradigm’s request. In the event that the amounts due to Aradigm are determined to have been underpaid, Purchaser shall promptly pay to Aradigm any amount due and unpaid. In the event that it is determined, as a result of such examination, that the amount underpaid with respect to a given payment is in excess of 5% of the total amount of such payment, then Purchaser shall reimburse Aradigm for all costs incurred by Aradigm in conducting such examination.",records
"Records. With respect to any Transferred Loans, all documents, books, records and other information (including computer programs, tapes, disks, punch cards, data processing software and related property and rights) maintained with respect to any item of Collateral and the related Obligors, other than the Loan Documents.",records
"Records. Borrower will keep and maintain full and accurate accounts and records of its operations in accordance with GAAP and will permit Bank, at Borrower’s expense, to have access thereto, to make examination and photocopies thereof, and to make audits of Borrower’s accounts and records and Bank’s collateral during regular business hours.",records
"Records. Create, maintain and retain all records a) relating to its activities and obligations under this Agreement in such manner as shall meet the obligations of the Fund under the 1940 Act, particularly Section 31 thereof and Rules 3la-1 and 3la-2 thereunder or b) as reasonably requested from time to time by the Fund. All records maintained by Provident in connection with the performance of its duties under this Agreement shall remain the property of the Fund and in the event of termination of this Agreement shall be delivered in accordance with the terms of paragraph 10 below.",records
"Records. Corvus shall maintain records in sufficient detail and in good scientific manner appropriate for patent and regulatory purposes, and in compliance with Applicable Law, which shall be materially complete and accurate and shall properly reflect all work done and results achieved in the performance of its Development and Commercialization activities. Such records shall be retained by Corvus for at least [***], or for such longer period as may be required by Applicable Law.",records
"Records. The Company shall make available for inspection by the Holders included in such Registration Statement, any Underwriter participating in any disposition pursuant to such Registration Statement and any attorney, accountant or other professional retained by the Holders included in such Registration Statement or any Underwriter (each an “Inspector” and, collectively, the “Inspectors”), all financial and other records, pertinent corporate documents and properties of the Company (collectively, the “Records”), as shall be necessary to enable them to exercise their due diligence responsibility, and cause the Company’s officers, directors and employees to supply all information reasonably requested by any of them in connection with such Registration Statement. Records that the Company determines, in good faith, to be confidential and which it notifies the Inspectors are confidential shall not be disclosed by the Inspectors (and the Inspectors shall confirm their agreement in writing in advance to the Company if the Company shall so request) unless (x) the disclosure of such Records is necessary, in the Company’s judgment, to avoid or correct a misstatement or omission in the Registration Statement, (y) the release of such Records is ordered pursuant to a subpoena or other order from a court of competent jurisdiction after exhaustion of all appeals therefrom or (z) the information in such Records was known to the Inspectors on a non-confidential basis prior to its disclosure by the Company or has been made generally available to the public. Each Holder participating in an offering agrees that it shall, upon learning that disclosure of such Records is sought in a court of competent jurisdiction, promptly give notice to the Company and allow the Company, at the Company’s expense, to undertake appropriate action to prevent disclosure of the Records deemed confidential. In the event that the Company is unsuccessful in preventing the disclosure of such Records, such Holder agrees that it shall furnish only such portion of those Records which it is advised by counsel is legally required and shall, at the Company’s expense, exercise all reasonable efforts to obtain reliable assurance that confidential treatment will be accorded to those Records.",records
"Records as necessary under Board-approved policies and procedures of the Trust, including without limitation those related to valuation determinations. * Such information might include: current financial information, annual and quarterly reports, press releases, reports by analysts and from brokerage firms (including their recommendations, i.e., buy, sell, hold) or any internal reports or subadviser review. For services provided to the Trust, the Adviser will pay to the Subadviser a fee, payable monthly in arrears, equal to 50% of the net advisory fee applicable to the Designated Series. For this purpose, the “net advisory fee” means the advisory fee paid to the Adviser after accounting for any fees paid to other subadvisers to the Designated Series and any applicable fee waiver and/or expense limitation agreement, which shall not include reimbursement of the Adviser for any expenses or recapture of prior waivers. In the event that the Adviser waives its entire fee and also assumes expenses of the Designated Series pursuant to an applicable expense limitation agreement, the Subadviser will similarly waive its entire fee and will share in the expense assumption by contributing 50% of the assumed amount. However, because the Subadviser shares the fee waiver and/or expense assumption equally with the Adviser, if during the term of this Agreement the Adviser later recaptures some or all of the fees so waived or expenses so assumed by the Adviser and the Subadviser together, the Adviser shall pay to the Subadviser 50% of the amount recaptured. With respect to managing the investment and reinvestment of the Designated Series’ assets, the Subadviser shall provide, at its own expense:",records
