clause_text,clause_type
"Solvency. Based on the consolidated financial condition of the Company as of the Closing Date, after giving effect to the receipt by the Company of the proceeds from the sale of the Securities hereunder, (i) the fair saleable value of the Company’s assets exceeds the amount that will be required to be paid on or in respect of the Company’s existing debts and other liabilities (including known contingent liabilities) as they mature, (ii) the Company’s assets do not constitute unreasonably small capital to carry on its business as now conducted and as proposed to be conducted including its capital needs taking into account the particular capital requirements of the business conducted by the Company, consolidated and projected capital requirements and capital availability thereof, and (iii) the current cash flow of the Company, together with the proceeds the Company would receive, were it to liquidate all of its assets, after taking into account all anticipated uses of the cash, would be sufficient to pay all amounts on or in respect of its liabilities when such amounts are required to be paid. The Company does not intend to incur debts beyond its ability to pay such debts as they mature (taking into account the timing and amounts of cash to be payable on or in respect of its debt). The Company has no knowledge of any facts or circumstances which lead it to believe that it will file for reorganization or liquidation under the bankruptcy or reorganization laws of any jurisdiction within one year from the Closing Date. Schedule 3.1(aa) sets forth as of the date hereof all outstanding secured and unsecured Indebtedness of the Company or any Subsidiary, or for which the Company or any Subsidiary has commitments. For the purposes of this Agreement, “Indebtedness” means (x) any liabilities for borrowed money or amounts owed in excess of $50,000 (other than trade accounts payable incurred in the ordinary course of business), (y) all guaranties, endorsements and other contingent obligations in respect of indebtedness of others, whether or not the same are or should be reflected in the Company’s consolidated balance sheet (or the notes thereto), except guaranties by endorsement of negotiable instruments for deposit or collection or similar transactions in the ordinary course of business; and (z) the present value of any lease payments in excess of $50,000 due under leases required to be capitalized in accordance with GAAP. Neither the Company nor any Subsidiary is in default wi...",solvency
"Solvency. The Company (after giving effect to the transactions contemplated by this Agreement) is solvent (i.e., its assets have a fair market value in excess of the amount required to pay its probable liabilities on its existing debts as they become absolute and matured) and currently the Company has no information that would lead it to reasonably conclude that the Company would not, after giving effect to the transaction contemplated by this Agreement, have the ability to, nor does it intend to take any action that would impair its ability to, pay its debts from time to time incurred in connection therewith as such debts mature. The Company did not receive a qualified opinion from its auditors with respect to its most recent fiscal year end and, after giving effect to the transactions contemplated by this Agreement, does not anticipate or know of any basis upon which its auditors might issue a qualified opinion in respect of its current fiscal year.",solvency
Solvency. The fair salable value of Borrower’s assets (including goodwill minus disposition costs) exceeds the fair value of its liabilities; Borrower is not left with unreasonably small capital after the transactions in this Agreement; and Borrower is able to pay its debts (including trade debts) as they mature.,solvency
"Solvency. (i) Immediately after the Agreement Execution Date and immediately following the making of each Loan and after giving effect to the application of the proceeds of such Loans, (a) the fair value of the assets of the Borrower and its Subsidiaries on a consolidated basis, at a fair valuation, will exceed the debts and liabilities, subordinated, contingent or otherwise, of the Borrower and its Subsidiaries on a consolidated basis; (b) the present fair saleable value of the Properties of the Borrower and its Subsidiaries on a consolidated basis will be greater than the amount that will be required to pay the probable liability of the Borrower and its Subsidiaries on a consolidated basis on their debts and other liabilities, subordinated, contingent or otherwise, as such debts and other liabilities become absolute and matured; (c) the Borrower and its Subsidiaries on a consolidated basis will be able to pay their debts and liabilities, subordinated, contingent or otherwise, as such debts and liabilities become absolute and matured; and (d) the Borrower and its Subsidiaries on a consolidated basis will not have unreasonably small capital with which to conduct the businesses in which they are engaged as such businesses are now conducted and are proposed to be conducted after the date hereof.",solvency
"Solvency. Based on the financial condition of the Company as of the Closing Date, (i) the Company's fair saleable value of its assets exceeds the amount that will be required to be paid on or in respect of the Company's existing debts and other liabilities (including known contingent liabilities) as they mature; (ii) the Company's assets do not constitute unreasonably small capital to carry on its business for the current fiscal year as now conducted and as proposed to be conducted including its capital needs taking into account the particular capital requirements of the business conducted by the Company, and projected capital requirements and capital availability thereof; and (iii) the current cash flow of the Company, together with the proceeds the Company would receive, were it to liquidate all of its assets, after taking into account all anticipated uses of the cash, would be sufficient to pay all amounts on or in respect of its debt when such amounts are required to be paid. The Company does not intend to incur debts beyond its ability to pay such debts as they mature (taking into account the timing and amounts of cash to be payable on or in respect of its debt).",solvency
"Solvency. Based on the consolidated financial condition of the Company as of the Closing Date, after giving effect to the receipt by the Company of the proceeds from the sale of the Securities hereunder, (i) the fair saleable value of the Company’s assets exceeds the amount that will be required to be paid on or in respect of the Company’s existing debts and other liabilities (including known contingent liabilities) as they mature, (ii) the Company’s assets do not constitute unreasonably small capital to carry on its business as now conducted and as proposed to be conducted including its capital needs taking into account the particular capital requirements of the business conducted by the Company, consolidated and projected capital requirements and capital availability thereof, and (iii) the current cash flow of the Company, together with the proceeds the Company would receive, were it to liquidate all of its assets, after taking into account all anticipated uses of the cash, would be sufficient to pay all amounts on or in respect of its liabilities when such amounts are required to be paid. The Company does not intend to incur debts beyond its ability to pay such debts as they mature (taking into account the timing and amounts of cash to be payable on or in respect of its debt). The Company has no knowledge of any facts or circumstances which lead it to believe that it will file for reorganization or liquidation under the bankruptcy or reorganization laws of any jurisdiction within one year from the Closing Date. The SEC Reports sets forth as of the date hereof all outstanding secured and unsecured Indebtedness of the Company or any Subsidiary, or for which the Company or any Subsidiary has commitments.",solvency
"Solvency. Immediately after the consummation of the Transactions to occur on the Closing Date and immediately following the making of each Loan and after giving effect to the application of the proceeds of each Loan, (a) the fair value of the assets of each Loan Party, at a fair valuation, will exceed its debts and liabilities, subordinated, contingent or otherwise; (b) the present fair saleable value of the property of each Loan Party will be greater than the amount that will be required to pay the probable liability of its debts and other liabilities, subordinated, contingent or otherwise, as such debts and other liabilities become absolute and matured; (c) each Loan Party will be able to pay its debts and liabilities, subordinated, contingent or otherwise, as such debts and liabilities become absolute and matured; and (d) each Loan Party will not have unreasonably small capital with which to conduct the business in which it is engaged as such business is now conducted and is proposed to be conducted following the Closing Date.",solvency
"Solvency. Each Loan Party is, and after giving effect to the incurrence of all Indebtedness and obligations being incurred in connection herewith will be and will continue to be, Solvent.",solvency
"Solvency. Immediately after the consummation of the Transactions to occur on the Closing Date and immediately following the making of each Loan and after giving effect to the application of the proceeds of each Loan, (a) the fair value of the assets of the Loan Parties, taken as a whole, at a fair valuation, will exceed their debts and liabilities, subordinated, contingent or otherwise; (b) the present fair saleable value of the property of the Loan Parties, taken as a whole, will be greater than the amount that will be required to pay the probable liability of their debts and other liabilities, subordinated, contingent or otherwise, as such debts and other liabilities become absolute and matured; (c) the Loan Parties, taken as a whole, will be able to pay their debts and liabilities, subordinated, contingent or otherwise, as such debts and liabilities become absolute and matured; and (d) the Loan Parties, taken as a whole, will not have unreasonably small capital with which to conduct the business in which they are engaged as such business is now conducted and is proposed to be conducted following the Closing Date.",solvency
"Solvency. Both before and after giving effect to (a) the Credit Extensions to be made or extended on the Closing Date or such other date as Credit Extensions requested hereunder are made or extended, (b) the disbursement of the proceeds of such Loans pursuant to the instructions of the Borrower, (c) the consummation of the transactions contemplated hereby and (d) the payment and accrual of all transaction costs in connection with the foregoing, the Loan Parties, taken as a whole, are Solvent.",solvency
"Solvency. (a) Immediately after the consummation of the Transactions to occur on the Effective Date, (i) the fair value of the assets of each Loan Party, at a fair valuation, will exceed its debts and liabilities, subordinated, contingent or otherwise; (ii) the present fair saleable value of the property of each Loan Party will be greater than the amount that will be required to pay the probable liability of its debts and other liabilities, subordinated, contingent or otherwise, as such debts and other liabilities become absolute and matured; (iii) each Loan Party will be able to pay its debts and liabilities, subordinated, contingent or otherwise, as such debts and liabilities become absolute and matured; and (iv) no Loan Party will have unreasonably small capital with which to conduct the business in which it is engaged as such business is now conducted and is proposed to be conducted after the Effective Date.",solvency
"Solvency. The Seller is not insolvent, nor will the Seller be made insolvent by the transfer of the Receivables, nor does the Seller anticipate any pending insolvency.",solvency
"Solvency. On the Closing Date, after giving effect to the Transactions, the Borrower and its Subsidiaries, on a consolidated basis, are Solvent.",solvency
"Solvency. Assuming (a) satisfaction of the conditions to Parent’s obligation to consummate the Merger and after giving effect to the transactions contemplated by this Agreement, including the Financing Commitment Letters and the payment of the Aggregate Merger Consideration, (b) any repayment, repurchase or refinancing of debt contemplated in this Agreement, (c) the accuracy of the representations and warranties of the Company set forth in Article 4 hereof, (d) payment of all amounts required to be paid in connection with the consummation of the transactions contemplated by this Agreement, (e) payment of all related fees and expenses, (f) compliance with the Company’s obligations in this Agreement and satisfaction of the conditions set forth in Section 7.01 and Section 7.02 on the Closing Date and (g) any estimates, projections or forecasts of the Company and its Subsidiaries furnished to Parent or its Affiliates or Representatives have been prepared by them in good faith based upon assumptions that were and continue to be reasonable, Parent and the Surviving Corporation on a consolidated basis will be Solvent as of the Effective Time and immediately after the consummation of the transactions contemplated by this Agreement. For purposes of this Agreement, the term “Solvent” when used with respect to any Person, means that, as of any date of determination (x) the amount of the “fair saleable value” of the assets of such Person will, as of such date, exceed (i) the value of all “liabilities of such Person, including contingent and other liabilities,” as of such date, as such quoted terms are generally determined in accordance with Applicable Laws governing determinations of the insolvency of debtors, and (ii) the amount that will be required to pay the probable liabilities of such Person on its existing debts (including contingent and other liabilities) as such debts become absolute and mature, (y) such Person will not have, as of such date, an unreasonably small amount of capital for the operation of the businesses in which it is engaged or proposed to be engaged following such date, and (z) such Person will be able to pay its liabilities, including contingent and other liabilities, as they mature. For purposes of this definition, “not have an unreasonably small amount of capital for the operation of the businesses in which it is engaged or proposed to be engaged” and “able to pay its liabilities, including contingent and other liabilities, as they mature” means that...",solvency
"Solvency. Based on the financial condition of the Company as of the Closing Date after giving effect to the receipt by the Company of the proceeds from the sale of the Securities hereunder, (i) the Company’s fair saleable value of its assets exceeds the amount that will be required to be paid on or in respect of the Company’s existing debts and other liabilities (including known contingent liabilities) as they mature; (ii) the Company’s assets do not constitute unreasonably small capital to carry on its business for the current fiscal year as now conducted and as proposed to be conducted including its capital needs taking into account the particular capital requirements of the business conducted by the Company, and projected capital requirements and capital availability thereof; and (iii) the current cash flow of the Company, together with the proceeds the Company would receive, were it to liquidate all of its assets, after taking into account all anticipated uses of the cash, would be sufficient to pay all amounts on or in respect of its debt when such amounts are required to be paid. The Company does not intend to incur debts beyond its ability to pay such debts as they mature (taking into account the timing and amounts of cash to be payable on or in respect of its debt). The Company has no knowledge of any facts or circumstances which lead it to believe that it will file for reorganization or liquidation under the bankruptcy or reorganization laws of any jurisdiction within one year from the Closing Date. The SEC Reports set forth as of the dates thereof all outstanding secured and unsecured Indebtedness of the Company or any Subsidiary, or for which the Company or any Subsidiary has commitments. For the purposes of this Agreement, “Indebtedness” shall mean (a) any liabilities for borrowed money or amounts owed in excess of $50,000 (other than trade accounts payable incurred in the ordinary course of business), (b) all guaranties, endorsements and other contingent obligations in respect of Indebtedness of others, whether or not the same are or should be reflected in the Company’s balance sheet (or the notes thereto), except guaranties by endorsement of negotiable instruments for deposit or collection or similar transactions in the ordinary course of business; and (c) the present value of any lease payments in excess of $50,000 due under leases required to be capitalized in accordance with GAAP. Neither the Company nor any Subsidiary is in default with respect to ...",solvency
"Solvency. On and immediately after the Closing Date, the Company (after giving effect to the issuance and sale of the Securities and the other transactions related thereto as described in each of the Time of Sale Information and the Offering Memorandum) will be Solvent. As used in this paragraph, the term “Solvent” means, with respect to a particular date, that on such date (i) the present fair market value (or present fair saleable value) of the assets of the Company is not less than the total amount required to pay the probable liabilities of the Company on its total existing debts and liabilities (including contingent liabilities) as they become absolute and matured; (ii) the Company is able to realize upon its assets and pay its debts and other liabilities, contingent obligations and commitments as they mature and become due in the normal course of business; (iii) assuming consummation of the issuance and sale of the Securities as contemplated by this Agreement, the Time of Sale Information and the Offering Memorandum, the Company is not incurring debts or liabilities beyond its ability to pay as such debts and liabilities mature; and (iv) the Company is not engaged in any business or transaction, and does not propose to engage in any business or transaction, for which its property would constitute unreasonably small capital.",solvency
"Solvency. As of and from and after the date of this Agreement, the Borrower: (i) owns and will own assets the fair saleable value of which are: (A) greater than the total amount of liabilities (including contingent liabilities); and (B) greater than the amount that will be required to pay the probable liabilities of its then existing debts as they become absolute and matured considering all financing alternatives and potential asset sales reasonably available to it; (ii) has capital that is not unreasonably small in relation to its business as presently conducted or any contemplated or undertaken transaction; and (iii) does not intend to incur and does not believe that it will incur debts beyond its ability to pay such debts as they become due;",solvency
"Solvency. Each of the Company and the Guarantors is, and immediately after the Closing Date will be, Solvent. As used herein, the term “Solvent” means, with respect to any person on a particular date, that on such date (i) the fair market value of the assets of such person is greater than the total amount of liabilities (including contingent liabilities) of such person, (ii) the present fair salable value of the assets of such person is greater than the amount that will be required to pay the probable liabilities of such person on its debts as they become absolute and matured, (iii) such person is able to realize upon its assets and pay its debts and other liabilities, including contingent obligations, as they mature and (iv) such person does not have unreasonably small capital.",solvency
"Solvency. After giving effect to the transactions contemplated hereby, (a) the aggregate assets (after giving effect to amounts that could reasonably be received by reason of indemnity, offset, insurance or any similar arrangement), at a fair valuation, of the Borrower and the Guarantors, taken as a whole, will exceed the aggregate Debt of the Borrower and the Guarantors on a consolidated basis, as the Debt becomes absolute and matures, (b) each of the Borrower and the Guarantors will not have incurred or intended to incur, and will not believe that it will incur, Debt beyond its ability to pay such Debt (after taking into account the timing and amounts of cash to be received by each of the Borrower and the Guarantors and the amounts to be payable on or in respect of its liabilities, and giving effect to amounts that could reasonably be received by reason of indemnity, offset, insurance or any similar arrangement) as such Debt becomes absolute and matures and (c) each of the Borrower and the Guarantors will not have (and will have no reason to believe that it will have thereafter) unreasonably small capital for the conduct of its business.",solvency
"Solvency. Each Loan Party is, individually and together with its Subsidiaries on a consolidated basis, Solvent.",solvency
"Solvency. Giving effect to the Loan, the fair saleable value of Borrower’s assets exceeds and will, immediately following the making of the Loan, exceed Borrower’s total liabilities, including, without limitation, subordinated, unliquidated, disputed and contingent liabilities. The fair saleable value of Borrower’s assets is and will, immediately following the making of the Loan, be greater than Borrower’s probable liabilities, including the maximum amount of its contingent liabilities on its Debts as such Debts become absolute and matured, Borrower’s assets do not and, immediately following the making of the Loan will not, constitute unreasonably small capital to carry out its business as conducted or as proposed to be conducted. Borrower does not intend to, and does not believe that it will, incur Debts and liabilities (including contingent liabilities and other commitments) beyond its ability to pay such Debts as they mature (taking into account the timing and amounts of cash to be received by Borrower and the amounts to be payable on or in respect of obligations of Borrower). Except as expressly disclosed to Lender in writing, no petition in bankruptcy has been filed against Borrower or any Borrower Party in the last seven (7) years, and neither Borrower or any Borrower Party in the last seven (7) years has ever made an assignment for the benefit of creditors or taken advantage of any insolvency act for the benefit of debtors.",solvency
"Solvency. After giving effect to the transactions contemplated by this Agreement, and before and after giving effect to each Credit Extension, the Loan Parties, on a Consolidated basis, are Solvent. No transfer of property has been or will be made by any Loan Party and no obligation has been or will be incurred by any Loan Party in connection with the transactions contemplated by this Agreement or the other Loan Documents with the intent to hinder, delay, or defraud either present or future creditors of any Loan Party.",solvency
"Solvency. Each Loan Party is and, upon the incurrence of any Obligations by such Loan Party on any date on which this representation is made, will be, Solvent.",solvency
"Solvency. Each Guarantor expressly represents and warrants that as of the date hereof and after giving effect to the transactions contemplated by the Indenture (a) the capital of such Guarantor will not be unreasonably small to conduct its business; (b) such Guarantor will not have incurred debts, or have intended to incur debts, beyond its ability to pay such debts as they mature; and (c) the present fair salable value of the assets of such Guarantor is greater than the amount that will be required to pay its probable liabilities (including debts) as they become absolute and matured. For purposes of this Section 3.12, “debt” means any liability on a claim, and “claim” means (x) the right to payment, whether or not such right is reduced to judgment, liquidated, unliquidated, fixed, contingent, matured, unmatured, undisputed, legal, equitable, secured or unsecured, or (y) the right to an equitable remedy for breach of performance if such breach gives rise to a right to payment, whether or not such right to an equitable remedy is reduced to judgment, fixed, contingent, matured, unmatured, undisputed, secured or unsecured.",solvency
