clause_text,clause_type
"Solvency. As of the Effective Time and immediately after giving effect to the Merger (including the payment of all amounts payable pursuant to Article II in connection with or as a result of the Merger and all related fees and expenses of Parent, Merger Sub, the Company and their respective Subsidiaries in connection therewith), (a) the amount of the “fair saleable value” of the assets of each of the Surviving Corporation and its Subsidiaries will exceed (i) the value of all liabilities of the Surviving Corporation and such Subsidiaries, including contingent and other liabilities; and (ii) the amount that will be required to pay the probable liabilities of each of the Surviving Corporation and its Subsidiaries on their existing debts (including contingent liabilities) as such debts become absolute and matured; (b) each of the Surviving Corporation and its Subsidiaries will not have an unreasonably small amount of capital for the operation of the businesses in which it is engaged or proposed to be engaged; and (c) each of the Surviving Corporation and its Subsidiaries will be able to pay its liabilities, including contingent and other liabilities, as they mature. For purposes of the foregoing, “not have an unreasonably small amount of capital for the operation of the businesses in which it is engaged or proposed to be engaged” and “able to pay its liabilities, including contingent and other liabilities, as they mature” means that such Person will be able to generate enough cash from operations, asset dispositions or refinancing, or a combination thereof, to meet its obligations as they become due.",solvency
"Solvency. Both before and immediately after the consummation, of the transactions contemplated by the Loan Documents and after giving effect to such transactions, each disbursement of Revolving Loans, (a) the value of the assets of Borrower and its Subsidiaries on a consolidated basis (both at fair value and present fair saleable value) is greater than the total amount of liabilities (including contingent and unliquidated liabilities) of Borrower; (b) Borrower and its Subsidiaries, on a consolidated basis, are able to pay all of their liabilities as such liabilities mature in the ordinary course; and (c) Borrower and its Subsidiaries, on a consolidated basis, do not have unreasonably small capital. In computing the amount of contingent or unliquidated liabilities at any time, such liabilities shall be computed at the amount that, in light of all the facts and circumstances existing at such time, represents the amount can reasonably be expected to become an actual or matured liability.",solvency
"Solvency. Borrower is, after giving effect to the transactions contemplated hereby, solvent, able to pay its debts as they become due, has capital sufficient to carry on its business, now owns property having a value both at fair valuation and at present fair saleable value greater than the amount required to pay its debts, and will not be rendered insolvent by the execution and delivery of this Agreement or any of the Other Agreements or by completion of the transactions contemplated hereunder or thereunder.",solvency
"Solvency. The Credit Parties are and, upon the incurrence of any Obligation by any Credit Party on any date on which this representation and warranty is made, will be, Solvent, on a consolidated basis.",solvency
"Solvency. On the Closing Date and after giving effect to the transactions contemplated by the Loan Documents occurring on the Closing Date, the Borrower will be Solvent.",solvency
"Solvency. Seller is not now insolvent and Seller will not be rendered insolvent by any of the transactions contemplated by this Agreement. As used in this section, “insolvent” means that the sum of the debts and other probable liabilities of Seller exceed the present fair saleable value of Seller’s assets. Immediately after giving effect to the consummation of the transactions contemplated by this Agreement: (i) Seller will be able to pay its liabilities as they become due in the ordinary course of business; (ii) Seller will not have unreasonably small capital with which to conduct its present or proposed business; and (iii) after taking into account all pending and threatened litigation, final judgments against Seller in actions for money damages are not reasonably anticipated to be rendered at a time when, or in amounts such that, Seller will be unable to satisfy any such judgments promptly in accordance with their terms (taking into account the maximum probable amount of such judgments in any such actions and the earliest reasonable time at which such judgments might be rendered) as well as all other obligations of Seller. The cash available to Seller, after taking into account all other anticipated uses of the cash, will be sufficient to pay all such debts and judgments of Seller promptly in accordance with their terms.",solvency
"Solvency. As of the Closing Date and after giving effect to each Extension of Credit made hereunder, the Borrower and each of its Subsidiaries will be Solvent.",solvency
"Solvency. Buyer is not entering into the transactions contemplated hereby with the intent to hinder, delay or defraud either present or future creditors. Immediately after giving effect to all of the transactions contemplated hereby, including the payment of the Purchase Price and payment of all related fees and expenses, Buyer and its Affiliates will be Solvent. For purposes of this Section 4.10, the term “Solvent” with respect to any Person means that, as of any date of determination, (a) the amount of the fair saleable value of the assets of such Person exceeds, as of such date, the value of all liabilities of such Person, including contingent and other liabilities, as of such date, as such quoted terms are generally determined in accordance with the applicable federal Laws governing determinations of the solvency of debtors, (b) such Person will not have, as of such date, an unreasonably small amount of capital for the operation of the business in which they are engaged or proposed to be engaged following such date, and (c) such Person will be able to pay its liabilities, including contingent and other liabilities, as they mature. For purposes of this definition, “not have an unreasonably small amount of capital for the operation of the business in which it is engaged or proposed to be engaged” means that the Person will be able to generate enough cash from operations, asset dispositions or refinancing, or a combination thereof, to meet their financial obligations as they become due.",solvency
Solvency. Borrower and each of its Subsidiaries is Solvent.,solvency
"Solvency. Immediately after the consummation of the Transactions to occur on the Closing Date and immediately following the making of each Loan and after giving effect to the application of the proceeds of each Loan, the Borrower and the Restricted Subsidiaries are, on a consolidated basis, Solvent.",solvency
Solvency. The Borrower is Solvent.,solvency
Solvency. The Servicer is not the subject of any Bankruptcy Proceedings or Bankruptcy Event. The transactions under this Agreement and any other Transaction Document to which the Servicer is a party do not and will not render the Servicer not Solvent.,solvency
"Solvency. Each Loan Party is, individually and together with its Subsidiaries, Solvent.",solvency
"Solvency. Based on the consolidated financial condition of the Company as of the Closing Date, after giving effect to the receipt by the Company of the proceeds from the sale of the Securities hereunder: (i) the fair saleable value of the Company’s assets exceeds the amount that will be required to be paid on or in respect of the Company’s existing debts and other liabilities (including known contingent liabilities) as they mature, and (ii) the current cash flow of the Company, together with the proceeds the Company would receive, were it to liquidate all of its assets, after taking into account all anticipated uses of the cash, would be sufficient to pay all amounts on or in respect of its liabilities when such amounts are required to be paid. The Company does not intend to incur debts beyond its ability to pay such debts as they mature (taking into account the timing and amounts of cash to be payable on or in respect of its debt). The Company has no knowledge of any facts or circumstances which lead it to believe that it will file for reorganization or liquidation under the bankruptcy or reorganization laws of any jurisdiction within one year from the Closing Date. Schedule 3.1(z) sets forth as of the date hereof all outstanding secured and unsecured Indebtedness of the Company or any Subsidiary, or for which the Company or any Subsidiary has commitments. For the purposes of this Agreement, “Indebtedness” means (x) any liabilities for borrowed money or amounts owed in excess of $50,000 (other than accrued liabilities and trade accounts payable incurred in the ordinary course of business), (y) all guaranties, endorsements and other contingent obligations in respect of indebtedness of others, whether or not the same are or should be reflected in the Company’s balance sheet (or the notes thereto), except guaranties by endorsement of negotiable instruments for deposit or collection or similar transactions in the ordinary course of business; and (z) the present value of any lease payments in excess of $50,000 due under leases required to be capitalized in accordance with GAAP. Neither the Company nor any Subsidiary is in default with respect to any Indebtedness.",solvency
Solvency. The Servicer is not the subject of any Insolvency Proceedings or Insolvency Event. The transactions under this Agreement and any other Transaction Document to which the Servicer is a party do not and will not render the Servicer not Solvent and the Servicer shall deliver to the Administrative Agent on the Closing Date a certification in the form of Exhibit E-2.,solvency
Solvency. The Issuer (i) is not “insolvent” (as such term is defined in the Bankruptcy Code); (ii) is able to pay its debts as they become due; and (iii) does not have unreasonably small capital for the business in which it is engaged or for any business or transaction in which it is about to engage.,solvency
"Solvency. As disclosed in the SEC Reports, the Company does not currently generate significant recurring revenue. The SEC Reports set forth, as of the date hereof, all outstanding secured and unsecured Indebtedness of the Company or any Subsidiary, or for which the Company or any Subsidiary has commitments. For the purposes of this Agreement, “Indebtedness” means (x) any liabilities for borrowed money or amounts owed in excess of $50,000 (other than trade accounts payable incurred in the ordinary course of business), (y) all guaranties, endorsements and other contingent obligations in respect of indebtedness of others, whether or not the same are or should be reflected in the Company’s consolidated balance sheet (or the notes thereto), except guaranties by endorsement of negotiable instruments for deposit or collection or similar transactions in the ordinary course of business; and (z) the present value of any lease payments in excess of $50,000 due under leases required to be capitalized in accordance with GAAP. Neither the Company nor any Subsidiary is in default with respect to any Indebtedness, except where such default would not reasonably be expected to result, individually or in the aggregate, in a Material Adverse Effect.",solvency
"Solvency. The Loan Parties, on a Consolidated basis, are Solvent. No transfer of property is being made by any Loan Party and no obligation is being incurred by any Loan Party in connection with the transactions contemplated by this Agreement or the other Loan Documents with the intent to hinder, delay, or defraud either present or future creditors of any Loan Party.",solvency
"Solvency. Immediately after giving effect to the transactions contemplated by this Agreement, no member of the Acquiror Group (excluding the Company after the Closing) will (a) be insolvent (either because its financial condition is such that the sum of its debts is greater than the fair value of its assets or because the fair salable value of its assets is less than the amount required to pay its probable liability on its existing debts as they mature), (b) have unreasonably small capital with which to engage in its business or (c) have incurred debts beyond its ability to pay as they become due.",solvency
"Solvency. As of the date hereof (and after giving effect to the extensions of credit hereunder and to the other transactions contemplated hereby), (i) the aggregate value of all properties of the Borrower and its Subsidiaries at their present fair saleable value (i.e., the amount that may be realized within a reasonable time, considered to be six to eighteen months, either through collection or sale at the regular market value, conceiving the latter as the amount that could be obtained for the properties in question within such period by a capable and diligent businessman from an interested buyer who is willing to purchase under ordinary selling conditions), exceeds the amount of all the debts and liabilities (including contingent, subordinated, unmatured and unliquidated liabilities) of the Borrower and its Subsidiaries, (ii) the Borrower and its Subsidiaries will not, on a consolidated basis, have unreasonably small capital with which to conduct their business operations as heretofore conducted and (iii) the Borrower and its Subsidiaries will have, on a consolidated basis, sufficient cash flow to enable them to pay their debts as they mature.",solvency
"Solvency. Borrower and each Borrower Principal have (a) not entered into the transaction or executed the Note, this Agreement or any other Loan Documents with the actual intent to hinder, delay or defraud any creditor and (b) received reasonably equivalent value in exchange for their obligations under such Loan Documents. Giving effect to the Loan, the fair saleable value of the assets of Borrower and each Borrower Principal exceeds and will, immediately following the making of the Loan, exceed the total liabilities of Borrower and each Borrower Principal, including, without limitation, subordinated, unliquidated, disputed and contingent liabilities. No petition in bankruptcy has been filed against Borrower, any Borrower Principal, any SPE Component Entity (if any) or Affiliated Manager in the last ten (10) years, and neither Borrower nor any Borrower Principal, any SPE Component Entity (if any) or Affiliated Manager in the last ten (10) years has made an assignment for the benefit of creditors or taken advantage of any Creditors Rights Laws. Neither Borrower nor any Borrower Principal, any SPE Component Entity (if any) or Affiliated Manager is contemplating either the filing of a petition by it under any Creditors Rights Laws or the liquidation of all or a major portion of Borrower's assets or property, and Borrower has no knowledge of any Person contemplating the filing of any such petition against Borrower or any Borrower Principal, any SPE Component Entity (if any) or Affiliated Manager.",solvency
"Solvency. Immediately after the consummation of the Transactions and the Related Transactions to occur on the Closing Date, (a) the fair value of the properties of each Issuer Party (individually and on a consolidated basis with its Subsidiaries) will exceed its debts and liabilities, subordinated, contingent or otherwise; (b) the present fair saleable value of the property of each Issuer Party (individually and on a consolidated basis with its Subsidiaries) will be greater than the amount that will be required to pay the probable liability of its debts and other liabilities, subordinated, contingent or otherwise, as such debts and other liabilities become absolute and matured; (c) each Issuer Party (individually and on a consolidated basis with its Subsidiaries) will be able to pay its debts and liabilities, subordinated, contingent or otherwise, as such debts and liabilities become absolute and matured; and (d) each Issuer Party (individually and on a consolidated basis with its Subsidiaries) will not have unreasonably small capital with which to conduct its business in which it is engaged as such business is now conducted and is proposed to be conducted following the Closing Date.",solvency
"Solvency. As of the date hereof and after giving effect to the consummation of the transactions contemplated by the Loan Documents, the Borrower and each Significant Subsidiary is solvent. For purposes of the preceding sentence, solvent means (a) the fair saleable value (on a going concern basis) of the Borrower's assets or a Significant Subsidiary's assets, as applicable, exceed its liabilities, contingent or otherwise, fairly valued, (b) such Person will be able to pay its debts as they become due and (c) such Person will not be left with unreasonably small capital as is necessary to satisfy all of its current and reasonably anticipated obligations giving due consideration to the prevailing practice in the industry in which such Person is engaged. In computing the amount of contingent liabilities at any time, it is intended that such liabilities will be computed at the amount which, in light of all the facts and circumstances existing at such time, represents the amount that can reasonably be expected to become an actual or matured liability. The Borrower is not entering into the Loan Documents with the actual intent to hinder, delay or defraud its current or future creditors, nor does the Borrower intend to or believe that it will incur, as a result of entering into this Agreement and the other Loan Documents, debts beyond its ability to repay.",solvency
"Solvency. As of the Initial Borrowing Date, after giving effect to the Borrowings hereunder on such date and the distributions to Baxter and other transactions related to the Spin-Off, (a) the fair value of the assets of the Company and the Subsidiaries, at a fair valuation, will exceed their debts and liabilities, subordinated, contingent or otherwise; (b) the present fair saleable value of the property of the Company and the Subsidiaries will be greater than the amount that will be required to pay the probable liability in respect of their debts and other liabilities, subordinated, contingent or otherwise, as such debts and other liabilities become absolute and matured; (c) the Company and the Subsidiaries will be able to pay their debts and liabilities, subordinated, contingent or otherwise, as such debts and liabilities become absolute and matured; and (d)the Company and the Subsidiaries will not have unreasonably small capital with which to conduct the businesses in which they are engaged as such businesses are now conducted and are proposed to be conducted following the completion of the Spin-Off.",solvency
Solvency. The Seller is Solvent.,solvency
"Solvency. Both before and after giving effect to the transactions contemplated by the Series 2010-3 Related Documents, RCFC is solvent within the meaning of the Bankruptcy Code and RCFC is not the subject of any voluntary or involuntary case or proceeding seeking liquidation, reorganization or other relief with respect to itself or its debts under any bankruptcy or insolvency law and no Event of Bankruptcy has occurred with respect to RCFC.",solvency
"Solvency. The Depositor, both prior to and after giving effect to each sale and/or contribution of Receivables with respect to the Designated Servicing Agreements on each Sale Date, (1) is not, and will not be, “insolvent” (as such term is defined in § 101(32)(A) of the Bankruptcy Code), (2) is, and will be, able to pay its debts as they become due, and (3) does not have unreasonably small capital for the business in which it is engaged or for any business or transaction in which it is about to engage.",solvency
"Solvency. Notwithstanding the above, a payment may be delayed where the payment would jeopardize the ability of the Employer to continue as a going concern.",solvency
Solvency. The Administrative Agent (or its counsel) shall have received a certificate in substantially the form of Exhibit O from the chief financial officer (or other officer with reasonably equivalent responsibilities) of the Borrower dated as of the Closing Date and certifying as to the matters set forth therein.,solvency
"Solvency. The Borrower is, individually and together with its Subsidiaries on a consolidated basis, Solvent.",solvency
"Solvency. The Borrower is and, after the consummation of the transactions contemplated by this Credit Agreement, will be Solvent.",solvency
"Solvency. Each of the Credit Parties is Solvent prior to and after giving effect to the Borrowings to be made on the Closing Date and the issuance of the Letters of Credit to be issued on the Closing Date, and shall remain Solvent during the term of this Agreement.",solvency
"Solvency. Upon giving effect to the issuance of the Notes, the execution of the Loan Documents by Borrower and the consummation of the transactions contemplated hereby, Borrower will be solvent (as such term is used in applicable bankruptcy, liquidation, receivership, insolvency or similar laws).",solvency
"Solvency. Borrower is, and upon consummation of the transactions contemplated by this Agreement, the other Loan Documents and any other documents, instruments or agreements relating thereto, will be, Solvent.",solvency
"Solvency. Neither Parent nor Buyer is entering into the transactions contemplated by this Agreement with the actual intent to hinder, delay or defraud either present or future creditors of the Company or its Subsidiaries. Buyer is Solvent as of the date of this Agreement, and Buyer will, after giving effect to all of the transactions contemplated by this Agreement, including the Financing, any alternative financing and the payment of the Closing Payment all other amounts required to be paid by Buyer pursuant to this Agreement, any payment of any outstanding indebtedness of the Company or its Subsidiaries contemplated by this Agreement or the Commitment Letters, the payment of all other amounts required to be paid in connection with the consummation of the transactions contemplated by this Agreement and the payment of all related fees and expenses, be Solvent at and after the Closing Date. As used in this Section 7.08, the term “Solvent” means, with respect to a particular date, that on such date, (a) the sum of the assets, at a fair valuation, of Buyer (and, after the Closing, the Company and its Subsidiaries) (on a consolidated basis) and of each of them (on a stand-alone basis) will exceed their debts, (b) each of Buyer (and, after the Closing, the Company and its Subsidiaries) (on a consolidated basis) and each of them (on a stand-alone basis) has not incurred and does not intend to incur, and does not believe that it will incur, debts beyond its ability to pay such debts as such debts mature, and (c) each of Buyer (and, after the Closing, the Company and its Subsidiaries) (on a consolidated basis) and each them (on a stand-alone basis) has sufficient capital and liquidity with which to conduct its business. For purposes of this Section 7.08, “debt” means any liability on a claim, and “claim” means any (i) right to payment, whether or not such a right is reduced to judgment, liquidated, unliquidated, fixed, contingent, matured, unmatured, disputed, undisputed, legal, equitable, secured or unsecured, and (ii) any right to an equitable remedy for breach of performance if such breach gives rise to a payment, whether or not such right to an equitable remedy is reduced to judgment, fixed, contingent, matured, unmatured, disputed, undisputed, secured or unsecured.",solvency
"Solvency. The Trust Depositor, after giving effect to the conveyances made by it hereunder, is Solvent. Such representations speak as of the execution and delivery of this Agreement and as of the Closing Date, but shall survive the transfer and assignment of the Contracts to the Trust.",solvency
"Solvency. (a) Immediately after the consummation of the Transactions to occur on the Effective Date, the Borrower and its Subsidiaries, taken as a whole, are and will be Solvent.",solvency
"Solvency. The Depositor, at the time of and after giving effect to each conveyance made hereunder, is Solvent on and as of the date thereof.",solvency
"Solvency. As of the date hereof and immediately after giving effect to each Transaction, the fair value of the assets of the Seller is greater than the fair value of the liabilities (including, without limitation, contingent liabilities if and to the extent required to be recorded as a liability on the financial statements of the Seller in accordance with GAAP) of the Seller and the Seller is solvent and, after giving effect to the transactions contemplated by this Repurchase Agreement and the other Repurchase Documents, will not be rendered insolvent or left with an unreasonably small amount of capital with which to conduct its business and perform its obligations. The Seller does not intend to incur, nor does it believe that it has incurred, debts beyond its ability to pay such debts as they mature. The Seller is not contemplating the commencement of an insolvency, bankruptcy, liquidation, or consolidation proceeding or the appointment of a receiver, liquidator, conservator, trustee, or similar official in respect of itself or any of its property.",solvency
"Solvency. The Borrower and its Restricted Subsidiaries are and, upon the incurrence of any Obligation by any Loan Party on any date on which this representation and warranty is made, will be, on a consolidated basis, Solvent.",solvency
