clause_text,clause_type
"Solvency. Assuming (a) satisfaction of the conditions to Parent’s obligations to consummate the Merger as set forth herein, (b) the accuracy in all material respects of the representations and warranties of the Company set forth in Article 4 hereof (disregarding all materiality and Material Adverse Effect qualifications contained therein), and (c) any estimates, projections or forecasts of the Company and its Subsidiaries have been prepared in good faith based upon reasonable assumptions, (d) compliance by the Company with its covenants and agreements hereunder, (i) immediately after giving effect to the transactions contemplated by this Agreement and the closing of any financing to be obtained by Parent or any of its Affiliates in order to effect the transactions contemplated by this Agreement, the Surviving Corporation shall, as of such date, be able to pay its debts as they become due and shall own assets having a fair saleable value greater than the amounts required to pay its debts (including a reasonable estimate of the amount of all contingent liabilities) as they become absolute and mature; and (ii) immediately after giving effect to the transactions contemplated by this Agreement and the closing of any financing to be obtained by Parent or any of its Affiliates in order to effect the transactions contemplated by this Agreement, the Surviving Corporation shall not have, as of such date, unreasonably small capital to carry on its business in which it is engaged or proposed to be engaged. Neither Parent nor Merger Subsidiary is entering into the transactions contemplated by this Agreement with the intent to hinder, delay or defraud either present or future creditors of Parent or the Surviving Corporation.",solvency
"Solvency. As of the Closing Date, the Group Members, on a consolidated basis, after giving effect to the Transactions and the incurrence of all Indebtedness and obligations being incurred in connection herewith and therewith and the other transactions contemplated hereby and thereby, will be and will continue to be, Solvent.",solvency
"Solvency. The Administrative Agent shall have received a certificate of the chief financial officer (or other comparable officer) of Holdings certifying the Solvency, after giving effect to the Transactions, of Holdings and its Subsidiaries on a consolidated basis in substantially the form of Exhibit H hereto.",solvency
"Solvency. The Borrower and the other Loan Parties, taken as a whole, are, and immediately after giving effect to the incurrence of all Debt and obligations being incurred in connection herewith, will be Solvent.",solvency
Solvency. 53 7.4. Subsidiaries and Stockholders. . . . . . . . . . . . . . . . . . . . . . 53 7.5.,solvency
"Solvency. The Depositor is not insolvent, nor will the Depositor be made insolvent by the transfer of the Receivables, nor does the Depositor contemplate any pending insolvency.",solvency
Solvency. The Administrative Agent shall have received a solvency certificate from a Financial Officer.,solvency
"Solvency. Borrower is and, immediately after giving effect to the Borrowing and the use of proceeds thereof will be, Solvent.",solvency
Solvency. Each Credit Party is Solvent after giving effect to the transactions contemplated by the Loan Documents.,solvency
"Solvency. After the making of the Loans, each Loan Party (i) will be able to pay its debts as they become due, (ii) will have funds and capital sufficient to carry on its business and all businesses in which it is about to engage, and (iii) will own property having a value at both fair valuation and at fair saleable value in the ordinary course of its business greater than the amount required to pay its debts as they become due. No Loan Party was insolvent immediately prior to the date of this Agreement and no Loan Party will be rendered insolvent by the execution and delivery of this Agreement, the borrowing hereunder and/or the consummation of any transactions contemplated by this Agreement or any of the other Loan Documents.",solvency
"Solvency. The transactions under this Agreement and any other Transaction Document to which the Borrower is a party do not and will not render the Borrower not Solvent and the Borrower shall deliver to the Deal Agent on the Closing Date a certification in the form of Exhibit F. The Originator has confirmed in writing to the Borrower that, so long as the Borrower is Solvent, the Originator will not cause the Borrower to file a voluntary petition under the Bankruptcy Code or any other Insolvency Laws.",solvency
"Solvency. Giving effect to the contribution rights of the Loan Parties contained in Section 12.7 and the limitation in Section 12.6(b), both before and after giving effect to (a) the Loans made on or prior to the date this representation and warranty is made, (b) the disbursement of the proceeds of such Loans, and (c) the payment and accrual of all transaction costs in connection with the foregoing, both the Loan Parties taken as a whole and each Borrower are Solvent.",solvency
"Solvency. The Buyer is not entering into the transactions contemplated by this Agreement with the actual intent to hinder, delay or defraud either present or future creditors of the Target Entities. The Buyer and Holdings are Solvent as of the date of this Agreement and, assuming the satisfaction of the conditions to the Sellers’ obligation to consummate the transactions contemplated hereby, Holdings and the Buyer (on both a stand-alone and on a combined basis) will, after giving effect to all of the transactions contemplated by this Agreement, including the payments required to be paid by Section 2.3 or otherwise, in connection with the consummation of the transactions contemplated by this Agreement and all related fees and expenses, be Solvent on and after the Closing Date.",solvency
"Solvency. Neither Parent nor Merger Sub is entering into the transactions contemplated by this Agreement with the actual intent to hinder, delay or defraud either present or future creditors of the Company or any of its Subsidiaries. As of the Effective Time, assuming (i) the satisfaction or waiver of the conditions set forth in Section 7.1 and Section 7.2, (ii) (a) the representations and warranties of the Company contained in this Agreement (other than those qualified by materiality or “Company Material Adverse Effect”) are true and correct in all material respects and (b) the representations and warranties of the Company contained in this Agreement that are qualified by materiality or “Company Material Adverse Effect” are true and correct in all respects, and (iii) any estimates, projections or forecasts of the Company or its Subsidiaries that have been provided by the Company to Parent have been prepared in good faith based upon assumptions that were, at the time made, and continue to be, at the Effective Time, reasonable, after giving effect to all of the transactions contemplated by this Agreement, including the payment of the Preferred Stock Consideration and the other amounts payable in accordance with this Agreement (including any repayment or refinancing of any indebtedness that may be required in connection with the Merger and the other transactions contemplated by this Agreement), the Surviving Entity and its Subsidiaries, taken as a whole, will be Solvent. For purposes of this Section 4.26, (i) the term “Solvent” means, with respect to any Person as of a particular date, that on such date, (x) the sum of the assets, at a fair valuation, of such Person exceeds its debts, (y) such Person has not incurred debts beyond its ability to pay such debts as such debts mature and (z) such Person does not have unreasonably small capital with which to conduct its business, (ii) “debt” means any liability whether or not reduced to judgment, liquidated, unliquidated, fixed, contingent, matured, unmatured, disputed, undisputed, legal, equitable, secured or unsecured and (iii) the amount of any unliquidated or contingent liabilities at any time shall be the maximum amount which, in light of all the facts and circumstances existing at such time, could reasonably be expected to become an actual or matured liability.",solvency
"Solvency. Company and each of its Subsidiaries is and, upon the incurrence of any Obligations by Company on any date on which this representation is made, will be, Solvent.",solvency
"Solvency. After giving effect to the Loans and the other transactions contemplated hereby, the borrowings made and/or to be made by the Borrower under this Agreement do not and will not render the Borrower insolvent or with unreasonably small capital for its business; the fair saleable value of all of the assets and properties of the Borrower does now, and will, upon the funding of the Loans contemplated hereby, exceed the aggregate liabilities and Indebtedness of the Borrower (including contingent liabilities); the Borrower is not contemplating either the filing of a petition under any state or federal bankruptcy or insolvency law, or the liquidation of all or any substantial portion of its assets or property; the Borrower has no knowledge of any Person contemplating the filing of any such petition against the Borrower; and the Borrower reasonably anticipates that it will be able to pay its debts as they mature.",solvency
"Solvency. Borrower and its consolidated Subsidiaries, taken as a whole, are and, upon the incurrence of any Credit Extension by the Credit Parties on any date on which this representation and warranty is made, will be, Solvent.",solvency
Solvency. The Credit Parties are Solvent on a consolidated basis.,solvency
"Solvency. The Contractor shall maintain a fiscally solvent operation per federal regulations and IDOI’s requirements for a minimum net worth and risk-based capital. The Contractor shall have a process in place to review and authorize contracts established for reinsurance and third party liability, if applicable. The Contractor shall comply with the federal requirements for protection against insolvency pursuant to 42 CFR 438.116, which sets solvency standards for managed care entities. These requirements provide that, unless the Contractor is a federally qualified HMO (as defined in Section 1310 of the Public Health Service Act), the Contractor shall:  Provide assurances satisfactory to the State showing that its provision against the risk of insolvency is adequate to ensure that its members will not be liable for the Contractor's debts if the entity becomes insolvent  Meet the solvency standards established by the State for private health maintenance organizations, or be licensed or certified by the State as a risk-bearing entity",solvency
"Solvency. As of the Effective Date, the Borrower and the Restricted Subsidiaries, taken as a whole, are, and after giving effect to the incurrence of any Indebtedness and obligations being incurred in connection herewith will be, Solvent.",solvency
"Solvency. The Borrower has received consideration that is the reasonable equivalent value of the obligations and liabilities that the Borrower has incurred to the Administrative Agent, each LC Issuer and the Lenders under the Loan Documents. The Borrower now has capital sufficient to carry on its business and transactions and all business and transactions in which it is about to engage and is now solvent and able to pay its debts as they mature and the Borrower, as of the Closing Date, owns property having a value, both at fair valuation and at present fair salable value, greater than the amount required to pay the Borrower’s debts; and the Borrower is not entering into the Loan Documents with the intent to hinder, delay or defraud its creditors.",solvency
"Solvency. The Administrative Agent shall have received a customary certificate from the chief financial officer or vice president of finance of the Borrower certifying that Holdings and its Subsidiaries, on a consolidated basis after giving effect to the Transactions to occur on the Closing Date, are solvent (within the meaning of Section 3.13).",solvency
"Solvency. The Administrative Agent shall have received a certificate in form and substance reasonably satisfactory to the Administrative Agent from a senior financial officer or such other officer acceptable to the Administrative Agent of the Borrower and each Guarantor certifying that, before and after giving effect to the Transactions, (i) the Borrower is solvent on an individual basis, and (ii) that the Borrower and each such other Guarantor are solvent on a consolidated basis (assuming with respect to each Guarantor, that the fraudulent conveyance savings language contained in the Guaranty applicable to such Guarantor will be given full effect).",solvency
"Solvency. Both immediately before and immediately after giving effect to (a) the Loans and Letters of Credit made or Issued on or prior to the date this representation and warranty is made, (b) the disbursement and use of the proceeds of such Loans (including the payment of the Dividend) and (c) the payment and accrual of all transaction costs in connection with the foregoing, both the Loan Parties taken as a whole and each Loan Party (other than any Immaterial Subsidiary) individually are Solvent. The Borrower has delivered to the Administrative Agent copies of all written analyses, evaluations and opinions with respect to the solvency of the Borrower and of Parent both immediately before and immediately after giving effect to the payment of the Dividend that was provided to or presented to the board of directors of the Borrower and the sole member of Parent.",solvency
"Solvency. The Loan Parties are, on a consolidated basis, Solvent.",solvency
"Solvency. After giving effect to the Loans to be made on the Initial Funding Date or such other date as Loans requested hereunder are made, and the disbursement of the proceeds of such Loans pursuant to the Borrower’s or the applicable Qualified Borrower’s instructions, the Borrower and each Qualified Borrower, if any, is Solvent.",solvency
"Solvency. On the Effective Date, immediately after the consummation of the Transactions to occur on the Effective Date, Holdings and its Subsidiaries are, on a consolidated basis after giving effect to the Transactions, Solvent.",solvency
"Solvency. Before and after giving effect to the making of each Advance and the issuance, increase, or amendment of each Letter of Credit, the Credit Parties are, when taken as a whole, Solvent.",solvency
"Solvency. No order has been made, petition presented or meeting convened for the winding up of the Seller, nor any other action taken in relation to the appointment of an administrator, liquidator, receiver, administrative receiver, compulsory manager or any provisional liquidator (or equivalent in any other jurisdiction) (or other process whereby the business is terminated and the assets of the company concerned are distributed amongst the creditors or shareholders or any other contributors), and there are no proceedings under any applicable insolvency, reorganisation or similar laws in any relevant jurisdiction, and no events have occurred which, under applicable laws, would justify any such proceedings.",solvency
"Solvency. On the Effective Date after giving effect to the Transactions, the Company and its Subsidiaries, on a consolidated basis, are Solvent.",solvency
"Solvency. After giving effect to the execution and delivery of the Loan Documents and the making of the Loans under this Agreement, each Loan Party is Solvent.",solvency
"Solvency. After giving effect to the Loan advance and the liabilities and obligations of each Borrower under the Operative Documents, each Borrower and each additional Credit Party is Solvent.",solvency
Solvency. The Borrower is not the subject of any Insolvency Proceedings or Insolvency Event. The transactions under the Transaction Documents to which the Borrower is a party do not and will not render the Borrower not Solvent.,solvency
"Solvency. (i) Based on the financial condition of the Company as of the Closing Date, the Company's fair saleable value of its assets exceeds the amount that will be required to be paid on or in respect of the Company's existing debts and other liabilities (including known contingent liabilities) as they mature.",solvency
Solvency. Borrower ceases to be solvent (as represented by Borrower in subsection 4.17) or admits in writing its present or prospective inability to pay its debts as they become due; or,solvency
"Solvency. The Credit Parties are solvent on a consolidated basis and are able to pay their debts and other liabilities, contingent obligations and other commitments as they mature in the normal course of business, and the fair saleable value of the Credit Parties’ assets, measured on a going concern basis, exceeds all probable liabilities, including those to be incurred pursuant to this Agreement. The Credit Parties do not have, on a consolidated basis, unreasonably small capital in relation to the business in which they are or propose to be engaged. The Credit Parties have not incurred, on a consolidated basis, and the Credit Parties do not believe that they will incur debts beyond their ability to pay such debts as they become due. In executing the Credit Documents and consummating the Transactions, none of the Credit Parties intends to hinder, delay or defraud either present or future creditors or other Persons to which one or more of the Credit Parties is or will become indebted. On the Closing Date, the foregoing representations and warranties shall be made both before and after giving effect to the Transactions.",solvency
"Solvency. Parent is not entering into the Transactions with the actual intent to hinder, delay or defraud either present or future creditors of Parent or the Company. Assuming (a) that the representations and warranties of Contributor contained in Article IV and Article V are true and correct in all material respects (disregarding for these purposes any materiality qualifiers or references to “Contributor Material Adverse Effect” or “HighPeak Material Adverse Effect”) and (b) that the projections and other forecasts for the HighPeak Entities and related estimates, plans and budget information made available to Parent are true and correct in all material respects, and at the Closing, and after giving effect to the Transactions, each of Parent, the Company and each of the Transferred Entities (i) will be solvent (in that both the fair value of its assets will not be less than the sum of its debts and that the present fair saleable value of its assets will not be less than the amount required to pay its probable liability on its debts as they become absolute and matured); (ii) will have adequate capital and liquidity with which to engage in its business and (iii) will not have incurred and does not plan to incur debts beyond its ability to pay as they become absolute and matured.",solvency
Solvency. The Administrative Agent shall have received a solvency certificate from a Financial Officer of each Borrower.,solvency
"Solvency. The fair salable value of each Credit Party’s assets (including goodwill minus disposition costs) exceeds the fair value of its liabilities. After giving effect to the transactions described in this Agreement, (a) no Credit Party is left with unreasonably small capital in relation to its business as presently conducted, and (b) each Credit Party is able to pay its debts (including trade debts) as they mature.",solvency
"Solvency. Each of the Servicer and COAF is solvent and will not be rendered insolvent by the Transaction and, after giving effect to the Transaction, neither the Servicer nor COAF will be left with an unreasonably small amount of capital with which to engage in its business, nor does the Servicer or COAF intend to incur, or believe that it has incurred, debts beyond its ability to pay as they mature. Neither the Servicer nor COAF contemplates the commencement of insolvency, bankruptcy, liquidation or consolidation proceedings or the appointment of a receiver, liquidator, conservator, trustee or similar official in respect of any COAF Company or any of their assets.",solvency
"Solvency. (i) The fair value of the property of the Seller is greater than the total amount of liabilities, including contingent liabilities, of the Seller, (ii) the present fair salable value of the assets of the Seller is not less than the amount that will be required to pay all probable liabilities of the Seller on its debts as they become absolute and matured, (iii) the Seller does not intend to, and does not believe that it will, incur debts or liabilities beyond the Seller’s abilities to pay such debts and liabilities as they mature and (iv) the Seller is not engaged in a business or a transaction, and is not about to engage in a business or a transaction, for which the Seller’s property would constitute unreasonably small capital.",solvency
"Solvency. The Company and the Guarantors, on a consolidated basis, are not, nor will the Company and the Guarantors, on a consolidated basis, be, after giving effect to the execution, delivery and performance of the Transaction Documents and the consummation of the transactions contemplated thereby, (i) left with unreasonably small capital with which to carry on their businesses as proposed to be conducted, (ii) unable to pay their debts (contingent or otherwise) as they mature or (iii) insolvent. The fair value and present fair saleable value of the assets of the Company and the Guarantors, on a consolidated basis, exceeds the amount that will be required to be paid on or in respect of their existing debts and other liabilities (including contingent liabilities) as they become absolute and matured.",solvency
"Solvency. After giving effect to the execution and delivery of the Transaction Documents and the consummation of the Transactions, the Borrower and its Subsidiaries, taken as a whole, will not be “insolvent” within the meaning of such term as defined in § 101 of Title 11 of the United States Code, as amended from time to time, or be unable to pay their debts generally as such debts become due, or have an unreasonably small capital to engage in any business or transaction, whether current or contemplated.",solvency
"Solvency. Immediately after giving effect to the Transactions and any indebtedness incurred by the Buyer or any Affiliate thereof in connection with the Transactions and the use of the proceeds thereof, the Buyer and each subsidiary of the Buyer, including the Subject Companies, shall be solvent and shall (a) be able to realize upon its assets and pay its debts and other Liabilities as they become due, (b) own property that has a fair saleable value greater than the amounts required to pay their respective debts and Liabilities (including a reasonable estimate of the amount of all contingent Liabilities), and (c) have adequate capital to carry on its business. No transfer of property is being made and no obligation is being incurred in connection with the Transactions with the intent to hinder, delay or defraud either present or future creditors of the Buyer and each subsidiary of the Buyer, including the Subject Companies. In connection with the Transactions, the Buyer has not incurred, nor plans to incur, debts beyond its ability to pay as they become absolute and matured.",solvency
"Solvency. The sale of the Receivables to the Purchaser is not being made with any intent to hinder, delay or defraud any of its creditors. The Seller is not insolvent, nor will the Seller be made insolvent by the transfer of the Receivables, nor does the Seller anticipate any pending insolvency.",solvency
"Solvency. The Borrower is, and Borrower and its Subsidiaries on a consolidated basis are, Solvent.",solvency
"Solvency. The Borrower has and, after giving effect to the Loans, will have, assets (both tangible and intangible) having a fair saleable value in excess of the amount required to pay the probable liability on its then-existing debts (whether matured or unmatured, liquidated or unliquidated, fixed or contingent); the Borrower has and will have access to adequate capital for the conduct of its business and the discharge of its debts incurred in connection therewith as such debts mature; the Borrower was not insolvent immediately prior to the making of the Loans and immediately after giving effect thereto, the Borrower will not be insolvent.",solvency
Solvency. The Administrative Agent shall have received a certificate dated as of the Closing Date in substantially the form of Exhibit H from a Financial Officer of the Borrower certifying as to the matters set forth therein.,solvency
"Solvency. Taking into account rights of contribution and subrogation under Applicable Laws, and after giving effect to the Transactions, (x) the Parent Guarantor and its Subsidiaries, taken as a whole, are and will continue to be solvent, able to pay their debts and liabilities, contingent liabilities and other commitments as they mature in the ordinary course of business, and have and will have capital sufficient to carry on their business and all businesses in which they are about to engage and (y) the fair present saleable value of their assets and property, calculated on a going concern basis, are in excess of the amount of their liabilities, including contingent liabilities and will continue to be in excess of the amount of their liabilities.",solvency
